category,datetime,headline,id,image,related,source,summary,url
company,2023-05-30 12:46:00,Copart Inc. stock underperforms Tuesday when compared to competitors despite daily gains,120715915,https://images.mktw.net/im-220105/social,CPRT,MarketWatch,"Shares of Copart Inc. inched 0.82% higher to $88.60 Tuesday, on what proved to be an all-around mixed trading session for the stock market, with the S&P 500...",https://finnhub.io/api/news?id=bd95b6ddf20284422cad2203b2fb381fff7980f0c7ebe6596e9d90ed16583df3
company,2023-05-30 11:22:00,"Copart, Inc. to Present at Baird’s Global Consumer, Technology & Services Conference",120612866,https://s.yimg.com/cv/apiv2/social/images/yahoo_default_logo-1200x1200.png,CPRT,Yahoo,"DALLAS, May 30, 2023--Copart, Inc. (NASDAQ: CPRT) announced today that Leah Stearns, the company’s Chief Financial Officer, will participate in a fireside chat at Baird’s Global Consumer, Technology & Services Conference on Wednesday, June 7, 2023. The presentation is scheduled for 1:25 pm Eastern Time.",https://finnhub.io/api/news?id=2b25da1b00035575f06c44dc558cfc9a97822d7f4e82fc7c1063b08a9f3ffed6
company,2023-05-30 09:45:06,Why This 1 Growth Stock Could Be a Great Addition to Your Portfolio,120612867,https://media.zenfs.com/en/zacks.com/71afbbc0512eb3c471136d93f39079c9,CPRT,Yahoo,"Whether you're a value, growth, or momentum investor, finding strong stocks becomes easier with the Zacks Style Scores, a top feature of the Zacks Premium research service.",https://finnhub.io/api/news?id=5874b4bf2b1d900d381516285768b86bb3150b301ad4a2f479f6942bafb1e4b1
company,2023-05-30 05:25:00,Jefferies taps small- and mid-cap stocks that rank well on all factors,120611928,,CPRT,Seeking Alpha,Looking for stock market analysis and research with proves results? Zacks.com offers in-depth financial research with over 30years of proven results.,https://finnhub.io/api/news?id=ccea18e861e7fc24ea7558cbae5e66ec1e98e2dd3a2f3024f9be066739121954
company,2023-05-29 06:02:25,Is Copart (CPRT) Recovering?,120601485,https://media.zenfs.com/en/insidermonkey.com/03ea9026bbb8212983c2cb45159ea0cf,CPRT,Yahoo,"Conestoga Capital Advisors, an asset management company, released its “Mid Cap Strategy” first-quarter 2023 investor letter. A copy of the same can be downloaded here. The Mid Cap Composite rose 10.23% net of fees in the first quarter, compared to the Russell Midcap Growth Index’s 9.14% return. The strategy primarily benefitted from the stock selection while the […]",https://finnhub.io/api/news?id=d0df285d233cba7ee9d475f1225534561eaf9552f268928f6b668fd88335039e
company,2023-06-02 12:52:00,"Copart Inc. stock rises Friday, still underperforms market",120715912,https://images.mktw.net/im-220105/social,CPRT,MarketWatch,"Shares of Copart Inc. inched 0.27% higher to $88.03 Friday, on what proved to be an all-around positive trading session for the stock market, with the S&P...",https://finnhub.io/api/news?id=17c1026ddf7b5a8dbab6293c16c2cca717d1243fbefe3ce06de4445003ccb297
company,2023-06-02 09:50:07,Why This 1 Momentum Stock Could Be a Great Addition to Your Portfolio,120679595,https://media.zenfs.com/en/zacks.com/48ad4265c55e3ba7a1fb9148d6e717d9,CPRT,Yahoo,The Zacks Style Scores offers investors a way to easily find top-rated stocks based on their investing style. Here's why you should take advantage.,https://finnhub.io/api/news?id=dc88b462f743f912fb992cf64ca39741dd8054bf350d0cbd0d14da0f35855008
company,2023-06-01 12:47:00,"Copart Inc. stock rises Thursday, still underperforms market",120715913,https://images.mktw.net/im-220105/social,CPRT,MarketWatch,"Shares of Copart Inc. inched 0.23% higher to $87.79 Thursday, on what proved to be an all-around positive trading session for the stock market, with the S&P...",https://finnhub.io/api/news?id=363d858e10f6e599aea5b2ace713954189caccb4015230bcf80a9c57c35064bd
company,2023-05-31 12:46:00,Copart Inc. stock outperforms competitors despite losses on the day,120715914,https://images.mktw.net/im-220105/social,CPRT,MarketWatch,"Shares of Copart Inc. shed 1.14% to $87.59 Wednesday, on what proved to be an all-around poor trading session for the stock market, with the S&P 500 Index...",https://finnhub.io/api/news?id=f32efc9d611ed57a7fdf430445051ce8449e02f8652c335f0510e5d00376ce77
company,2023-05-31 08:30:03,"Here's How Much a $1000 Investment in Copart, Inc. Made 10 Years Ago Would Be Worth Today",120630392,https://media.zenfs.com/en/zacks.com/8442d24e11d454aa89061259a9714d43,CPRT,Yahoo,"Investing in certain stocks can pay off in the long run, especially if you hold on for a decade or more.",https://finnhub.io/api/news?id=ced63ac6843342bee28fca7b7e5fe01dac18b8a0300ba244c4d7292bafee95da
company,2023-06-07 12:52:00,Copart Inc. stock underperforms Wednesday when compared to competitors,120760965,https://images.mktw.net/im-220105/social,CPRT,MarketWatch,"Shares of Copart Inc. slipped 2.12% to $86.22 Wednesday, on what proved to be an all-around mixed trading session for the stock market, with the Dow Jones...",https://finnhub.io/api/news?id=3cff5808fc57b1ae9a86962b024da46cd62bff9eb6294dd81c68ff9a348de82c
company,2023-06-06 12:52:00,"Copart Inc. stock falls Tuesday, underperforms market",120760966,https://images.mktw.net/im-220105/social,CPRT,MarketWatch,"Shares of Copart Inc. slipped 0.49% to $88.09 Tuesday, on what proved to be an all-around favorable trading session for the stock market, with the S&P 500...",https://finnhub.io/api/news?id=15a11d59e1fe80851fe94867f4617d55e7826f01b21c444a69ab4383c9daa3bf
company,2023-06-05 12:56:00,Copart Inc. stock outperforms competitors on strong trading day,120760967,https://images.mktw.net/im-220105/social,CPRT,MarketWatch,"Shares of Copart Inc. inched 0.56% higher to $88.52 Monday, on what proved to be an all-around grim trading session for the stock market, with the S&P 500...",https://finnhub.io/api/news?id=d180772fbb9ed0262818c7cd7238729a25832ce011408bac9d8f7d7eade05d97
company,2023-06-09 12:53:00,"Copart Inc. stock falls Friday, underperforms market",120803653,https://images.mktw.net/im-220105/social,CPRT,MarketWatch,"Shares of Copart Inc. slipped 1.14% to $85.74 Friday, on what proved to be an all-around favorable trading session for the stock market, with the S&P 500...",https://finnhub.io/api/news?id=7f18c95d69c37797d44f39804bddb165872652d1f52073ebc7308f2349fb5bf1
company,2023-06-09 09:35:05,"Copart, Inc. (CPRT) Just Overtook the 20-Day Moving Average",120793079,,CPRT,Yahoo,Is it a good or bad thing when a stock surpasses resistance at the 20-day simple moving average?,https://finnhub.io/api/news?id=502706be5819b34a563d0fcb5923eb83a75e60f6aeec339b32e70f1a08f4aac6
company,2023-06-08 14:46:34,Copart (NASDAQ:CPRT) Will Be Hoping To Turn Its Returns On Capital Around,120788162,https://media.zenfs.com/en/simply_wall_st__316/3906216b8cfc9ed88e06b5e462760ad6,CPRT,Yahoo,"If you're looking for a multi-bagger, there's a few things to keep an eye out for. One common approach is to try and...",https://finnhub.io/api/news?id=3fe4b60acd6b0963a09f1a991678fcbf29cfacb38285ade0d67f091a97be8545
company,2023-06-08 12:53:00,"Copart Inc. stock rises Thursday, still underperforms market",120803654,https://images.mktw.net/im-220105/social,CPRT,MarketWatch,"Shares of Copart Inc. inched 0.59% higher to $86.73 Thursday, on what proved to be an all-around great trading session for the stock market, with the S&P 500...",https://finnhub.io/api/news?id=7699e3f5e9af745aac6d1a0cd077faab9f3f372ee725f4d9e41162df7fc602aa
company,2023-06-08 04:22:00,Want to Invest in Republican or Democratic Stocks? Check Out These 2 ETFs,120793583,,CPRT,TipRanks,Looking for stock market analysis and research with proves results? Zacks.com offers in-depth financial research with over 30years of proven results.,https://finnhub.io/api/news?id=d41ec7103d998061ea3e770ef12d23263aa698ceb5d17a1c130162e6b4239435
company,2023-06-08 02:38:00,Here’s Why the QQQ ETF Could Be a Great Pick,120774177,,CPRT,TipRanks,Looking for stock market analysis and research with proves results? Zacks.com offers in-depth financial research with over 30years of proven results.,https://finnhub.io/api/news?id=92d350831be0c3566ff9951fb38645ef4858e9e42ecfc8a51511aa68aeeb00da
company,2023-06-15 12:53:00,"Copart Inc. stock rises Thursday, still underperforms market",120940037,https://images.mktw.net/im-220105/social,CPRT,MarketWatch,"Shares of Copart Inc. inched 0.89% higher to $87.11 Thursday, on what proved to be an all-around favorable trading session for the stock market, with the S&P...",https://finnhub.io/api/news?id=a93cbef1b8dfd62601dcd3029a194653e8895c47ca5253949e9fe4c0b437753f
company,2023-06-14 12:52:00,Copart Inc. stock outperforms competitors despite losses on the day,120940038,https://images.mktw.net/im-220105/social,CPRT,MarketWatch,"Shares of Copart Inc. slid 0.45% to $86.34 Wednesday, on what proved to be an all-around mixed trading session for the stock market, with the S&P 500 Index...",https://finnhub.io/api/news?id=bbe3c6b5d329fc6d97eb7b2bd19a419a1064e5e8766c5d35fbc8157276b9db12
company,2023-06-13 13:55:00,Copart Inc. stock underperforms Tuesday when compared to competitors,120940039,https://images.mktw.net/im-220105/social,CPRT,MarketWatch,"Shares of Copart Inc. slipped 0.24% to $86.73 Tuesday, on what proved to be an all-around favorable trading session for the stock market, with the S&P 500...",https://finnhub.io/api/news?id=d7d9ec18af0d62371002d798c577af4e5a805c926bf3765b2359fc0a234dd4a4
company,2023-06-13 08:14:00,4 S&P 500 Stocks to Buy as the Index Enters Bull Market,120844869,https://media.zenfs.com/en/zacks.com/add8f550d9b996c1d72a9c9008822627,CPRT,Yahoo,"CAT, ADBE, AME and CPRT are among those S&P 500 members that are exhibiting strong fundamentals and impressive price performance.",https://finnhub.io/api/news?id=95998004a16fcbdd97523c21aaa07ba0f1a753dbba5a735b35a035864075d055
company,2023-06-12 12:53:00,"Copart Inc. stock rises Monday, outperforms market",120940040,https://images.mktw.net/im-220105/social,CPRT,MarketWatch,"Shares of Copart Inc. advanced 1.40% to $86.94 Monday, on what proved to be an all-around favorable trading session for the stock market, with the S&P 500...",https://finnhub.io/api/news?id=ea6f235ae3598c77058ce5ac1df8fd995cb8e86e2e78d1e430b277afebe75fbb
company,2023-06-12 09:40:09,Are Business Services Stocks Lagging  Copart (CPRT) This Year?,120827080,https://media.zenfs.com/en/zacks.com/d2f7ed3d1940141716bfd200f5c94c6b,CPRT,Yahoo,"Here is how Copart, Inc. (CPRT) and Amadeus IT Group SA Unsponsored ADR (AMADY) have performed compared to their sector so far this year.",https://finnhub.io/api/news?id=2fdd7fa7f3657d4091624557976c483f9179daaede64dda799e6cd772ab29950
company,2023-06-12 06:37:38,Copart Shares See Mega Inflows,120827081,https://media.zenfs.com/en/fx_empire_176/57af601f8129ed00003711e78bafbaa1,CPRT,Yahoo,"Copart, Inc. (CPRT) shares are up a staggering 40% in 2023. Investing in growth stocks this year has been a great way to outperform markets. Big Money footprints tell the real story.",https://finnhub.io/api/news?id=d5fc10b33d021f097727cf59c876775a42053c6c01adb4759514006c64a698ba
company,2023-06-12 05:47:00,First Week of June 16th Options Trading For Copart (CPRT),120844670,,CPRT,Stock Options Channel,Looking for stock market analysis and research with proves results? Zacks.com offers in-depth financial research with over 30years of proven results.,https://finnhub.io/api/news?id=5ad03a7ec8925bcb9123205214539bc881fce2e4e8c23ff834738b24ea8e46fa
company,2023-06-18 20:20:57,Top Stock Picker Scouts AI Fringes to Beat 97% of Peers,121464303,https://s.yimg.com/ny/api/res/1.2/YhGmUqQOCjYfvIZtTZuHHA--/YXBwaWQ9aGlnaGxhbmRlcjt3PTEyMDA7aD04MDA-/https://media.zenfs.com/en/bloomberg_technology_68/85e5fbc84b93c2d24f9e0f42dd268ce1,CPRT,Yahoo,"(Bloomberg) -- When it comes to trading the artificial intelligence frenzy, one top-performing global equity fund is winning big by scouting out some out-of-the-box ideas.Most Read from BloombergTitanic Sub Search Chases Mystery Noises as Air Runs LowThese Are the World’s Most (and Least) Liveable Cities in 2023Modi Meets With Elon Musk and Ray Dalio as Global Money Flocks to IndiaDebris Found Near Titanic Wreck in Search for Missing VesselShort Bets on US Stocks Hit $1 Trillion, Most Since Apri",https://finnhub.io/api/news?id=fc40a11ce97283d6c1292aef17ccede37e6ec1d598bd0a6b72631109260f1dc7
company,2023-06-16 12:52:00,Copart Inc. stock outperforms market on strong trading day,120940036,https://images.mktw.net/im-220105/social,CPRT,MarketWatch,"Shares of Copart Inc. inched 0.20% higher to $87.28 Friday, on what proved to be an all-around rough trading session for the stock market, with the S&P 500...",https://finnhub.io/api/news?id=d786249a920a235cf9261498881b5ad84b439178d450034a3214837926af4c4f
company,2023-06-16 11:30:15,"Why Is Copart, Inc. (CPRT) Down 1.4% Since Last Earnings Report?",120916121,https://media.zenfs.com/en/zacks.com/5ecaf2a9bf082a5f3a554e6526b34be0,CPRT,Yahoo,"Copart, Inc. (CPRT) reported earnings 30 days ago. What's next for the stock? We take a look at earnings estimates for some clues.",https://finnhub.io/api/news?id=8feeee2ea398bf08d9ea907b198adfd41fc8ea12fd5355580b79e8ffb56ab63e
company,2023-06-23 12:52:00,"Copart Inc. stock falls Friday, still outperforms market",121057802,https://images.mktw.net/im-220105/social,CPRT,MarketWatch,"Shares of Copart Inc. slipped 0.12% to $89.19 Friday, on what proved to be an all-around dismal trading session for the stock market, with the S&P 500 Index...",https://finnhub.io/api/news?id=cd0a865356e571bce0408d7669d313a75a60cb2d73607a043d6a7c5e6c0b6995
company,2023-06-23 04:36:00,Copart acquisition of Hills Motors provisionally cleared by CMA,121037065,,CPRT,Alliance News,Looking for stock market analysis and research with proves results? Zacks.com offers in-depth financial research with over 30years of proven results.,https://finnhub.io/api/news?id=877911ff5436508b87eb3b5b9e318eb338ef1b78646f379b6bef59d1a5327e5d
company,2023-06-22 12:52:00,"Copart Inc. stock rises Thursday, still underperforms market",121010398,https://images.mktw.net/im-220105/social,CPRT,MarketWatch,"Shares of Copart Inc. inched 0.33% higher to $89.30 Thursday, on what proved to be an all-around mixed trading session for the stock market, with the S&P 500...",https://finnhub.io/api/news?id=4c97b4917efa4d6739fe356ef9039ede33683e8ce0cee2b1eb950d9a48157d8c
company,2023-06-22 08:42:00,Do Options Traders Know Something About Copart (CPRT) Stock We Don't?,121004562,,CPRT,Yahoo,Investors need to pay close attention to Copart (CPRT) stock based on the movements in the options market lately.,https://finnhub.io/api/news?id=1cde565f5fbe344843532bca243adb8e6aeafdc52880c8de50f57f53c349d86e
company,2023-06-22 05:44:00,First Week of February 2024 Options Trading For Copart (CPRT),121037067,,CPRT,Stock Options Channel,Looking for stock market analysis and research with proves results? Zacks.com offers in-depth financial research with over 30years of proven results.,https://finnhub.io/api/news?id=a3e1e11390b0e747013c24d89530f99e33c791b5751710a13fd02a235f4b5203
company,2023-06-22 05:32:00,"If You Invested $100 In This Stock 5 Years Ago, You Would Have $300 Today",121037068,,CPRT,Benzinga,Looking for stock market analysis and research with proves results? Zacks.com offers in-depth financial research with over 30years of proven results.,https://finnhub.io/api/news?id=244aee69ffea70a78aede2e033a387074f9e1c36a963643295630d3a69e99f45
company,2023-06-21 12:53:00,"Copart Inc. stock rises Wednesday, outperforms market",120992357,https://images.mktw.net/im-220105/social,CPRT,MarketWatch,"Shares of Copart Inc. rose 1.41% to $89.01 Wednesday, on what proved to be an all-around poor trading session for the stock market, with the S&P 500 Index...",https://finnhub.io/api/news?id=00f6598073d81301c013642713b113c75d672d837e07c19e2f2718748177effd
company,2023-06-21 01:05:00,Here’s Why the Invesco QQQ Trust ETF is Appealing,120976025,,CPRT,TipRanks,Looking for stock market analysis and research with proves results? Zacks.com offers in-depth financial research with over 30years of proven results.,https://finnhub.io/api/news?id=230da283befb471d785061a6141bd8fe5302ddeac05dabbde5b282cd32241145
company,2023-06-20 23:16:00,Here’s Why the Invesco QQQ Trust ETF is Worth Considering,120976027,,CPRT,TipRanks,Looking for stock market analysis and research with proves results? Zacks.com offers in-depth financial research with over 30years of proven results.,https://finnhub.io/api/news?id=9fb136b5052a1f16831449f0307f6ab438d127d6557bc7a5223fcdb6ef058ae1
company,2023-06-20 22:52:00,5 High GF Score Stocks That Outperformed the Market During 1st Half,120982418,,CPRT,GuruFocus,Looking for stock market analysis and research with proves results? Zacks.com offers in-depth financial research with over 30years of proven results.,https://finnhub.io/api/news?id=fa4794cea18485808e35c155c22dc28451fb0fbe422f3c8b28f288f5f4de5eca
company,2023-06-20 12:53:00,"Copart Inc. stock rises Tuesday, outperforms market",120992358,https://images.mktw.net/im-220105/social,CPRT,MarketWatch,"Shares of Copart Inc. inched 0.56% higher to $87.77 Tuesday, on what proved to be an all-around rough trading session for the stock market, with the S&P 500...",https://finnhub.io/api/news?id=37568167248d419a3d03375bf847ec0ed7b6c783638d45c21251810096e05241
company,2023-06-20 05:56:06,Copart: Fantastic Margins And Positive Trajectory,120955454,https://static.seekingalpha.com/cdn/s3/uploads/getty_images/1482196909/image_1482196909.jpg?io=getty-c-w1536,CPRT,SeekingAlpha,Copart has a strong business model and has created a moat through technological development and increased scale. Read why I'm bullish on CPRT stock.,https://finnhub.io/api/news?id=1221621165ac01d7920b36ae81c89ecc72458aca7c7ac1ca3e3b1623fb3e5773
company,2023-06-20 04:55:00,Early notable gainers among liquid option names on June 20th,120957012,,CPRT,Thefly.com,Looking for stock market analysis and research with proves results? Zacks.com offers in-depth financial research with over 30years of proven results.,https://finnhub.io/api/news?id=c6ad9d9dfa685d37329e27ec98bbe0d19023084e67f41823dacef6961a15961e
company,2023-06-27 12:52:00,"Copart Inc. stock falls Tuesday, underperforms market",121128812,https://images.mktw.net/im-220105/social,CPRT,MarketWatch,"Shares of Copart Inc. slipped 0.13% to $88.98 Tuesday, on what proved to be an all-around great trading session for the stock market, with the S&P 500 Index...",https://finnhub.io/api/news?id=1a3b5f710ffe0e7f387a7eda9b5472a8fadbb801cc7b1dbc8c7e20b7edef78f4
company,2023-06-26 15:45:00,These 3 Top-Ranked Stocks Have Displayed Red-Hot Momentum,121063126,https://media.zenfs.com/en/zacks.com/6a3f31499cad45f54c416ad8ced0cbe0,CPRT,Yahoo,"These three stocks have stopped for nobody in 2023, all delivering outsized gains to investors. Can their runs continue?",https://finnhub.io/api/news?id=6e91dcaa194e51f841602d6e44486e0841df1a586100d4873aab694d77a4a06b
company,2023-06-26 12:52:00,"Copart Inc. stock falls Monday, still outperforms market",121057801,https://images.mktw.net/im-220105/social,CPRT,MarketWatch,"Shares of Copart Inc. slumped 0.10% to $89.10 Monday, on what proved to be an all-around dismal trading session for the stock market, with the S&P 500 Index...",https://finnhub.io/api/news?id=cde344a6c6ee3b3651c4310b9a60c4a542e603d345b3f06c3d96be74ff86bde2
company,2023-06-30 17:27:00,Analysts Are Raising Expectations for These 3 Auto Stocks,121158558,https://media.zenfs.com/en/zacks.com/77e7d4ab925ca610086fbb7709550d20,CPRT,Yahoo,Targeting areas of the market that are seeing positive earnings estimate revisions is an excellent way for investors to insert themselves in favorable trends.,https://finnhub.io/api/news?id=f210a8b99049a9a718b5c7ba0c0d429d8b7428b922be28ca785eefb6d655564a
company,2023-06-30 12:52:00,"Copart Inc. stock rises Friday, still underperforms market",121167158,https://images.mktw.net/im-220105/social,CPRT,MarketWatch,"Shares of Copart Inc. rallied 1.05% to $91.21 Friday, on what proved to be an all-around favorable trading session for the stock market, with the S&P 500...",https://finnhub.io/api/news?id=9fe42afb00b268ff4a25bb52304066a38793724de0cc256040874b665bccff46
company,2023-06-30 07:08:28,Reasons For the Outperformance of Copart (CPRT),121141126,https://media.zenfs.com/en/insidermonkey.com/b8eef2409e3cf80b5c7ebd6d4b7e62fb,CPRT,Yahoo,"The London Company, an investment management company, released “The London Company Mid Cap Strategy” first quarter 2023 investor letter. A copy of the same can be downloaded here. In the first quarter, the fund returned 6.5% gross, (6.4% net) compared to a 4.1% return for the Russell Midcap Index. The outperformance of the fund is […]",https://finnhub.io/api/news?id=bd94eaf5ee8515cadd7c60f65949b7cc028df5bbeb35912bd5f660db44c4eaa7
company,2023-06-29 12:52:00,Copart Inc. stock outperforms market on strong trading day,121128810,https://images.mktw.net/im-220105/social,CPRT,MarketWatch,"Shares of Copart Inc. inched 0.61% higher to $90.26 Thursday, on what proved to be an all-around positive trading session for the stock market, with the S&P...",https://finnhub.io/api/news?id=9012c4752d619367a8c49ee966b91027fc8cc9856cf9148cfc9c2a7b1aaec6e4
company,2023-06-29 07:21:00,(CPRT) - Analyzing Copart's Short Interest,121123886,,CPRT,Benzinga,Looking for stock market analysis and research with proves results? Zacks.com offers in-depth financial research with over 30years of proven results.,https://finnhub.io/api/news?id=205b361f7f10d0608f2907577baa983eb1836220431e08fbd6b0bc25eb3ca19e
company,2023-06-29 05:02:00,"Insider Sell: Willis Johnson Sells 660,000 Shares of Copart Inc",121155140,,CPRT,GuruFocus,Looking for stock market analysis and research with proves results? Zacks.com offers in-depth financial research with over 30years of proven results.,https://finnhub.io/api/news?id=4883e1f1f07bab9f3715c4fba99ef010048a179c6e2106e9aa975095c997065f
company,2023-06-28 15:45:00,6 Stocks You Probably Didn’t Know Have Outperformed Apple This Year,121098405,https://s.yimg.com/ny/api/res/1.2/JnKUnCXo.iiia30wMqFzMw--/YXBwaWQ9aGlnaGxhbmRlcjt3PTEyMDA7aD02MDA-/https://media.zenfs.com/en/Barrons.com/1de1471b45160d8ee27420dfd9f270d0,CPRT,Yahoo,"Apple  has been in the spotlight as its stock runs higher and gets close to hitting a $3 trillion market capitalization.  ON Semiconductor,  Align Technology  and several other stocks aren’t a part of the “big seven” tech giants, but are still outpacing  Apple  ‘s shares this year.  Apple stock (ticker: AAPL) has been on a tear this year, surging 45% over the last six months.",https://finnhub.io/api/news?id=0ef6e985146ebf2cf70a785f8f37da4da3c2c7ed92f4824a2402cf8c0e6902a9
company,2023-06-28 14:59:00,3 Top-Ranked Stocks Investors Can Buy Today,121099662,https://media.zenfs.com/en/zacks.com/f8e8dd74fec7b16eb85235be391efa80,CPRT,Yahoo,It is hard to go wrong buying stock in high quality businesses that have consistently grown sales and earnings year after year,https://finnhub.io/api/news?id=9bf5e3ba12ecddfe44808a1bbcffa1409659dddaf142d22f5571ecbe3187a51e
company,2023-06-28 12:52:00,"Copart Inc. stock rises Wednesday, outperforms market",121128811,https://images.mktw.net/im-220105/social,CPRT,MarketWatch,"Shares of Copart Inc. inched 0.82% higher to $89.71 Wednesday, on what proved to be an all-around dismal trading session for the stock market, with the S&P...",https://finnhub.io/api/news?id=9d9fb2bf137b01e76ffa2efd4de85a3d2b5cd721ecd42b1ca521bc85ece04847
company,2023-06-28 09:40:09,Is Copart (CPRT) Outperforming Other Business Services Stocks This Year?,121090238,https://media.zenfs.com/en/zacks.com/670d1917693293f70179651625deb88f,CPRT,Yahoo,"Here is how Copart, Inc. (CPRT) and Amadeus IT Group SA Unsponsored ADR (AMADY) have performed compared to their sector so far this year.",https://finnhub.io/api/news?id=f3875cd49005c0e774ddae2646923fffc040a9016d1d5f13edff9db9e4f6db44
company,2023-07-05 12:52:00,"Copart Inc. stock rises Wednesday, outperforms market",121219503,https://images.mktw.net/im-220105/social,CPRT,MarketWatch,"Shares of Copart Inc. inched 0.27% higher to $90.49 Wednesday, on what proved to be an all-around grim trading session for the stock market, with the S&P 500...",https://finnhub.io/api/news?id=88b64965031487f199a9068b459aa3b035d17fab5c14d3b600a593b2d7928399
company,2023-07-05 06:01:00,CPRT December 2024 Options Begin Trading,121213153,,CPRT,Stock Options Channel,Looking for stock market analysis and research with proves results? Zacks.com offers in-depth financial research with over 30years of proven results.,https://finnhub.io/api/news?id=88a1c55546d616d02a5aaf9fbaad5ad45f4a98357451323bab57d04bbeda1713
company,2023-07-02 22:07:00,A Look Into Copart Inc's Price Over Earnings,121197379,,CPRT,Benzinga,Looking for stock market analysis and research with proves results? Zacks.com offers in-depth financial research with over 30years of proven results.,https://finnhub.io/api/news?id=c37b36b1d898fb4c62e61ccdf1669263dac76dbb2af63bce1322c467ca8ad4d7
company,2023-07-07 12:52:00,Copart Inc. stock underperforms Friday when compared to competitors,121278418,https://images.mktw.net/im-220105/social,CPRT,MarketWatch,"Shares of Copart Inc. slid 0.93% to $88.11 Friday, on what proved to be an all-around rough trading session for the stock market, with the S&P 500 Index...",https://finnhub.io/api/news?id=3ec74d841a7eb228c957d3060d2a994fa72ad3203dc8e87e56554de47c2aef91
company,2023-07-06 22:05:00,Here's How Much You Would Have Made Owning Copart Stock In The Last 10 Years,121274288,,CPRT,Benzinga,Looking for stock market analysis and research with proves results? Zacks.com offers in-depth financial research with over 30years of proven results.,https://finnhub.io/api/news?id=4a8e4755b4c2d8978d108f72e4da14c85a8878b36618fdbe1117a283d72d336c
