category,datetime,headline,id,image,related,source,summary,url
company,2022-09-24 10:00:00,"A Stock's Price ""Tells You Almost Nothing""",116232883,,CPRT,Yahoo,"Last time we played The Market Cap Game Show, returning champions Motley Fool analyst Yasser El-Shimy and Motley Fool contributor Brian Stoffel had to be content with a tie at five points apiece.  To catch full episodes of all The Motley Fool's free podcasts, check out our podcast center.  David Gardner: A lot of people, when they first think about stocks, tend to lock in on the share price.",https://finnhub.io/api/news?id=f5d48df44c2701865ace09b109a40b404b5807f5c2c5d888293dff37ddb51362
company,2022-09-23 22:24:00,5 High-Quality S&P 500 Stocks  - GuruFocus.com,116236507,https://static.gurufocus.com/photos/companies/discount_sale_reduce_price_value_investing_out_of_favor.jpg,CPRT,GuruFocus,GuruFocus Article or News written by James Li and the topic is about: Stocks to consider as investors monitor aggressive Fed interest rate hikes,https://finnhub.io/api/news?id=be82c62f7c4aaf857c38930e28939bdfe6ce3e832fc4cbe698ab79ae7caf3181
company,2022-09-23 12:46:00,Copart Inc. stock outperforms market on strong trading day,116241723,https://images.mktw.net/im-220105/social,CPRT,MarketWatch,"Shares of Copart Inc. advanced 1.01% to $106.14 Friday, on what proved to be an all-around dismal trading session for the stock market, with the S&P 500...",https://finnhub.io/api/news?id=81c462906041d2d7a917fbcd6c4bcc9865b1131a04d803f65a6b47fbf2d369a4
company,2022-09-28 05:42:00,First Week of May 2023 Options Trading For Copart (CPRT),116337065,,CPRT,Stock Options Channel,"Staff article entitled First Week of May 2023 Options Trading For Copart (CPRT), about stock options, from Stock Options Channel.",https://finnhub.io/api/news?id=da2b41ea4e5ea995ba04e63631fdfe3795b6d59fab45e85badcee3854dcbd548
company,2022-09-27 12:30:06,COPART INC Management's Discussion and Analysis of Financial Condition andResults of Operations (form 10-K),116286158,,CPRT,Finnhub,"CAUTION REGARDING FORWARD-LOOKING STATEMENTSThis Annual Report on Form 10-K for the fiscal year ended July 31, 2022, or thisForm 10-K, including the information incorporated by reference herein,... | September 27, 2022",https://finnhub.io/api/news?id=6fa79fd7f359d7ff92e62ca66a2f6b790a08159ea33d82baa0b8fe3f0bf4d22b
company,2022-09-27 11:57:03,COPART INC : Change in Directors or Principal Officers (form 8-K),116285441,,CPRT,Finnhub,"Item 5.02 Departure of Directors or Certain Officers; Election of Directors;Appointment of Certain Officers; Compensatory Arrangements of Certain Officers.On September 23, 2022, the Board of... | September 27, 2022",https://finnhub.io/api/news?id=4cbd062fba92fae4b81079124880f36b9b6d65254147bc47540cfdd3c4be1346
company,2022-09-27 04:51:16,Tracking David Rolfe's Wedgewood Partners Portfolio - Q2 2022 Update,116278551,https://static.seekingalpha.com/cdn/s3/uploads/getty_images/1248262649/image_1248262649.jpg?io=getty-c-w750,CPRT,SeekingAlpha,Wedgewood Partnersâ 13F portfolio value decreased from $709M to $579M. Click here to read more about Wedgewood Partners Portfolio's holdings and trades for Q2 2022.,https://finnhub.io/api/news?id=771ee052ab62edfba3968697598d6335c0e2d0c1066ae0e165f6179aeff826bc
company,2022-09-29 16:10:31,Top Funds Rev Up Demand As This Large Cap Eyes Breakout,116339407,https://s.yimg.com/uu/api/res/1.2/rd4jxOdKOdP.yw_w0LHhAA--~B/aD01NjU7dz0xMDAwO2FwcGlkPXl0YWNoeW9u/https://media.zenfs.com/en/ibd.com/335ae58c996c3dd0c9b06a4c554fe161,CPRT,Yahoo,"With its relative strength line soaring in a bad market, O'Reilly Automotive nears buy point with strong demand by top funds.",https://finnhub.io/api/news?id=02188bb7a98ad5e7af5ea75daa6f202edb7f2a047830f7eae6febfcd587c3445
company,2022-09-29 09:10:00,Nasdaq Bear Market: 2 Unbelievable Stocks You'll Regret Not Buying on the Dip,116331662,https://s.yimg.com/ny/api/res/1.2/1.ej2G.IPibL2jR9.hsP8g--/YXBwaWQ9aGlnaGxhbmRlcjt3PTEyMDA7aD04MDA-/https://media.zenfs.com/en/motleyfool.com/32f9e927196a6d431174125d6ac0d68c,CPRT,Yahoo,Bear markets all have one thing in common. Here's how smart investors can navigate today's bear markets and avoid the regret of missing the recovery.,https://finnhub.io/api/news?id=09b0b7a31ed8afc0d5b0ee6b736cd32ff4521e6858c2fd20cae5e14009216b6b
company,2022-09-29 09:02:39,Compounders And Dividends: Building A Watchlist,116333865,https://static.seekingalpha.com/cdn/s3/uploads/getty_images/477583982/image_477583982.jpg?io=getty-c-w750,CPRT,SeekingAlpha,I explain how I generate ideas and my methodology of adding companies to my watchlist. Read here to know the stocks in areas/sectors that I find interesting.,https://finnhub.io/api/news?id=8cab9cb15f70677d7d2889730140311e882a97b2f565dd47307b6781b383c6aa
company,2022-10-04 12:46:00,IN BRIEF: UK competitions watchdog looks into Copart acquisition,116470037,,CPRT,Alliance News,Looking for stock market analysis and research with proves results? Zacks.com offers in-depth financial research with over 30years of proven results.,https://finnhub.io/api/news?id=990862d9f0f102ab8b2e0c8b2e687d71055923c957bdf38b05304851763e2277
company,2022-10-03 20:23:00,BetterInvesting™ Magazine Update on Copart Inc. and Charter Communications Inc.,116406331,https://s.yimg.com/uu/api/res/1.2/tXuvGH2OoXOzqGvr97Mh2Q--~B/aD0xNjt3PTE2O2FwcGlkPXl0YWNoeW9u/https://media.zenfs.com/en/prnewswire.com/ba4e1e6f56fc8d4e59b8ab0dc6a78f24,CPRT,Yahoo,"The Editorial Advisory and Securities Review Committee of BetterInvesting Magazine today announced Copart Inc. (NASDAQ: CPRT) as its ""Stock to Study"" and Charter Communications Inc. (NASDAQ: CHTR) as its ""Undervalued Stock"" in the December 2022 issue for investors' informational and educational use.",https://finnhub.io/api/news?id=c9b53268daceeae8b42e2e1991cac7607beb0a04b5296d740af1cb95e52083a7
company,2022-10-10 08:18:06,"Is Now An Opportune Moment To Examine Copart, Inc. (NASDAQ:CPRT)?",116574662,https://s.yimg.com/uu/api/res/1.2/ZOQCmyATlYtp8ZaAQnvOpA--~B/aD00MzI7dz0xMTk0O2FwcGlkPXl0YWNoeW9u/https://media.zenfs.com/en/simply_wall_st__316/3906216b8cfc9ed88e06b5e462760ad6,CPRT,Yahoo,"Let's talk about the popular Copart, Inc. ( NASDAQ:CPRT ). The company's shares received a lot of attention from a...",https://finnhub.io/api/news?id=985f5fa7a39dca8974e8ab68f9d87421dad51b3ff139ea413cda6aea6cd8ce85
company,2022-10-07 11:30:03,"Why Is Copart, Inc. (CPRT) Down 3.1% Since Last Earnings Report?",116535501,https://s.yimg.com/uu/api/res/1.2/UYup8AGIrn99rMsHiTllqA--~B/aD04NzY7dz05MDA7YXBwaWQ9eXRhY2h5b24-/https://media.zenfs.com/en/zacks.com/d0d4ab152198da2f423d92da8a7d22ee,CPRT,Yahoo,"Copart, Inc. (CPRT) reported earnings 30 days ago. What's next for the stock? We take a look at earnings estimates for some clues.",https://finnhub.io/api/news?id=ee041ed9c36ba89731fb32112ae80dfb5f02566f8684748859133af367d56e94
company,2022-10-11 12:26:43,10 Best Hurricane and Natural Disaster Stocks to Buy Now,116597695,https://s.yimg.com/uu/api/res/1.2/QW5u0KY.XHozEcKX4Xd9Gw--~B/aD02MDA7dz01OTI7YXBwaWQ9eXRhY2h5b24-/https://media.zenfs.com/en/insidermonkey.com/3324bb3c5aea9eb32784a7c380c57761,CPRT,Yahoo,"In this article, we discuss 10 best hurricane and natural disaster stocks to buy now. If you want to read about some more natural disaster stocks, go directly to 5 Best Hurricane and Natural Disaster Stocks to Buy Now. Climate change in general and global warming in particular have started to create new problems for […]",https://finnhub.io/api/news?id=30f11c78b2fe6ed5af480a8f4fefef4ff1ca86c9275197f4371637dff0c8f7b0
company,2022-10-17 11:53:16,Wedgewood Partners’ Top Q3 Contributor: Copart Inc. (CPRT),116691546,https://s.yimg.com/uu/api/res/1.2/fPBmdPYxrMf2EQwYzxDyeg--~B/aD00NTU7dz03NTA7YXBwaWQ9eXRhY2h5b24-/https://media.zenfs.com/en/insidermonkey.com/a0e24883eb4904540569966102a2b39f,CPRT,Yahoo,"Wedgewood Partners, an investment management company, released its “Large Cap Focused Growth Fund” third-quarter 2022 investor letter. A copy of the same can be downloaded here. In the third quarter, the fund returned -4.1% net, compared to a -4.9% return for the Standard & Poor’s Index. In addition, you can check the top 5 holdings of […]",https://finnhub.io/api/news?id=dcc1bfd5320ee727be4b44f216a16860881649a41a15c59a948f0d60128459e3
company,2022-10-16 18:20:00,Wedgewood Partners Third Quarter 2022 Client Letter,116678374,https://static.seekingalpha.com/cdn/s3/uploads/getty_images/1432207155/image_1432207155.jpg?io=getty-c-w750,CPRT,SeekingAlpha,Wedgewood partners posted their third quarter 2022 client letter recently. Click here for a discussion on the top performance detractors and contributors.,https://finnhub.io/api/news?id=1398459e212b05b4fecea1effecb558142c4bae7c4239ecc65d479b8365d13d3
company,2022-10-21 12:46:00,"Copart Inc. stock rises Friday, still underperforms market",116789144,https://images.mktw.net/im-220105/social,CPRT,MarketWatch,"Shares of Copart Inc. inched 0.75% higher to $109.63 Friday, on what proved to be an all-around favorable trading session for the stock market, with the S&P...",https://finnhub.io/api/news?id=80ac7bed4ee98f09d282b516106f12f1df4d7e426391553f41feac803fadf455
company,2022-10-20 12:46:00,Copart Inc. stock underperforms Thursday when compared to competitors,116777564,https://images.mktw.net/im-220105/social,CPRT,MarketWatch,"Shares of Copart Inc. slid 1.93% to $108.81 Thursday, on what proved to be an all-around poor trading session for the stock market, with the S&P 500 Index...",https://finnhub.io/api/news?id=1f17c8e09aaf7fa54ed753a9534e313c5cfb13db1e3555e4d7ba9c5b8d116f2a
company,2022-10-20 07:13:00,David Rolfe Comments on Copart - GuruFocus.com,116750572,https://static.gurufocus.com/logos/0C00000AQJ.png,CPRT,GuruFocus,GuruFocus Article or News written by Sydnee Gatewood and the topic is about: Guru stock highlight,https://finnhub.io/api/news?id=9a502307b3fdadf0772acc738b986f7633c3d4bda071cf05f31e9857b0513c98
company,2022-10-19 12:46:00,"Copart Inc. stock falls Wednesday, underperforms market",116777566,https://images.mktw.net/im-220105/social,CPRT,MarketWatch,"Shares of Copart Inc. slid 1.41% to $110.95 Wednesday, on what proved to be an all-around dismal trading session for the stock market, with the S&P 500 Index...",https://finnhub.io/api/news?id=6d831c8d987aa2b0507c331c804deac06cdfaf819115ccbe4536454c257284e3
company,2022-10-26 12:46:00,"Copart Inc. stock rises Wednesday, outperforms market",116878212,https://images.mktw.net/im-220105/social,CPRT,MarketWatch,"Shares of Copart Inc. inched 0.19% higher to $113.85 Wednesday, on what proved to be an all-around mixed trading session for the stock market, with the Dow...",https://finnhub.io/api/news?id=f7555d224f854108efa8d516dd6252a81a18c37dcc064a0dfc6f3d6dcb777dc1
company,2022-10-25 21:01:00,"Lincoln Capital LLC Buys 2, Se - GuruFocus.com",116850744,https://static.gurufocus.com/images/logo_global.png,CPRT,GuruFocus,GuruFocus Article or News written by insider and the topic is about: ,https://finnhub.io/api/news?id=e6ad83d97cfa7b018e77f59d6a49fb85df6a992677c289c1ab9e820be9823aca
company,2022-10-25 12:46:00,Copart Inc. stock outperforms market on strong trading day,116878214,https://images.mktw.net/im-220105/social,CPRT,MarketWatch,"Shares of Copart Inc. advanced 2.24% to $113.63 Tuesday, on what proved to be an all-around great trading session for the stock market, with the S&P 500...",https://finnhub.io/api/news?id=8969d264d52d660425147fab22d57a8c83b195f7bd5a12614c88109db19e9c6c
company,2022-10-24 15:03:27,10 Best Used Car Stocks To Buy Now,116805711,https://s.yimg.com/uu/api/res/1.2/4l_Y00vFgpnyDt0YtWlUYQ--~B/aD01MTI7dz03Njg7YXBwaWQ9eXRhY2h5b24-/https://media.zenfs.com/en/insidermonkey.com/590fd3235c5c62e02880136cf413a14b,CPRT,Yahoo,"In this article, we discuss 10 best used car stocks to buy now. If you want to see more stocks in this selection, check out 5 Best Used Car Stocks To Buy Now. New car inventory is nearly half of what it should be, and dwindling inventories are an indicator of tight supply and demand. […]",https://finnhub.io/api/news?id=91f703222113dc0aed077c6c92ee41640467380e3ea94a15de673906f9b1f7bb
company,2022-10-28 12:46:00,Copart Inc. stock outperforms market on strong trading day,116878209,https://images.mktw.net/im-220105/social,CPRT,MarketWatch,"Shares of Copart Inc. rallied 2.60% to $116.36 Friday, on what proved to be an all-around positive trading session for the stock market, with the S&P 500...",https://finnhub.io/api/news?id=c5501ba29892d6ce61b45efd2bfe2204ed237b77a4eae9098bcdf71a9a796eab
company,2022-10-27 12:46:00,Copart Inc. stock underperforms Thursday when compared to competitors,116878211,https://images.mktw.net/im-220105/social,CPRT,MarketWatch,"Shares of Copart Inc. shed 0.39% to $113.41 Thursday, on what proved to be an all-around mixed trading session for the stock market, with the Dow Jones...",https://finnhub.io/api/news?id=f949b25096d95226547916cea3523bb6a11e59981b250d67c8ea20290704c6df
company,2022-11-02 12:46:00,Copart Inc. stock outperforms competitors despite losses on the day,116929456,https://images.mktw.net/im-220105/social,CPRT,MarketWatch,"Shares of Copart Inc. slid 2.64% to $112.06 Wednesday, on what proved to be an all-around rough trading session for the stock market, with the S&P 500 Index...",https://finnhub.io/api/news?id=3359dcad1b34f7dd14c7c1f93a2b39b47854b8c5fb87c6bff3a0a7dee0f8f453
company,2022-11-02 09:11:45,Does Copart (NASDAQ:CPRT) Deserve A Spot On Your Watchlist?,116939048,https://media.zenfs.com/en/simply_wall_st__316/3906216b8cfc9ed88e06b5e462760ad6,CPRT,Yahoo,"Investors are often guided by the idea of discovering 'the next big thing', even if that means buying 'story stocks...",https://finnhub.io/api/news?id=ceebf368f4fd1184f1bde2030b2d195cbe28eeb9ef0242e2a7a7b1e22bef4577
company,2022-11-01 12:46:00,Copart Inc. stock outperforms market on strong trading day,116888136,https://images.mktw.net/im-220105/social,CPRT,MarketWatch,"Shares of Copart Inc. inched 0.07% higher to $115.10 Tuesday, on what proved to be an all-around grim trading session for the stock market, with the S&P 500...",https://finnhub.io/api/news?id=c318e21a96cf8e7e5f23af6c06bf939ed04ad7ddc6a7ca9e51b3dc50df157c32
company,2022-11-07 11:46:00,Copart Inc. stock underperforms Monday when compared to competitors,117031098,https://images.mktw.net/im-220105/social,CPRT,MarketWatch,"Shares of Copart Inc. slid 0.51% to $57.09 Monday, on what proved to be an all-around great trading session for the stock market, with the S&P 500 Index...",https://finnhub.io/api/news?id=940c457250c603581167a9c226d853fa838d924e21e65ea467cf432f1c88eb99
company,2022-11-06 23:00:00,WEYBOSSET RESEARCH & MANAGEMEN - GuruFocus.com,116999449,https://static.gurufocus.com/images/logo_global.png,CPRT,GuruFocus,GuruFocus Article or News written by insider and the topic is about: ,https://finnhub.io/api/news?id=fb2db3a74423ef93f58f0ea5ae600a4dd2c1c5b00c424bcadf332f9effe2156c
company,2022-11-06 21:01:00,Arizona State Retirement Syste - GuruFocus.com,116995116,https://static.gurufocus.com/images/logo_global.png,CPRT,GuruFocus,GuruFocus Article or News written by insider and the topic is about: ,https://finnhub.io/api/news?id=4bc8e8790edad6b3f42d7c0ac47aa73297acb085aaa1408bf40f27c3a15f10ce
company,2022-11-05 07:01:00,Top 5 3rd Quarter Trades of GE - GuruFocus.com,116999338,https://static.gurufocus.com/images/logo_global.png,CPRT,GuruFocus,GuruFocus Article or News written by insider and the topic is about: ,https://finnhub.io/api/news?id=e3c71e8d0d547f6dba8a8ac1055ccf27cab7b76d0520953f68270c8324cc8bba
company,2022-11-04 12:46:00,"Copart Inc. stock rises Friday, still underperforms market",117031100,https://images.mktw.net/im-220105/social,CPRT,MarketWatch,"Shares of Copart Inc. rallied 1.21% to $57.38 Friday, on what proved to be an all-around favorable trading session for the stock market, with the S&P 500...",https://finnhub.io/api/news?id=c2a02588ee14f4e615750945536b77b522aeeb296f7d6280d07fc0a82d9fa0a9
company,2022-11-04 02:36:00,Today’s Biggest Pre-Market Stock Movers: 10 Top Gainers and Losers on Friday,116953196,https://investorplace.com/wp-content/uploads/2021/04/wall-street-washington-statue.jpg,CPRT,InvestorPlace,We're starting off the final day of trading this week with a look at the biggest pre-market stock movers for Friday morning!,https://finnhub.io/api/news?id=e6604cb1d8a5be84207aa5c14321436ece28547920df9a29537bc0e058a08108
company,2022-11-11 11:46:00,"Copart Inc. stock rises Friday, outperforms market",117166480,https://images.mktw.net/im-220105/social,CPRT,MarketWatch,"Shares of Copart Inc. rallied 1.82% to $61.56 Friday, on what proved to be an all-around great trading session for the stock market, with the S&P 500 Index...",https://finnhub.io/api/news?id=f6788cbcb6ad840b0c5c409a5612bfde9c4b1dab45a017b4feb5e5a5e40d3d20
company,2022-11-11 08:05:00,"Copart Releases 2023 Report on Environmental, Social and Governance Efforts",117123349,https://media.zenfs.com/en/prnewswire.com/f0029b484d1b93ef44d66822c6806561,CPRT,Yahoo,"Copart, Inc. (NASDAQ: CPRT) released its inaugural report on its ongoing environmental, social, and governance (ESG) efforts.",https://finnhub.io/api/news?id=b7047e01e8d48eaa375731f9b024889952d89153df69af4752a3ab49a3fd8970
company,2022-11-11 04:05:00,"YCG, LLC Buys 3, Sells 2 in 3r - GuruFocus.com",117113663,https://static.gurufocus.com/images/logo_global.png,CPRT,GuruFocus,GuruFocus Article or News written by insider and the topic is about: ,https://finnhub.io/api/news?id=e4aee8fd0301503efb14572192c94432ebb87ce2f98cd8a7a689ac381c003938
company,2022-11-11 04:05:00,Top 5 3rd Quarter Trades of Co - GuruFocus.com,117112375,https://static.gurufocus.com/images/logo_global.png,CPRT,GuruFocus,GuruFocus Article or News written by insider and the topic is about: ,https://finnhub.io/api/news?id=339f8ec0f37cc1a06b029b9557c8451d31d0cf88e7aac943a65563bc8b041630
company,2022-11-10 12:10:05,"Why Copart, Inc. (CPRT) is Poised to Beat Earnings Estimates Again",117085832,https://media.zenfs.com/en/zacks.com/078b2d95159d12a337f09f2519ff10ba,CPRT,Yahoo,"Copart, Inc. (CPRT) has an impressive earnings surprise history and currently possesses the right combination of the two key ingredients for a likely beat in its next quarterly report.",https://finnhub.io/api/news?id=2d7e11b6134e318bfd96ff0345ce7c0a8ff8c1795a7b71f33b7e11e001f3b5f0
company,2022-11-10 11:46:00,Copart Inc. stock outperforms market on strong trading day,117166481,https://images.mktw.net/im-220105/social,CPRT,MarketWatch,"Shares of Copart Inc. advanced 8.60% to $60.46 Thursday, on what proved to be an all-around great trading session for the stock market, with the S&P 500...",https://finnhub.io/api/news?id=59dabf36f3c7d12e3e04557864279032d93e91f01bbf2283fe3f2a9412bb1a07
company,2022-11-09 17:55:00,"Copart, Inc. to Release First Quarter Fiscal 2023 Results",117051562,https://s.yimg.com/cv/apiv2/social/images/yahoo_default_logo-1200x1200.png,CPRT,Yahoo,"DALLAS, November 09, 2022--Copart, Inc. (NASDAQ: CPRT) announced today that it will release earnings for the first quarter of fiscal 2023 after the close of market on Wednesday, November 16, 2022.",https://finnhub.io/api/news?id=9767753bf3780f243c518ac8a0377cd56aa5e626f06903a2f4f27c9518e3aa12
company,2022-11-09 11:46:00,Copart Inc. stock underperforms Wednesday when compared to competitors,117166482,https://images.mktw.net/im-220105/social,CPRT,MarketWatch,"Shares of Copart Inc. shed 2.14% to $55.67 Wednesday, on what proved to be an all-around poor trading session for the stock market, with the S&P 500 Index...",https://finnhub.io/api/news?id=ded411b2cbdc3999cb3dd6af5ea38cbc405662adbc708c421c871defc5417630
company,2022-11-08 11:46:00,"Copart Inc. stock falls Tuesday, underperforms market",117031096,https://images.mktw.net/im-220105/social,CPRT,MarketWatch,"Shares of Copart Inc. shed 0.35% to $56.89 Tuesday, on what proved to be an all-around favorable trading session for the stock market, with the S&P 500 Index...",https://finnhub.io/api/news?id=acef3475982c0e9e5e9c0a6ede1967e8b325301c0f1e8a2e3922fa7536fa489d
company,2022-11-08 01:01:00,STATE BOARD OF ADMINISTRATION  - GuruFocus.com,117003435,https://static.gurufocus.com/images/logo_global.png,CPRT,GuruFocus,GuruFocus Article or News written by insider and the topic is about: ,https://finnhub.io/api/news?id=b930b8997371e4493a71c436820470824b472b69c34c1a43de2b7ef9c428935d
company,2022-11-15 11:46:00,Copart Inc. stock outperforms competitors on strong trading day,117201797,https://images.mktw.net/im-220105/social,CPRT,MarketWatch,"Shares of Copart Inc. advanced 1.34% to $62.06 Tuesday, on what proved to be an all-around favorable trading session for the stock market, with the S&P 500...",https://finnhub.io/api/news?id=d4b14ada34b4d133a912e0d196d9b65bd3b70c193fc29ba1cd7908e58751f559
company,2022-11-14 23:01:00,Top 5 3rd Quarter Trades of NI - GuruFocus.com,117171740,https://static.gurufocus.com/images/logo_global.png,CPRT,GuruFocus,GuruFocus Article or News written by insider and the topic is about: ,https://finnhub.io/api/news?id=fa4489c19add79fd1d184213d40151550523f2a1ba23ac4d535c2c31b2a7d9d5
company,2022-11-14 23:01:00,SMITH THOMAS W Cuts Portfolio  - GuruFocus.com,117171940,https://static.gurufocus.com/images/logo_global.png,CPRT,GuruFocus,GuruFocus Article or News written by insider and the topic is about: ,https://finnhub.io/api/news?id=3901af187f4772f15560c06f8553f3519adc1dc4669191645d3280df13b8f628
company,2022-11-14 21:01:00,SNYDER CAPITAL MANAGEMENT L P  - GuruFocus.com,117165379,https://static.gurufocus.com/images/logo_global.png,CPRT,GuruFocus,GuruFocus Article or News written by insider and the topic is about: ,https://finnhub.io/api/news?id=fed57bc02a973c04edc9d3ff7eb97598726de081323a4355e4d29afbb387dde7
company,2022-11-14 11:46:00,"Copart Inc. stock falls Monday, still outperforms market",117166479,https://images.mktw.net/im-220105/social,CPRT,MarketWatch,"Shares of Copart Inc. sank 0.52% to $61.24 Monday, on what proved to be an all-around grim trading session for the stock market, with the S&P 500 Index...",https://finnhub.io/api/news?id=e4da5fbec67be40e4164c8da389a90b2d71edb41d5a9f2951b62044520269659
company,2022-11-14 08:40:01,Why Copart (CPRT) Might Surprise This Earnings Season,117145345,https://media.zenfs.com/en/zacks.com/d3e6082245f05efd98282f79c39d114d,CPRT,Yahoo,Copart (CPRT) is seeing favorable earnings estimate revision activity and has a positive Zacks Earnings ESP heading into earnings season.,https://finnhub.io/api/news?id=c142ffd0d220ba5f635654b95c55a8521ed845d083b5b7afe9ba38c13221a5d6
company,2022-11-14 07:53:12,Here's Why We Expect Q1 Earnings Beat From Copart (CPRT),117145346,https://media.zenfs.com/en/zacks.com/b0c6d74ebecca634ce8b7589701ac537,CPRT,Yahoo,"The Zacks Consensus Estimate for Copart's (CPRT) fiscal Q1 earnings per share and revenues is 55 cents and $884.5 million, respectively.",https://finnhub.io/api/news?id=c702672791166a50de4fc63e880ac3dcba9700eb8ebd3c01313e41417fe7b5c4
company,2022-11-18 11:45:00,"Copart Inc. stock rises Friday, still underperforms market",117201793,https://images.mktw.net/im-220105/social,CPRT,MarketWatch,"Shares of Copart Inc. inched 0.44% higher to $64.42 Friday, on what proved to be an all-around favorable trading session for the stock market, with the S&P...",https://finnhub.io/api/news?id=43254bf7658b3d5265e78510fdc92c6a31b163e63baf0c75a5dd9c1f40c0223c
company,2022-11-18 08:33:21,Compounders And Dividends: November 2022 Watch List Update,117197960,https://static.seekingalpha.com/cdn/s3/uploads/getty_images/477583982/image_477583982.jpg?io=getty-c-w750,CPRT,SeekingAlpha,"Since my original watch list article in September 2022, I have purchased three companies, two of which were on my September 2022 watch list. Click to read.",https://finnhub.io/api/news?id=de6d78ec347f64291ab555cebd3cfe0db2120f95e1b69536e8cb1bf4e3d1aa45
company,2022-11-18 07:02:00,Robert W. Baird Keeps Their Buy Rating on Copart (CPRT),117873966,,CPRT,TipRanks,Looking for stock market analysis and research with proves results? Zacks.com offers in-depth financial research with over 30years of proven results.,https://finnhub.io/api/news?id=36f362aa8670bf3a7d9556ca6448fce5a808d172dc52a2e2dae5ea87e6728128
company,2022-11-18 05:08:57,Copart First Quarter 2023 Earnings: EPS Misses Expectations,117196511,https://media.zenfs.com/en/simply_wall_st__316/3906216b8cfc9ed88e06b5e462760ad6,CPRT,Yahoo,Copart ( NASDAQ:CPRT ) First Quarter 2023 Results Key Financial Results Revenue: US$893.4m (up 10% from 1Q 2022). Net...,https://finnhub.io/api/news?id=f0af1384c388a1bbd75b14ccdb83db475466ff5e63ada0c815f961af1d9bb7fa
company,2022-11-18 01:02:00,Copart price target raised to $74 from $68 at Baird,117873967,,CPRT,Thefly.com,Looking for stock market analysis and research with proves results? Zacks.com offers in-depth financial research with over 30years of proven results.,https://finnhub.io/api/news?id=bb77d73f655ee9592aaa467861005f83b9e5640eaa06965d5900ee4d52b9a623
company,2022-11-17 09:52:02,"Copart (CPRT) Q1 Earnings Miss, Service Revenues Lag Estimates",117188910,https://media.zenfs.com/en/zacks.com/d029cec63692623ab191a664e47b1d3c,CPRT,Yahoo,"Copart's (CPRT) fiscal Q1 service revenues (accounting for more than 81% of total revenues) come in at $726.8 million, falling short of the consensus mark of $729 million.",https://finnhub.io/api/news?id=45d9265f7fae4cea3ec07789caff54e0d18df35fce8e58e95d3eaf867f74f0f0
