category,datetime,headline,id,image,related,source,summary,url
company,2022-12-12 15:03:45,Top 15 Digital Transformation Companies in the US,117485701,https://media.zenfs.com/en/insidermonkey.com/16615175a6b4c5bd680dcaf145b37ef4,CTSH,Yahoo,"In this piece, we will take a look at the top 15 digital transformation companies in the U.S. For more companies, head on over to Top 5 Digital Transformation Companies in the U.S. Digital transformation is a diverse field and one that continues to evolve with time. As the name suggests, this sector simply involves […]",https://finnhub.io/api/news?id=4db58ee069b1df9537b9737745cd539c639f9f65e2ec2a4b03212f17a77e4565
company,2022-12-12 11:47:00,"Cognizant Technology Solutions Corp. stock rises Monday, still underperforms market",117509072,https://images.mktw.net/im-220105/social,CTSH,MarketWatch,"Shares of Cognizant Technology Solutions Corp. rose 1.20% to $59.04 Monday, on what proved to be an all-around positive trading session for the stock market,...",https://finnhub.io/api/news?id=28018681b25daebe5829820ef2191ed22f6b4b229c530f37b405f06c97197877
company,2022-12-12 04:14:00,Harris Williams Advises Utegration on its Pending Sale to Cognizant,117932845,,CTSH,Business Wire,Looking for stock market analysis and research with proves results? Zacks.com offers in-depth financial research with over 30years of proven results.,https://finnhub.io/api/news?id=6c65e607ec2f7c8a6defaef5c362357ce2093861987778fcae4cf5d0b1629522
company,2022-12-16 11:47:00,Cognizant Technology Solutions Corp. stock underperforms Friday when compared to competitors,117559390,https://images.mktw.net/im-220105/social,CTSH,MarketWatch,"Shares of Cognizant Technology Solutions Corp. slipped 1.40% to $55.56 Friday, on what proved to be an all-around dismal trading session for the stock...",https://finnhub.io/api/news?id=c3e4d4f14859e2568f93756747cd4616bf219f876609f11e7848768736f7e814
company,2022-12-15 11:47:00,"Cognizant Technology Solutions Corp. stock falls Thursday, underperforms market",117559391,https://images.mktw.net/im-220105/social,CTSH,MarketWatch,"Shares of Cognizant Technology Solutions Corp. slid 3.23% to $56.35 Thursday, on what proved to be an all-around poor trading session for the stock market,...",https://finnhub.io/api/news?id=52b81045244be69eab4f89bbc49307ebb0ee3491fb7b29b9c9e6daaacd28aca3
company,2022-12-15 08:00:00,Syniti and Cognizant Partner to Deliver Improved Data Transformation,117530786,https://media.zenfs.com/en/prnewswire.com/f7ce02821e79dffcecc17c477ba5d861,CTSH,Yahoo,"Syniti, a global leader in enterprise data management, and Cognizant today announced a strategic alliance agreement between the two companies. Syniti will be Cognizant's solution provider of choice for data transformation delivery in driving customers' migrations to SAP S/4HANA®.",https://finnhub.io/api/news?id=e1a8ed77bc41c2e07060306d6ac7b90111faacc8cd5768132fcebe5e82f499bf
company,2022-12-15 06:57:14,Returns On Capital At Cognizant Technology Solutions (NASDAQ:CTSH) Have Hit The Brakes,117530787,https://media.zenfs.com/en/simply_wall_st__316/b394072c431426666ba19d9f9857f297,CTSH,Yahoo,"Finding a business that has the potential to grow substantially is not easy, but it is possible if we look at a few key...",https://finnhub.io/api/news?id=04286a36a41adb31f078e5a94597509269284c17529fffd79d0c2cb8b136e7c1
company,2022-12-15 02:41:00,J.P. Morgan expects IT/BPO demand uncertainty to prevail in 2023,117632191,,CTSH,Seeking Alpha,Looking for stock market analysis and research with proves results? Zacks.com offers in-depth financial research with over 30years of proven results.,https://finnhub.io/api/news?id=5e8a7a57560abb26bf8b311be859a05241f6012210b2bd6e16e8fb935a7ff1e3
company,2022-12-15 02:18:00,"Cognizant, Syniti announce strategic alliance agreement",117932832,,CTSH,Thefly.com,Looking for stock market analysis and research with proves results? Zacks.com offers in-depth financial research with over 30years of proven results.,https://finnhub.io/api/news?id=823ad646e682a4d56dcc3d5206cfdb3331d32a742a1b92c9c2d800c0ff755949
company,2022-12-15 01:46:00,GLOBAL BROKER RATINGS: Investec raises Phoenix Group to 'buy',117628651,,CTSH,Alliance News,Looking for stock market analysis and research with proves results? Zacks.com offers in-depth financial research with over 30years of proven results.,https://finnhub.io/api/news?id=62964a1134fe7ff599635149d246fbc364d737fd200deb6b2c7893038df44a2c
company,2022-12-14 23:03:00,Cognizant downgraded to Underweight from Neutral at JPMorgan,117932836,,CTSH,Thefly.com,Looking for stock market analysis and research with proves results? Zacks.com offers in-depth financial research with over 30years of proven results.,https://finnhub.io/api/news?id=72b4764c026a4be3ef8c91c03008096e5b65224ee1e40fd5f6e7ec25812e8be1
company,2022-12-14 11:48:00,"Cognizant Technology Solutions Corp. stock falls Wednesday, underperforms market",117559392,https://images.mktw.net/im-220105/social,CTSH,MarketWatch,"Shares of Cognizant Technology Solutions Corp. shed 1.61% to $58.23 Wednesday, on what proved to be an all-around grim trading session for the stock market,...",https://finnhub.io/api/news?id=36cf5c6157e1b150e6b0440f9bfeb2ba803215163942f1fcb044cbbcae8f3f4b
company,2022-12-21 11:47:00,"Cognizant Technology Solutions Corp. stock rises Wednesday, still underperforms market",117695658,https://images.mktw.net/im-220105/social,CTSH,MarketWatch,"Shares of Cognizant Technology Solutions Corp. rose 1.07% to $55.63 Wednesday, on what proved to be an all-around positive trading session for the stock...",https://finnhub.io/api/news?id=4d324b8e32438e75cd7e798d7d7ba62a794c167f8e65bc17c968811c195a0eae
company,2022-12-20 11:47:00,Cognizant Technology Solutions Corp. stock underperforms Tuesday when compared to competitors despite daily gains,117695659,https://images.mktw.net/im-220105/social,CTSH,MarketWatch,"Shares of Cognizant Technology Solutions Corp. inched 0.11% higher to $55.04 Tuesday, on what proved to be an all-around great trading session for the stock...",https://finnhub.io/api/news?id=a7184be71078357556c0757561d4240d3d68e2e52f5dc780c44604a7e1422334
company,2022-12-19 11:47:00,"Cognizant Technology Solutions Corp. stock falls Monday, underperforms market",117695661,https://images.mktw.net/im-220105/social,CTSH,MarketWatch,"Shares of Cognizant Technology Solutions Corp. shed 1.04% to $54.98 Monday, on what proved to be an all-around dismal trading session for the stock market,...",https://finnhub.io/api/news?id=bd56ff56507c2d4eb8430c1bda67684c21d61290b5d2844eee47d6bf99c9d0ac
company,2022-12-19 06:19:00,First Week of CTSH February 2023 Options Trading,117932817,,CTSH,Stock Options Channel,Looking for stock market analysis and research with proves results? Zacks.com offers in-depth financial research with over 30years of proven results.,https://finnhub.io/api/news?id=7ea8838f3ce3cba9ad067db6a87488cc6a97526fbb5e9c2bc03114fd40109efc
company,2022-12-19 06:01:00,EPAM: Value and Fast Growth All in One,117632610,,CTSH,GuruFocus,Looking for stock market analysis and research with proves results? Zacks.com offers in-depth financial research with over 30years of proven results.,https://finnhub.io/api/news?id=d611c7d350c8a28e01271b8a375ca9e12b28504ed02987b285286b4d15155d16
company,2022-12-19 03:37:00,The 7 Best Tech Stocks to Buy Now,117691542,,CTSH,InvestorPlace,Looking for stock market analysis and research with proves results? Zacks.com offers in-depth financial research with over 30years of proven results.,https://finnhub.io/api/news?id=a4dfb642d84f8977ec098328b9e3751cd21928e46113c00f8a18cd625e3c9499
company,2022-12-23 11:47:00,Cognizant Technology Solutions Corp. stock outperforms market on strong trading day,117695654,https://images.mktw.net/im-220105/social,CTSH,MarketWatch,"Shares of Cognizant Technology Solutions Corp. rallied 1.01% to $56.02 Friday, on what proved to be an all-around positive trading session for the stock...",https://finnhub.io/api/news?id=7933a2c359f2f096a1a55446cb8cc605105fffc90340630cfc341a9517c6ea2e
company,2022-12-23 07:20:07,20 Biggest Companies that Sponsor H1B Visas,117624710,,CTSH,Yahoo,"In this piece, we will take a look at the 20 biggest companies that sponsor H1B visas. For more companies, head on over to 5 Biggest Companies that Sponsor H1B Visas. The United States of America is the world’s largest economy and among the most popular nations in the world. It is home to one […]",https://finnhub.io/api/news?id=a74c72e4ccb36856920c6ddfd4e1f36ac3c446ecb368c36ad6103a4d9d869732
company,2022-12-22 15:07:00,Justice Department Faces Accusations It Outsourced a Corporate Investigation in Bribery Case,117619189,,CTSH,Yahoo,"Two former executives of a New Jersey technology company are accusing federal prosecutors of outsourcing a bribery probe, in a legal challenge that could have implications for the Justice Department’s preferred approach in recent years to investigating corporate crimes.",https://finnhub.io/api/news?id=c525e027354c8d21cbb019303ac26cb22bd113543ab8a29a958cf9a5277efc1b
company,2022-12-22 11:47:00,Cognizant Technology Solutions Corp. stock outperforms competitors despite losses on the day,117695656,https://images.mktw.net/im-220105/social,CTSH,MarketWatch,"Shares of Cognizant Technology Solutions Corp. dropped 0.31% to $55.46 Thursday, on what proved to be an all-around poor trading session for the stock...",https://finnhub.io/api/news?id=78ea39fc45ce378d8ac9d04d03a1b43b3e1e250fb4c4638ae6e5fbc067e77840
company,2022-12-29 11:47:00,Cognizant Technology Solutions Corp. stock outperforms competitors on strong trading day,117970168,https://images.mktw.net/im-220105/social,CTSH,MarketWatch,"Shares of Cognizant Technology Solutions Corp. rose 2.79% to $57.13 Thursday, on what proved to be an all-around favorable trading session for the stock...",https://finnhub.io/api/news?id=4b2744107906345619da0f2b30157eed9e4d2e9f546cccf386767d2f15f599e7
company,2022-12-28 11:47:00,"Cognizant Technology Solutions Corp. stock falls Wednesday, underperforms market",117852553,https://images.mktw.net/im-220105/social,CTSH,MarketWatch,"Shares of Cognizant Technology Solutions Corp. slipped 1.59% to $55.58 Wednesday, on what proved to be an all-around dismal trading session for the stock...",https://finnhub.io/api/news?id=f208f32c838f5cbc8dee10b11d9a766af37ae0c0c195256f5f11a3c75af557f3
company,2022-12-30 11:47:00,"Cognizant Technology Solutions Corp. stock rises Friday, outperforms market",117970167,https://images.mktw.net/im-220105/social,CTSH,MarketWatch,"Shares of Cognizant Technology Solutions Corp. inched 0.11% higher to $57.19 Friday, on what proved to be an all-around dismal trading session for the stock...",https://finnhub.io/api/news?id=991bef690a750ddcf63166688fb351511a0bf98387c341e4e92fcdba99fe91d0
company,2023-01-06 08:49:29,Palantir: It's Still Ridiculously Pricey,118168162,https://static.seekingalpha.com/cdn/s3/uploads/getty_images/1338939245/image_1338939245.jpg?io=getty-c-w750,CTSH,SeekingAlpha,Palantir Technologies Inc. stock plunged off a cliff by about 68% in 2022. Is it finally time to load up the truck? Click here for more on PLTR.,https://finnhub.io/api/news?id=a90911e7da6c3e160b51e339f15748577766a77acd8f242149442281000db38d
company,2023-01-05 14:09:54,Top 10 HR Companies in the World,118149288,https://media.zenfs.com/en/insidermonkey.com/8d1720162e3a6a36dc016a343d3a2e1c,CTSH,Yahoo,"In this article, we take a look at the top 10 HR companies in the world. If you want to see more of the top HR companies in the world, go directly to Top 5 HR Companies in the World. A company’s employee base is very important. With the right employees, a company can be […]",https://finnhub.io/api/news?id=442869d3162dcbdb2d9fe33393224f420b18831b6ca04d54189eb243424b289a
company,2023-01-04 23:37:57,RDVY: High Dividend Growth And Price Volatility,118137387,https://static.seekingalpha.com/cdn/s3/uploads/getty_images/1421622240/image_1421622240.jpg?io=getty-c-w750,CTSH,SeekingAlpha,"RDVY has a 50-stock portfolio, selected on dividend growth and quality factors once a year and rebalanced in equal weight every qtr. See why the ETF is a Hold.",https://finnhub.io/api/news?id=31d1f9958f1501bf14dc098fba68154d4e58a299682aa7cbcd1aff01929d1b6b
company,2023-01-04 11:47:00,"Cognizant Technology Solutions Corp. stock rises Wednesday, outperforms market",118127804,https://images.mktw.net/im-220105/social,CTSH,MarketWatch,"Shares of Cognizant Technology Solutions Corp. inched 0.82% higher to $58.06 Wednesday, on what proved to be an all-around great trading session for the...",https://finnhub.io/api/news?id=163b299bb9c9840c4771c032602d4a6c100e26c3dce27f2f5d02ec9f5e481490
company,2023-01-03 11:47:00,Cognizant Technology Solutions Corp. stock outperforms competitors on strong trading day,118127805,https://images.mktw.net/im-220105/social,CTSH,MarketWatch,"Shares of Cognizant Technology Solutions Corp. inched 0.70% higher to $57.59 Tuesday, on what proved to be an all-around grim trading session for the stock...",https://finnhub.io/api/news?id=019ad14da85dbf5ae7702c9df8824b27e66f1cade7009a7f71f82b64c1679af8
company,2023-01-07 15:52:21,7 Must-Buy Value Stocks for Your January Buy List,118202447,https://media.zenfs.com/en/investorplace_417/d339c588c31732db7fed8fdc8a0550d2,CTSH,Yahoo,"Fundamentally, the narrative for value stocks to buy in Jan. (or any other month) sells itself. Even the wealthiest among us find great deals attractive. Indeed, it takes a special kind of person to deliberately acquire something that’s overvalued for no good reason. As well, the wild market volatility in 2022 brings to the table amazing opportunities regarding value stocks to buy. Sure, no one likes seeing red ink in their portfolio. However, with a little bit of patience, less-appreciated idea",https://finnhub.io/api/news?id=575a93db8611944340ec7b7a54af2484bb3f8de9efd9c56e1ba9b70985388558
company,2023-01-07 14:10:58,7 Must-Buy Tech Stocks for Your January Buy List,118198971,https://media.zenfs.com/en/investorplace_417/d339c588c31732db7fed8fdc8a0550d2,CTSH,Yahoo,"While many investors may still be reeling from the chaos of 2022, the volatility also presents contrarians with upside (and discounted) prospects among compelling tech stocks to buy. True, red ink by itself doesn’t necessarily equate to opportunity. Still, the underlying innovation sector may not stay deflated indefinitely, even with recession fears on the horizon. It’s not to dismiss the possibility of an economic downturn. However, several enticing tech stocks to buy already incurred substanti",https://finnhub.io/api/news?id=1c796a1506b0ee8e043f03bcf1cbf9cef08f6415cf3482fb2c166da7e1e0cc11
company,2023-01-07 09:04:43,Is There An Opportunity With Cognizant Technology Solutions Corporation's (NASDAQ:CTSH) 49% Undervaluation?,118225941,https://media.zenfs.com/en/simply_wall_st__316/b394072c431426666ba19d9f9857f297,CTSH,Yahoo,Does the January share price for Cognizant Technology Solutions Corporation ( NASDAQ:CTSH ) reflect what it's really...,https://finnhub.io/api/news?id=0361b27ec69738eeb788a37a9ebc2715d7e541089bdda2ddabafc918a3fd22be
company,2023-01-07 09:00:32,Insiders who sold US$1.1m worth of Cognizant Technology Solutions Corporation (NASDAQ:CTSH) stock last year were handsomely rewarded,118225942,https://media.zenfs.com/en/simply_wall_st__316/b394072c431426666ba19d9f9857f297,CTSH,Yahoo,"Even though Cognizant Technology Solutions Corporation ( NASDAQ:CTSH ) stock gained 4.5% last week, insiders who sold...",https://finnhub.io/api/news?id=3ca66c57133a9fa88ebc1198902073043e0944a253c5f655c58a3fbc062f456c
company,2023-01-12 10:54:43,Cognizant Shares Gain Following Leadership Changes; Names Former Infosys President Ravi Kumar As CEO,118225936,https://media.zenfs.com/en/Benzinga/2f3c7c400259b154edd45b55bbcafc32,CTSH,Yahoo,"Cognizant Technology Solutions Corp (NASDAQ: CTSH) named Ravi Kumar S as CEO and a member of the Board, effective immediately. Kumar succeeds Brian Humphries in both roles. Humphries will remain with the company as a special advisor until March 15, 2023. Kumar joined Cognizant after a 20-year career at Infosys Limited (NYSE: INFY), where he held various leadership roles, most recently serving as President from January 2016 through October 2022. Cognizant has elected board member Stephen J. Rohle",https://finnhub.io/api/news?id=6e0d2a441c176e7fc78781aff5bdeb339f50b0b3a2088d3cd7d1430780caae54
company,2023-01-12 08:53:00,"Cognizant stock swings higher toward a 4 1/2-month high after profit outlook cut, CEO steps down",118208828,https://media.zenfs.com/en/marketwatch.com/96d076434b2a015a3010bd2787b8c856,CTSH,Yahoo,"Shares of Cognizant Technology Solutions Corp.  (CTSH)  shot up 8.1% toward a 4 1/2-month high in morning trading Thursday, reversing an earlier premarket loss, after the business consultant cut its profit outlook and said Chief Executive Brian Humphries will step down after four years in the role, and will be succeeded by Ravi Kumar, effective Immediately.  Humphries will remain as special advisor until March 15.  “The Board is focused on positioning Cognizant to reaccelerate growth and drive shareholder value,” said Chairman Stephen Rohleder.",https://finnhub.io/api/news?id=0606e30f95a7a4db2bdf36470f0e95a892bfcb7fcf53d2385769b1748fbd89d5
company,2023-01-12 08:30:00,Cognizant Appoints Ravi Kumar S as Chief Executive Officer,118225938,https://media.zenfs.com/en/prnewswire.com/b9f85bae8ec09506fbbd7d8e454f93e3,CTSH,Yahoo,"Cognizant (Nasdaq: CTSH) today announced that its Board of Directors (the ""Board"") has named Ravi Kumar S as CEO and a member of the Board, effective immediately. Kumar succeeds Brian Humphries in both roles. To facilitate a smooth transition, Humphries will remain with the Company as a special advisor until March 15, 2023.",https://finnhub.io/api/news?id=8fb670067c6df314840d8f0a1d451ecc5b29b9949c208d970482ca35b9bdb990
company,2023-01-12 07:39:35,"Stocks making the biggest moves midday: Cognizant, American Airlines, Logitech and more",118205130,https://image.cnbcfm.com/api/v1/image/107177777-1673529236557-gettyimages-1246158581-124077-me-faa-ground-stop-lax-05-cmc.jpeg?v=1673545175&w=1920&h=1080,CTSH,CNBC,These are the stocks posting the largest moves in midday trading. ,https://finnhub.io/api/news?id=ecda85463aa3bd8684576dcd1089c96d1c0b9029bde1114721864dd676958dc0
company,2023-01-17 11:47:00,"Cognizant Technology Solutions Corp. stock falls Tuesday, underperforms market",118305398,https://images.mktw.net/im-220105/social,CTSH,MarketWatch,"Shares of Cognizant Technology Solutions Corp. slipped 1.72% to $62.96 Tuesday, on what proved to be an all-around poor trading session for the stock market,...",https://finnhub.io/api/news?id=5ca06f8b6a388f067737203fcb32679c5bbe0e028731e96b8baac2efa3802764
company,2023-01-17 08:00:00,Cognizant Schedules Fourth Quarter 2022 Earnings Release and Conference Call,118289469,https://media.zenfs.com/en/prnewswire.com/c8de4a7538ab6b3d5d3fe951dc211baa,CTSH,Yahoo,"Cognizant (Nasdaq: CTSH), a leading provider of information technology, consulting, and business process services, will announce results for the fourth quarter of 2022 on Thursday, February 2, 2023, after market close.",https://finnhub.io/api/news?id=fc061c5b3014823a21bd748f552fd66362dcfbcf19ec6c1d16ed84616dc97829
company,2023-01-21 20:40:00,"Buy/Sell: Wall Street`s Top 10 Stock Calls This Week - Sunday, Jan. 22",118457319,,CTSH,TalkMarkets,Looking for stock market analysis and research with proves results? Zacks.com offers in-depth financial research with over 30years of proven results.,https://finnhub.io/api/news?id=15a35258edc56b79ed76419a6015d5e44b9ad0a2884688ea4c392d024d525829
company,2023-01-21 03:12:00,Buy/Sell: Wall Street`s top 10 stock calls this week,118457321,,CTSH,Thefly.com,Looking for stock market analysis and research with proves results? Zacks.com offers in-depth financial research with over 30years of proven results.,https://finnhub.io/api/news?id=922f77104e768d9428f30c075e7793069b1bc8c2334e2455b5e29b131631abc0
company,2023-01-19 06:01:00,What You Missed On Wall Street This Morning,118414621,,CTSH,Thefly.com,Looking for stock market analysis and research with proves results? Zacks.com offers in-depth financial research with over 30years of proven results.,https://finnhub.io/api/news?id=a13c94b3478ea907a1f3917000cabcb773461ffe215e8ca93671609ad51fb5ff
company,2023-01-19 04:15:00,"Street Wrap: Today`s Top 15 Upgrades, Downgrades, Initiations",118409021,,CTSH,Thefly.com,Looking for stock market analysis and research with proves results? Zacks.com offers in-depth financial research with over 30years of proven results.,https://finnhub.io/api/news?id=f77b3a599377bf0bbc58ee875b6b25654f7f0c26a3a57342a66bf428b4747a4a
company,2023-01-26 09:16:33,15 Most Undervalued Quality Stocks To Buy According To Hedge Funds,118379475,https://media.zenfs.com/en/insidermonkey.com/fa0b8bb863ca7cb691d99a09ad4c4ed6,CTSH,Yahoo,"In this article, we discuss 15 most undervalued quality stocks to buy according to hedge funds. If you want to see more stocks in this selection, 5 Most Undervalued Quality Stocks To Buy According To Hedge Funds. Quality stocks usually have little debt, steady earnings, regular growth in assets, and effective leadership. Investors can identify […]",https://finnhub.io/api/news?id=5750e5347ad96c45e6a9c3cf6aabea9c9dad648af25e40e38f507926a1d1f622
company,2023-01-26 07:00:00,"Cognizant and CoreLogic Extend Decade-Long Relationship With $1B, Ten-Year Services Agreement",118390091,https://media.zenfs.com/en/prnewswire.com/c8de4a7538ab6b3d5d3fe951dc211baa,CTSH,Yahoo,"Cognizant (NASDAQ: CTSH), a leading provider of information technology, consulting, and business process services, today announced a new, 10-year services agreement valued at approximately $1 billion with CoreLogic®, a leading global property information, analytics and data-enabled solutions provider.",https://finnhub.io/api/news?id=90bc24a75fbdeb0be86f859719e4e05db538880dd3f7febedcd19d07d7a8de8a
company,2023-01-26 01:10:00,"Cognizant, CoreLogic announce new 10-year services agreement worth $1B",118457299,,CTSH,Thefly.com,Looking for stock market analysis and research with proves results? Zacks.com offers in-depth financial research with over 30years of proven results.,https://finnhub.io/api/news?id=068810c7f95045455c58a5b83760e6d805b53edc6de82a95d5963d68e4500ff2
company,2023-01-25 22:48:00,"Cognizant Technology Solutions Corp. stock rises Thursday, still underperforms market",118457301,,CTSH,MarketWatch,Looking for stock market analysis and research with proves results? Zacks.com offers in-depth financial research with over 30years of proven results.,https://finnhub.io/api/news?id=78e408bff656579b706e4d43cbd0ed3d8c381f1f9117965252040c39f9b21acc
company,2023-01-24 22:48:00,Cognizant Technology Solutions Corp. stock outperforms market on strong trading day,118457303,,CTSH,MarketWatch,Looking for stock market analysis and research with proves results? Zacks.com offers in-depth financial research with over 30years of proven results.,https://finnhub.io/api/news?id=88b89d9e15ea3f934ef58b95ce41aa9bb0eb64d4e10d19b10e6b749e87ee2e37
company,2023-01-24 17:54:50,"YouTube Illegally Uses Return-to-Office Push to Derail Union, Complaint Claims",118357283,https://s.yimg.com/ny/api/res/1.2/dKlj2J6EfcXwmp3febBOWQ--/YXBwaWQ9aGlnaGxhbmRlcjt3PTEyMDA7aD04MDA-/https://media.zenfs.com/en/bloomberg_technology_68/3490a32648556c4acb337080d4838cdf,CTSH,Yahoo,"(Bloomberg) -- Alphabet Inc. is illegally using return-to-office policies as a tool to try to derail YouTube contract workers from organizing in Texas, a union alleged in a National Labor Relations Board complaint.Most Read from BloombergUS Confronts China Over Companies’ Ties to Russia War EffortNYSE Investigates Technical Issue That Caused Wild Market OpenChina Slams US on Debt Limit and Accuses Washington of SabotageCitadel’s $16 Billion Win Tops Paulson’s Greatest Trade EverBlizzard Manager",https://finnhub.io/api/news?id=c89762cc507263b9a1ea8e61cd088448ffa48fe2c9bcfa1eca086fef50e4100e
company,2023-01-24 06:15:00,Cognizant (CTSH): New Buy Recommendation for This Technology Giant,118457305,,CTSH,TipRanks,Looking for stock market analysis and research with proves results? Zacks.com offers in-depth financial research with over 30years of proven results.,https://finnhub.io/api/news?id=c9e2ea26c0fd99a5281088573055983657b4744b5397aa87f0f687d8f1263296
company,2023-01-24 00:31:00,"Correction: IBM upgraded, Cognizant downgraded previously at MoffettNathanson",118457307,,CTSH,Thefly.com,Looking for stock market analysis and research with proves results? Zacks.com offers in-depth financial research with over 30years of proven results.,https://finnhub.io/api/news?id=0f69dde72956675e9a73714cf9845351f1d115154ce17ef055606f0a60fa01e2
company,2023-01-24 00:23:00,Cognizant downgraded to Underperform from Market Perform at MoffettNathanson,118457309,,CTSH,Thefly.com,Looking for stock market analysis and research with proves results? Zacks.com offers in-depth financial research with over 30years of proven results.,https://finnhub.io/api/news?id=c936512f98e8cf5b0d41a85542c76306f1ba0e3a23773f7d0eb7163ec8155d4d
company,2023-01-23 22:48:00,Cognizant Technology Solutions Corp. stock outperforms competitors despite losses on the day,118457311,,CTSH,MarketWatch,Looking for stock market analysis and research with proves results? Zacks.com offers in-depth financial research with over 30years of proven results.,https://finnhub.io/api/news?id=b1c61f4e9fc3c71ec083d5052699ba9678def94a15627b71e492a55dea89a4f1
