category,datetime,headline,id,image,related,source,summary,url
company,2023-07-07 06:00:00,2 Top Growth Stocks to Buy Hand Over Fist in July,121251821,https://s.yimg.com/ny/api/res/1.2/j8JDkEt5lg09.J112YWhdQ--/YXBwaWQ9aGlnaGxhbmRlcjt3PTEyMDA7aD04MDA-/https://media.zenfs.com/en/motleyfool.com/4d812123870194f8bc05f82539417f5c,DDOG,Yahoo,"Many U.S. companies will be reporting their financial results throughout July and August, which will offer investors insight into their businesses.  Datadog (NASDAQ: DDOG) and DigitalOcean (NYSE: DOCN) are two great examples.  Both companies are due to report their Q2 results in early August, so this month might be a great time for investors to start accumulating a long-term position.",https://finnhub.io/api/news?id=6edd6202c897318fd7d6cba5cbf1a012c5e44d4f599585a28b2e3dfd5264257c
company,2023-07-07 05:10:00,Better Buy: Palantir vs. Datadog,121251822,https://s.yimg.com/ny/api/res/1.2/bYgWva3m5E3RRSM2os4LFg--/YXBwaWQ9aGlnaGxhbmRlcjt3PTEyMDA7aD02NzU-/https://media.zenfs.com/en/motleyfool.com/7c90847bbbb1fd8b922ebe4192cff5c4,DDOG,Yahoo,"Palantir (NYSE: PLTR) and Datadog (NASDAQ: DDOG) both streamline the collection of data for organizations.  Palantir's government-oriented Gotham platform and commercial-oriented Foundry platform accumulate data from a broad range of disparate sources.  Datadog's platform collects real-time diagnostics data from an organization's servers, databases, and apps, then aggregates that information onto unified dashboards to aid IT professionals.",https://finnhub.io/api/news?id=97a1021c00eb1b799a26d664ab4252d481fab360e1649658aa722b9145130ec2
company,2023-07-06 08:00:16,"Is Datadog, Inc. (NASDAQ:DDOG) Trading At A 28% Discount?",121238374,https://media.zenfs.com/en/simply_wall_st__316/41bdd0c670f621394929d5266c5d6c72,DDOG,Yahoo,Key Insights The projected fair value for Datadog is US$137 based on 2 Stage Free Cash Flow to Equity Current share...,https://finnhub.io/api/news?id=d7cbb0d329bb8bddbdadb958986d30b44c72c3fd21c3153f21403ca5566bd196
company,2023-07-13 16:42:59,Here's Why Datadog Stock Climbed 34% in the First Half of 2023,121375797,https://s.yimg.com/ny/api/res/1.2/W3GhFPUWhcIfXmWYfelSvg--/YXBwaWQ9aGlnaGxhbmRlcjt3PTEyMDA7aD04MDA-/https://media.zenfs.com/en/motleyfool.com/973261c307cded68ef2020c1815fe581,DDOG,Yahoo,"Shares of Datadog (NASDAQ: DDOG) rose 33.9% during the first six months of the year, according to S&P Global Market Intelligence.  It also rode a wave of momentum for growth stocks that was triggered by promising economic news.  Datadog provides monitoring and analytics software services for cloud computing systems.",https://finnhub.io/api/news?id=381e6041f1c9eb38d2c85ca7a0def33aab85a07c29cd08a5e622bf96184d0b53
company,2023-07-13 16:17:08,Cramer's Lightning Round: Datadog is a buy,121376332,https://image.cnbcfm.com/api/v1/image/102086320-mad-money-lightning-2.jpg?v=1689293828&w=1920&h=1080,DDOG,CNBC,"""Mad Money"" host Jim Cramer rings the lightning round bell, which means he's giving his answers to callers' stock questions at rapid speed.",https://finnhub.io/api/news?id=143350a7e28fee15af59ff1e2fe68737f76e25dbb05b57d1cff2e9a259779668
company,2023-07-13 16:05:00,Datadog Announces Date of Second Quarter Fiscal Year 2023 Earnings Call,121375798,https://media.zenfs.com/en/prnewswire.com/d952ecf955dd3968248e1f7edb882015,DDOG,Yahoo,"Datadog, Inc. (NASDAQ: DDOG), the monitoring and security platform for cloud applications, today announced that it will report its second quarter fiscal year 2023 financial results before the U.S. financial markets open on Tuesday, August 8, 2023.",https://finnhub.io/api/news?id=9bf4a3cc43913f6a8860987c8bd7e88477978d20103d6424262b98d9a8dbda69
company,2023-07-13 15:25:34,"Lightning Round: I was positive on RH while the CEO was negative, says Jim Cramer",121375004,https://image.cnbcfm.com/api/v1/image/107271488-MM-E-071323_mezz.jpg?v=1689290734&w=1920&h=1080,DDOG,CNBC,"'Mad Money' host Jim Cramer weighs in on stocks including: Super Micro Computer, Fresh Del Monte, MYR Group, Sterling Infrastructure, RH and Datadog.",https://finnhub.io/api/news?id=730d06733fbdc4bf0a09ab45d00a59d7168f7fd4c199cef29b3690bf80303d88
company,2023-07-12 09:53:00,The Nasdaq Just Had Its Best First Half in 40 Years: 2 Remarkable Growth Stocks to Buy Now,121339404,https://s.yimg.com/ny/api/res/1.2/uCgsTSoLYZmOwsf07IuH8g--/YXBwaWQ9aGlnaGxhbmRlcjt3PTEyMDA7aD02ODY-/https://media.zenfs.com/en/motleyfool.com/520fd97daa1efeced701d79aa1fa2656,DDOG,Yahoo,"The tech-heavy Nasdaq Composite skyrocketed in the first half of 2023, but there are still buying opportunities to be found.",https://finnhub.io/api/news?id=1403ef72c397f474ac0ca96234a421704ba09d04947327048a05435e5fb62daa
company,2023-07-12 06:31:13,Dow Jones Futures Rise Amid Broad Market Strength; CPI Inflation Report Due,121330451,https://media.zenfs.com/en/ibd.com/28ad5e95b79cd942453df4d3a968579b,DDOG,Yahoo,Salesforce led several software stocks into buy areas amid broader market strength. The CPI inflation report is on deck.,https://finnhub.io/api/news?id=98c3c5de228514b7fcb36f598fb0b875d48d7df352be11198d191da2d8738aeb
company,2023-07-11 22:02:13,Dow Jones Futures: CPI Inflation Report Due Amid Broad Market Strength,121326508,https://media.zenfs.com/en/ibd.com/28ad5e95b79cd942453df4d3a968579b,DDOG,Yahoo,Salesforce led several software stocks into buy areas amid broader market strength. The CPI inflation report is on deck.,https://finnhub.io/api/news?id=8343f82b2313ac4600eb290c55cbcfcd1622b60bb654aea7ba4e45392ba036af
company,2023-07-11 08:44:00,10 Information Technology Stocks Whale Activity In Today's Session,121315683,,DDOG,Benzinga,Looking for stock market analysis and research with proves results? Zacks.com offers in-depth financial research with over 30years of proven results.,https://finnhub.io/api/news?id=260d5dcd5731d4135a4c76ba5ad2a4c6c59ffcb3a2314008cedfb2eed0280541
company,2023-07-11 08:39:00,Check Out What Whales Are Doing With DDOG,121344569,,DDOG,Benzinga,Looking for stock market analysis and research with proves results? Zacks.com offers in-depth financial research with over 30years of proven results.,https://finnhub.io/api/news?id=d02dc48cadfedaff5508c2297d87604da6891c30322f146d9c1068f804e1ab03
company,2023-07-11 08:17:00,"Zacks Investment Ideas feature highlights: Rambus, Monday.com, Datadog, MongoDB and Alphabet's",121310363,https://media.zenfs.com/en/zacks.com/b710a1eb6cdacbc4c19b02b9a3482f7e,DDOG,Yahoo,"Rambus, Monday.com, Datadog, MongoDB and Alphabet's are part of the Zacks Investment Ideas article.",https://finnhub.io/api/news?id=ba2e6728435ea1b548a7ad02e306b167e8c5c13770cf1e870413118be1249b84
company,2023-07-11 06:49:00,Datadog Reaches Analyst Target Price,121344570,,DDOG,ETF Channel,Looking for stock market analysis and research with proves results? Zacks.com offers in-depth financial research with over 30years of proven results.,https://finnhub.io/api/news?id=bec0df1462c867b4baa62d2d8887fa8fdd3f98b0478c128576b8529a55009e31
company,2023-07-10 14:14:00,Datadog Named a Leader in the 2023 Gartner® Magic Quadrant™ For Application Performance Monitoring And Observability,121296310,https://media.zenfs.com/en/prnewswire.com/d952ecf955dd3968248e1f7edb882015,DDOG,Yahoo,"Datadog, Inc. (NASDAQ: DDOG), the monitoring and security platform for cloud applications, today announced it has been named a Leader in the 2023 Gartner Magic Quadrant for Application Performance Monitoring and Observability. This is the third year in a row Gartner has positioned Datadog as a Leader in its Magic Quadrant.",https://finnhub.io/api/news?id=2017f73db779742f8eaee6d66bd931e9b423c6103fde0970d7dff4332f487fea
company,2023-07-10 11:48:03,10 Best Data Storage Stocks To Buy Now,121292937,https://media.zenfs.com/en/insidermonkey.com/95ba8249d586608dd6a9db523d1cd6e0,DDOG,Yahoo,"In this article, we discuss 10 best data storage stocks to buy now. If you want to skip our detailed analysis of the data storage industry, head directly to 5 Best Data Storage Stocks To Buy Now. Fortune Business Insights predicts that the worldwide data storage market will experience substantial growth, increasing from $247.32 billion […]",https://finnhub.io/api/news?id=e0197d7a9776a18ff2c63adb0b019962cbd337692cbea1e8ab32ebd0010008d1
company,2023-07-10 10:00:54,Possible Bearish Signals With Datadog Insiders Disposing Stock,121296314,https://media.zenfs.com/en/simply_wall_st__316/41bdd0c670f621394929d5266c5d6c72,DDOG,Yahoo,"Many Datadog, Inc. ( NASDAQ:DDOG ) insiders ditched their stock over the past year, which may be of interest to the...",https://finnhub.io/api/news?id=f153d508e94e2d969d44e9b0076df617e02f533e97eb14c63cbb79e2a0addb91
company,2023-07-09 21:45:00,Datadog call volume above normal and directionally bullish,121298019,,DDOG,Thefly.com,Looking for stock market analysis and research with proves results? Zacks.com offers in-depth financial research with over 30years of proven results.,https://finnhub.io/api/news?id=38066ce27bbe9710324033f3b7f8aef8f601215ef6952ee624f541a66fe83ee8
company,2023-07-17 16:22:00,"Why SaaS Stars Datadog, Cloudflare, and Zscaler Roared Higher Today",121434263,https://s.yimg.com/ny/api/res/1.2/HbmZiCrlw8B7HzNdRbtQ1g--/YXBwaWQ9aGlnaGxhbmRlcjt3PTEyMDA7aD04NTE-/https://media.zenfs.com/en/motleyfool.com/35d98105f5e5044351d96f53b82aab9f,DDOG,Yahoo,Two analyst upgrades and a bounce-back from last week's competitive scare sent cloud security and monitoring stocks higher on Monday.,https://finnhub.io/api/news?id=8e0d33130297724f634502c56d6fe80289bb0dad00e8960f3e1d13a25820e89a
company,2023-07-17 08:36:00,This Is What Whales Are Betting On Datadog,121429600,,DDOG,Benzinga,Looking for stock market analysis and research with proves results? Zacks.com offers in-depth financial research with over 30years of proven results.,https://finnhub.io/api/news?id=e43bfe7693eab39d8630ab009eb00fe55d2adff8003c1695110665dd2e13205f
company,2023-07-17 06:30:00,Datadog stock rallies after analyst says company ‘can deliver a strong beat’,121698987,https://s.wsj.net/public/resources/MWimages/MW-GP644_MicroS_ZG_20180906154215.jpg,DDOG,MarketWatch,Shares of Datadog Inc. were rising nearly 4% in Monday morning action after Oppenheimer analyst Ittai Kidron boosted his price target on the stock to $120...,https://finnhub.io/api/news?id=9b28d9ffd92bb69193c7507e94c839455a875c33fa2eae1f0d231b4e17d01cb1
company,2023-07-17 03:50:00,"Datadog, IQVIA, Organon And An Oilfield Services Giant Rolling Out An AI Platform: CNBC's 'Final Trades'",121426222,,DDOG,Benzinga,Looking for stock market analysis and research with proves results? Zacks.com offers in-depth financial research with over 30years of proven results.,https://finnhub.io/api/news?id=a1533e5801925b62cd91fa22e4c340a2e1856adae364efd5baa107f2770519e0
company,2023-07-17 02:34:00,Datadog price target raised to $120 from $105 at Oppenheimer,121429603,,DDOG,Thefly.com,Looking for stock market analysis and research with proves results? Zacks.com offers in-depth financial research with over 30years of proven results.,https://finnhub.io/api/news?id=8d3ca5d476182abf61ae6cca266b2a1cf51863c4cdbcebab9e0490f5d13af7e1
company,2023-07-17 01:46:00,Datadog price target raised to $112 from $82 at Mizuho,121429604,,DDOG,Thefly.com,Looking for stock market analysis and research with proves results? Zacks.com offers in-depth financial research with over 30years of proven results.,https://finnhub.io/api/news?id=b878a21184af2b1d9999a6c33ff1e8c0b9d85d0b70f2a966f256f69a1b2ac0c1
company,2023-07-16 14:05:00,Datadog Is Poised for Growth as the Cloud Monitoring Market Expands,121420007,,DDOG,Yahoo,"Artificial intelligence, the Internet of Things, and the increasing adoption of cloud computing are driving growth for Datadog.",https://finnhub.io/api/news?id=a5099b1d0b9245c5359887e9b3079b16c999f8a4e342581c2e6c9d1e4f1bbcc9
company,2023-07-16 10:00:13,"Datadog, Inc. (NASDAQ:DDOG): Are Analysts Optimistic?",121414225,https://media.zenfs.com/en/simply_wall_st__316/41bdd0c670f621394929d5266c5d6c72,DDOG,Yahoo,"We feel now is a pretty good time to analyse Datadog, Inc.'s ( NASDAQ:DDOG ) business as it appears the company may be...",https://finnhub.io/api/news?id=33922a44c3d4fb4fda5846e7f3d3be1dee6bc61da5f5f957f452fce9aa4b3df1
company,2023-07-14 17:50:19,Datadog (DDOG) Dips More Than Broader Markets: What You Should Know,121401266,https://media.zenfs.com/en/zacks.com/f541c90e0d995722d10914cb76a7c653,DDOG,Yahoo,"Datadog (DDOG) closed the most recent trading day at $108.53, moving -0.6% from the previous trading session.",https://finnhub.io/api/news?id=1040ed84a8e4763ef461434317aec3471727dd3c37391f13eaf88c6f9c0d66e0
company,2023-07-14 07:02:00,"Insider Sell: CFO David Obstler Sells 30,000 Shares of Datadog Inc",121429605,,DDOG,GuruFocus,Looking for stock market analysis and research with proves results? Zacks.com offers in-depth financial research with over 30years of proven results.,https://finnhub.io/api/news?id=0121bd7fe94e87bc7b529f07ab29bea3f225be8500edd4b9a5e407368dcdc680
company,2023-07-21 17:50:18,Datadog (DDOG) Stock Sinks As Market Gains: What You Should Know,121543087,https://media.zenfs.com/en/zacks.com/5ecaf2a9bf082a5f3a554e6526b34be0,DDOG,Yahoo,"Datadog (DDOG) closed at $109.87 in the latest trading session, marking a -0.03% move from the prior day.",https://finnhub.io/api/news?id=43525a88700c1f9153ed084ea07817a2494bd316f6b09ac1f2a8ac85fc238767
company,2023-07-21 01:16:00,"Analysts Conflicted on These Technology Names: Avnet (AVT), Datadog (DDOG) and NEXTracker, Inc. Class A (NXT)",121529253,,DDOG,TipRanks,Looking for stock market analysis and research with proves results? Zacks.com offers in-depth financial research with over 30years of proven results.,https://finnhub.io/api/news?id=d933bbf82a94e399385e266a8e32f59955661bd919d0e37a4dec4975bc449cd9
company,2023-07-20 08:34:44,3 High-Growth Stocks That Could Double Your Money,121609854,https://media.zenfs.com/en/investorplace_417/05269baa05b36ad6d6464f59d097a126,DDOG,Yahoo,"Navigating the bustling landscape of the stock market is a thrilling journey, especially when it comes to high-growth stocks. Look to the horizon now and let these stocks that could double be your guide to multiplying fortunes. This isn’t merely about chasing sky-high returns; it’s a comprehensive approach rooted in investing for growth. We are mapping out a pathway to the most alluring top growth stocks. These stocks have unparalleled upside potential, promising to give your portfolio an impres",https://finnhub.io/api/news?id=99da037d7ee549245f3ba04ada7fa4f09cbacf2462795edddfd72cca1ae8e03f
company,2023-07-20 01:24:03,Zscaler: Positioned For Success In The Evolving Cloud Security Market,121492031,https://static.seekingalpha.com/cdn/s3/uploads/getty_images/1436767563/image_1436767563.jpg?io=getty-c-w1536,DDOG,SeekingAlpha,"Zscaler excels in both security and network transformation, positioning it as a major player in the market. Click here to see why ZS stock is a buy.",https://finnhub.io/api/news?id=3766ca9a35c1c8a5a0afe5d5a460979e5b1220bfad8718ffecf630bb330c548f
company,2023-07-19 18:28:03,Barclays Maintains Datadog Inc - (DDOG) Overweight Recommendation,121484796,,DDOG,Fintel,,https://finnhub.io/api/news?id=1e7360a84431c1cd06120b9ffc2c4d19a2e76327394168060d3e5030a4d254c2
company,2023-07-19 05:50:00,Datadog Unusual Options Activity For July 19,121479783,,DDOG,Benzinga,Looking for stock market analysis and research with proves results? Zacks.com offers in-depth financial research with over 30years of proven results.,https://finnhub.io/api/news?id=776eb570d43508bfa7153069e615a384d759493651d9c9c577f088e27474b37c
company,2023-07-19 00:28:00,Datadog price target raised to $134 from $90 at Barclays,121479784,,DDOG,Thefly.com,Looking for stock market analysis and research with proves results? Zacks.com offers in-depth financial research with over 30years of proven results.,https://finnhub.io/api/news?id=92b36e5b55dfe9319933683be1d3c68f08214d2a7daeb7ff3017cb35b39e68b4
company,2023-07-18 16:09:13,Cantor Fitzgerald Reiterates Datadog Inc - (DDOG) Overweight Recommendation,121457356,,DDOG,Fintel,,https://finnhub.io/api/news?id=a4983acf03b5c401f655f4f0b0dd2530f4f9726a706ef033a69860621aa59b38
company,2023-07-18 06:21:00,November 17th Options Now Available For Datadog (DDOG),121456592,,DDOG,Stock Options Channel,Looking for stock market analysis and research with proves results? Zacks.com offers in-depth financial research with over 30years of proven results.,https://finnhub.io/api/news?id=54b49d2c6b49fd0ba47682389be650c9b65f5fb0058832fe5b904f35d5fe908a
company,2023-07-18 05:55:00,"2 Spectacular Growth Stocks That Could Turn $250,000 Into $1 Million by 2033",121443782,https://s.yimg.com/ny/api/res/1.2/iueZqIZ93Fhx0yoLOU9cJw--/YXBwaWQ9aGlnaGxhbmRlcjt3PTEyMDA7aD04MDA-/https://media.zenfs.com/en/motleyfool.com/020c6b69f27bc700cbce5760f2439837,DDOG,Yahoo,"Nobody can reliably predict where the stock market will trade next week, next month, or even next year. All history can tell us for sure is that over the long term, key indexes like the S&P 500 and Nasdaq-100 make their way to new all-time highs.",https://finnhub.io/api/news?id=cb7f8fbb719d52157501b11bc486764ad11d479e5c9f510cedbaac6f00d1984e
company,2023-07-18 04:21:00,How Is The Market Feeling About Datadog?,121456593,,DDOG,Benzinga,Looking for stock market analysis and research with proves results? Zacks.com offers in-depth financial research with over 30years of proven results.,https://finnhub.io/api/news?id=bfa1e70ba4cc2bbe92c6f38645411386b5bae00b8cb71b69f6bafbe449b4f70b
company,2023-07-18 02:49:05,Oppenheimer Maintains Datadog Inc - (DDOG) Outperform Recommendation,121441820,,DDOG,Fintel,,https://finnhub.io/api/news?id=59d29184422513ee3b7cc14f6d6eba41158813686794c17c28d36b13229d317b
company,2023-07-17 23:05:00,The Latest Analyst Ratings for Datadog,121456594,,DDOG,Benzinga,Looking for stock market analysis and research with proves results? Zacks.com offers in-depth financial research with over 30years of proven results.,https://finnhub.io/api/news?id=410134dafc850c07c7d6ed98f6cbaa3e12277bb01b6fde87923b57cda1bffee7
company,2023-07-25 15:44:00,Datadog Shares Spike as Analyst Sees Boost From AI,121591429,https://s.yimg.com/ny/api/res/1.2/zGsmu1VaoltqbPfs8NQMUw--/YXBwaWQ9aGlnaGxhbmRlcjt3PTEyMDA7aD02MDA-/https://media.zenfs.com/en/Barrons.com/212d09dfb3a3224d50007df25ad557b7,DDOG,Yahoo,"Datadog  shares are trading sharply higher Tuesday after the provider of IT monitoring and analytics tools snagged an upgrade from Wolfe Research analyst Alex Zukin, who raised his rating on the stock to Outperform from Peer Perform.  Zukin set a price target on Datadog (ticker: DDOG) of $140, implying about 25% upside from recent levels.  Datadog has long been one of the fastest growing and expensive stocks in enterprise software.",https://finnhub.io/api/news?id=bf60787dbd25cdb971a3eb33bb709bb08d0f8fc854a8894ed72c24b1b523b281
company,2023-07-25 14:17:00,"Why Datadog, Zscaler, and C3.ai Were Rallying Today",121591430,https://s.yimg.com/ny/api/res/1.2/T6jHwIcgiBgS3hic52PS6g--/YXBwaWQ9aGlnaGxhbmRlcjt3PTEyMDA7aD04MTQ-/https://media.zenfs.com/en/motleyfool.com/ed294786fe838fcd9cce321646cf300a,DDOG,Yahoo,"Two separate analysts upgraded Datadog and Zscaler, and the newfound optimism on enterprise spending seemed to be pulling along other SaaS names as well.",https://finnhub.io/api/news?id=f9fe4e32af8651067e9a598bbc67957317e07bf14c4db0e3c8d38265e616cfca
company,2023-07-25 08:36:00,10 Information Technology Stocks Whale Activity In Today's Session,121592862,,DDOG,Benzinga,Looking for stock market analysis and research with proves results? Zacks.com offers in-depth financial research with over 30years of proven results.,https://finnhub.io/api/news?id=da1aa4d858211afeebfd4aa080ba85dc469ab3b96a584077f19aadfa8c9dd072
company,2023-07-25 07:54:16,Wolfe Research Upgrades Datadog Inc - (DDOG),121583128,,DDOG,Fintel,,https://finnhub.io/api/news?id=149e61188dd713ba822f4fb3f17ca8147839bf9af4baded2e9870be4863db3d8
company,2023-07-25 07:16:00,DDOG Stock Alert: Is Datadog the Next Big AI Play?,121596040,,DDOG,InvestorPlace,Looking for stock market analysis and research with proves results? Zacks.com offers in-depth financial research with over 30years of proven results.,https://finnhub.io/api/news?id=89a67f24bf556713f895fa3d5cdba853a666a570de5a9b60b91b945fc87c8c44
company,2023-07-25 05:12:00,"Datadog stock jumps after Wolfe upgrades on easing competition, gen AI opportunity",121596041,,DDOG,Seeking Alpha,Looking for stock market analysis and research with proves results? Zacks.com offers in-depth financial research with over 30years of proven results.,https://finnhub.io/api/news?id=ee4afebef39fbb58831f40df5ee84203fb0ae9aac27e9bfe9c43bf5791a0369d
company,2023-07-25 05:07:00,"Disney downgraded, Meta Platforms upgraded: Wall Street's top analyst calls",121586426,,DDOG,Thefly.com,Looking for stock market analysis and research with proves results? Zacks.com offers in-depth financial research with over 30years of proven results.,https://finnhub.io/api/news?id=6dd085c20adad6e16c844b939436050c26c676b30adafafb21b0a56d0ea5eea3
company,2023-07-25 04:35:00,"If You Can Only Buy One Tech Stock, It Better Be One of These 7 Names",121596043,,DDOG,InvestorPlace,Looking for stock market analysis and research with proves results? Zacks.com offers in-depth financial research with over 30years of proven results.,https://finnhub.io/api/news?id=c60def47b16157de81b7f7ed48992557bb536e45aa29a13931877900cef9ceaa
company,2023-07-25 04:34:00,Datadog's stock scores upgrade as engineers 'simply cannot live without' the software,121698986,https://images.mktw.net/im-726339/social,DDOG,MarketWatch,"Datadog's monitoring tools appears ever more essential to the company's user base, and that's one reason a Wolfe Research analyst has warmed to the stock.",https://finnhub.io/api/news?id=a7cad634540a2c61b116b99542d9d789efa26bfecc4e7fe7471fb4265238dcaa
company,2023-07-25 03:35:00,Datadog’s stock scores upgrade as engineers ‘simply cannot live without’ the software,121596044,,DDOG,MarketWatch,Looking for stock market analysis and research with proves results? Zacks.com offers in-depth financial research with over 30years of proven results.,https://finnhub.io/api/news?id=c188a9f81997423e07d3d74b156fda7462d7db2f6e074d025211e664059ea8e1
company,2023-07-25 01:33:53,"4 big analyst picks: Walmart has 'opportunity to extend market gains,' says Piper",121583750,https://s.yimg.com/cv/apiv2/social/images/yahoo_default_logo-1200x1200.png,DDOG,Yahoo,"Here is your Pro Recap of the biggest analyst picks you may have missed since yesterday: upgrades at Walmart, Datadog, and Neurocrine Biosciences, and initiations at Savers Value Village.  Walmart (NYSE:WMT) shares rose more than 1% pre-market today after Piper Sandler upgraded the company to Overweight from Neutral and raised its price target to $210.00 from $145.00, as reported in real-time on InvestingPro.",https://finnhub.io/api/news?id=0688bf80bc9f1758e2f35a71a2b1847c8c65ffe5cf2f56e5099382d4e9437916
company,2023-07-24 23:58:00,"Wolfe upgrades Datadog, says engineers cannot live without",121596045,,DDOG,Thefly.com,Looking for stock market analysis and research with proves results? Zacks.com offers in-depth financial research with over 30years of proven results.,https://finnhub.io/api/news?id=333819a4e753e8571380271fabbae763ab5ae283e44da60ed742ac3180966744
company,2023-07-24 21:47:00,DDOG Stock Jumps on Good News from Wolfe Research,121596046,,DDOG,TipRanks,Looking for stock market analysis and research with proves results? Zacks.com offers in-depth financial research with over 30years of proven results.,https://finnhub.io/api/news?id=6d592ffc33c959c97766490bd35e24c83d60a4f930a1a8987fb48493bb3f34b2
company,2023-07-24 21:06:00,Datadog Jumps With Good News from Wolfe,121596047,,DDOG,TipRanks,Looking for stock market analysis and research with proves results? Zacks.com offers in-depth financial research with over 30years of proven results.,https://finnhub.io/api/news?id=94aa34a78e274bcd07e2be6e7d4979d582b46d2d9ffa369723201eee63984c76
company,2023-07-24 21:03:00,These 26 AI Stocks Are Up 58% In Just 11 Weeks,121585643,,DDOG,TalkMarkets,Looking for stock market analysis and research with proves results? Zacks.com offers in-depth financial research with over 30years of proven results.,https://finnhub.io/api/news?id=4694bfdd90318aaabe4bd91f195fa60474af9c1519e736d6eccd128f1b077eeb
company,2023-07-24 08:55:19,7 Top Analyst Picks That Are Actually Not Worth Your Attention,121702184,https://media.zenfs.com/en/investorplace_417/f74924a59e36fc60c70010a3c3c50ba5,DDOG,Yahoo,"Analyst ratings are a key factor that can influence an investor’s decision to take a position in a stock. Analysts work for financial firms or investment banks. They analyze companies and offer a rating that helps investors differentiate between stocks that are likely to outperform and overhyped stocks. Because of their relationships with company insiders, analysts’ opinions carry significant weight with investors. The typical ratings that analysts use are buy, hold, and sell. Other ratings that",https://finnhub.io/api/news?id=84e27c5c9200c52f5982423ae52178ccf6a0b1180b1cb829c177e17bb67da101
company,2023-07-24 08:49:00,Check Out What Whales Are Doing With DDOG,121596049,,DDOG,Benzinga,Looking for stock market analysis and research with proves results? Zacks.com offers in-depth financial research with over 30years of proven results.,https://finnhub.io/api/news?id=a561e3aaf3c2a1760d780c13d42a8a9215f3ad265a0fbf09af70ff95e4e4b3a1
company,2023-07-24 04:19:00,Datadog upgraded to Outperform from Peer Perform at Wolfe Research,121596050,,DDOG,Thefly.com,Looking for stock market analysis and research with proves results? Zacks.com offers in-depth financial research with over 30years of proven results.,https://finnhub.io/api/news?id=d80ffbb50b36089ff21682bf5fd3506fc068b671c58a61d56b8a9e18c30c4e32
