category,datetime,headline,id,image,related,source,summary,url
company,2023-03-31 15:32:03,"Why Datadog, CrowdStrike, and Atlassian Rallied Today",119546704,https://s.yimg.com/ny/api/res/1.2/554MNPz8zTcTMzhiIsn0BA--/YXBwaWQ9aGlnaGxhbmRlcjt3PTEyMDA7aD02NzU-/https://media.zenfs.com/en/motleyfool.com/9770ecc3b57c2ae073d68b0423e0b141,DDOG,Yahoo,"Shares of high-growth software stocks Datadog (NASDAQ: DDOG), CrowdStrike (NASDAQ: CRWD), and Atlassian (NASDAQ: TEAM) were rallying on Friday, rising 6.7%, 4%, and 5.3%, respectively, as of 2 p.m. ET.  The synchronous moves across these three software plays suggest a broader theme, which likely came from today's personal consumption expenditures price index, or PCE -- a measure of inflation closely watched by the Federal Reserve.  The Fed tends to prefer the PCE because the PCE changes its weightings more frequently than the CPI, and tends to reflect customer buying behavior, such as ""trading down"" in times of inflation to understand what consumers are actually paying for goods and services.",https://finnhub.io/api/news?id=557b31a1463024fa4f04d3e6356f0e1ca7e2c68276841e08405d01785978d246
company,2023-03-31 03:25:00,Datadog (DDOG) Gets a Buy from Needham,119543829,,DDOG,TipRanks,Looking for stock market analysis and research with proves results? Zacks.com offers in-depth financial research with over 30years of proven results.,https://finnhub.io/api/news?id=5c0f3cddf86527ae6109d2c26b7cb0d26eee450eff8a5f35854be622d1b1bc76
company,2023-03-30 18:50:07,Tracking Stanley Druckenmiller's Duquesne Family Office Portfolio - Q4 2022 Update,119525804,https://static.seekingalpha.com/cdn/s3/uploads/getty_images/495501698/image_495501698.jpg?io=getty-c-w1536,DDOG,SeekingAlpha,Stanley Druckenmillerâs 13F portfolio value increased from $1.76B to $2.02B this quarter. Click here to see an update on the portfolio for Q4 2022.,https://finnhub.io/api/news?id=01b6cb8439e48c0ce07aa44c5ae86873bed945a1127937fda82a347c20a1aa8e
company,2023-03-30 17:45:09,Datadog (DDOG) Stock Sinks As Market Gains: What You Should Know,119526094,https://media.zenfs.com/en/zacks.com/f889276f4a638f3c7a79c0e3e6b768c1,DDOG,Yahoo,"In the latest trading session, Datadog (DDOG) closed at $67.91, marking a -0.28% move from the previous day.",https://finnhub.io/api/news?id=c1393c1bdc8e93e11f68d9ae710511aac9cfbb216140e29d0e55e9d6860987c7
company,2023-03-30 14:34:28,7 Growth Stocks That Are Poised to Boom in 2024,119577107,https://media.zenfs.com/en/investorplace_417/d19c812b11e570bbadef2f5722cf436b,DDOG,Yahoo,"As investors navigate the ever-changing financial landscape, growth stocks to buy have emerged as attractive options for those looking to pounce on market shifts. Recently, growth stocks have taken a hit following concerns about declining revenue growth rates and tech industry layoffs. However, the focus has shifted to the banking sector because of multiple major banking failures in March sending throughout the financial world. The turn of events could be a silver lining for growth stocks, as an",https://finnhub.io/api/news?id=ecbd04e70b4af56c6464e06a8fe464868867b829f03b31a9d7292d36ccc6c0bf
company,2023-03-30 09:45:00,Have Expectations For Enterprise Spend Finally Reset? Semis Vs. B2B Software,119518283,https://static.seekingalpha.com/cdn/s3/uploads/getty_images/1397047877/image_1397047877.jpg?io=getty-c-w1536,DDOG,SeekingAlpha,"With earnings expectations lowered and interest rates less of a headwind, is it time to look at technology? Semis have bottomed, and we expect broader enterprise spend will follow in 2H23.",https://finnhub.io/api/news?id=533ef75ea2063e5e008f0ce9c4a3e660e672ed1a8a4acdf88fc44052dc8ae8c9
company,2023-03-30 06:25:00,DA Davidson DEN Group to hold an analyst/industry conference call,119517856,,DDOG,Thefly.com,Looking for stock market analysis and research with proves results? Zacks.com offers in-depth financial research with over 30years of proven results.,https://finnhub.io/api/news?id=08d93c55957dfd3d959af604a7525f29ff812b70555bfd9a30cb40acd92c24c4
company,2023-03-30 05:55:00,Tracking Stanley Druckenmiller`s Duquesne Family Office Portfolio - Q4 2022 Update,119535172,,DDOG,Seeking Alpha,Looking for stock market analysis and research with proves results? Zacks.com offers in-depth financial research with over 30years of proven results.,https://finnhub.io/api/news?id=0ecdbed867bdf3584f2e4baee80f591631403a810bbbabff028d2fc524e5224e
company,2023-03-29 17:50:09,Datadog (DDOG) Gains But Lags Market: What You Should Know,119515273,https://media.zenfs.com/en/zacks.com/a41b81fe729c761f3f94f42ff348f70c,DDOG,Yahoo,"In the latest trading session, Datadog (DDOG) closed at $68.10, marking a +0.55% move from the previous day.",https://finnhub.io/api/news?id=1b9ea0d5c2851411043e679ae1d3a9b5bb2ebd549b5deef0549dace1c610d062
company,2023-03-29 06:44:00,DDOG September 15th Options Begin Trading,119493563,,DDOG,Stock Options Channel,Looking for stock market analysis and research with proves results? Zacks.com offers in-depth financial research with over 30years of proven results.,https://finnhub.io/api/news?id=7bc224872e81eab9edc4a69437720c7ea3dbaf939ad37dc636b16f2e76731b51
company,2023-03-29 04:19:00,7 Cloud Computing Stocks to Buy for Digital Transformation,119507038,,DDOG,InvestorPlace,Looking for stock market analysis and research with proves results? Zacks.com offers in-depth financial research with over 30years of proven results.,https://finnhub.io/api/news?id=adc002438c17863bf8fa4c691a57a0a2c35aed8d583732fd7239916d446725b8
company,2023-03-29 02:31:00,"Microsoft, Apple, others may benefit as tech readies for `modestly better` earnings",119491366,,DDOG,Seeking Alpha,Looking for stock market analysis and research with proves results? Zacks.com offers in-depth financial research with over 30years of proven results.,https://finnhub.io/api/news?id=902a3ef25e432929dfb7b04132ad7d67b553b3e931a4c25ac0cc6459b23bb360
company,2023-03-28 11:47:51,Datadog: Growing Fast But Extremely Expensive,119477863,https://static.seekingalpha.com/cdn/s3/uploads/getty_images/1420039843/image_1420039843.jpg?io=getty-c-w1536,DDOG,SeekingAlpha,"Despite being expected to deliver strong growth rates and solid FCFF, Datadogâs stock looks highly overvalued at todayâs prices. Read more on DDOG here.",https://finnhub.io/api/news?id=bbf5d565ec82affa7a26ec4bff28aecdd233c7180d3b259f134791165640e8ac
company,2023-03-28 05:21:00,"3 ""Expensive"" Growth Stocks That Are a Lot Cheaper Than You Realize",119476416,https://s.yimg.com/ny/api/res/1.2/IPOSqKzAfSG6jlhpgaLhSg--/YXBwaWQ9aGlnaGxhbmRlcjt3PTEyMDA7aD03OTQ-/https://media.zenfs.com/en/motleyfool.com/68891a1f8ecfa74f54c1d87c8ceaf014,DDOG,Yahoo,The nosebleed trailing-12-month price-to-earnings ratios for these supercharged growth stocks fails to tell the full story.,https://finnhub.io/api/news?id=6a0717a01d6808ed7a59658e75df353af5f37440692ef1a4aaa7f6fa5fb597e8
company,2023-03-28 02:10:35,Datadog: Strong Observability Market And Increasing Customers,119466380,https://static.seekingalpha.com/cdn/s3/uploads/getty_images/1432660477/image_1432660477.jpg?io=getty-c-w1536,DDOG,SeekingAlpha,Datadog products and services demand is increasing and the market outlook for cloud services is expected to get better in the next 10 years. See why DDOG stock is a Buy.,https://finnhub.io/api/news?id=285e0564af98b6927b83f7a0bd6492a594c270b5f53b7672c10b5fcb2cb51d83
company,2023-04-03 00:27:00,Goldman leans to growth picks in either recession scenario,119589037,,DDOG,Seeking Alpha,Looking for stock market analysis and research with proves results? Zacks.com offers in-depth financial research with over 30years of proven results.,https://finnhub.io/api/news?id=f919a17a8b0acea12f9b095ac4353ec0949e2d4f0eac5204589fa932b7a2dbb8
company,2023-04-01 01:17:00,Confounded's Complete All-Weather Portfolio Revealed,119550142,https://static.seekingalpha.com/cdn/s3/uploads/getty_images/585624358/image_585624358.jpg?io=getty-c-w1536,DDOG,SeekingAlpha,Most readers follow my work for the extensive writing I have done referencing my aggressive growth portfolio. Read more here.,https://finnhub.io/api/news?id=1786c6fddb812b0567dd3ca8062743722cc593d1e8b364541bf21c814313f852
company,2023-04-01 00:22:00,Confounded`s Complete All-Weather Portfolio Revealed,119555099,,DDOG,Seeking Alpha,Looking for stock market analysis and research with proves results? Zacks.com offers in-depth financial research with over 30years of proven results.,https://finnhub.io/api/news?id=37367731d0bd63063f529ff82f6578064fb6c818556b5b69f7aa89b77733829f
company,2023-04-08 05:06:00,Nasdaq Bear Market: 5 Astonishing Growth Stocks You'll Regret Not Buying on the Dip,119682167,https://s.yimg.com/ny/api/res/1.2/dBM1PXglv1PPHyUAS5XTsg--/YXBwaWQ9aGlnaGxhbmRlcjt3PTEyMDA7aD04MDA-/https://media.zenfs.com/en/motleyfool.com/45feee41c2a773b10b5f9ff3820bd448,DDOG,Yahoo,A 33% plunge in the Nasdaq Composite is the perfect excuse for opportunistic investors to pounce on discounted growth stocks.,https://finnhub.io/api/news?id=2e9f0dce9b037c749c4d92834a99b722f3c831912d1207bf3063664a56995538
company,2023-04-06 17:50:09,Datadog (DDOG) Stock Sinks As Market Gains: What You Should Know,119665092,https://media.zenfs.com/en/zacks.com/17a4db66bb13bdabcbf848550a6ea15a,DDOG,Yahoo,"In the latest trading session, Datadog (DDOG) closed at $65.83, marking a -0.42% move from the previous day.",https://finnhub.io/api/news?id=9bc9a4472a95ed23e00fd33f1f4493238e563a01a6d395ee957195a953109eca
company,2023-04-06 17:49:29,"DA Davidson Initiates Coverage of Datadog, Inc. (DDOG) with Neutral Recommendation",119658169,,DDOG,Fintel,,https://finnhub.io/api/news?id=b217f9470548f92e41ef623507f1a1b677380b08ab3e2e76dfbefc4f24e1bd27
company,2023-04-06 08:51:27,Splunk: The SIEM Leader Is A Great Buy On Declines,119652638,https://static.seekingalpha.com/cdn/s3/uploads/getty_images/1029298014/image_1029298014.jpg?io=getty-c-w1536,DDOG,SeekingAlpha,Splunk expects slow FY24 with revenue growth of only 9%. Click here to read my most recent analysis of SPLK stock.,https://finnhub.io/api/news?id=9212ad1504106e52676b6b1e5c2102efac5ae5591eb62d2d13265de6fa9663da
company,2023-04-06 05:07:00,New Relic rises as DA Davidson starts coverage with buy rating,119651235,,DDOG,Seeking Alpha,Looking for stock market analysis and research with proves results? Zacks.com offers in-depth financial research with over 30years of proven results.,https://finnhub.io/api/news?id=88127f5caa13397f5c105f4b9b959802b225cd83aa204a8f883557fdd9226a21
company,2023-04-06 03:28:00,Datadog stock slips as DA Davidson starts coverage with neutral rating,119653422,,DDOG,Seeking Alpha,Looking for stock market analysis and research with proves results? Zacks.com offers in-depth financial research with over 30years of proven results.,https://finnhub.io/api/news?id=cbc6f26ccf7926f9f5b264ac0b3edc057dbf2d83f85edb04f8fe97aff7048603
company,2023-04-06 00:26:00,Davidson starts Datadog at Neutral with bull case `well understood`,119653423,,DDOG,Thefly.com,Looking for stock market analysis and research with proves results? Zacks.com offers in-depth financial research with over 30years of proven results.,https://finnhub.io/api/news?id=795a361003f981e81798849312857332e8d6f68b01da87396a6cd53983d844a6
company,2023-04-06 00:24:00,"New Relic initiated with Buy, $100 target at DA Davidson",119651237,,DDOG,Thefly.com,Looking for stock market analysis and research with proves results? Zacks.com offers in-depth financial research with over 30years of proven results.,https://finnhub.io/api/news?id=833255ad4312ca9db26ef015e437baa3ab7193ce9a96f379746306293098bc7c
company,2023-04-05 02:37:00,Datadog initiated with a Neutral at DA Davidson,119653426,,DDOG,Thefly.com,Looking for stock market analysis and research with proves results? Zacks.com offers in-depth financial research with over 30years of proven results.,https://finnhub.io/api/news?id=325f8c05716bcd2d72e0620dfd882176c6dc1da735f67c9848aacfca71e1c8e2
company,2023-04-12 12:53:44,3 Stocks to Buy That Could Be the Next Cloud Computing Champion,119784415,https://media.zenfs.com/en/investorplace_417/c11f33af742df06547314c642160ef2f,DDOG,Yahoo,"Cloud computing has rapidly transformed how businesses operate in recent years. Due to the security, cost savings and flexibility benefits, demand for cloud-based services and technologies continues to grow. Across the technology stack, whether it’s data storage solutions, infrastructure, applications hosted and delivered through the cloud or high-performance computing, cloud services have never been in such high demand. As cloud migration continues and the economy undergoes a digital transforma",https://finnhub.io/api/news?id=87c5dc0f50500b0f484f1e67cefa89e5800d60474d0ed1237a4dbfaf25eba2c0
company,2023-04-11 05:15:00,"Prediction: 3 Stocks That Will Turn $250,000 Into $1 Million by 2030",119739312,https://s.yimg.com/ny/api/res/1.2/634Cdcd6f0wchQyx4VM79w--/YXBwaWQ9aGlnaGxhbmRlcjt3PTEyMDA7aD04MDE-/https://media.zenfs.com/en/motleyfool.com/4b718fa9113f12458961de332f62a082,DDOG,Yahoo,"Last year's 33% plunge in the Nasdaq-100 technology index was a reminder to investors that focusing on the long term is the best way to generate positive returns in the stock market.  There's no perfect time to buy; however, the index has only declined in consecutive years on one occasion -- during the dot-com bust from 2000 to 2002 -- which suggests buying technology stocks after a down year tends to work really well.  Uber Technologies (NYSE: UBER) is the leading ride-hailing (mobility) company globally, and one of the top food delivery providers, too.",https://finnhub.io/api/news?id=0661a0931b0e236951479722d35b00fb7deaf55b67e752ed627b42f7e50b6df8
company,2023-04-10 14:41:02,The 7 Best Growth Stocks to Buy for 2023,119750726,https://media.zenfs.com/en/investorplace_417/d339c588c31732db7fed8fdc8a0550d2,DDOG,Yahoo,"So far, 2023 has been great year for growth stocks. For one, it seems that the Federal Reserve’s rate hiking campaign is approaching its limits. Two, the banking system has started to stumble amid sharply higher interest rates. While this has been rough for bank investors, we’re now seeing a rotation out of financials and back into growth stocks. From here, if inflation starts to come down and interest rates reverse course, we could see a meaningful recovery in growth stocks. In any case, many g",https://finnhub.io/api/news?id=ffb1d0f21e1e8e6a11a21983908224a6f42779c7ce52e5416ffec63fc2424dca
company,2023-04-10 04:41:00,The 7 Best Growth Stocks to Buy in the Cloud Computing Sector,119703755,,DDOG,InvestorPlace,Looking for stock market analysis and research with proves results? Zacks.com offers in-depth financial research with over 30years of proven results.,https://finnhub.io/api/news?id=f9266507870850fdff91b07d2baffa74f9f31da9fc796f6e46e250feffabb37f
company,2023-04-14 11:04:03,Datadog (DDOG) Announces Bottomline as a Partner Network Member,119771663,,DDOG,Yahoo,Datadog (DDOG) announces that Bottomline has joined its Marketplace to become a partner network member.,https://finnhub.io/api/news?id=5f4207b33620980df1c176ba406eb91d13c1ab3d2e6adaed92f14d99e7ea794c
company,2023-04-13 17:50:09,Datadog (DDOG) Outpaces Stock Market Gains: What You Should Know,119771664,https://media.zenfs.com/en/zacks.com/1a018a29aef5adbf5b4319f32058e209,DDOG,Yahoo,"In the latest trading session, Datadog (DDOG) closed at $68.08, marking a +1.86% move from the previous day.",https://finnhub.io/api/news?id=bfe96fbdf696cd667e3eb7ef33854ada4e7a2e1137e2a358419427a04f6839b0
company,2023-04-13 16:05:00,Datadog Announces Date of First Quarter Fiscal Year 2023 Earnings Call,119771665,https://media.zenfs.com/en/prnewswire.com/d952ecf955dd3968248e1f7edb882015,DDOG,Yahoo,"Datadog, Inc. (NASDAQ:DDOG), the monitoring and security platform for cloud applications, today announced that it will report its first quarter fiscal year 2023 financial results before the U.S. financial markets open on Thursday, May 4, 2023.",https://finnhub.io/api/news?id=d8840ed20d06a134292320312c7b078d2e6825b6716aaab6c486580735d041b8
company,2023-04-13 07:48:00,June 2nd Options Now Available For Datadog,119744177,,DDOG,Stock Options Channel,Looking for stock market analysis and research with proves results? Zacks.com offers in-depth financial research with over 30years of proven results.,https://finnhub.io/api/news?id=ed362176dd6b4fb9992d3315ecc192de48f7341d51e58390bc4a24b701a5857e
company,2023-04-13 04:00:00,Bottomline Joins Datadog Marketplace,119771666,https://media.zenfs.com/en/globenewswire.com/03688042dbd6d47b99b2300de2786840,DDOG,Yahoo,"Extending availability of company’s award-winning Record and Replay user monitoring solutionPORTSMOUTH, N.H., April 13, 2023 (GLOBE NEWSWIRE) -- Bottomline, a leading provider of financial technology, announced today a new integration with Datadog, Inc. (NASDAQ: DDOG), the monitoring and security platform for cloud applications. Datadog consolidates metrics, traces, logs and more to help organizations scale their cloud environments, troubleshoot potential issues and provide their customers with",https://finnhub.io/api/news?id=a6c8eb535d81dd473fb384f909136bfe373e3058ef358e13d2239bb25148aafc
company,2023-04-20 11:32:03,Datadog (DDOG) Expands Reach With New Data Center in Japan,119852148,https://media.zenfs.com/en/zacks.com/78a79ebefdc16723fa497df320e2e643,DDOG,Yahoo,"Datadog (DDOG) launched its new data center in Japan, which will help to expand the company's reach.",https://finnhub.io/api/news?id=ee97cf4069d1cc6cd876bf6d1b9be5e7d158094ef04dc2a5ccb53855a1f9e34c
company,2023-04-20 06:30:01,3 Growth Stocks That Could Explode in Value This Year,119896932,https://media.zenfs.com/en/investorplace_417/0508ff61f6067d1748c20474a606fcae,DDOG,Yahoo,"Amidst the bearish storm that raged through last year, there’s a lot of money to be made with growth stocks to buy. Growth stocks took a hammering last year, navigating choppy waters of record-high inflation and interest rates. Down significantly from their historical highs, it’s perhaps the right time to revisit the best growth stocks to buy. The stock market this year has been building a decent head of steam, with hopes of a more dovish policy from the Federal Reserve from now on.InvestorPlace",https://finnhub.io/api/news?id=81a2544c8e15c1f0cfd6fc7c8be620fed0e8e96961dd69949b48761e5b4febb4
company,2023-04-20 06:10:02,3 Great Growth Stocks to Invest in Now,119898118,https://media.zenfs.com/en/investorplace_417/0508ff61f6067d1748c20474a606fcae,DDOG,Yahoo,"There is a healthy debate right now about whether growth stocks are on the upswing. On the one hand, growth names have rallied sharply to start 2023. On the other, the factors that sunk growth shares in 2022 remain present. The tech industry is facing layoffs, revenue growth is down, and higher interest rates continue to cause slumping valuations across the industry. The thing to keep in mind, however, is that there are some great growth stocks that can power through. Regardless of whether we’re",https://finnhub.io/api/news?id=d6c895699471d424655a1462ecbad5d3f3d593e2c41bfe9c60d9683d0cd68670
company,2023-04-20 05:28:00,"2 Growth Stocks to Buy Before They Soar 82% and 113%, According to Wall Street",119836137,https://s.yimg.com/ny/api/res/1.2/uDPxD4iLBAtDfuhFiBbxZQ--/YXBwaWQ9aGlnaGxhbmRlcjt3PTEyMDA7aD04MDE-/https://media.zenfs.com/en/motleyfool.com/4be720cd593c2976b55ffa71ec3a1a69,DDOG,Yahoo,"Wall Street is bullish on these growth stocks, and some analysts are forecasting big gains for shareholders.",https://finnhub.io/api/news?id=a391ec72216cd648c4c996924ef9cc25ca46a41e3e2f5dbb8a015d127a3b82ea
company,2023-04-19 17:50:09,Datadog (DDOG) Dips More Than Broader Markets: What You Should Know,119836138,https://media.zenfs.com/en/zacks.com/48ad4265c55e3ba7a1fb9148d6e717d9,DDOG,Yahoo,"Datadog (DDOG) closed the most recent trading day at $69.56, moving -0.64% from the previous trading session.",https://finnhub.io/api/news?id=fdb33fe694d31473e12626c7522fee23499d7fa2402baf20b4da17bb87890f55
company,2023-04-19 16:05:00,Datadog Launches New Data Center in Japan,119836139,https://media.zenfs.com/en/prnewswire.com/d952ecf955dd3968248e1f7edb882015,DDOG,Yahoo,"Datadog, Inc. (NASDAQ: DDOG), the monitoring and security platform for cloud applications, today announced the launch of its new data center. Located in Tokyo, Japan, the data center is Datadog's first in Asia and adds to existing locations in the United States, Europe and AWS GovCloud.",https://finnhub.io/api/news?id=61698b31c9c57a77abc59cfc048df5aa319e907b543750a695f858f3f54e2057
company,2023-04-19 12:54:00,IN BRIEF: Datadog launches its first Asia-based data centre in Tokyo,119849569,,DDOG,Alliance News,Looking for stock market analysis and research with proves results? Zacks.com offers in-depth financial research with over 30years of proven results.,https://finnhub.io/api/news?id=dbd2ea20e13e1e45eef7646b453ee7d10ba42307549fc3dd4b08f5d87db83d1d
company,2023-04-19 07:29:16,"Revenues Tell The Story For Datadog, Inc. (NASDAQ:DDOG)",119836140,,DDOG,Yahoo,"Datadog, Inc.'s ( NASDAQ:DDOG ) price-to-sales (or ""P/S"") ratio of 13.4x might make it look like a strong sell right...",https://finnhub.io/api/news?id=5263c2d94bbdffb9b73db4010bb40627ccd4e8935f3946c6cec4fd4ec97b1893
company,2023-04-18 19:38:10,"Piper Sandler Initiates Coverage of Datadog, Inc. (DDOG) with Neutral Recommendation",119818658,,DDOG,Fintel,,https://finnhub.io/api/news?id=2fb021076846eb8f29c0111bab1ecc60dbc3b7f7861242696a659f0bfcebed45
company,2023-04-18 16:05:00,Datadog Expands Application Security Capabilities to Automatically Uncover Vulnerabilities in Production Code,119822488,https://media.zenfs.com/en/prnewswire.com/d952ecf955dd3968248e1f7edb882015,DDOG,Yahoo,"Datadog, Inc. (NASDAQ: DDOG), the monitoring and security platform for cloud applications, today announced the general availability of Application Vulnerability Management, which expands Datadog's application security capabilities by automatically uncovering and prioritizing the most important vulnerabilities in open-source libraries.",https://finnhub.io/api/news?id=3ba2988488b481559c134d3d14ad610931efdbb7f6d7b0a00cd83c4c20792190
company,2023-04-18 05:08:00,"Street Wrap: Today`s Top 15 Upgrades, Downgrades, Initiations",119824137,,DDOG,Thefly.com,Looking for stock market analysis and research with proves results? Zacks.com offers in-depth financial research with over 30years of proven results.,https://finnhub.io/api/news?id=350641a26b40928097beb38964c97e14ad7560767b1c27997ae4c2bcea611486
company,2023-04-18 03:08:00,Datadog rises even as Piper Sandler sees `little room for upside`,119849574,,DDOG,Seeking Alpha,Looking for stock market analysis and research with proves results? Zacks.com offers in-depth financial research with over 30years of proven results.,https://finnhub.io/api/news?id=fdbff055e62005dcbb94bbe423547136cff5598831308985814a96b3a6798c98
company,2023-04-18 00:22:00,Datadog initiated with a Neutral at Piper Sandler,119849575,,DDOG,Thefly.com,Looking for stock market analysis and research with proves results? Zacks.com offers in-depth financial research with over 30years of proven results.,https://finnhub.io/api/news?id=521f8c5ecba2808e69f85a3b2572ab2b8e12f4a7c76676d70aa041f1a6701b3f
company,2023-04-17 23:50:00,"Analysts Offer Insights on Technology Companies: Gartner (IT), Datadog (DDOG) and Roblox (RBLX)",119823992,,DDOG,TipRanks,Looking for stock market analysis and research with proves results? Zacks.com offers in-depth financial research with over 30years of proven results.,https://finnhub.io/api/news?id=39c577ae7bf1872f6f9d0689e14dc846f1a5573f0c769bb905fed026bcebe3f3
company,2023-04-17 19:47:03,"Mizuho Maintains Datadog, Inc. (DDOG) Buy Recommendation",119809095,,DDOG,Fintel,,https://finnhub.io/api/news?id=50cae88b59eb859588ec724173474f2f078751cdec0bcc1ca1221cdaeb0189aa
company,2023-04-17 08:03:00,"Recession? No One Can Tell When; Meanwhile, We Rally",119801394,,DDOG,Seeking Alpha,Looking for stock market analysis and research with proves results? Zacks.com offers in-depth financial research with over 30years of proven results.,https://finnhub.io/api/news?id=c3fbda4e14a7b596f2659374a32f0bffb024829f901f14afcd55906864662275
company,2023-04-17 03:32:42,"Amazon: 100 Hated Stocks, These 4 Worth Considering",119796328,,DDOG,SeekingAlpha,,https://finnhub.io/api/news?id=4f93f5cef0447c8e0db6bfc7e7a926ac834fb31e8edd167350a56ebfd41f4c03
company,2023-04-17 01:44:00,Datadog price target lowered to $80 from $94 at Mizuho,119805349,,DDOG,Thefly.com,Looking for stock market analysis and research with proves results? Zacks.com offers in-depth financial research with over 30years of proven results.,https://finnhub.io/api/news?id=dda60dfe5b97c6acc8aaeb1f1a93ab9ce204ed0f674b2d809d28e864abf86408
company,2023-04-23 08:27:00,Datadog An Outstanding But Over-Priced Data Monitor,119895769,,DDOG,Seeking Alpha,Looking for stock market analysis and research with proves results? Zacks.com offers in-depth financial research with over 30years of proven results.,https://finnhub.io/api/news?id=77ce25fbc9895f26b20156b6066946a4dfa4bc69c8cdf3c199ba2d6aa9db97e3
company,2023-04-21 12:10:04,Why Datadog (DDOG) Could Beat Earnings Estimates Again,119899506,https://media.zenfs.com/en/zacks.com/e8e4b0344809eaac6d73c9fd25fd180a,DDOG,Yahoo,Datadog (DDOG) has an impressive earnings surprise history and currently possesses the right combination of the two key ingredients for a likely beat in its next quarterly report.,https://finnhub.io/api/news?id=cac699fd93cbb394c267365e48bfa047011fc0dc0a58607263c5eadcfaef5157
company,2023-04-21 04:40:00,Unusually active option classes on open April 21st,119865721,,DDOG,Thefly.com,Looking for stock market analysis and research with proves results? Zacks.com offers in-depth financial research with over 30years of proven results.,https://finnhub.io/api/news?id=c5082cbd73081de6c3fe7bbbb71793fc2d2748e6bdf347cc0c12066689d74d95
