category,datetime,headline,id,image,related,source,summary,url
company,2023-06-12 07:20:00,3 Semiconductor Stocks Poised to Benefit From the AI Revolution,120834400,,MCHP,GuruFocus,Looking for stock market analysis and research with proves results? Zacks.com offers in-depth financial research with over 30years of proven results.,https://finnhub.io/api/news?id=1904284bbbd057241476dad7cf84ddc4917a2da1a67512b01df5d0dde4934e38
company,2023-06-12 03:24:00,Microchip announces 5071B cesium atomic clock,120849512,,MCHP,Thefly.com,Looking for stock market analysis and research with proves results? Zacks.com offers in-depth financial research with over 30years of proven results.,https://finnhub.io/api/news?id=194433e3c65a0b904bd3498f734a90f8d1ad9b1f104a0f5f17dca61216a910af
company,2023-06-11 21:12:00,"Microchip Technology Stock (NYSE:MCHP): Unstoppable Growth, No Signs of Slowing Down",120849515,,MCHP,TipRanks,Looking for stock market analysis and research with proves results? Zacks.com offers in-depth financial research with over 30years of proven results.,https://finnhub.io/api/news?id=8a23001bd2b0625a5ef07c3a6c768928bb30ec1f110dfea0d2778292f12dac1d
company,2023-06-19 08:05:00,4 Semiconductor Stocks to Watch as Sales Rebound in April,120946508,https://media.zenfs.com/en/zacks.com/f3466aebbef6850826a46314bf4b3ccf,MCHP,Yahoo,"With semiconductor sales finally showing signs of rebounding, stocks like NVIDIA Corporation (NVDA), ON Semiconductor Corporation (ON), NXP Semiconductors (NXPI) and Microchip Technology (MCHP) are likely to benefit in the near term.",https://finnhub.io/api/news?id=d0b628c3da1631b28e1cdb342162000e9621deaa7b7508a0deb3a943966e9604
company,2023-06-16 12:50:00,"Microchip Technology Inc. stock rises Friday, outperforms market",120939856,https://images.mktw.net/im-220105/social,MCHP,MarketWatch,"Shares of Microchip Technology Inc. inched 0.14% higher to $85.49 Friday, on what proved to be an all-around dismal trading session for the stock market,...",https://finnhub.io/api/news?id=e12e29a638e711e4f30f7e711923163ade6370540bc958f5d1ec042eb77d1582
company,2023-06-16 02:31:00,5 Dividend Growth Stocks With Upside To Analyst Targets,120919713,,MCHP,ETF Channel,Looking for stock market analysis and research with proves results? Zacks.com offers in-depth financial research with over 30years of proven results.,https://finnhub.io/api/news?id=10a99c6f44ebe46abe45b474e4b16483a76c69fb6aea4fa8f132829080df3c76
company,2023-06-23 12:51:00,"Microchip Technology Inc. stock falls Friday, underperforms market",121028211,https://images.mktw.net/im-220105/social,MCHP,MarketWatch,"Shares of Microchip Technology Inc. slipped 1.38% to $81.97 Friday, on what proved to be an all-around grim trading session for the stock market, with the...",https://finnhub.io/api/news?id=4ab24ee07e064c4567f1d360f49a48c2ff486cf25c9705c5e90cd22849605349
company,2023-06-22 12:50:00,"Microchip Technology Inc. stock rises Thursday, still underperforms market",121028212,https://images.mktw.net/im-220105/social,MCHP,MarketWatch,"Shares of Microchip Technology Inc. inched 0.19% higher to $83.12 Thursday, on what proved to be an all-around mixed trading session for the stock market,...",https://finnhub.io/api/news?id=1a7f51e73148c80af6266c9636e4986f76bf982c53adcf3ea9dd283dd8858f35
company,2023-06-22 03:24:26,Microchip: Expanding Profitability In Challenging Environment Makes It A Buy,120994460,https://static.seekingalpha.com/cdn/s3/uploads/getty_images/1412693936/image_1412693936.jpg?io=getty-c-w1536,MCHP,SeekingAlpha,Microchip Technology demonstrates expanding profitability metrics in a challenging environment meaning solid resilience. Find out why MCHP stock is a Buy.,https://finnhub.io/api/news?id=c79810e1dba788825e230d9d98b8dfb97714e04d1fcd82b9a70e6e75e1167eb3
company,2023-06-21 21:05:00,Here's How Much You Would Have Made Owning Microchip Technology Stock In The Last 15 Years,121010206,,MCHP,Benzinga,Looking for stock market analysis and research with proves results? Zacks.com offers in-depth financial research with over 30years of proven results.,https://finnhub.io/api/news?id=fbb7d1a617f4139a12ac10b9ec1823725038777775209d00125bce30e644e053
company,2023-06-21 12:50:00,"Microchip Technology Inc. stock falls Wednesday, underperforms market",120990957,https://images.mktw.net/im-220105/social,MCHP,MarketWatch,"Shares of Microchip Technology Inc. slipped 1.69% to $82.96 Wednesday, on what proved to be an all-around grim trading session for the stock market, with the...",https://finnhub.io/api/news?id=343301ebd96401825c5e9eb9d089c88f147d9b543c99d980700327a7a767863a
company,2023-06-20 17:50:21,Microchip Technology (MCHP) Dips More Than Broader Markets: What You Should Know,120970985,,MCHP,Yahoo,"In the latest trading session, Microchip Technology (MCHP) closed at $84.39, marking a -1.29% move from the previous day.",https://finnhub.io/api/news?id=9507c166e9ee82c5f61dc6cd19a5107db64d2c34dc71ea59a435322596bcf237
company,2023-06-20 12:50:00,"Microchip Technology Inc. stock falls Tuesday, underperforms market",120990958,https://images.mktw.net/im-220105/social,MCHP,MarketWatch,"Shares of Microchip Technology Inc. slipped 1.29% to $84.39 Tuesday, on what proved to be an all-around dismal trading session for the stock market, with the...",https://finnhub.io/api/news?id=2399316a6e33c53ddafdaed861e82cd3a05e5f535f2547b866774abd6bb7632a
company,2023-06-20 09:30:07,Is Microchip Tech (MCHP) a Buy as Wall Street Analysts Look Optimistic?,120959843,https://media.zenfs.com/en/zacks.com/7ea641b46fe75c0a913349e5e610d6a2,MCHP,Yahoo,"Based on the average brokerage recommendation (ABR), Microchip Tech (MCHP) should be added to one's portfolio. Wall Street analysts' overly optimistic recommendations cast doubt on the effectiveness of this highly sought-after metric. So, is the stock worth buying?",https://finnhub.io/api/news?id=ab307e9ce70c6eec183935e0721d59495a1ec5603d175cf68ee730eb6a9c6d1f
company,2023-06-27 12:51:00,"Microchip Technology Inc. stock rises Tuesday, outperforms market",121166160,https://images.mktw.net/im-220105/social,MCHP,MarketWatch,"Shares of Microchip Technology Inc. rose 4.76% to $86.78 Tuesday, on what proved to be an all-around great trading session for the stock market, with the S&P...",https://finnhub.io/api/news?id=47017dbc96eb79645c8301ec3fa2c7697db159756c305045e8e0fff8ce127544
company,2023-06-27 01:13:00,"Biden administration mulls new curbs on AI chip exports to China, WSJ reports",121081642,,MCHP,Thefly.com,Looking for stock market analysis and research with proves results? Zacks.com offers in-depth financial research with over 30years of proven results.,https://finnhub.io/api/news?id=fe3bd623d88241b01b49c088b7c8f79e1c326e81d8d8734fb76cb67038017169
company,2023-06-26 21:46:00,"Tuesday Sector Leaders: Technology & Communications, Industrial",121077224,,MCHP,Market News Video,Looking for stock market analysis and research with proves results? Zacks.com offers in-depth financial research with over 30years of proven results.,https://finnhub.io/api/news?id=a3c6d8153f9d720165b598925be52f3c7663aa6c1b8626fde9569ca33fe84183
company,2023-06-26 17:50:21,Microchip Technology (MCHP) Gains As Market Dips: What You Should Know,121063291,https://media.zenfs.com/en/zacks.com/e8e4b0344809eaac6d73c9fd25fd180a,MCHP,Yahoo,"In the latest trading session, Microchip Technology (MCHP) closed at $82.84, marking a +1.06% move from the previous day.",https://finnhub.io/api/news?id=a1fec484082f975300d993efdf4cfa3c3f43f3d72919d5fd4132a4fef861d82e
company,2023-06-26 12:51:00,"Microchip Technology Inc. stock rises Monday, outperforms market",121059781,https://images.mktw.net/im-220105/social,MCHP,MarketWatch,"Shares of Microchip Technology Inc. rallied 1.06% to $82.84 Monday, on what proved to be an all-around poor trading session for the stock market, with the...",https://finnhub.io/api/news?id=c764d0552ae1f4711d3af5fb4abf2ddee78777d27158608b511484fa471ca607
company,2023-06-24 05:00:00,Our Top 10 Picks For Dividend Growth Stocks - June 2023,121032001,https://static.seekingalpha.com/cdn/s3/uploads/getty_images/1177165160/image_1177165160.jpg?io=getty-c-w1536,MCHP,SeekingAlpha,This monthly series of articles is on DGI stocks that may provide a high rate of dividend growth rather than a high current yield. Check out our exclusive list.,https://finnhub.io/api/news?id=50497937e9084cf346ac95687761a982e394affdde57e6f19c639f72a09aecf0
company,2023-06-30 13:07:33,Visa Hits A New High On Deal News. Chip Products Stock Breaks Out.,121152840,https://media.zenfs.com/en/ibd.com/45207160c8854d05d6fbd74994ee2daf,MCHP,Yahoo,These 3 stocks all hit new highs and broke out of bases. Visa stock rose on news of its $1 billion acquisition of Pismo.,https://finnhub.io/api/news?id=2a6235d9bd388f6e2d43ba0600808407f3f97461899267db65ce1f87b6df67d3
company,2023-06-30 12:50:00,"Microchip Technology Inc. stock rises Friday, outperforms market",121166155,https://images.mktw.net/im-220105/social,MCHP,MarketWatch,"Shares of Microchip Technology Inc. rose 3.00% to $89.59 Friday, on what proved to be an all-around great trading session for the stock market, with the S&P...",https://finnhub.io/api/news?id=71e6597a00aa913d71cdf9a4701e65fda723cec94c91cbf504c2f6eb76bdd800
company,2023-06-30 06:40:35,The 3 Most Undervalued Semiconductor Stocks to Buy Now,121228738,https://media.zenfs.com/en/investorplace_417/882ecc1ba05c2286f69cfc59a8ac8669,MCHP,Yahoo,"Due to recent innovations in artificial intelligence and large language models, most semiconductor stocks have rallied. The VanEck Semiconductor ETF (NASDAQ:SMH) is up 45% year-to-date. Meanwhile, Nvidia (NASDAQ:NVDA) is up over 180%. However, many undervalued semiconductor stocks have yet to rally. The AI tide has not lifted all boats. While beneficiaries like Nvidia and Broadcom (NASDAQ:AVGO) have had enormous rallies, other semi stocks have lagged. Some underperforming stocks have had idiosyn",https://finnhub.io/api/news?id=9d4c4057a8d4503136979f0d39f0a31e31924c6f8ef995d6ad2220a1ccb14421
company,2023-06-30 05:03:00,(MCHP) - Analyzing Microchip Technology's Short Interest,121168274,,MCHP,Benzinga,Looking for stock market analysis and research with proves results? Zacks.com offers in-depth financial research with over 30years of proven results.,https://finnhub.io/api/news?id=2597d44a9baad3a666e5a93a84bc63cd7b15c26fe70331e924818af8ded1bc39
company,2023-06-29 12:50:00,"Microchip Technology Inc. stock rises Thursday, outperforms market",121166156,https://images.mktw.net/im-220105/social,MCHP,MarketWatch,"Shares of Microchip Technology Inc. rose 1.28% to $86.98 Thursday, on what proved to be an all-around favorable trading session for the stock market, with...",https://finnhub.io/api/news?id=81718d964c5feac2db015494b49f4a3c2167c1610a99cc6842e5e25fa101af11
company,2023-06-28 21:37:00,Micron leads chips lower as investors fret about recovery,121118724,,MCHP,Seeking Alpha,Looking for stock market analysis and research with proves results? Zacks.com offers in-depth financial research with over 30years of proven results.,https://finnhub.io/api/news?id=f5b2478dc99167ceca58e19a44281626e202a548a242baadb40f734570f94eaa
company,2023-06-28 12:52:54,Chip stocks drop as U.S. mulls fresh curbs on AI access to China,121090744,https://static.reuters.com/resources/r/?m=02&d=20230628&t=2&i=1637180992&r=LYNXMPEJ5R0AT,MCHP,Reuters,Shares of U.S. chipmakers fell on Wednesday following a report that the Biden administration was planning new curbs on export of computing chips for artificial intelligence to China as early as July.,https://finnhub.io/api/news?id=ee1391593946455f255a8b7c48d8ea5d1d079a3185169cd71587494a6320690e
company,2023-06-28 12:50:00,"Microchip Technology Inc. stock falls Wednesday, underperforms market",121166158,https://images.mktw.net/im-220105/social,MCHP,MarketWatch,"Shares of Microchip Technology Inc. slipped 1.04% to $85.88 Wednesday, on what proved to be an all-around rough trading session for the stock market, with...",https://finnhub.io/api/news?id=21301f33ff9c4b424c19a63ed6465833c0811d43efa42f7ad0a0f2eda4810732
company,2023-06-28 06:18:18,Chip stocks smacked as U.S. mulls fresh curbs on AI access to China,121090745,,MCHP,Reuters,Shares of U.S. chipmakers fell in premarket trading on Wednesday following a report that the Biden administration is planning new curbs on export of computing chips for artificial intelligence to China as early as July.,https://finnhub.io/api/news?id=fdea12e5b4d97f112ab2ad93a83465a6bb0f80fcf08a7b31c428fd875cd814ff
company,2023-06-28 00:12:00,"Nvidia, AMD dip as US mulls new AI chip curbs for China - report",121088608,,MCHP,Seeking Alpha,Looking for stock market analysis and research with proves results? Zacks.com offers in-depth financial research with over 30years of proven results.,https://finnhub.io/api/news?id=54eee48f549acf59db446f0be479e28ee4bcf172d9d461e095e18239a3b02f48
company,2023-07-05 12:49:00,"Microchip Technology Inc. stock falls Wednesday, underperforms market",121219394,https://images.mktw.net/im-220105/social,MCHP,MarketWatch,"Shares of Microchip Technology Inc. shed 2.49% to $88.43 Wednesday, on what proved to be an all-around rough trading session for the stock market, with the...",https://finnhub.io/api/news?id=d55a1ae8e135c104958007021bc8764867197316b1971f89c3b820258f0d360a
company,2023-07-05 11:51:00,Microchip Technology Is Poised to Make a Major Upside Breakout,121213216,https://media.zenfs.com/en/thestreet.com/de4d195a0126314a8927d0a4f0eed418,MCHP,Yahoo,"Microchip Technology Inc.  manufactures microcontroller, mixed-signal, analog, and Flash-IP integrated circuits.  The On-Balance-Volume (OBV) line has strengthened in the past seven weeks.  In this daily Point and Figure chart of MCHP, below, I can see an upside price target in the $93 area.",https://finnhub.io/api/news?id=9dae0d928e4aafbe13e7caf55a87d494429195e93a6d0c5530535a1baf4b31f6
company,2023-07-05 07:28:00,Semiconductors Winners And Losers At The Start Of H2 2023,121234233,,MCHP,Seeking Alpha,Looking for stock market analysis and research with proves results? Zacks.com offers in-depth financial research with over 30years of proven results.,https://finnhub.io/api/news?id=5dac94eafca3db897aa9fb0df26001f440ecfacf5496569f304f01345b334c23
company,2023-07-05 07:15:00,Microchip put volume heavy and directionally bearish,121212909,,MCHP,Thefly.com,Looking for stock market analysis and research with proves results? Zacks.com offers in-depth financial research with over 30years of proven results.,https://finnhub.io/api/news?id=b3348c677ac96be8c1b64a418b43de4c781d34b061506d9e2036a3a05337dba3
company,2023-07-05 04:09:00,"Wolfspeed, Qorvo most at risk from Chinese export controls: Wells Fargo",121210031,,MCHP,Seeking Alpha,Looking for stock market analysis and research with proves results? Zacks.com offers in-depth financial research with over 30years of proven results.,https://finnhub.io/api/news?id=5f15eed802f9b13e8be554577be7bf6fb0e3e9f2b9f9e0abb6407aadfc6c21c8
company,2023-07-04 10:44:00,Microchip (MCHP) Expands Operations With Investment in India,121203018,https://media.zenfs.com/en/zacks.com/78a79ebefdc16723fa497df320e2e643,MCHP,Yahoo,"Microchip (MCHP) announces a $300-million expansion plan for India's semiconductor industry. This reflects on its strong infrastructure, product portfolio and customer base.",https://finnhub.io/api/news?id=98daba154eaf7cda26dd622fb9eb8147194e2aa661c1106a8f1ea9d38bfa827b
company,2023-07-04 04:17:15,Mouser Electronics and Microchip Technology Present Webinar on PIC and AVR Microcontrollers for Sensing Applications,121196064,,MCHP,Finnhub,"Mouser Electronics, Inc., the authorized global distributor with the newest semiconductors and electronic components, has teamed up with Microchip Technology to provide the engineering community with...",https://finnhub.io/api/news?id=6b82ee736769ec9b786d42d8e8cbf94cfed68f1f22f221bc38a0dd74ae55006e
company,2023-07-03 17:50:21,Microchip Technology (MCHP) Outpaces Stock Market Gains: What You Should Know,121193899,https://media.zenfs.com/en/zacks.com/d7dcbe11345e3f8e5e71e6827fe3c4c9,MCHP,Yahoo,"In the latest trading session, Microchip Technology (MCHP) closed at $90.69, marking a +1.23% move from the previous day.",https://finnhub.io/api/news?id=8bf4431610e0ab2487d98c0e4e19734881e9d3aebdf62298c4b9844b35796c27
company,2023-07-03 07:30:00,Microchip Launches $300M Multi-Year Investment Initiative to Expand its Presence in India,121183237,https://media.zenfs.com/en/globenewswire.com/e48b0ed5b81579831415fc492414749c,MCHP,Yahoo,"Includes funding for facilities, engineering labs, talent acquisition and support for regional technology consortia and educational institutionsCHANDLER, Ariz., July 03, 2023 (GLOBE NEWSWIRE) -- Microchip Technology Incorporated (Nasdaq: MCHP), a leading provider of smart, connected and secure embedded control solutions, today announces a multi-year initiative to invest approximately $300 million in expanding its operations in India, one of the world’s fastest-growing semiconductor industry hubs",https://finnhub.io/api/news?id=0aaf7097b0bd6b1bd484d0927744a58970593c5b64ecf2e47973778713405bd5
company,2023-07-03 07:20:46,My Top 15 High Growth Dividend Stocks For July 2023,121183414,https://static.seekingalpha.com/cdn/s3/uploads/getty_images/1460419757/image_1460419757.jpg?io=getty-c-w1536,MCHP,SeekingAlpha,"The watchlist from June posted a gain of 8.91% last month, outperforming the SPY by 2.43% and VIG by 2.41%. Click here to find out the Top 15 for July 2023.",https://finnhub.io/api/news?id=05fa3884cc1b9ee2634f762f217e98fa93fd3ec330f5d3a9979f83a24d4590f9
company,2023-07-03 06:42:00,Microchip Expands Its Presence In India With $300M Multi-Year Investment,121186938,,MCHP,Benzinga,Looking for stock market analysis and research with proves results? Zacks.com offers in-depth financial research with over 30years of proven results.,https://finnhub.io/api/news?id=8ab2677ebbe4b103a8eb3afa135b2ac13dfa748452ee1ddac0076afa5317c166
company,2023-07-03 03:54:00,Microchip to Invest $300M to Expand Presence in India,121219395,https://mw3.wsj.net/mw5/content/logos/mw_logo_social.png,MCHP,MarketWatch,"By Ben Glickman Microchip Technology said Monday it would invest $300 million to expand its operations in India. The Chandler, Ariz.-based chip maker said...",https://finnhub.io/api/news?id=2c07c69d90e113d0d70476fc794fa6129f0e1ab47eb5a286ef5fa30e30f660be
company,2023-07-03 03:49:00,"Microchip to invest $300 million to expand in India, joining rival chipmakers",121219396,https://s.wsj.net/public/resources/MWimages/MW-GP644_MicroS_ZG_20180906154215.jpg,MCHP,MarketWatch,"Microchip Technology Inc. said Monday it will invest $300 million over multiple years to expand its presence in India. The company already has about 2,500...",https://finnhub.io/api/news?id=a072517b7c2a5424c6ad1fc78ca4cd98b045bad6b3e78103ba494761bd359b22
company,2023-07-03 03:20:00,Microchip plans $300M investment in India to expand operations,121186941,,MCHP,Seeking Alpha,Looking for stock market analysis and research with proves results? Zacks.com offers in-depth financial research with over 30years of proven results.,https://finnhub.io/api/news?id=d89591c77fed45d90154e88f27c91ad1d24f884b6a60d36c6c26be0ecf39ba66
company,2023-07-03 02:33:00,Microchip to invest $300M to expand operations in India,121186943,,MCHP,Thefly.com,Looking for stock market analysis and research with proves results? Zacks.com offers in-depth financial research with over 30years of proven results.,https://finnhub.io/api/news?id=d6e42eb912cac20664090defcf31f82b1d8b3ee787ca8dad0787787afe911f21
company,2023-07-07 12:50:00,"Microchip Technology Inc. stock falls Friday, underperforms market",121278005,https://images.mktw.net/im-220105/social,MCHP,MarketWatch,"Shares of Microchip Technology Inc. slipped 0.31% to $86.62 Friday, on what proved to be an all-around poor trading session for the stock market, with the...",https://finnhub.io/api/news?id=556a2e4c4fd3a04b824e054686e7dcb487af770a788313fb2dc32e3fe6998138
company,2023-07-07 05:50:00,"Global semiconductor sales plunge 21% in May, but M/M increase keeps optimism alive",121257681,,MCHP,Seeking Alpha,Looking for stock market analysis and research with proves results? Zacks.com offers in-depth financial research with over 30years of proven results.,https://finnhub.io/api/news?id=9c397fd225a640e03790207d8a5113f8106f6768758a5b92239dd1107f751dff
company,2023-07-07 03:07:31,Factbox-Companies respond to China's curbs on gallium and germanium exports,121251597,https://static.reuters.com/resources/r/?m=02&d=20230706&t=2&i=1638001832&r=LYNXMPEJ650DA,MCHP,Reuters,"China said on July 3 it would restrict exports of two metals used in semiconductors and electric vehicles, escalating a technology war with the United States and potentially causing more disruption to global supply chains.",https://finnhub.io/api/news?id=223ff99ab484a3b79190e7ccbf3e0dab0cf2c157aeef4109391fdce3487495b5
company,2023-07-06 12:50:00,"Microchip Technology Inc. stock falls Thursday, underperforms market",121278006,https://images.mktw.net/im-220105/social,MCHP,MarketWatch,"Shares of Microchip Technology Inc. slipped 1.74% to $86.89 Thursday, on what proved to be an all-around grim trading session for the stock market, with the...",https://finnhub.io/api/news?id=09ff3148fa7193ae4ad5bb23e5172e077e11f359cb4da5c9647de85c9e672c7a
company,2023-07-06 09:45:09,Here's Why Microchip Technology (MCHP) is a Strong Growth Stock,121247364,https://media.zenfs.com/en/zacks.com/670d1917693293f70179651625deb88f,MCHP,Yahoo,"Wondering how to pick strong, market-beating stocks for your investment portfolio? Look no further than the Zacks Style Scores.",https://finnhub.io/api/news?id=80f76bc026e79f1cd956d0a226bbc43bef9642073d6d0adc6dc18a9633ac4f43
company,2023-07-06 07:41:20,Factbox: Companies respond to China's curbs on gallium and germanium exports,121237288,https://static.reuters.com/resources/r/?m=02&d=20230706&t=2&i=1638001832&r=LYNXMPEJ650DA,MCHP,Reuters,"China said on July 3 it would restrict exports of two metals used in semiconductors and electric vehicles, escalating a technology war with the United States and potentially causing more disruption to global supply chains.",https://finnhub.io/api/news?id=59e35aa43d38d3c697bba373aacd2b6fef783f2f07303a3f6501e8756aad28b8
company,2023-07-06 07:38:18,FACTBOX-Companies respond to China's curbs on gallium and germanium exports ,121251598,,MCHP,Reuters,"China said on July 3 it would restrict exports of two metals used in semiconductors and electric vehicles, escalating a technology war with the United States and potentially causing more disruption to global supply chains.",https://finnhub.io/api/news?id=53aabae7343c0be122393b233852740816c36fcaef4dde2fc0759ac2d4d39dcf
company,2023-07-06 01:35:00,"As China slowdown continues, here are the U.S. stocks with the most exposure",121233389,,MCHP,Seeking Alpha,Looking for stock market analysis and research with proves results? Zacks.com offers in-depth financial research with over 30years of proven results.,https://finnhub.io/api/news?id=687edbb9f90077155918c18c555f5de114730e64a4d0e85ece834677ea76dab8
company,2023-07-06 01:29:00,As China slowdown continues here are the U.S. stocks with the most exposure,121233390,,MCHP,Seeking Alpha,Looking for stock market analysis and research with proves results? Zacks.com offers in-depth financial research with over 30years of proven results.,https://finnhub.io/api/news?id=5ebb2a848d91d3519b7fdf53c1657c072e587ebba5b216a5221b3802fd24dd08
company,2023-07-05 20:23:31,Semiconductors Winners And Losers At The Start Of H2 2023,121224505,https://static.seekingalpha.com/cdn/s3/uploads/getty_images/478266200/image_478266200.jpg?io=getty-c-w1536,MCHP,SeekingAlpha,"Semis look poised for continued gains in Q3 after the rally continued in Q2, but there were several changes worth noting. Read more on semi stocks here.",https://finnhub.io/api/news?id=5fd0b47cec1127ff9f630dcd7c85df3d2da49717b75318a293ab7efa251aff5b
company,2023-07-13 18:00:22,Microchip Technology (MCHP) Outpaces Stock Market Gains: What You Should Know,121376677,https://media.zenfs.com/en/zacks.com/b95cfdd8768bc3c4620e666dbcb0b248,MCHP,Yahoo,"Microchip Technology (MCHP) closed the most recent trading day at $92.36, moving +1.82% from the previous trading session.",https://finnhub.io/api/news?id=724040491369adcbdb2929970fd7369f0bb424d4b7ea844927f378b678a535f9
company,2023-07-13 12:51:00,"Microchip Technology Inc. stock rises Thursday, outperforms market",121397434,https://images.mktw.net/im-220105/social,MCHP,MarketWatch,"Shares of Microchip Technology Inc. rose 1.82% to $92.36 Thursday, on what proved to be an all-around positive trading session for the stock market, with the...",https://finnhub.io/api/news?id=0dde70322861812dac51a31b62a87b699b49d4928a89ed024cb053f865131dfd
company,2023-07-13 09:15:09,Microchip Technology Incorporated (MCHP) Hits Fresh High: Is There Still Room to Run?,121375297,https://media.zenfs.com/en/zacks.com/5ecaf2a9bf082a5f3a554e6526b34be0,MCHP,Yahoo,"Microchip Tech (MCHP) is at a 52-week high, but can investors hope for more gains in the future? We take a look at the company's fundamentals for clues.",https://finnhub.io/api/news?id=78923f9d2e8c779243b1af4704599cf3e1960d4139f385af8189b8da5ec5bc7b
