category,datetime,headline,id,image,related,source,summary,url
company,2022-12-26 07:50:00,5 Sleep-at-Night Microchip Stocks With Growing Passive Income,117803264,https://s.yimg.com/ny/api/res/1.2/GOEBf5njLzLKNuxFrkMCcA--/YXBwaWQ9aGlnaGxhbmRlcjt3PTEyMDA7aD04MDA-/https://media.zenfs.com/en/motleyfool.com/a5ed5a0d0e84c43a84b086a6924c2dc6,MCHP,Yahoo,"It has been a rough year for semiconductor stocks, but all may not be lost.  After all, semiconductors power all of today's big technology applications, from artificial intelligence, to the Internet of Things, to the Metaverse and electric vehicles.  While somewhat cyclical, semiconductor stocks are usually generally quite profitable, and their stocks are less expensive than the high-flying software sector.",https://finnhub.io/api/news?id=90dcab94e61a57b49a46bca126597487cd9c0ddf3cbae4777608c710b27fb06b
company,2022-12-30 12:08:00,"Microchip Technology Inc. stock falls Friday, underperforms market",118001834,https://images.mktw.net/im-220105/social,MCHP,MarketWatch,"Shares of Microchip Technology Inc. dropped 0.28% to $70.25 Friday, on what proved to be an all-around rough trading session for the stock market, with the...",https://finnhub.io/api/news?id=00e17c597773803da793f762914aa44bcd9506ad799cfbf5d40817223d089cfa
company,2023-01-06 12:09:00,"Microchip Technology Inc. stock rises Friday, outperforms market",118234382,https://images.mktw.net/im-220105/social,MCHP,MarketWatch,"Shares of Microchip Technology Inc. rallied 5.31% to $72.77 Friday, on what proved to be an all-around favorable trading session for the stock market, with...",https://finnhub.io/api/news?id=9add39ee8b7a2f768096be8ced171807abdd4bb83bbf603b17d4afbd76ab7a44
company,2023-01-05 11:40:43,U.S. Wide-Moat Stocks On Sale: The January 2023 Heat Map,118149242,https://static.seekingalpha.com/cdn/s3/uploads/getty_images/912585074/image_912585074.jpg?io=getty-c-w750,MCHP,SeekingAlpha,Our 3-step process focuses on wide-moat stocks (as per Morningstarâs rating). We are only interested in those targets that are attractively valued in historical comparison. Click for more.,https://finnhub.io/api/news?id=c605b8b39b4058c65928d2efb6ce9787021ac0fb0e13b266798eb36fd04f0216
company,2023-01-05 10:44:03,onsemi (ON) New SiC Modules Selected for Hyundai Motors EV,118144787,https://media.zenfs.com/en/zacks.com/22cecf4ad0ca1f0a5387d618d7255695,MCHP,Yahoo,onsemi (ON) Elite SiC modules will boost the performance of Hyundai and Kia's electric vehicles.,https://finnhub.io/api/news?id=e8f47414f34743a9d18907d56ae5d0eab41d25dcd04e4963199d7860c635c35a
company,2023-01-05 05:33:23,Semiconductors Winners And Losers At The Start Of 2023,118140214,https://static.seekingalpha.com/cdn/s3/uploads/getty_images/1339020389/image_1339020389.jpg?io=getty-c-w750,MCHP,SeekingAlpha,The year 2022 was bad for semis even though business was mostly good. Check out which semiconductor stock gained or lost in the past year.,https://finnhub.io/api/news?id=828e2e1e4a795afee107435e8925d0c46077c9108534d9fe4878977c20308f32
company,2023-01-04 23:09:00,"Microchip Technology Inc. stock falls Thursday, underperforms market",118169353,,MCHP,MarketWatch,Looking for stock market analysis and research with proves results? Zacks.com offers in-depth financial research with over 30years of proven results.,https://finnhub.io/api/news?id=602f43bd9f149d74d88c00449fc71e2ec7a2b3a6fdf13000ffde49d2bcceb995
company,2023-01-04 21:55:00,Microchip put volume heavy and directionally bearish,118169356,,MCHP,Thefly.com,Looking for stock market analysis and research with proves results? Zacks.com offers in-depth financial research with over 30years of proven results.,https://finnhub.io/api/news?id=270235317429b078d639679ba9e45ba18bca03d18098cc17ad89b13839ca6150
company,2023-01-04 13:04:04,Microchip Technology: Well-Positioned For A Smooth And Soft Landing,118124798,https://static.seekingalpha.com/cdn/s3/uploads/getty_images/1202024001/image_1202024001.jpg?io=getty-c-w750,MCHP,SeekingAlpha,Microchip Technology Incorporated enjoys a growing top line supported with high-quality backlogs. See why MCHP stock is an appealing buy-on-fear candidate.,https://finnhub.io/api/news?id=dd797b2c0e5af41d420ff9ad0b85eb1dc75001dd1b7da4b6af376a2df3409459
company,2023-01-04 12:08:00,"Microchip Technology Inc. stock rises Wednesday, outperforms market",118135386,https://images.mktw.net/im-220105/social,MCHP,MarketWatch,"Shares of Microchip Technology Inc. rallied 2.45% to $70.79 Wednesday, on what proved to be an all-around favorable trading session for the stock market,...",https://finnhub.io/api/news?id=7783261a91b23d7e9f056f210c426cb67fc483845c38ca68863c8436e2143f43
company,2023-01-04 11:12:04,onsemi's (ON) New EliteSiC Solutions to Boost Prospects,118117776,https://media.zenfs.com/en/zacks.com/a37bf1952483e0b1b3ad5c99eff1e8e8,MCHP,Yahoo,onsemi (ON) to launch SiC Solutions to diversify its business and address the uptrend in the energy infrastructure market.,https://finnhub.io/api/news?id=52a8f019a2cf5b8a3cab61e8c0376a6b9d15b801d823e586388052ca1c77a698
company,2023-01-04 06:08:00,What You Missed On Wall Street This Morning,118116022,,MCHP,Thefly.com,Looking for stock market analysis and research with proves results? Zacks.com offers in-depth financial research with over 30years of proven results.,https://finnhub.io/api/news?id=99bdec59ca392666c8510b567bac95061a75bdc4f04d3622dce168f3fbd661af
company,2023-01-04 03:22:00,"China pauses chip industry investments as COVID resurges, Bloomberg reports",118116429,,MCHP,Thefly.com,Looking for stock market analysis and research with proves results? Zacks.com offers in-depth financial research with over 30years of proven results.,https://finnhub.io/api/news?id=01d4981246e71c7c3c061739a6d67f27b92632c1c0c5f20e34086fbbbafd6d33
company,2023-01-03 22:30:00,What You Missed On Wall Street On Wednesday,118122485,,MCHP,Thefly.com,Looking for stock market analysis and research with proves results? Zacks.com offers in-depth financial research with over 30years of proven results.,https://finnhub.io/api/news?id=4a551fb8e018248578bb75e9304569524247912e28e0afea4a301174601bb9e4
company,2023-01-03 12:08:00,"Microchip Technology Inc. stock falls Tuesday, underperforms market",118108035,https://images.mktw.net/im-220105/social,MCHP,MarketWatch,"Shares of Microchip Technology Inc. shed 1.64% to $69.10 Tuesday, on what proved to be an all-around poor trading session for the stock market, with the S&P...",https://finnhub.io/api/news?id=15a61900b59569a681b0b66c2e1d359f2e92a3c5e464cd861595fc841bff9259
company,2023-01-10 12:08:00,"Microchip Technology Inc. stock rises Tuesday, outperforms market",118234378,https://images.mktw.net/im-220105/social,MCHP,MarketWatch,"Shares of Microchip Technology Inc. rallied 2.24% to $75.45 Tuesday, on what proved to be an all-around favorable trading session for the stock market, with...",https://finnhub.io/api/news?id=2f619c1ec8bd091a50c73f44b5bb225853d41591eba053d73cab5f61ca3ed9a2
company,2023-01-09 12:08:00,"Microchip Technology Inc. stock rises Monday, outperforms market",118234381,https://images.mktw.net/im-220105/social,MCHP,MarketWatch,"Shares of Microchip Technology Inc. rose 1.42% to $73.80 Monday, on what proved to be an all-around grim trading session for the stock market, with the S&P...",https://finnhub.io/api/news?id=1e28dcafb59a661d04b976326cc068b59face74c5acb012897cf5a7b65ef4909
company,2023-01-07 08:00:45,Shareholders might want to keep a close eye on Microchip Technology Incorporated (NASDAQ:MCHP) after insiders sold US$1.4m stock earlier this year,118206359,https://media.zenfs.com/en/simply_wall_st__316/ce85212c51bd88fd1fdcd0febb642a4a,MCHP,Yahoo,"While Microchip Technology Incorporated ( NASDAQ:MCHP ) shareholders have had a good week with the stock up 3.6%, they...",https://finnhub.io/api/news?id=8e7c76a15a0c2c5c3fc8686bca8aa6c424e31d0f0bde2154b76422042bdbe77b
company,2023-01-12 14:16:00,Microchip Technology Is Booting Up,118210354,https://media.zenfs.com/en/thestreet.com/de4d195a0126314a8927d0a4f0eed418,MCHP,Yahoo,"Shares of Microchip Technology are shaping up nicely on the charts. The company manufactures various types of integrated circuits.     Let's check the charts.     In this daily bar chart of MCHP, below, I see a pretty clear-looking base pattern with a neckline across the $80 level.",https://finnhub.io/api/news?id=d9ea1205347004d07d18d188bda23fd6af23ae325cc04b2eeb91755529545f61
company,2023-01-12 12:08:00,"Microchip Technology Inc. stock falls Thursday, underperforms market",118234375,https://images.mktw.net/im-220105/social,MCHP,MarketWatch,"Shares of Microchip Technology Inc. shed 0.21% to $75.24 Thursday, on what proved to be an all-around positive trading session for the stock market, with the...",https://finnhub.io/api/news?id=dc3afd388568b09ea7560b1664399dfdf0283437a74dbbac47efde442df751aa
company,2023-01-11 18:15:11,Microchip Technology (MCHP) Stock Sinks As Market Gains: What You Should Know,118206358,https://media.zenfs.com/en/zacks.com/1a018a29aef5adbf5b4319f32058e209,MCHP,Yahoo,"In the latest trading session, Microchip Technology (MCHP) closed at $75.40, marking a -0.07% move from the previous day.",https://finnhub.io/api/news?id=52180e75cdad7fd5bf01f3655fc305ae79e5922cb9f051b6b59902c20053cf0c
company,2023-01-11 12:09:00,"Microchip Technology Inc. stock falls Wednesday, underperforms market",118234377,https://images.mktw.net/im-220105/social,MCHP,MarketWatch,"Shares of Microchip Technology Inc. dropped 0.07% to $75.40 Wednesday, on what proved to be an all-around great trading session for the stock market, with...",https://finnhub.io/api/news?id=38a3e204e85148cb9b466d63a5d80d555cc580dd316492a658ae6b17a9e7a1c4
company,2023-01-18 18:15:11,Microchip Technology (MCHP) Stock Moves -0.79%: What You Should Know,118314019,https://media.zenfs.com/en/zacks.com/737ffb82e07dc8bffb77e72d153c91f2,MCHP,Yahoo,"Microchip Technology (MCHP) closed at $73.90 in the latest trading session, marking a -0.79% move from the prior day.",https://finnhub.io/api/news?id=59cc786ebfcd6bcb2e7ee383dad7d393d0e33389a4a02f2b944d49714959d651
company,2023-01-18 12:08:00,"Microchip Technology Inc. stock falls Wednesday, still outperforms market",118323805,https://images.mktw.net/im-220105/social,MCHP,MarketWatch,"Shares of Microchip Technology Inc. slipped 0.79% to $73.90 Wednesday, on what proved to be an all-around poor trading session for the stock market, with the...",https://finnhub.io/api/news?id=6bea746a6ff7900cc260e47553319231aa4d7cea93c54ba36c3e61dc9ab65675
company,2023-01-17 12:08:00,"Microchip Technology Inc. stock falls Tuesday, underperforms market",118296713,https://images.mktw.net/im-220105/social,MCHP,MarketWatch,"Shares of Microchip Technology Inc. slipped 0.57% to $74.49 Tuesday, on what proved to be an all-around poor trading session for the stock market, with the...",https://finnhub.io/api/news?id=29c3c18ab91e5ecebdda684ee29f322cf4592419da7bda3f6c543c6c7ced3723
company,2023-01-17 08:00:00,Microchip Launches Radiation-Tolerant Power Management Device Targeting Low-Earth Orbit Space Applications,118291774,https://media.zenfs.com/en/globenewswire.com/e48b0ed5b81579831415fc492414749c,MCHP,Yahoo,"Space system developers can quickly develop prototypes and final designs for their power management system with a radiation-tolerant device based on a familiar plastic COTS deviceCHANDLER, Ariz., Jan. 17, 2023 (GLOBE NEWSWIRE) -- The commercialization of the Low-Earth Orbit (LEO) region is transforming space exploration and satellite communication at roughly 1,200 miles above Earth. For satellites to successfully operate and reach their destination, it is essential to select components that can",https://finnhub.io/api/news?id=5faca5353a864674cc867e2802391636f6da88699e09f35ff94f8045d27ad274
company,2023-01-17 02:30:00,TDV: The Underlying Index Looks Unattractive,118288821,https://static.seekingalpha.com/cdn/s3/uploads/getty_images/1133364931/image_1133364931.jpg?io=getty-c-w750,MCHP,SeekingAlpha,The ProShares S&P Technology Dividend Aristocrats ETF is an equal-weight dividend-growth ETF in technology. Click here to see whether TDV is a Buy at this time.,https://finnhub.io/api/news?id=94aef66b4da8217da04af296be7c73aaa391cacb3686a4cb7ecf9809d539efbd
company,2023-01-19 12:08:00,"Microchip Technology Inc. stock falls Thursday, underperforms market",118323804,https://images.mktw.net/im-220105/social,MCHP,MarketWatch,"Shares of Microchip Technology Inc. slid 2.91% to $71.75 Thursday, on what proved to be an all-around grim trading session for the stock market, with the S&P...",https://finnhub.io/api/news?id=a683d56c6e9286720194b595692926845317770eef05bd2c99ca7cf65bdbed14
company,2023-01-19 08:00:00,New All-in-One Hybrid Power Drive Module Solution from Microchip is Designed for Electric Aviation Applications to Reduce Development Time and Weight,118320539,https://media.zenfs.com/en/globenewswire.com/e48b0ed5b81579831415fc492414749c,MCHP,Yahoo,"The highly integrated and configurable three-phase power module is the first variant of the new family and can be customized using silicon carbide or silicon, reducing power solution size and weight for electric aircraftCHANDLER, Ariz., Jan. 19, 2023 (GLOBE NEWSWIRE) -- Aircraft manufacturers designing More Electric Aircraft (MEA) are looking to convert the flight control systems from hydraulic to electric to reduce weight and design complexities. To meet the needs for an integrated and configur",https://finnhub.io/api/news?id=3dc1dc0d330bd0e015748cf71f74d2405afdb28ea4e73eda4e4ebd6d6d885e7f
company,2023-01-26 10:01:03,Microchip Technology (MCHP) Earnings Expected to Grow: Should You Buy?,118381234,https://media.zenfs.com/en/zacks.com/8442d24e11d454aa89061259a9714d43,MCHP,Yahoo,Microchip Tech (MCHP) doesn't possess the right combination of the two key ingredients for a likely earnings beat in its upcoming report. Get prepared with the key expectations.,https://finnhub.io/api/news?id=717152d9c635fe0c58c34959d55ff2b064093b9344a2da7cdc4ca11e064679a3
company,2023-01-24 18:15:11,Microchip Technology (MCHP) Dips More Than Broader Markets: What You Should Know,118357913,https://media.zenfs.com/en/zacks.com/b95cfdd8768bc3c4620e666dbcb0b248,MCHP,Yahoo,"Microchip Technology (MCHP) closed at $75.72 in the latest trading session, marking a -0.77% move from the prior day.",https://finnhub.io/api/news?id=0114b44cdb95f3b7162616648a8c7cb9a0cb80ba17d49ec36e3b365aed0aa47a
company,2023-01-30 10:33:37,"Oregon lawmakers told chip push could reap billions, but will take upfront money, rural land",118420036,https://s.yimg.com/ny/api/res/1.2/WOeJJFcV1rm9bUiRAbabkQ--/YXBwaWQ9aGlnaGxhbmRlcjt3PTEyMDA7aD04MDA-/https://media.zenfs.com/en/bizjournals.com/3a43e85630a78bdb638432fd87a805b0,MCHP,Yahoo,"Oregon lawmakers are getting a better sense of the possible benefits of semiconductor industry growth — and of what it might take to make it happen.  The Joint Committee on Semiconductors is the focal point in an effort to position the state for big investment as the federal government puts $50 billion from the CHIPS Act toward domestic chip manufacturing and R&D.  There’s urgency to the committee’s work — the U.S. Commerce Department said it will issue application guidance early next month and begin making grants and loans on a rolling basis “as soon as applications can be responsibly processed, evaluated and negotiated.”  In less than two weeks of activity, the committee has heard that the fiscal impact of a single fab could be in the billions, but also that the state will likely need to come up with upfront money as a lure while also wresting big swaths of land from rural reserves.",https://finnhub.io/api/news?id=cf5b72da5060425bfafdb2f353c32325ebada6e0affd37eda00a9f1749c509b7
company,2023-01-30 10:00:03,ON Semiconductor Corp. (ON) Earnings Expected to Grow: What to Know Ahead of Next Week's Release,118420038,https://media.zenfs.com/en/zacks.com/17a4db66bb13bdabcbf848550a6ea15a,MCHP,Yahoo,ON Semiconductor Corp. (ON) doesn't possess the right combination of the two key ingredients for a likely earnings beat in its upcoming report. Get prepared with the key expectations.,https://finnhub.io/api/news?id=a01f6964599d52f7041462b76ef90e4f6693c6b0c5eedaee0b18c95513c210a7
company,2023-02-03 16:30:38,Chandler-based Microchip Technology reports record sales growth in third fiscal quarter,118484749,https://s.yimg.com/ny/api/res/1.2/xgkhhbwuV1jfsocmNeugzg--/YXBwaWQ9aGlnaGxhbmRlcjt3PTEyMDA7aD04MDA-/https://media.zenfs.com/en/bizjournals.com/175397265f2ee97a76dbacfc1d4c6a51,MCHP,Yahoo,"Microchip attributes its semiconductor market resilience to solid demand from industrial, automotive, aerospace, data center and communications industries, which make up 86% of the company’s net sales.",https://finnhub.io/api/news?id=4af896a8e27201a011f5440cc6b934562c8731148bd7589efd9609a2ee899846
company,2023-02-03 16:09:21,Microchip Technology Incorporated (NASDAQ:MCHP) Q3 2023 Earnings Call Transcript,118484750,https://media.zenfs.com/en/insidermonkey.com/6b40fec2ae07612733f1cd1860e5e2cb,MCHP,Yahoo,"Microchip Technology Incorporated (NASDAQ:MCHP) Q3 2023 Earnings Call Transcript February 2, 2023 Operator: Good day everyone, and welcome to Microchip’s Third Quarter Fiscal 2023 Financial Results Conference Call. As a reminder, today’s call is being recorded. At this time, I would like to turn the call over to Mr. Eric Bjornholt, our CFO. Please go […]",https://finnhub.io/api/news?id=affdc050b81f57f5da1ce1ecf0d7f0543a8843cdd22d7a1c64b96f94f94f009a
company,2023-02-03 12:04:14,Qualcomm Joins Other Chipmakers Guiding Lower For The March Quarter,118457922,https://media.zenfs.com/en/ibd.com/e56356fd2408f71f5a6fce06126bd7e7,MCHP,Yahoo,Wireless-chip giant Qualcomm has joined the parade of chipmakers guiding below Wall Street's estimates for the March quarter.,https://finnhub.io/api/news?id=f197f70791c70a6795ef51fd85a18a7e081b02b08c48650f64a777089842ce2b
company,2023-02-03 12:09:00,"Microchip Technology Inc. stock rises Friday, outperforms market",118487765,https://images.mktw.net/im-220105/social,MCHP,MarketWatch,"Shares of Microchip Technology Inc. inched 0.96% higher to $85.34 Friday, on what proved to be an all-around dismal trading session for the stock market,...",https://finnhub.io/api/news?id=2d29534e9a9e1518f290bc2f6b3f64add935dfd45b95836faf1f15c4a3135028
company,2023-02-03 12:08:05,"Microchip (MCHP) Q3 Earnings Top Estimates, Sales Rise Y/Y",118476449,https://media.zenfs.com/en/zacks.com/f54f709ae65e32f6086a21eeef8d44f3,MCHP,Yahoo,Microchip's (MCHP) third-quarter fiscal 2023 results reflect continued momentum in the microcontroller business despite the weaker business environment in China.,https://finnhub.io/api/news?id=284cc639e8adba83623c91b0bd2b19b334520160f8beffd6fac50d1d0c4d33c6
company,2023-02-03 07:01:00,Top 5 4th Quarter Trades of MIZUHO MARKETS AMERICAS LLC,118680075,,MCHP,GuruFocus,Looking for stock market analysis and research with proves results? Zacks.com offers in-depth financial research with over 30years of proven results.,https://finnhub.io/api/news?id=eb28ae19346b6f2bbcdfd34ebbd98e084b932936bdfd68b13e8972fe26a2e6bd
company,2023-02-03 03:37:00,Microchip price target raised to $94 from $85 at Truist,118742105,,MCHP,Thefly.com,Looking for stock market analysis and research with proves results? Zacks.com offers in-depth financial research with over 30years of proven results.,https://finnhub.io/api/news?id=bb8754d8f110bb7ce6662aa643437aee58effaf062a57c440a939ee0b1a923d2
company,2023-02-03 03:07:00,Microchip price target raised to $110 from $82 at Needham,118742107,,MCHP,Thefly.com,Looking for stock market analysis and research with proves results? Zacks.com offers in-depth financial research with over 30years of proven results.,https://finnhub.io/api/news?id=364670f981f8f0514b8499176cd3f5088022cb39f7a5d537730efe83de3bf5d1
company,2023-02-03 02:02:00,Microchip price target raised to $100 from $85 at Susquehanna,118742109,,MCHP,Thefly.com,Looking for stock market analysis and research with proves results? Zacks.com offers in-depth financial research with over 30years of proven results.,https://finnhub.io/api/news?id=db21cf7b54e1aa184829c1ca53a087eab42bb5e6f5192c6ec680f0cddab8529a
company,2023-02-03 01:55:00,Microchip (MCHP): New Buy Recommendation for This Technology Giant,118742110,,MCHP,TipRanks,Looking for stock market analysis and research with proves results? Zacks.com offers in-depth financial research with over 30years of proven results.,https://finnhub.io/api/news?id=1ab3cd69dd754e441677b1ebf22567788b7d75c3b1e4d1a9e751c027e001692a
company,2023-02-03 01:50:00,MCHP Crosses Above Average Analyst Target,118742112,,MCHP,ETF Channel,Looking for stock market analysis and research with proves results? Zacks.com offers in-depth financial research with over 30years of proven results.,https://finnhub.io/api/news?id=7325b2a4486e99c9f26f5db402f051f1e1ee0a46be96cd9ce9a0350acca19e06
company,2023-02-03 01:47:00,Microchip price target raised to $106 from $86 at B. Riley,118742113,,MCHP,Thefly.com,Looking for stock market analysis and research with proves results? Zacks.com offers in-depth financial research with over 30years of proven results.,https://finnhub.io/api/news?id=ac7839a6ccab3bf7f7b08f70a31fa6e101296cf0d370149ca685a34dde9b5a07
company,2023-02-03 01:26:00,"New Buy Rating for Microchip (MCHP), the Technology Giant",118742115,,MCHP,TipRanks,Looking for stock market analysis and research with proves results? Zacks.com offers in-depth financial research with over 30years of proven results.,https://finnhub.io/api/news?id=b7d460609e3e72daa8d2d41e876185ee8213dc3df377470df62dfc57c333decd
company,2023-02-03 00:58:00,Microchip price target raised to $85 from $74 at Citi,118742120,,MCHP,Thefly.com,Looking for stock market analysis and research with proves results? Zacks.com offers in-depth financial research with over 30years of proven results.,https://finnhub.io/api/news?id=18297dd55a0202a8c80ae7c729715dfbe2bf3e760cb2aa695889af8f9622b2a9
company,2023-02-03 00:58:00,Microchip price target raised to $105 from $90 at Raymond James,118742119,,MCHP,Thefly.com,Looking for stock market analysis and research with proves results? Zacks.com offers in-depth financial research with over 30years of proven results.,https://finnhub.io/api/news?id=a9435ded0872861039c1b7eb8da3999a1157277dedbf11c835a8046fede3e6c7
company,2023-02-03 00:42:00,Microchip price target raised to $79 from $72 at Mizuho,118742122,,MCHP,Thefly.com,Looking for stock market analysis and research with proves results? Zacks.com offers in-depth financial research with over 30years of proven results.,https://finnhub.io/api/news?id=ace90fe1699e9181045b511f3082f24ba156f109f5933ea7035fbbd6a498aea8
company,2023-02-03 00:26:00,Microchip (MCHP) Gets a Buy from Needham,118742123,,MCHP,TipRanks,Looking for stock market analysis and research with proves results? Zacks.com offers in-depth financial research with over 30years of proven results.,https://finnhub.io/api/news?id=7a9ad5ff7fc056d8fb8f7f0bf9d704bae0bc272f82ca45c03421fb9d65bf41be
company,2023-02-03 00:11:00,Microchip price target raised to $100 from $80 at Piper Sandler,118742126,,MCHP,Thefly.com,Looking for stock market analysis and research with proves results? Zacks.com offers in-depth financial research with over 30years of proven results.,https://finnhub.io/api/news?id=e0e9dc92ba10e82bd7f4069bd64aa3af7ad1d9e7db65c6f2eba11bae04f6b816
company,2023-02-02 17:55:10,Microchip Technology (MCHP) Q3 Earnings and Revenues Surpass Estimates,118484753,https://media.zenfs.com/en/zacks.com/d7dcbe11345e3f8e5e71e6827fe3c4c9,MCHP,Yahoo,"Microchip Tech (MCHP) delivered earnings and revenue surprises of 0.65% and 0.89%, respectively, for the quarter ended December 2022. Do the numbers hold clues to what lies ahead for the stock?",https://finnhub.io/api/news?id=b7ea4b616f566205e6a144e7f3c1fdc3b890f772c3a62f43a92fb33d9f785616
company,2023-02-02 17:05:24,Microchip Technology Inc. (MCHP) Q3 2023 Earnings Call Transcript,118445671,https://static.seekingalpha.com/assets/og_image_1200-29b2bfe1a595477db6826bd2126c63ac2091efb7ec76347a8e7f81ba17e3de6c.png,MCHP,SeekingAlpha,"Microchip Technology Inc. (NASDAQ:NASDAQ:MCHP) Q3 2023 Earnings Conference Call February 2, 2023 5:00 PM ETCompany ParticipantsGanesh Moorthy - President & Chief Executive OfficerJames...",https://finnhub.io/api/news?id=4b56d55169edb22e08595f226f2ed53f3500d887097e16bfaf3f0f0b18750179
company,2023-02-02 16:15:00,Microchip Technology Increases Quarterly Cash Dividend  41.5% Year-Over-Year to 35.8 Cents Per Share,118484755,https://media.zenfs.com/en/globenewswire.com/e48b0ed5b81579831415fc492414749c,MCHP,Yahoo,"CHANDLER, Ariz., Feb. 02, 2023 (GLOBE NEWSWIRE) -- (NASDAQ: MCHP) – Microchip Technology Incorporated, a leading provider of smart, connected, and secure embedded control solutions, today announced that its Board of Directors declared a quarterly cash dividend on its common stock of 35.8 cents per share. The dividend is payable on March 7, 2023, to stockholders of record on February 21, 2023. Microchip initiated quarterly cash dividend payments in the third quarter of fiscal year 2003 and has in",https://finnhub.io/api/news?id=eddf91f3c02929a2d65303e98a85289dc06a247a534e8cb9fa7ae76a573781f6
