category,datetime,headline,id,image,related,source,summary,url
company,2023-03-16 13:08:00,"Microchip Technology Inc. stock rises Thursday, outperforms market",119281643,https://images.mktw.net/im-220105/social,MCHP,MarketWatch,"Shares of Microchip Technology Inc. advanced 2.16% to $82.25 Thursday, on what proved to be an all-around positive trading session for the stock market, with...",https://finnhub.io/api/news?id=5b9a19561e1e76bd1e46899040e60312e0decd8c1d929e059b294bd2762a682f
company,2023-03-16 08:06:12,"Zacks Investment Ideas feature highlights: Silicon Valley Bank, Impinj, Delta Airlines, Rambu and Microchip Technology",119274453,https://media.zenfs.com/en/zacks.com/1bb826624df7dc54f989dd7f1149dca0,MCHP,Yahoo,"Silicon Valley Bank, Impinj, Delta Airlines, Rambu and Microchip Technology are part of the Zacks Investment Ideas article.",https://finnhub.io/api/news?id=18034fa0a0cc83ba79e71bd4aa341942c9d36229ec009b15ff6e28f1e2f0d0a1
company,2023-03-16 06:56:00,"Chips, energy and an Amazon rival: Stock picks from a fund manager with three decades of experience",119281987,https://s.yimg.com/ny/api/res/1.2/iHwTfTCEfP_TOfhhR8o5zg--/YXBwaWQ9aGlnaGxhbmRlcjt3PTEyMDA7aD02MDA-/https://media.zenfs.com/en/marketwatch.com/0b5c0a19adad296c8e7542d1cafc89a3,MCHP,Yahoo,"The manager of the Plumb Balanced Fund has three stock ideas to share. But first, some timely advice from the manager's three decades of experience.",https://finnhub.io/api/news?id=c8fe2409853e7663dd5af9d45ab712b248623b18d3b01ab5027a2e0e8e92f5f5
company,2023-03-23 16:09:08,2 Semiconductor Stocks to Buy with Reasonable Valuations,119382670,https://media.zenfs.com/en/zacks.com/a032b41978f7532c56d6ba50432ba3ca,MCHP,Yahoo,There are still some chip stocks that are trading at reasonable valuations,https://finnhub.io/api/news?id=5f401d45ff3e0c55d6efd4291a201f6af590b96a2f027be5b989599a9a4366dd
company,2023-03-23 13:09:00,"Microchip Technology Inc. stock rises Thursday, outperforms market",119447483,https://images.mktw.net/im-220105/social,MCHP,MarketWatch,"Shares of Microchip Technology Inc. advanced 2.15% to $82.30 Thursday, on what proved to be an all-around great trading session for the stock market, with...",https://finnhub.io/api/news?id=1c746e419b8dad9b9495eec485badbc5bd0bad0276c0876a67f6c733558bb2cd
company,2023-03-22 13:08:00,"Microchip Technology Inc. stock falls Wednesday, underperforms market",119447485,https://images.mktw.net/im-220105/social,MCHP,MarketWatch,"Shares of Microchip Technology Inc. slid 2.09% to $80.57 Wednesday, on what proved to be an all-around grim trading session for the stock market, with the...",https://finnhub.io/api/news?id=cb3c5c0c2310ca7e9dbe496b6dbf94b1ebba46adefe6c15308337c32f2fda21f
company,2023-03-22 12:00:04,All You Need to Know About Microchip Tech (MCHP) Rating Upgrade to Strong Buy,119364340,https://media.zenfs.com/en/zacks.com/078b2d95159d12a337f09f2519ff10ba,MCHP,Yahoo,"Microchip Tech (MCHP) has been upgraded to a Zacks Rank #1 (Strong Buy), reflecting growing optimism about the company's earnings prospects. This might drive the stock higher in the near term.",https://finnhub.io/api/news?id=c6349827b74dc34cd862e31a95efd034f64adb83d233d39fba8feec7606b2f67
company,2023-03-22 11:06:32,Microchip Technology: Solid Microcontroller Performance In A Strong Semiconductor Sector,119354663,https://static.seekingalpha.com/cdn/s3/uploads/getty_images/1425733331/image_1425733331.jpg?io=getty-c-w1536,MCHP,SeekingAlpha,"Microchip Technology reported F3Q 2023 earnings on February 2, 2023, with record net sales of $2.169 billion. Click here to read my analysis of MCHP stock.",https://finnhub.io/api/news?id=fff5826721dd59878cf8077c6732d432bea58511f2278f859eff5254725d7751
company,2023-03-22 06:58:10,"Zacks.com featured highlights include Dr. Reddys Laboratories, Darden Restaurants, The Interpublic Group of Companies, Microchip Technology and Valero Energy",119351237,https://media.zenfs.com/en/zacks.com/a162db310eadf3a53e7c1325236322af,MCHP,Yahoo,"Dr. Reddys Laboratories, Darden Restaurants, The Interpublic Group of Companies, Microchip Technology and Valero Energy are part of the Zacks Screen of the Week article.",https://finnhub.io/api/news?id=37dad490960beece40f0b9c0836ac5d8152267b348495f7911e1eb24a2049967
company,2023-03-22 04:55:00,Early notable gainers among liquid option names on March 22nd,119354628,,MCHP,Thefly.com,Looking for stock market analysis and research with proves results? Zacks.com offers in-depth financial research with over 30years of proven results.,https://finnhub.io/api/news?id=427798bad5e1dff0021248c0a409a0c9dd8efbfa92e79fc5b21d51546fc0e015
company,2023-03-21 21:56:30,Microchip Technology: Growth Across All Segments Support Positive Outlook,119344652,https://static.seekingalpha.com/cdn/s3/uploads/getty_images/1345555708/image_1345555708.jpg?io=getty-c-w1536,MCHP,SeekingAlpha,Microchip Technology has had strong and stable growth across all of its major segments. Read more to see why we rate MCHP stock as a Buy.,https://finnhub.io/api/news?id=02d13da415699f7d713017a8cea46a401bf6cac0cc0944799121688fe8c78c1f
company,2023-03-21 13:08:00,"Microchip Technology Inc. stock remains steady Tuesday, underperforms market",119348299,https://images.mktw.net/im-220105/social,MCHP,MarketWatch,"Shares of Microchip Technology Inc. were unchanged Tuesday, on what proved to be an all-around favorable trading session for the stock market, with the S&P...",https://finnhub.io/api/news?id=4ce56bc510db9d5d0c95d21322e70e2d75a7d0e1d7639eb3f7d3df2fc566466c
company,2023-03-20 13:08:00,"Microchip Technology Inc. stock rises Monday, outperforms market",119328707,https://images.mktw.net/im-220105/social,MCHP,MarketWatch,"Shares of Microchip Technology Inc. advanced 1.96% to $82.29 Monday, on what proved to be an all-around great trading session for the stock market, with the...",https://finnhub.io/api/news?id=b6c6238a78bba93289b8bd8c52ad561efb23aebf846ad78d35b60b588af4ed46
company,2023-03-20 08:00:00,New MPLAB® SiC Power Simulator Allows Customers to Test Microchip’s SiC Power Solutions in Design Phase,119313446,https://media.zenfs.com/en/globenewswire.com/e48b0ed5b81579831415fc492414749c,MCHP,Yahoo,"Microchip’s PLECS-based tool quickly evaluates solutions across power-switching topologies before committing design to hardwareCHANDLER, Ariz., March 20, 2023 (GLOBE NEWSWIRE) -- The electrification of everything is driving the growth of SiC semiconductors as large market segments such as E-Mobility, sustainability and industrial turn to SiC power solutions because of its fast-switching capabilities, lower power loss and higher temperature performance. To help power design engineers transition t",https://finnhub.io/api/news?id=65652f5a9b6a1a8f30614e858f7afccdd4ae7865bf45155f2709c09694963b95
company,2023-03-20 03:09:00,Microchip announces MPLAB SiC Power Simulator,119310975,,MCHP,Thefly.com,Looking for stock market analysis and research with proves results? Zacks.com offers in-depth financial research with over 30years of proven results.,https://finnhub.io/api/news?id=bfcd4d242d0332604b8cc4fff03d6c1df94e3cf7f2ea0b9660bed88b60b50cfe
company,2023-03-20 00:25:00,"Microchip Technology Moves Up In Market Cap Rank, Passing AutoZone",119310976,,MCHP,The Online Investor,Looking for stock market analysis and research with proves results? Zacks.com offers in-depth financial research with over 30years of proven results.,https://finnhub.io/api/news?id=fe7e8be2eeecbd28f4e9100e8abe584851f3080e97190b5ba36b4042ab9be490
company,2023-03-27 16:58:08,3 Tech Stocks That Can March into April,119452006,https://media.zenfs.com/en/zacks.com/6f1e3a78c582128776b71f4bf7041742,MCHP,Yahoo,Here are three tech stocks that were recently added to the Zacks Rank #1 (Strong Buy) list this week and could rise going into April.,https://finnhub.io/api/news?id=33a92db85ac4877e56e02f6fd026ada3ad2e706893f9793803281767c985f109
company,2023-03-27 13:08:00,"Microchip Technology Inc. stock falls Monday, underperforms market",119447480,https://images.mktw.net/im-220105/social,MCHP,MarketWatch,"Shares of Microchip Technology Inc. slid 2.37% to $77.55 Monday, on what proved to be an all-around positive trading session for the stock market, with the...",https://finnhub.io/api/news?id=b994fc4317ae17faff23c070f89ac7dba8fb7b8ec7ed1f6be46ecab082a73f59
company,2023-03-27 07:45:00,1 Super Semiconductor Stock Bucking the Downturn and Boosting Its Cash Returns to Shareholders,119439128,https://s.yimg.com/ny/api/res/1.2/2qCYIGVdxxiK_gJjZsbfIw--/YXBwaWQ9aGlnaGxhbmRlcjt3PTEyMDA7aD04MDA-/https://media.zenfs.com/en/motleyfool.com/c9b4097a7d3d2db89f1a8f88c3a5e768,MCHP,Yahoo,"Other growing industrial markets -- including automotive -- have slowed down as well.  Through it all, though, Microchip Technology (NASDAQ: MCHP) has continued its fast-and-steady expansion.  Microchip has also laid out plans for boosting its dividend and share repurchases in the coming years as a result.",https://finnhub.io/api/news?id=809df068a280d73499a133bf0d4cfbb31870e92d8e024b45df45a61cb671b2ea
company,2023-03-26 09:13:12,Microchip Technology's (NASDAQ:MCHP) investors will be pleased with their strong 143% return over the last three years,119429636,https://media.zenfs.com/en/simply_wall_st__316/ce85212c51bd88fd1fdcd0febb642a4a,MCHP,Yahoo,"It might seem bad, but the worst that can happen when you buy a stock (without leverage) is that its share price goes...",https://finnhub.io/api/news?id=49a3e1671a74af34d45cb997b9e6a396c687fac19ea2ce917d7a1e0293a20cf9
company,2023-03-24 13:08:00,"Microchip Technology Inc. stock falls Friday, underperforms market",119447481,https://images.mktw.net/im-220105/social,MCHP,MarketWatch,"Shares of Microchip Technology Inc. slid 3.49% to $79.43 Friday, on what proved to be an all-around positive trading session for the stock market, with the...",https://finnhub.io/api/news?id=6070f82bab2dae7a1b6039ed4da782a64df5bda7ec04ed3f627033931d8f2f99
company,2023-03-31 15:12:57,These Five IBD 50 Chip Stocks Hold Surprisingly Low P/E Ratios; All Are Setting Up Buy Points,119546643,https://media.zenfs.com/en/ibd.com/1e268910d94985b14ab9c4a8b59d2616,MCHP,Yahoo,These five semiconductor growth stocks have low P/E ratios and sound fundamentals and have gained between 19% and 50% this year so far.,https://finnhub.io/api/news?id=85db7799ca022baec3df3056063999f75d4a9a1760bb365a64dac1e8b2fa5876
company,2023-03-31 13:11:00,"Microchip Technology Inc. stock rises Friday, still underperforms market",119616312,https://images.mktw.net/im-220105/social,MCHP,MarketWatch,"Shares of Microchip Technology Inc. rallied 1.21% to $83.78 Friday, on what proved to be an all-around favorable trading session for the stock market, with...",https://finnhub.io/api/news?id=143e0efb31a759233f546ef2e71f737d2cd65a6599cae11fb1709c9db2351bdd
company,2023-03-31 08:37:42,Should You Consider Adding Microchip Technology Incorporated (MCHP) to Your Portfolio?,119550784,https://media.zenfs.com/en/insidermonkey.com/c9b89eff8cc79a8250ea9a56ec356250,MCHP,Yahoo,"TimesSquare Capital Management, an equity investment management company, released its “U.S. Mid Cap Growth Strategy” fourth-quarter investor letter. A copy of the same can be downloaded here. In the fourth quarter, the strategy returned 4.18% (net), compared to 6.90% for the Russell Midcap Growth Index. For the calendar year, the strategy returned -22.13% (net) compared to […]",https://finnhub.io/api/news?id=ff697640c4f19598297ad2ed2c28c0a22a58c8195935662cceaadf60254feee7
company,2023-03-30 13:08:00,"Microchip Technology Inc. stock rises Thursday, outperforms market",119616313,https://images.mktw.net/im-220105/social,MCHP,MarketWatch,"Shares of Microchip Technology Inc. rose 2.36% to $82.78 Thursday, on what proved to be an all-around positive trading session for the stock market, with the...",https://finnhub.io/api/news?id=5da6e22d92a37090fe926dd687e24b162274da0e01acccf4183a71e551bc87db
company,2023-03-29 16:27:09,Unusual Call Option Trade in Microchip Technology (MCHP)  Worth $586.18K,119497916,,MCHP,Fintel,,https://finnhub.io/api/news?id=721a71f55842b4f51dfdfc6313a6ed18b6160948eb01055a6d4de2aa965f3196
company,2023-03-29 13:08:00,"Microchip Technology Inc. stock rises Wednesday, outperforms market",119511417,https://images.mktw.net/im-220105/social,MCHP,MarketWatch,"Shares of Microchip Technology Inc. advanced 3.87% to $80.87 Wednesday, on what proved to be an all-around positive trading session for the stock market,...",https://finnhub.io/api/news?id=69fa5ac55d8994801cb4b545293975344a2fb492f802ad41e43599895570c7e9
company,2023-03-29 11:40:03,MCHP or MPWR: Which Is the Better Value Stock Right Now?,119492984,https://media.zenfs.com/en/zacks.com/e8e4b0344809eaac6d73c9fd25fd180a,MCHP,Yahoo,MCHP vs. MPWR: Which Stock Is the Better Value Option?,https://finnhub.io/api/news?id=c7f8b4a1f94d451ab95ba4b15967cbe516c7efe28a517bd0243517edbe1eeb02
company,2023-03-29 09:55:01,Here's Why Microchip Tech (MCHP) Is a Great 'Buy the Bottom' Stock Now,119492985,https://media.zenfs.com/en/zacks.com/21b1f011539d3e31c28282071d344177,MCHP,Yahoo,"Microchip Tech (MCHP) appears to have found support after losing some value lately, as indicated by the formation of a hammer chart. In addition to this technical chart pattern, strong agreement among Wall Street analysts in revising earnings estimates higher enhances the stock's potential for a turnaround in the near term.",https://finnhub.io/api/news?id=bbb9e56289d6983f383982a2ae9b53c3335c84f07b009e6f20cd8ce306032d98
company,2023-03-28 18:15:10,Microchip Technology (MCHP) Gains As Market Dips: What You Should Know,119492986,https://media.zenfs.com/en/zacks.com/d7dcbe11345e3f8e5e71e6827fe3c4c9,MCHP,Yahoo,"In the latest trading session, Microchip Technology (MCHP) closed at $77.86, marking a +0.4% move from the previous day.",https://finnhub.io/api/news?id=becff5724b436f5c0c0ad903a671bcff318ea9263e1830cd530941483f9abe6d
company,2023-03-28 13:08:00,"Microchip Technology Inc. stock rises Tuesday, outperforms market",119511418,https://images.mktw.net/im-220105/social,MCHP,MarketWatch,"Shares of Microchip Technology Inc. inched 0.40% higher to $77.86 Tuesday, on what proved to be an all-around dismal trading session for the stock market,...",https://finnhub.io/api/news?id=73b49029e311ee06bc6f3dbb26fd3ab35dbd592d04101fe690d7ab6878bb6e5c
company,2023-03-28 08:48:00,"Wells Fargo sees Infineon`s increased expectations as positive for NXP, others",119477407,,MCHP,Thefly.com,Looking for stock market analysis and research with proves results? Zacks.com offers in-depth financial research with over 30years of proven results.,https://finnhub.io/api/news?id=f231e17cc26d08f3c76b22309925045ddd7a6db57336cd2fc23d8b26cd8648c5
company,2023-04-04 13:08:00,"Microchip Technology Inc. stock falls Tuesday, underperforms market",119616310,https://images.mktw.net/im-220105/social,MCHP,MarketWatch,"Shares of Microchip Technology Inc. shed 1.29% to $81.64 Tuesday, on what proved to be an all-around dismal trading session for the stock market, with the...",https://finnhub.io/api/news?id=a726e6ed70cbc3dee3859322023af8482fe8dd85d31a12f253c9bc11d2f3b3b9
company,2023-04-04 05:24:09,"The Zacks Analyst Blog Highlights Microchip Technology, DSV and Trane Technologies",119605134,https://media.zenfs.com/en/zacks.com/197b5c2fa3339542af117a4a723e66a2,MCHP,Yahoo,"Microchip Technology, DSV and Trane Technologies are included in this Analyst Blog.",https://finnhub.io/api/news?id=dae0f691c9de580e727c6e3d22f188281aa85ce45352be86072685feaff4672d
company,2023-04-04 00:18:57,Semiconductors Winners And Losers Heading Into Q2 2023,119602750,https://static.seekingalpha.com/cdn/s3/uploads/getty_images/134157706/image_134157706.jpg?io=getty-c-w1536,MCHP,SeekingAlpha,"Semiconductor stocks have outperformed thus far in 2023, probably a lot more than many had expected. Click here for a complete analysis.",https://finnhub.io/api/news?id=4eedb279a8994dfd7989a6057a9647e9b59a29ac308c2f033b6bc9281b633b5b
company,2023-04-03 18:15:10,Microchip Technology (MCHP) Stock Sinks As Market Gains: What You Should Know,119602294,https://media.zenfs.com/en/zacks.com/3cb5117fc22f5e37890d1860dcd61f9f,MCHP,Yahoo,"Microchip Technology (MCHP) closed the most recent trading day at $82.71, moving -1.28% from the previous trading session.",https://finnhub.io/api/news?id=62fceba49d0e7a996b83f107b9d59783adf54e4d871e848faf86e6b9f4ce3652
company,2023-04-03 13:08:00,"Microchip Technology Inc. stock falls Monday, underperforms market",119594229,https://images.mktw.net/im-220105/social,MCHP,MarketWatch,"Shares of Microchip Technology Inc. slipped 1.28% to $82.71 Monday, on what proved to be an all-around favorable trading session for the stock market, with...",https://finnhub.io/api/news?id=a37beb697b933fc532e5c6e1f6d3c8b2865eced10f6ba4591e6e8b0b025b5ae7
company,2023-04-07 01:00:00,10 Blue-Chip Tech Stocks For Growing Dividends,119672061,,MCHP,TalkMarkets,Looking for stock market analysis and research with proves results? Zacks.com offers in-depth financial research with over 30years of proven results.,https://finnhub.io/api/news?id=52018cd7ec01515b008f7163db723b962c05c6aea2a6bceced3d00e1ed0e0892
company,2023-04-06 13:08:00,"Microchip Technology Inc. stock falls Thursday, underperforms market",119675535,https://images.mktw.net/im-220105/social,MCHP,MarketWatch,"Shares of Microchip Technology Inc. slipped 1.03% to $78.70 Thursday, on what proved to be an all-around positive trading session for the stock market, with...",https://finnhub.io/api/news?id=b29352113f7e838009fd4dc32ff227f06cad4f02dd2f3f20528c8c96969dc40b
company,2023-04-06 09:40:01,Here's Why Microchip Technology (MCHP) is a Strong Value Stock,119663553,https://media.zenfs.com/en/zacks.com/e8e4b0344809eaac6d73c9fd25fd180a,MCHP,Yahoo,"Whether you're a value, growth, or momentum investor, finding strong stocks becomes easier with the Zacks Style Scores, a top feature of the Zacks Premium research service.",https://finnhub.io/api/news?id=50d8b25c2d65ba144ce2723759affcf738463bc5b3a638661ea366e1d5a5e442
company,2023-04-06 07:32:00,Micron leads chips higher as selling eases in holiday-shortened week,119652573,,MCHP,Seeking Alpha,Looking for stock market analysis and research with proves results? Zacks.com offers in-depth financial research with over 30years of proven results.,https://finnhub.io/api/news?id=dac5c44396b6ce1434a7c1735ed5bf7e43468c0c3e778e69ebdf19d2d035953f
company,2023-04-05 13:08:00,"Microchip Technology Inc. stock falls Wednesday, underperforms market",119656841,https://images.mktw.net/im-220105/social,MCHP,MarketWatch,"Shares of Microchip Technology Inc. slipped 2.60% to $79.52 Wednesday, on what proved to be an all-around mixed trading session for the stock market, with...",https://finnhub.io/api/news?id=2d5928d765ac3f27df680658a3367219afaf4d429dfbfeb654a719e7faac4d7f
company,2023-04-05 07:02:00,"EU to likely strike agreement on Chips Act on April 18, Reuters reports",119632374,,MCHP,Thefly.com,Looking for stock market analysis and research with proves results? Zacks.com offers in-depth financial research with over 30years of proven results.,https://finnhub.io/api/news?id=56b587cef80988badf7a18a84d0178071b9dfb2b37dd084568982a61c7adb520
company,2023-04-12 13:08:00,"Microchip Technology Inc. stock falls Wednesday, underperforms market",119755196,https://images.mktw.net/im-220105/social,MCHP,MarketWatch,"Shares of Microchip Technology Inc. shed 1.64% to $79.23 Wednesday, on what proved to be an all-around dismal trading session for the stock market, with the...",https://finnhub.io/api/news?id=52024b2031bd836dd9921f1e0042bcdc5f6845bd6589158086c0a8c096071785
company,2023-04-11 17:50:09,Microchip Technology (MCHP) Trades Flat On The Day: What You Should Know,119777860,https://media.zenfs.com/en/zacks.com/090f58c1efbe3555b861102525e50b39,MCHP,Yahoo,"Microchip Technology (MCHP) closed at $80.55 in the latest trading session, marking no change from the prior day.",https://finnhub.io/api/news?id=bf873fe22e63e1c9d5bdbad6afab9c0e49770f6665adadc3e765526232a3c5ef
company,2023-04-11 09:22:01,"The Zacks Analyst Blog Highlights STMicroelectronics, Microchip Technology, Analog Devices and Lam Research",119738434,https://media.zenfs.com/en/zacks.com/d0dedfeffc5b33885ead2445f0f3881c,MCHP,Yahoo,"STMicroelectronics, Microchip Technology, Analog Devices and Lam Research are part of the Zacks top Analyst Blog.",https://finnhub.io/api/news?id=d452ce08c9191f92d1192161237190970b763172302dffe67b0154d5a2407f83
company,2023-04-11 03:27:00,Global semiconductor sales down ~21% Y/Y in February 2023 - report,119719277,,MCHP,Seeking Alpha,Looking for stock market analysis and research with proves results? Zacks.com offers in-depth financial research with over 30years of proven results.,https://finnhub.io/api/news?id=2db11d4273ec0219a9957a2ea74a9702a60549ab062f8052274737668ef776e3
company,2023-04-11 03:21:00,Global semiconductor sales down ~21% Y/Y in February - report,119719278,,MCHP,Seeking Alpha,Looking for stock market analysis and research with proves results? Zacks.com offers in-depth financial research with over 30years of proven results.,https://finnhub.io/api/news?id=5cd5609fdf35f5194d1fed09539dfffad913d558a65370eb14c0b8e649f5818d
company,2023-04-11 00:09:00,"Microchip Technology Inc. stock remains steady Tuesday, still outperforms market",119730260,,MCHP,MarketWatch,Looking for stock market analysis and research with proves results? Zacks.com offers in-depth financial research with over 30years of proven results.,https://finnhub.io/api/news?id=eb2a4d15ae5b69f7f0e8aa0c2dad3e164005a3567a497fa4461bd07f895c8f17
company,2023-04-10 10:37:02,4 Semiconductor Stocks to Buy Amid Market Volatility,119709703,https://media.zenfs.com/en/zacks.com/a37bf1952483e0b1b3ad5c99eff1e8e8,MCHP,Yahoo,"Here we discuss four semiconductor stocks, namely STMicroelectronics (STM), Microchip Technology (MCHP), Analog Devices (ADI) and Lam Research Corporation (LRCX), which boast strong growth potential.",https://finnhub.io/api/news?id=10c9014bebf59b27644f09f81aba1fdd3996a9dd26cc132020124780076b1786
company,2023-04-10 08:44:12,5 Semiconductor Stock to Buy to Enhance Your Portfolio,119709704,https://media.zenfs.com/en/zacks.com/5663e6dec41541a697d4a8423c547a43,MCHP,Yahoo,"We have narrowed our search to five semiconductor manufacturers. These are: LRCX, MCHP, ADI, MTSI and STM.",https://finnhub.io/api/news?id=f10d9ec988e3b1bf456239c72899c97c9f65bf983229477d8bf9a1264589139e
company,2023-04-10 00:09:00,"Microchip Technology Inc. stock rises Monday, outperforms market",119720546,,MCHP,MarketWatch,Looking for stock market analysis and research with proves results? Zacks.com offers in-depth financial research with over 30years of proven results.,https://finnhub.io/api/news?id=61809458162dec998a9c497fe6a7833787470ca5969fc6c5f9b300ad691e0461
company,2023-04-14 13:08:00,"Microchip Technology Inc. stock falls Friday, underperforms market",119765113,https://images.mktw.net/im-220105/social,MCHP,MarketWatch,"Shares of Microchip Technology Inc. sank 0.75% to $79.53 Friday, on what proved to be an all-around dismal trading session for the stock market, with the S&P...",https://finnhub.io/api/news?id=58af9db324df6ec1944694939dfcb3a7a8e272f873c777caa9c0c33c66e3bb2b
company,2023-04-13 13:08:00,"Microchip Technology Inc. stock rises Thursday, still underperforms market",119755195,https://images.mktw.net/im-220105/social,MCHP,MarketWatch,"Shares of Microchip Technology Inc. rallied 1.14% to $80.13 Thursday, on what proved to be an all-around great trading session for the stock market, with the...",https://finnhub.io/api/news?id=e8173d6416637fdde0647e85748141ee7f841303115cf62fd2d26359ac160b70
company,2023-04-20 17:10:00,Microchip Technology Announces Promotion of Rich Simoncic to Executive Vice President,119858045,https://media.zenfs.com/en/globenewswire.com/e48b0ed5b81579831415fc492414749c,MCHP,Yahoo,"CHANDLER, Ariz., April 20, 2023 (GLOBE NEWSWIRE) -- Microchip Technology Inc. (Nasdaq: MCHP), a leading provider of smart, connected and secure embedded control solutions, today announced that its board of directors has promoted Rich Simoncic to Executive Vice President of Microchip. Simoncic started his business career as a new college graduate at Microchip in 1989, and has had progressively increasing development, operational and business unit responsibilities. He founded the analog business a",https://finnhub.io/api/news?id=122ff4eebe728aa4c622a9a0b9dbeb6aeacd1a3dfae735f3884987bca567cdcb
company,2023-04-20 13:08:00,"Microchip Technology Inc. stock falls Thursday, underperforms market",119846765,https://images.mktw.net/im-220105/social,MCHP,MarketWatch,"Shares of Microchip Technology Inc. slipped 2.37% to $77.50 Thursday, on what proved to be an all-around dismal trading session for the stock market, with...",https://finnhub.io/api/news?id=b31c10b026dffdfaeffd8dfa20569ee735024e746f3fca165afc3bd4b2dca070
company,2023-04-19 13:08:00,"Microchip Technology Inc. stock falls Wednesday, underperforms market",119846766,https://images.mktw.net/im-220105/social,MCHP,MarketWatch,"Shares of Microchip Technology Inc. slid 1.72% to $79.38 Wednesday, on what proved to be an all-around dismal trading session for the stock market, with the...",https://finnhub.io/api/news?id=ea763aa0a5f6a9f75b2e36a4948b036fa4b73e9ac0d2d3ce30f8a7045b5c38fc
