category,datetime,headline,id,image,related,source,summary,url
company,2022-09-23 15:10:15,4 Consumer Staples Stocks To Watch In The Stock Market Now,116219264,https://u3j7m9h7.rocketcdn.me/wp-content/uploads/2022/09/consumer-staples-stocks-1.jpg,MDLZ,StockMarket,Do these consumer staples stocks deserve a spot on your watchlist today?,https://finnhub.io/api/news?id=a3ccf0673c1b735cc39e5abfbca1a51f05b43e11ad292c52ca1a6754802231ed
company,2022-09-23 13:07:00,Mondelez International Inc. Cl A stock outperforms market despite losses on the day,116242572,https://images.mktw.net/im-220105/social,MDLZ,MarketWatch,"Shares of Mondelez International Inc. Cl A slid 1.42% to $58.95 Friday, on what proved to be an all-around rough trading session for the stock market, with...",https://finnhub.io/api/news?id=9c089e089e777bd483cb29bd0940030ad7238115c461043814a5796f517c34f9
company,2022-09-23 10:00:22,"An Intrinsic Calculation For Mondelez International, Inc. (NASDAQ:MDLZ) Suggests It's 44% Undervalued",116225516,https://s.yimg.com/uu/api/res/1.2/2PvBHvH77Ye.pw4O2mVV8A--~B/aD00MzI7dz0xMTk0O2FwcGlkPXl0YWNoeW9u/https://media.zenfs.com/en/simply_wall_st__316/1755b5a339fe0d610102dcc34fddba34,MDLZ,Yahoo,"Does the September share price for Mondelez International, Inc. ( NASDAQ:MDLZ ) reflect what it's really worth? Today...",https://finnhub.io/api/news?id=c54641174aaf2afbe17151f2aee55490ea9bb094af7389bf25294d44fed21bc9
company,2022-09-28 13:07:00,"Mondelez International Inc. Cl A stock rises Wednesday, still underperforms market",116348120,https://images.mktw.net/im-220105/social,MDLZ,MarketWatch,"Shares of Mondelez International Inc. Cl A inched 0.97% higher to $58.14 Wednesday, on what proved to be an all-around great trading session for the stock...",https://finnhub.io/api/news?id=a073edddc3b1ed24251e0c51fe9e02d103bc587bd530a5203891e73685615464
company,2022-09-28 04:13:00,Catch these Stocks Before their Ex-Dividend Dates Arrive,116306150,https://blog.tipranks.com/wp-content/uploads/2022/09/shutterstock_520763020-750x406.jpg,MDLZ,TipRanks,Investors looking for stocks that give dividends still have a chance to buy these eight stocks before their ex-dividend dates. An added bonus is that all of these s...,https://finnhub.io/api/news?id=e6ea112e462749954bbec00ae39006ba3459371c609c9f889615ac45149edfa4
company,2022-09-27 16:59:37,11 Best Consumer Stocks To Buy Now,116288687,https://s.yimg.com/uu/api/res/1.2/A0ZH1ZdSpICoT_MImKYhFA--~B/aD00MTc7dz02MjY7YXBwaWQ9eXRhY2h5b24-/https://media.zenfs.com/en/insidermonkey.com/7fd157f5ea9919a8923d5a3b14e5d1de,MDLZ,Yahoo,"In this article, we will take a look at the 11 best consumer stocks to buy now. You can skip our detailed analysis of the consumer industry’s outlook for 2022, and go directly to the 5 Best Consumer Stocks to Buy Now. Consumer staples are the essential items that people purchase to sustain their daily […]",https://finnhub.io/api/news?id=fcfb61db18fdb006f3fdf209f1ec25fddc60cd7da85c8d93aa0e0227c2977cb3
company,2022-09-27 13:07:00,Mondelez International Inc. Cl A stock underperforms Tuesday when compared to competitors,116348121,https://images.mktw.net/im-220105/social,MDLZ,MarketWatch,"Shares of Mondelez International Inc. Cl A slipped 1.32% to $57.58 Tuesday, on what proved to be an all-around grim trading session for the stock market,...",https://finnhub.io/api/news?id=40a5706ba6b49b19bd72d68caadcca7501f4519c68c8d0cb067b47a536b8a012
company,2022-09-27 08:00:15,"Insiders probably made the right decision selling US$12m worth of shares earlier this year as Mondelez International, Inc.'s (NASDAQ:MDLZ)) stock dips by 3.4%.",116292567,https://s.yimg.com/uu/api/res/1.2/2PvBHvH77Ye.pw4O2mVV8A--~B/aD00MzI7dz0xMTk0O2FwcGlkPXl0YWNoeW9u/https://media.zenfs.com/en/simply_wall_st__316/1755b5a339fe0d610102dcc34fddba34,MDLZ,Yahoo,"Over the past year, insiders sold US$12m worth of Mondelez International, Inc. ( NASDAQ:MDLZ ) stock at an average...",https://finnhub.io/api/news?id=d45915a0da61efbb9a9c1d70de16b41e50232ae198d3cfc57f291ab2d4abf3b1
company,2022-09-27 04:57:00,"Ex-Dividend Reminder: Mondelez International, Keurig Dr Pepper and Willis Towers Watson Public",116309811,,MDLZ,Dividend Channel,"dividend channel,MDLZ,KDP,WTW,",https://finnhub.io/api/news?id=b631211ddafd639362a7f8c32922acad274cd7d38eafe0842383412a0238722c
company,2022-09-26 23:05:00,Mondelez International Becomes Oversold,116309812,,MDLZ,Dividend Channel,"dividend channel,MDLZ,",https://finnhub.io/api/news?id=be5d48dbc55939da3bda927939a73efabe05e0be8e753937ac1753a4d37caf2f
company,2022-09-26 13:07:00,"Mondelez International Inc. Cl A stock falls Monday, still outperforms market",116348122,https://images.mktw.net/im-220105/social,MDLZ,MarketWatch,"Shares of Mondelez International Inc. Cl A slid 1.02% to $58.35 Monday, on what proved to be an all-around rough trading session for the stock market, with...",https://finnhub.io/api/news?id=2c969f97973272731e95e1c779bf2207724a8070c6445b61598da6d6dc941328
company,2022-09-24 20:55:10,"Dividend Champion, Contender, And Challenger Highlights: Week Of September 25",116239457,https://static.seekingalpha.com/cdn/s3/uploads/getty_images/1072593728/image_1072593728.jpg?io=getty-c-w750,MDLZ,SeekingAlpha,"Weekly summary of dividend activity for Dividend Champions, Contenders, Challengers. Click here to see companies with upcoming ex-dividend dates and pay dates.",https://finnhub.io/api/news?id=ed079c68aa87337b42b4c7ce59fafa66ac60a64393e5e163cb73b5994dae73a7
company,2022-10-01 09:00:19,"As Mondelez International, Inc.'s (NASDAQ:MDLZ)) market cap dropped by US$5.6b, insiders who sold US$12m worth of stock were able to offset their losses",116371004,https://s.yimg.com/uu/api/res/1.2/2PvBHvH77Ye.pw4O2mVV8A--~B/aD00MzI7dz0xMTk0O2FwcGlkPXl0YWNoeW9u/https://media.zenfs.com/en/simply_wall_st__316/1755b5a339fe0d610102dcc34fddba34,MDLZ,Yahoo,"Insiders at Mondelez International, Inc. ( NASDAQ:MDLZ ) sold US$12m worth of stock at an average price of US$63.66 a...",https://finnhub.io/api/news?id=4e248f33473c01066977a89ad2619e7d70dcc6cd552e13128d0bee4e72b854c7
company,2022-09-30 21:08:00,A Strong Dollar Spells Trouble for Some U.S. Companies,116367210,https://s.yimg.com/ny/api/res/1.2/PJ6EJ.PUI8qSdWpivtWwHQ--/YXBwaWQ9aGlnaGxhbmRlcjt3PTEyMDA7aD02MDA-/https://media.zenfs.com/en/Barrons.com/3fd772735b769d1c44eae9effa018389,MDLZ,Yahoo,"A surging U.S. dollar is a challenge for companies that rely heavily on overseas sales, such as Mondelez International and Booking Holdings.",https://finnhub.io/api/news?id=efae6ee7877ce20384cb1b8135079241043f8bcc3cd14b7e8176e516e9e4927f
company,2022-09-29 13:08:00,"Mondelez International Inc. Cl A stock falls Thursday, still outperforms market",116348118,https://images.mktw.net/im-220105/social,MDLZ,MarketWatch,"Shares of Mondelez International Inc. Cl A slipped 1.88% to $56.67 Thursday, on what proved to be an all-around poor trading session for the stock market,...",https://finnhub.io/api/news?id=11066ae1051345ba0479276eeedcbdf44c272ee9086ab1cf6911eb1b1abb49e0
company,2022-09-29 02:15:00,The Strong Dollar Could Ruin Earnings Season for These Companies,116320080,,MDLZ,Yahoo,The U.S. Dollar Index is up by just over 18% since the start of the year. Some companies are more at risk than others.,https://finnhub.io/api/news?id=d88dee1da060e9c82d642b9fc4203872fd31a4ba0ebdb5505f68f7dc41dd9d2a
company,2022-10-06 16:05:00,"Mondelēz International Celebrates 10th Anniversary, Reaffirms Long-Term Growth Strategy",116512906,https://s.yimg.com/uu/api/res/1.2/vCw.s6MBR93_dYrEgbh6fw--~B/aD05MDt3PTIxODthcHBpZD15dGFjaHlvbg--/https://media.zenfs.com/en/globenewswire.com/9ff7ecd56567d2f5831f3022e36d6000,MDLZ,Yahoo,"“Vision 2030” strategy emphasizes growth acceleration and portfolio focusGlobal Purpose Day events reinforce employee commitment to “empowering people to snack right”Chairman and CEO Dirk Van de Put rings Nasdaq Closing Bell CHICAGO, Oct. 06, 2022 (GLOBE NEWSWIRE) -- Mondelēz International (Nasdaq: MDLZ) today celebrated its 10th anniversary with a global, enterprise-wide recommitment to its Purpose of empowering people to snack right. Entering its second decade, the company is well positioned t",https://finnhub.io/api/news?id=0586b7ba24ae4bf6590eafcc52115894759ed3cff01152a1b1b82323eb8201ff
company,2022-10-06 11:42:20,"Food seems to be relatively unscathed by pullback in consumer spending, says Mondelēz CEO",116507618,https://image.cnbcfm.com/api/v1/image/107130577-16650845681665084566-25858068431-1080pnbcnews.jpg?v=1665085340&w=1920&h=1080,MDLZ,CNBC,"Dirk Van de Put, Mondelēz International CEO, joins 'Power Lunch' to discuss the state of the consumer from his vantage point, whether consumers are trading down to private label brands and insight into the snacking company's costs next year.",https://finnhub.io/api/news?id=9a88c431c5ee1897217c101df87193e63a08d5366bcac122f38a302c92e9bb20
company,2022-10-06 07:12:00,MDLZ November 25th Options Begin Trading,116507193,,MDLZ,Stock Options Channel,"Staff article entitled MDLZ November 25th Options Begin Trading, about stock options, from Stock Options Channel.",https://finnhub.io/api/news?id=22469f3066e419a6b09391ea141c6ad58e80bea2a77f977a8e94e1b5f01d2fa2
company,2022-10-05 21:01:00,Greenfield Savings Bank Buys 1 - GuruFocus.com,116505692,https://static.gurufocus.com/images/logo_global.png,MDLZ,GuruFocus,GuruFocus Article or News written by insider and the topic is about: ,https://finnhub.io/api/news?id=3abd551a2384eda1b2996d69a853949f9d358c604ab9166dd531713428d296c3
company,2022-10-05 08:00:56,"Insiders at Mondelez International, Inc. (NASDAQ:MDLZ) sold US$12m worth of stock, possibly indicating weakness in the future",116465980,https://s.yimg.com/uu/api/res/1.2/2PvBHvH77Ye.pw4O2mVV8A--~B/aD00MzI7dz0xMTk0O2FwcGlkPXl0YWNoeW9u/https://media.zenfs.com/en/simply_wall_st__316/1755b5a339fe0d610102dcc34fddba34,MDLZ,Yahoo,"Many Mondelez International, Inc. ( NASDAQ:MDLZ ) insiders ditched their stock over the past year, which may be of...",https://finnhub.io/api/news?id=11fa50bb81a583f2d57b75e0ee802bc96004b711cda1d83a6e15fdddcfe397cc
company,2022-10-04 19:43:20,Tracking Mario Gabelli's Gabelli Funds 13F Portfolio - Q2 2022 Update,116441484,https://static.seekingalpha.com/cdn/s3/uploads/getty_images/866307764/image_866307764.jpg?io=getty-c-w750,MDLZ,SeekingAlpha,Mario Gabelli's 13F portfolio value decreased from $15.22B to $13.02B this quarter. Click here to read more about Gabelli Funds' holdings and trades for Q2 2022.,https://finnhub.io/api/news?id=cb47b278b66e97d24dc500d31b4bc3b1b720321a43d063e87ba45ffc24dfc1fd
company,2022-10-03 06:15:55,7 Consumer Stocks to Buy for Growth and Dividends,116502245,https://s.yimg.com/uu/api/res/1.2/Jxn7FjlkTn97DVJESqV0ow--~B/aD00MDA7dz03Mjg7YXBwaWQ9eXRhY2h5b24-/https://media.zenfs.com/en/investorplace_417/41db46c17759661196271719141b2309,MDLZ,Yahoo,"This year’s market downturn has been brutal, even for steadier, less speculative stocks. With little sign concerns like inflation, interest rates, and a possible recession aren’t going away anytime soon, this trend could carry on in the months ahead. However, there is a silver lining. The 2022 bear market has created great opportunities among consumer stocks to buy. Pushed down to attractive valuations, and now sporting higher dividend yields, these stocks could provide solid long-term returns,",https://finnhub.io/api/news?id=a59a38ddc0679dd30d6febed8a649037f389a0976aafc4900bff07af720195f5
company,2022-10-10 10:56:21,Why Investors Should Never Purchase Mortgage REITs,116577629,https://static.seekingalpha.com/cdn/s3/uploads/getty_images/1340063616/image_1340063616.jpg?io=getty-c-w750,MDLZ,SeekingAlpha,"High fees, too much leverage and overpaying dividends based on faulty ânon-GAAPâ operating results are endemic to Mortgage REITs. See why you should sell them.",https://finnhub.io/api/news?id=c32a48dbfff4e1737e0162377698165ed0c2635255fe2c8f0ea4960d5ab84a1f
company,2022-10-10 09:14:00,"Kraft Heinz Stock Is Still a Haven as Consumer Staples Stumble, Says Goldman",116592710,https://images.barrons.com/im-640457/social,MDLZ,MarketWatch,"Analyst Jason English upgraded packaged-foods giant Kraft Heinz to Buy from Neutral, and lifted the price target to $43 from $37.",https://finnhub.io/api/news?id=200876ce29cec7a3dd8c816d3b4530c03530cd5277e224790b51d8911b193d47
company,2022-10-10 07:48:00,Goldman Sachs Sticks to Its Buy Rating for Mondelez International (MDLZ),116588882,,MDLZ,TipRanks,Goldman Sachs analyst Jason English maintained a Buy rating on Mondelez International (MDLZ &#8211; Research Report) today and set a price target of $65.00. The com...,https://finnhub.io/api/news?id=f25032c918de8c74db203e4af53e19339485d6f7b9d02d6566ef38a446c4e999
company,2022-10-10 06:00:07,"Mondelez: Richly Valued, But Still A Solid Income Investment",116572120,https://static.seekingalpha.com/cdn/s3/uploads/getty_images/1410106638/image_1410106638.jpg?io=getty-c-w750,MDLZ,SeekingAlpha,Mondelez is a very strong business and has been effective at offsetting inflation with price increases. Read my analysis of the MDLZ stock here.,https://finnhub.io/api/news?id=109f064208726ca21d0b5e4da8d20465ba34fa086d3c3425d47e4f2f65fdec11
company,2022-10-09 08:01:08,Mondelez International (NASDAQ:MDLZ) Shareholders Will Want The ROCE Trajectory To Continue,116578667,https://s.yimg.com/uu/api/res/1.2/2PvBHvH77Ye.pw4O2mVV8A--~B/aD00MzI7dz0xMTk0O2FwcGlkPXl0YWNoeW9u/https://media.zenfs.com/en/simply_wall_st__316/1755b5a339fe0d610102dcc34fddba34,MDLZ,Yahoo,"To find a multi-bagger stock, what are the underlying trends we should look for in a business? In a perfect world, we'd...",https://finnhub.io/api/news?id=3d4de79902237221cecb4913e38f13225d402137d32f578db43cf55ca28bbf42
company,2022-10-08 20:28:01,"Dividend Champion, Contender, And Challenger Highlights: Week Of October 9",116560180,https://static.seekingalpha.com/cdn/s3/uploads/getty_images/1072593728/image_1072593728.jpg?io=getty-c-w750,MDLZ,SeekingAlpha,"Weekly summary of dividend activity for Dividend Champions, Contenders, Challengers. Check out the companies with upcoming ex-dividend dates and upcoming pay dates.",https://finnhub.io/api/news?id=1ec3e534a6b263f9050c31442f5981842477e34414ae82ed5a1054f3ed5f15d9
company,2022-10-07 12:20:00,Mondelēz Snacking Made Right Report: Environmental Resilience,116539755,https://s.yimg.com/uu/api/res/1.2/b8u5lvngeFqlIJTKe9fb4w--~B/aD00NTU7dz02NTA7YXBwaWQ9eXRhY2h5b24-/https://media.zenfs.com/en/accesswire.ca/811faeec3a36f1788fa42cfaba0524ad,MDLZ,Yahoo,"NORTHAMPTON, MA / ACCESSWIRE / October 7, 2022 / Mondelēz International Environmental Resilience By tackling deforestation, we are helping to combat climate change and promoting sustainable supply of key ingredients. Forests Progress2018201920202021Economic ...",https://finnhub.io/api/news?id=97d33f0415173e1c8c570687b59e368637d3545db5d25804485d82ae193dd9a9
company,2022-10-07 01:01:00,Top 5 3rd Quarter Trades of Co - GuruFocus.com,116537429,https://static.gurufocus.com/images/logo_global.png,MDLZ,GuruFocus,GuruFocus Article or News written by insider and the topic is about: ,https://finnhub.io/api/news?id=a4df9a5eafb5a49f81932985dfb5502ff61dc085a6615521fc18ea291fedfe9d
company,2022-10-06 21:01:00,Top 5 3rd Quarter Trades of Mu - GuruFocus.com,116531261,https://static.gurufocus.com/images/logo_global.png,MDLZ,GuruFocus,GuruFocus Article or News written by insider and the topic is about: ,https://finnhub.io/api/news?id=c3e6b0ba7bd0584285ad0c794f6fa2e54976a2944a3f0b1afc6e9d1ba10d2eb7
company,2022-10-14 13:08:00,Mondelez International Inc. Cl A stock underperforms Friday when compared to competitors,116709072,https://images.mktw.net/im-220105/social,MDLZ,MarketWatch,"Shares of Mondelez International Inc. Cl A slipped 1.28% to $56.94 Friday, on what proved to be an all-around poor trading session for the stock market, with...",https://finnhub.io/api/news?id=28b0f7d92f65056af2cd77a12093dfef3d93abff07b3a0a8b153e1064253f1c7
company,2022-10-14 04:48:00,Analysts Offer Insights on Consumer Goods Companies: The Estée Lauder Companies (EL) and Mondelez International (MDLZ),116665550,,MDLZ,TipRanks,There&#8217;s a lot to be optimistic about in the Consumer Goods sector as 2 analysts just weighed in on The Estée Lauder Companies (<span class='tr-stock-ticker' s...,https://finnhub.io/api/news?id=15056522d36737091088542c8b3c6a34989b7817a57b727fff342045d4c85fa0
company,2022-10-14 04:10:00,Mondelez price target lowered to $63 from $70 at Morgan Stanley,116645603,https://thefly.com/images/meta/streetresearch_recommendations.jpg,MDLZ,Thefly.com,Morgan Stanley analyst Pa... MDLZ,https://finnhub.io/api/news?id=257c07016ba61754480b47bab95f05e200ddaed4fb7c47402f3e894921fb4bad
company,2022-10-14 03:33:00,"Analysts Offer Insights on Consumer Goods Companies: Simply Good Foods (SMPL), Walgreens Boots Alliance (WBA) and Mondelez International (MDLZ)",116640876,,MDLZ,TipRanks,Analysts have been eager to weigh in on the Consumer Goods sector with new ratings on Simply Good Foods (<span class='tr-stock-ticker' style='color:blue; font-weigh...,https://finnhub.io/api/news?id=c86c8e7c60eabd87f3d54a4b898ce1e82532ad8e8b8a6a169365a9ff22bc0428
company,2022-10-13 13:08:00,"Mondelez International Inc. Cl A stock rises Thursday, still underperforms market",116709073,https://images.mktw.net/im-220105/social,MDLZ,MarketWatch,"Shares of Mondelez International Inc. Cl A rose 1.50% to $57.68 Thursday, on what proved to be an all-around positive trading session for the stock market,...",https://finnhub.io/api/news?id=6291a846ef223e55022cfb186b17eccbc116a50385239e2df5118c9b3218d6dc
company,2022-10-13 11:40:03,CAG or MDLZ: Which Is the Better Value Stock Right Now?,116633171,https://s.yimg.com/uu/api/res/1.2/5w_iAw5naBqMPrzpIECi9Q--~B/aD02NzU7dz05MDA7YXBwaWQ9eXRhY2h5b24-/https://media.zenfs.com/en/zacks.com/670d1917693293f70179651625deb88f,MDLZ,Yahoo,CAG vs. MDLZ: Which Stock Is the Better Value Option?,https://finnhub.io/api/news?id=160f69689cbffa051cf01c40d7265e72ddedd51928184e9074f8e6579952fc74
company,2022-10-13 09:10:00,Mondelēz Snacking Made Right Report: Waste & Water,116633172,https://s.yimg.com/uu/api/res/1.2/R.L2n_No6sodid3hRfMJQg--~B/aD0zMTY7dz02NTA7YXBwaWQ9eXRhY2h5b24-/https://media.zenfs.com/en/accesswire.ca/69f3fca016ec04255f7ea9f385bf179b,MDLZ,Yahoo,"NORTHAMPTON, MA / ACCESSWIRE / October 13, 2022 / Mondelēz International Waste We continue to reduce waste where we can, to help the climate and the environment and to increase our operational efficiency. We drive out waste as we drive for excellence. ...",https://finnhub.io/api/news?id=07f27fa5927981978b7fcaf1bc8d3fa0f2065a57e3d040687c153fa83aba0504
company,2022-10-13 09:05:00,"Mondelēz International to Report Q3 2022 Financial Results on November 1, 2022",116633173,https://s.yimg.com/uu/api/res/1.2/vCw.s6MBR93_dYrEgbh6fw--~B/aD05MDt3PTIxODthcHBpZD15dGFjaHlvbg--/https://media.zenfs.com/en/globenewswire.com/9ff7ecd56567d2f5831f3022e36d6000,MDLZ,Yahoo,"CHICAGO, Oct. 13, 2022 (GLOBE NEWSWIRE) -- Mondelēz International, Inc. (Nasdaq: MDLZ) will release its third quarter 2022 financial results on Tuesday, November 1, 2022 at 4:05 p.m. ET and will host a conference call at 5:00 p.m. ET that day. Investors and analysts may participate via phone by calling 800-579-2543 from the United States and 785-424-1789 from other locations. To ensure timely access, participants should dial in approximately 10 minutes before the call starts. A listen-only webca",https://finnhub.io/api/news?id=d568bfaec502d00fbe582241ebaf97865f0939bbb36a7c5396160c8c91535ea3
company,2022-10-13 09:00:32,"Mondelez International, Inc.'s (NASDAQ:MDLZ) Fundamentals Look Pretty Strong: Could The Market Be Wrong About The Stock?",116633174,https://s.yimg.com/uu/api/res/1.2/2PvBHvH77Ye.pw4O2mVV8A--~B/aD00MzI7dz0xMTk0O2FwcGlkPXl0YWNoeW9u/https://media.zenfs.com/en/simply_wall_st__316/1755b5a339fe0d610102dcc34fddba34,MDLZ,Yahoo,"It is hard to get excited after looking at Mondelez International's (NASDAQ:MDLZ) recent performance, when its stock...",https://finnhub.io/api/news?id=66d4b8677d23d7df3e2abe3096513646f3861675366a87ebac22aba07dcb4c92
company,2022-10-13 09:00:04,Influencers with Andy Serwer: Dirk Van de Put,116633175,https://s.yimg.com/ny/api/res/1.2/90VevcmJZxTkbDMXyWvEtw--/YXBwaWQ9aGlnaGxhbmRlcjt3PTEyMDA7aD02NzQ-/https://s.yimg.com/os/creatr-uploaded-images/2022-10/3c5d83e0-4a64-11ed-bffd-989db335d26c,MDLZ,Yahoo,"In this episode of Influencers, Andy sits down with Mondelez International CEO Dirk Van de Put to discuss the state of the food & beverage industry, the part inflation has played in growth, and how he is navigating geopolitical issues.",https://finnhub.io/api/news?id=2bf49828a5d213c7d6c26182cd1c9eb6d2d0dedca9520b2c879f648b3dc5cbfb
company,2022-10-13 08:11:00,Interesting MDLZ Put And Call Options For December 2nd,116645605,,MDLZ,Stock Options Channel,"Staff article entitled Interesting MDLZ Put And Call Options For December 2nd, about stock options, from Stock Options Channel.",https://finnhub.io/api/news?id=5c49bfa1f53328c9f8ebc42b4b5ee67e41db2dba8a2b48de07b071be86cebde7
company,2022-10-12 15:24:06,Stocks To Invest In Right Now? 3 Consumer Staples Stocks To Know,116612396,https://u3j7m9h7.rocketcdn.me/wp-content/uploads/2022/10/stocks-to-invest-in-right-now-consumer-staples-stocks.jpg,MDLZ,StockMarket,Are these the top consumer staples stocks to invest in right now?,https://finnhub.io/api/news?id=405abf2fa8cfcae547a401d34fd844b3bf1c3b0c7874facdc162933d1adb2182
company,2022-10-12 13:08:00,Mondelez International Inc. Cl A stock outperforms market on strong trading day,116709074,https://images.mktw.net/im-220105/social,MDLZ,MarketWatch,"Shares of Mondelez International Inc. Cl A inched 0.98% higher to $56.83 Wednesday, on what proved to be an all-around rough trading session for the stock...",https://finnhub.io/api/news?id=3d220d63e012c4a6e62b9b3eb598a421a8dff64b88d4d93ca00b5a473c3fa90e
company,2022-10-11 09:05:00,Mondelēz International Celebrates 130th Anniversary of Historic Toledo Flour Mill; Milestone Honored with Recognition from Ohio Congressional and State Officials,116604595,https://s.yimg.com/uu/api/res/1.2/DgpcJXyIPlq2AmAjkDCIZQ--~B/aD00MzQ7dz02NjA7YXBwaWQ9eXRhY2h5b24-/https://media.zenfs.com/en/globenewswire.com/610b9876bfae9e9d3f502036ca151f9c,MDLZ,Yahoo,"Celebration recognizes Mill employees who supply flour for consumer-favorite snacks Mondelēz International Toledo Mill Celebration Mondelēz International marked the 130th anniversary of its Biscuit Flour Mill in Toledo, Ohio with a ceremony on Saturday, October 8, 2022, that highlighted the important role the Mill plays as a part of Mondelēz International’s U.S. snacking supply chain. Pictured from right to left, Dee Lewis, Plant Lead at Mondelēz International’s Toledo Flour Mill, and Claudio Pa",https://finnhub.io/api/news?id=00f907a592edf481f85081db7faea4d6ec52f59c3a614217ee8f36b88140518f
company,2022-10-11 04:17:00,Home - The Fly,116588881,https://thefly.com/images/meta/metatags.jpg,MDLZ,Thefly.com,The Fly is a leading digital publisher of real-time financial news. The Fly team scours all sources of company news and delivers short-form stories consisting of only market moving content.,https://finnhub.io/api/news?id=0c8dd9fbec3f28eb0ef4c758b31b919898675ce1ed9bed7b75ba751084f89da7
company,2022-10-18 14:17:35,"Credit Suisse Believes FX, Economic Uncertainty In Europe Pose Risk For Mondelez",116713704,https://s.yimg.com/uu/api/res/1.2/IxU7mMknkA24VYM_Qede9Q--~B/aD00MDA7dz02MDA7YXBwaWQ9eXRhY2h5b24-/https://media.zenfs.com/en/Benzinga/e5f06db4bf83efede773071e63b2cc23,MDLZ,Yahoo,"Credit Suisse analyst Robert Moskow reiterated an Outperform rating on the shares of Mondelez International Inc (NASDAQ: MDLZ) and lowered the price target to $67 from $70. The analyst finds it difficult to reconcile company management's positive tone with the challenging economic developments unfolding in Europe. Meanwhile, the analyst raised topline growth to 9% because management indicates that elasticities have held up better than the conservative assumptions they provided in their 2H guidan",https://finnhub.io/api/news?id=a62be34714df7a3bbf96b30b92cf94fd7e7810b11a863a108ed6b2c5f5806562
company,2022-10-18 13:08:00,Mondelez International Inc. Cl A stock outperforms competitors on strong trading day,116709070,https://images.mktw.net/im-220105/social,MDLZ,MarketWatch,"Shares of Mondelez International Inc. Cl A rose 1.58% to $58.35 Tuesday, on what proved to be an all-around positive trading session for the stock market,...",https://finnhub.io/api/news?id=f455c1a0b29948ccb6009e96a372f304ade6440425596e9a7b441b77c6045b85
company,2022-10-18 09:51:05,10 Best Food Stocks to Buy Now,116697702,https://s.yimg.com/uu/api/res/1.2/V.B3Vu8_MWBmfv6QG8R24g--~B/aD00MjY7dz02NDA7YXBwaWQ9eXRhY2h5b24-/https://media.zenfs.com/en/insidermonkey.com/73f8b4e02d9c4027c5645ac87a714486,MDLZ,Yahoo,"In this article we present the list of 10 Best Food Stocks to Buy Now. Click to skip ahead and see the 5 Best Food Stocks to Buy Now. The Hershey Company (NYSE:HSY), Mondelez International, Inc. (NASDAQ:MDLZ), and PepsiCo, Inc. (NASDAQ:PEP) are a few of the food stocks that hedge funds are investing billions of dollars […]",https://finnhub.io/api/news?id=f9465923de02c8cbfac0048fe132e5ee8c511e6907ea5968bb3fca8a127cc5b8
company,2022-10-18 08:47:12,Mondelez (MDLZ) Snacking Category Aids Amid Cost Pressure,116707085,https://s.yimg.com/uu/api/res/1.2/o2Cr0QcP2kYUWqNnqskQmA--~B/aD00MDA7dz02MzU7YXBwaWQ9eXRhY2h5b24-/https://media.zenfs.com/en/zacks.com/c421504ada8f1eaaf77da24955bedee4,MDLZ,Yahoo,"Mondelez (MDLZ) is seeing input cost inflation, especially for energy and transportation, among others. However, strong pricing efforts and a focus on the snacking category bode well.",https://finnhub.io/api/news?id=3bbfe96835607a87e5f25af36ed99f2879c43ffabb463906f0cbba149a3f8a84
