category,datetime,headline,id,image,related,source,summary,url
company,2022-12-23 12:08:00,"Mondelez International Inc. Cl A stock rises Friday, still underperforms market",117695403,https://images.mktw.net/im-220105/social,MDLZ,MarketWatch,"Shares of Mondelez International Inc. Cl A inched 0.55% higher to $67.10 Friday, on what proved to be an all-around favorable trading session for the stock...",https://finnhub.io/api/news?id=e40835e695589a7fd4d7b0813315cbf11c43634c32d72e8e5b1d88e934db13b6
company,2022-12-22 12:09:00,Mondelez International Inc. Cl A stock outperforms market despite losses on the day,117695406,https://images.mktw.net/im-220105/social,MDLZ,MarketWatch,"Shares of Mondelez International Inc. Cl A dropped 0.24% to $66.73 Thursday, on what proved to be an all-around grim trading session for the stock market,...",https://finnhub.io/api/news?id=0915186c75c8674a422961af746985f8f01e4fb7255a493d16451a5e29c0b122
company,2022-12-22 11:40:04,MHGVY or MDLZ: Which Is the Better Value Stock Right Now?,117621156,https://media.zenfs.com/en/zacks.com/1a018a29aef5adbf5b4319f32058e209,MDLZ,Yahoo,MHGVY vs. MDLZ: Which Stock Is the Better Value Option?,https://finnhub.io/api/news?id=0caee519b3025ede735270ddf09690eaf0e96732f92bb9e3fc0869920a7197ed
company,2022-12-22 07:01:05,"Mondelez International, Inc. (NASDAQ:MDLZ) insiders sold US$4.9m worth of stock, possibly signalling a downtrend",117614903,https://media.zenfs.com/en/simply_wall_st__316/1755b5a339fe0d610102dcc34fddba34,MDLZ,Yahoo,"Over the past year, many Mondelez International, Inc. ( NASDAQ:MDLZ ) insiders sold a significant stake in the company...",https://finnhub.io/api/news?id=e8affdf5636836299a4da43966967517531413ac5a15de07c1a865ccf9a98195
company,2022-12-22 05:44:00,Mondelez Stock: Gum Business Sale is Bullish,117660863,,MDLZ,TipRanks,Looking for stock market analysis and research with proves results? Zacks.com offers in-depth financial research with over 30years of proven results.,https://finnhub.io/api/news?id=2ef1be6b819b370b4ab5fe8f36d38b6ea35a9ace1fcac5d7e2da177a8062aa01
company,2022-12-22 05:38:00,February 2023 Options Now Available For Mondelez International (MDLZ),117660864,,MDLZ,Stock Options Channel,Looking for stock market analysis and research with proves results? Zacks.com offers in-depth financial research with over 30years of proven results.,https://finnhub.io/api/news?id=b636bebce593a49f790e525f99926090032ad191ef65dc66fdfdd0aa4ebadf4e
company,2022-12-29 12:08:00,"Mondelez International Inc. Cl A stock rises Thursday, still underperforms market",117996410,https://images.mktw.net/im-220105/social,MDLZ,MarketWatch,"Shares of Mondelez International Inc. Cl A inched 0.79% higher to $66.97 Thursday, on what proved to be an all-around favorable trading session for the stock...",https://finnhub.io/api/news?id=f0b210a25fea9912f79f6bf075910fe8bdd6f06f616f7fd7adf663e0127d23b7
company,2022-12-29 08:49:01,The J. M. Smucker (SJM) Up on Core Strategies & Pricing Efforts,117853378,https://media.zenfs.com/en/zacks.com/51605c2039ff58a386509d40df3f4403,MDLZ,Yahoo,"The J. M. Smucker (SJM) is on track with core priorities like driving commercial excellence, reshaping its portfolio, streamlining cost structure and unleashing its organization to win.",https://finnhub.io/api/news?id=eb552c46679dca6f28087f9a73dfb24c15448f24800a4a4424823b4a39f0d04c
company,2022-12-29 08:48:01,Pilgrim's Pride (PPC) Poised on Solid Performance & Expansions,117853379,https://media.zenfs.com/en/zacks.com/a9010eb8913baac4b2090d471e78cabc,MDLZ,Yahoo,Pilgrim's Pride (PPC) benefits from long-term investments like capacity expansion and automation. The company's customer-centric approach bodes well.,https://finnhub.io/api/news?id=3a445fceca7ac7a4adb48f88122a9575014f04b20d14394b01b69fef14f1ad84
company,2022-12-28 12:08:00,"Mondelez International Inc. Cl A stock falls Wednesday, still outperforms market",117837097,https://images.mktw.net/im-220105/social,MDLZ,MarketWatch,"Shares of Mondelez International Inc. Cl A dropped 0.98% to $66.83 Wednesday, on what proved to be an all-around dismal trading session for the stock market,...",https://finnhub.io/api/news?id=053168cee5f648c288a9da7040601f9ba65f91043371d9b3ebbe16fda79410d8
company,2022-12-28 10:15:54,Analysts Are Downgrading These 10 Stocks,117813845,https://media.zenfs.com/en/insidermonkey.com/2d75ec280126c5ef3bd096052d4ae33e,MDLZ,Yahoo,"In this article, we will look at the 10 stocks recently downgraded by analysts. If you want to see more such downgrades on the list, you can directly visit Analysts Are Downgrading These 5 Stocks. U.S. stocks mostly traded in red this month amid investors’ concerns over future rate hikes. Moreover, the producer price index […]",https://finnhub.io/api/news?id=1c6d35a4d878334e91989875597dc99298d3b67476022f298704d5b3b33c190b
company,2022-12-28 06:42:26,Mondelez: Stay Off The Cookies,117815172,https://static.seekingalpha.com/cdn/s3/uploads/getty_images/972538532/image_972538532.jpg?io=getty-c-w750,MDLZ,SeekingAlpha,Mondelez has been aggressively expanding the business with some targeted M&A actions. Click here to read our analysis of MDLZ stock.,https://finnhub.io/api/news?id=0406f4b579c311bd8f1c5322e0d8e23226c4d750c4738170e7e399a2e3be0487
company,2022-12-27 12:08:00,"Mondelez International Inc. Cl A stock rises Tuesday, outperforms market",117837098,https://images.mktw.net/im-220105/social,MDLZ,MarketWatch,"Shares of Mondelez International Inc. Cl A inched 0.58% higher to $67.49 Tuesday, on what proved to be an all-around mixed trading session for the stock...",https://finnhub.io/api/news?id=45bdf7e5c8c00c8878103c8fbb11a311d811b13944450e843fdafa6e0830facd
company,2022-12-27 09:40:02,Are Consumer Staples Stocks Lagging  Mondelez International (MDLZ) This Year?,117810898,https://media.zenfs.com/en/zacks.com/105b2acef7bf0873f24b78932b1fdc3c,MDLZ,Yahoo,Here is how Mondelez (MDLZ) and PepsiCo (PEP) have performed compared to their sector so far this year.,https://finnhub.io/api/news?id=78886ad2899b4b5c9ef479bfc436bef3209b6683e2d6d8be47f3f095459f91b0
company,2022-12-27 09:00:02,Want Better Returns? Don't Ignore These 2 Consumer Staples Stocks Set to Beat Earnings,117809909,https://media.zenfs.com/en/zacks.com/d2f7ed3d1940141716bfd200f5c94c6b,MDLZ,Yahoo,The Zacks Earnings ESP is a great way to find potential earnings surprises. Why investors should take advantage now.,https://finnhub.io/api/news?id=14477085ec8bf510cef6a4217e084e1a52b96579b6bf8fab7560ec2315d908d7
company,2022-12-27 08:01:45,Michael Farr: These are 2023's top stock picks for what could be a rocky year,117825444,https://image.cnbcfm.com/api/v1/image/107162950-1670445995023-nyse5.jpg?v=1672164105&w=1920&h=1080,MDLZ,CNBC,Lower lows could be ahead for investors. Here are Michael Farr's picks for the new year.,https://finnhub.io/api/news?id=a57ac8677f6a214eb9cdd1464ef287ef5d0e9f3dd4fea1e556c7866c5a84dfb4
company,2022-12-27 07:45:12,Mondelez (MDLZ) Looks Appetizing: Stock Up 15% in 3 Months,117807371,https://media.zenfs.com/en/zacks.com/c421504ada8f1eaaf77da24955bedee4,MDLZ,Yahoo,"Mondelez (MDLZ) benefits from a focus on its chocolate and biscuit business. Also, strength in emerging markets and pricing has been working well.",https://finnhub.io/api/news?id=9338bd99462e22fb09417c5a836c6570258e474be634b39c9bf808f166fb1824
company,2022-12-27 04:15:00,"Ex-Dividend Reminder: Mondelez International, B&G Foods and Thor Industries",117879727,,MDLZ,Dividend Channel,Looking for stock market analysis and research with proves results? Zacks.com offers in-depth financial research with over 30years of proven results.,https://finnhub.io/api/news?id=23849dfdd3c7a88ba273a19ecb88e4f5fa2e4dde79d46d087a9cbcb724d3492d
company,2022-12-26 07:00:50,"Is There An Opportunity With Mondelez International, Inc.'s (NASDAQ:MDLZ) 20% Undervaluation?",117805100,https://media.zenfs.com/en/simply_wall_st__316/1755b5a339fe0d610102dcc34fddba34,MDLZ,Yahoo,"How far off is Mondelez International, Inc. ( NASDAQ:MDLZ ) from its intrinsic value? Using the most recent financial...",https://finnhub.io/api/news?id=b4853b8b007b4ada4080180627de9e18689a65573ce2b6d44cfab288e9fe1abd
company,2023-01-02 13:02:22,Why These 7 Consumer Stocks Could Soar in 2023,118144437,https://media.zenfs.com/en/investorplace_417/0c45c88f7e2e4bef2aa28d8023c9911f,MDLZ,Yahoo,"This article will highlight seven consumer stocks to buy in 2023, and here’s why. While energy and bank stocks are strong choices, the investor should not count out the consumer. Inflation and rising interest rates were supposed to crush consumers in 2022, but that didn’t happen, at least not to the extent investors expected. However, that may be changing. In the last quarter there’s been a definite shift in way several companies are viewing their earnings outlooks. It’s possible that companies",https://finnhub.io/api/news?id=d88374a82f71ab4d05fb4f9885f08af2665d44628bac0c2eb43d10c655524290
company,2022-12-30 12:08:00,Mondelez International Inc. Cl A stock outperforms competitors despite losses on the day,117996409,https://images.mktw.net/im-220105/social,MDLZ,MarketWatch,"Shares of Mondelez International Inc. Cl A slid 0.48% to $66.65 Friday, on what proved to be an all-around grim trading session for the stock market, with...",https://finnhub.io/api/news?id=ddadf4ccd7afe0136e1560dc585f0729aa7cfd10cb37f292d500c959a6327996
company,2022-12-30 09:37:00,I'm Buying These 3 Resilient Stocks During a Bear Market,117922382,,MDLZ,Yahoo,"In a bull market, it's common for investors to chase growth stocks for attractive capital gains.  In a sharp U turn, investors are now refocusing their attention on resilience and stability as the bear market drags on.  Possessing these attributes means the company can navigate through tough economic times while doling out a steady stream of passive income.",https://finnhub.io/api/news?id=1a46173c079ad1b4d8befde308c1843a1c8fe44daa12db7e9e8dee8cf3d27725
company,2022-12-30 09:19:02,B&G Foods (BGS) Down More Than 50% in 6 Months: Here's Why,117924218,https://media.zenfs.com/en/zacks.com/35c687708a92dc1852487b4945bc1b43,MDLZ,Yahoo,"B&G Foods (BGS) has been battling major cost hurdles. Management anticipates significant cost inflation for inputs, such as ingredients, packaging, labor and transportation.",https://finnhub.io/api/news?id=d21948a2a315b0c55a5c45d36e8e3ce408917fb526398965cd0a02fd7a18a8c6
company,2022-12-30 08:13:01,Inter Parfums (IPAR) Gains on Solid Brands & Partnerships,117923582,https://media.zenfs.com/en/zacks.com/ea08ebc0f6218ea29387ab9d055cde41,MDLZ,Yahoo,Inter Parfums (IPAR) benefits from the strength of its partnerships. The company's focus on product launches to boost assortment strength is impressive.,https://finnhub.io/api/news?id=df93ae6e210e18b31b038d9c29fe26ba88cd05a6dba56a98038039c27cd3adac
company,2022-12-30 07:00:39,Returns On Capital At Mondelez International (NASDAQ:MDLZ) Have Stalled,117928327,https://media.zenfs.com/en/simply_wall_st__316/1755b5a339fe0d610102dcc34fddba34,MDLZ,Yahoo,"If you're not sure where to start when looking for the next multi-bagger, there are a few key trends you should keep an...",https://finnhub.io/api/news?id=7b5d55cb8f872758e730b7a11cd00e672977d792eda99a78a78b26c86c19b1c8
company,2023-01-06 00:38:00,Mondelez price target raised to $78 from $75 at Mizuho,118187511,,MDLZ,Thefly.com,Looking for stock market analysis and research with proves results? Zacks.com offers in-depth financial research with over 30years of proven results.,https://finnhub.io/api/news?id=8d931956c730d0df511234500cf8aa46bc06106d49342f61fe4fe3c798b711e2
company,2023-01-05 23:11:00,Mondelez International Inc. Cl A stock outperforms competitors on strong trading day,118187512,,MDLZ,MarketWatch,Looking for stock market analysis and research with proves results? Zacks.com offers in-depth financial research with over 30years of proven results.,https://finnhub.io/api/news?id=7bf5de388f82852248d78103cc5b064781bbbb258ec8ebbf4ed134014d324bc2
company,2023-01-04 23:10:00,"Mondelez International Inc. Cl A stock falls Thursday, still outperforms market",118187513,,MDLZ,MarketWatch,Looking for stock market analysis and research with proves results? Zacks.com offers in-depth financial research with over 30years of proven results.,https://finnhub.io/api/news?id=4601ae3cc8dcd6aa63648ad489a7e871a9729007964feb1f607c6fc691e7f8f0
company,2023-01-04 12:10:05,Why Mondelez (MDLZ) Could Beat Earnings Estimates Again,118128107,https://media.zenfs.com/en/zacks.com/1154d43aaeb65735a640003549116295,MDLZ,Yahoo,Mondelez (MDLZ) has an impressive earnings surprise history and currently possesses the right combination of the two key ingredients for a likely beat in its next quarterly report.,https://finnhub.io/api/news?id=22eebd28a29de9e054ebee99bc63d6a0b2988dd982f62a75daa0d2251f624e37
company,2023-01-04 12:08:00,"Mondelez International Inc. Cl A stock rises Wednesday, still underperforms market",118127001,https://images.mktw.net/im-220105/social,MDLZ,MarketWatch,"Shares of Mondelez International Inc. Cl A inched 0.72% higher to $66.73 Wednesday, on what proved to be an all-around positive trading session for the stock...",https://finnhub.io/api/news?id=d08751bc4f516a168c0abc1db749489ef5066f5b8f5121ffdbeaf31d4516554d
company,2023-01-04 09:37:02,Lamb Weston (LW) Gears Up for Q2 Earnings: Things to Note,118114736,https://media.zenfs.com/en/zacks.com/f692a3b240a8dce92d94c13ea4d1bd45,MDLZ,Yahoo,Lamb Weston's (LW) second-quarter performance is likely to have witnessed gains from pricing and capacity expansion endeavors amid escalated cost concerns.,https://finnhub.io/api/news?id=54abf871bd98b4e8f69a8442695a43410e658ba4a8e9a2df089ac14fdaadd6cc
company,2023-01-03 12:09:00,"Mondelez International Inc. Cl A stock falls Tuesday, underperforms market",118127002,https://images.mktw.net/im-220105/social,MDLZ,MarketWatch,"Shares of Mondelez International Inc. Cl A sank 0.60% to $66.25 Tuesday, on what proved to be an all-around dismal trading session for the stock market, with...",https://finnhub.io/api/news?id=744823aeac13490b495df71d16f15337cc464b302a46b1e3eb1da90360929ce0
company,2023-01-03 08:35:01,Conagra Brands (CAG) Readies for Q2 Earnings: Things to Note,118098931,https://media.zenfs.com/en/zacks.com/6f2cab89bf2cbad1966358e04258e202,MDLZ,Yahoo,Conagra Brands' (CAG) second-quarter performance is likely to have witnessed gains from pricing and the strength of the snacks category amid rising cost inflation.,https://finnhub.io/api/news?id=041d25cc15eb59e0dc717bce975690d8d1184fcbf3ceffd0cc364cf0a8d4e322
company,2023-01-03 07:00:47,"A Look At The Fair Value Of Mondelez International, Inc. (NASDAQ:MDLZ)",118095852,https://media.zenfs.com/en/simply_wall_st__316/1755b5a339fe0d610102dcc34fddba34,MDLZ,Yahoo,"Today we will run through one way of estimating the intrinsic value of Mondelez International, Inc. ( NASDAQ:MDLZ ) by...",https://finnhub.io/api/news?id=dbf089d713da0c2f15d53ca0e1937b50d0210821495ff1dce1ef23275099f56b
company,2023-01-03 03:46:00,"Street Wrap: Today`s Top 15 Upgrades, Downgrades, Initiations",118096958,,MDLZ,Thefly.com,Looking for stock market analysis and research with proves results? Zacks.com offers in-depth financial research with over 30years of proven results.,https://finnhub.io/api/news?id=c2212ef9f925c46a4a1ffa58350911c5bfee50e41adcc0dac6a923d12d1cb5bc
company,2023-01-03 01:27:00,Mondelez International attracts bull rating from Wells Fargo,118099939,,MDLZ,Seeking Alpha,Looking for stock market analysis and research with proves results? Zacks.com offers in-depth financial research with over 30years of proven results.,https://finnhub.io/api/news?id=0f227ec52ea9dd9474320107d12dc1b493e5f1def464f8307dadc4d8a803b3e2
company,2023-01-02 23:56:00,Mondelez initiated with an Overweight at Wells Fargo,118099940,,MDLZ,Thefly.com,Looking for stock market analysis and research with proves results? Zacks.com offers in-depth financial research with over 30years of proven results.,https://finnhub.io/api/news?id=a789f043fb965d51536ea3fa4f616267289a508634ca70fd1724a9c65aaccf04
company,2023-01-02 23:27:00,Mondelez downgraded to Sector Perform from Outperform at RBC Capital,118099941,,MDLZ,Thefly.com,Looking for stock market analysis and research with proves results? Zacks.com offers in-depth financial research with over 30years of proven results.,https://finnhub.io/api/news?id=c051b7e2b4443967df8679af0b53524a06973970d45d5a2cd86e08ed5657d78b
company,2023-01-10 18:15:11,Mondelez (MDLZ) Gains But Lags Market: What You Should Know,118196879,https://media.zenfs.com/en/zacks.com/71afbbc0512eb3c471136d93f39079c9,MDLZ,Yahoo,"Mondelez (MDLZ) closed the most recent trading day at $67.31, moving +0.1% from the previous trading session.",https://finnhub.io/api/news?id=1c14b6305bb4d5a4eea515a7234f7e58756f969f3ce65f77abb771db1f59495e
company,2023-01-10 11:28:04,Campbell Soup (CPB) Looks Appetizing on Snacks Unit & Savings,118196880,https://media.zenfs.com/en/zacks.com/b7c4fc8896650cc07a37b5bb9e8a3c86,MDLZ,Yahoo,Campbell Soup (CPB) has been benefiting from brand strength and inflation-driven pricing actions. Growing Snacks business is a key driver.,https://finnhub.io/api/news?id=f8843d4b9c3705b9d7b313cbb4cb2445101286b8dc16e74bdcf7294b6ab22ef5
company,2023-01-09 10:32:03,Kimberly-Clark (KMB) Benefits From Growth Pillars & Cost Cutting,118196881,https://media.zenfs.com/en/zacks.com/22084620ba8bd55a31560b62dc6bca4a,MDLZ,Yahoo,Kimberly-Clark (KMB) is committed to its three key strategic growth pillars. The company has been progressing well with expanding global business.,https://finnhub.io/api/news?id=f919c303d237349f5e41b64666dc7a4396de6d0e42685571c87c67f53185df9a
company,2023-01-09 10:28:03,The Estee Lauder Companies' (EL) Online Business Aids Growth,118196882,https://media.zenfs.com/en/zacks.com/fd7d9341593a93c951679f813f3417f3,MDLZ,Yahoo,"The Estee Lauder Companies (EL) is implementing new technology and digital experiences to drive online growth. However, inflation and supply-chain bottlenecks are concerns.",https://finnhub.io/api/news?id=2f065eb5b262ed6dc6af64ce6d25313b8da601002f4502a3e184102fc9681bc4
company,2023-01-07 09:00:14,"Mondelez International, Inc.'s (NASDAQ:MDLZ) Stock Is Going Strong: Is the Market Following Fundamentals?",118196884,https://media.zenfs.com/en/simply_wall_st__316/1755b5a339fe0d610102dcc34fddba34,MDLZ,Yahoo,Mondelez International's (NASDAQ:MDLZ) stock is up by a considerable 23% over the past three months. Since the market...,https://finnhub.io/api/news?id=829bd2df010e51e4f1d799f1a17781d9f84069efd1dce4c1e40c432df881a743
company,2023-01-12 16:05:00,"Mondelēz International to Report Q4 and Full Year 2022 Financial Results on January 31, 2023",118218593,https://media.zenfs.com/en/globenewswire.com/9ff7ecd56567d2f5831f3022e36d6000,MDLZ,Yahoo,"CHICAGO, Jan. 12, 2023 (GLOBE NEWSWIRE) -- Mondelēz International, Inc. (Nasdaq: MDLZ) will release its fourth quarter 2022 financial results on Tuesday, January 31, 2023 at 4:05 p.m. ET and will host a conference call at 5:00 p.m. ET that day. Investors and analysts may participate via phone by calling 800-225-9448 from the United States and 203-518-9814 from other locations. To ensure timely access, participants should dial in approximately 10 minutes before the call starts. A listen-only webc",https://finnhub.io/api/news?id=4a46e95cfee7aa8e6c631a336004ed4540cd0e1366b28ae6acaf888875a0353d
company,2023-01-12 13:52:00,Oreo Owner Plans Massive Revamp for Iconic Candy Brands,118207792,https://s.yimg.com/ny/api/res/1.2/QXw4j5Z0AV__NRJNwBpCfg--/YXBwaWQ9aGlnaGxhbmRlcjt3PTEyMDA7aD02NzU-/https://media.zenfs.com/en/thestreet.com/95828a2a466283fe65072bccac3a377e,MDLZ,Yahoo,"International food brand giant Mondelez  may not be a household name in its own right, but plenty of foods in its portfolio certainly are.  The parent of Oreo, Ritz, Cadbury, and Sour Patch Kids is known for its indulgent confections and lunch box staples around the globe.  As it stands currently, Mondelez holds the #1 market share position for cookies, biscuits and crackers.",https://finnhub.io/api/news?id=eaae8ca6118b5e5c489c87241d8aee9b5769e6cb671296e964df3b924740908b
company,2023-01-12 09:00:02,How to Find Strong Consumer Staples Stocks Slated for Positive Earnings Surprises,118207793,https://media.zenfs.com/en/zacks.com/c2fdcaac033e049c74f38d188afcc9f9,MDLZ,Yahoo,Investors looking for ways to find stocks that are set to beat quarterly earnings estimates should check out the Zacks Earnings ESP.,https://finnhub.io/api/news?id=4983946e4f12200eb608a0d6f6a6cc7f5ea65360cbfa43af6b79706fec0092bc
company,2023-01-18 12:08:00,"Mondelez International Inc. Cl A stock falls Wednesday, underperforms market",118310890,https://images.mktw.net/im-220105/social,MDLZ,MarketWatch,"Shares of Mondelez International Inc. Cl A shed 3.66% to $64.57 Wednesday, on what proved to be an all-around poor trading session for the stock market, with...",https://finnhub.io/api/news?id=cb70702bb01b9a2984f4bec82961a2a202d0d54097b40b6de84ed95d9ee73d0c
company,2023-01-18 10:36:03,Kraft Heinz (KHC) Gains on Solid Pricing & Transformation,118306734,https://media.zenfs.com/en/zacks.com/224bb62dec070a9830819afff0adb6f2,MDLZ,Yahoo,Solid pricing initiatives have been aiding Kraft Heinz (KHC) for a while now. The company's top line is supported by three pillars of growth.,https://finnhub.io/api/news?id=c6ad3ecde37e998c75dc9f334fcd29f8bb86d4d8bce2d8641c71a50d34549e27
company,2023-01-18 07:26:12,Top 5 Consumer Staple Stocks Set to Beat This Earnings Season,118303521,https://media.zenfs.com/en/zacks.com/d37f5c2defb471c2653329a64a33c61f,MDLZ,Yahoo,"Five consumer staples companies' earnings are set to beat estimates. These are MDLZ, PG, CTVA, ELF and THS.",https://finnhub.io/api/news?id=f5c41d9a67474adaf7ced099d1bef0aced25579aaaa034eda8d13881b4db91b1
company,2023-01-17 12:08:00,"Mondelez International Inc. Cl A stock falls Tuesday, still outperforms market",118306496,https://images.mktw.net/im-220105/social,MDLZ,MarketWatch,"Shares of Mondelez International Inc. Cl A dropped 0.06% to $67.02 Tuesday, on what proved to be an all-around poor trading session for the stock market,...",https://finnhub.io/api/news?id=afb41a46517bf7391ad9bb294fa311420ac0e03ae26f9a19edccdbddda41c424
company,2023-01-17 08:36:01,Buy 5 High-Yielding U.S. Bigwigs to Enhance Your Portfolio,118291055,https://media.zenfs.com/en/zacks.com/57b04c7d2045e30707e0179045b0da10,MDLZ,Yahoo,"We have narrowed our search to five U.S. corporate bigwigs. These are: MCD, KO, IBM, MDLZ and PEP.",https://finnhub.io/api/news?id=33f787eef03980f086128e6c1a77a7b307942b7199e3cfb5a8f69747ed16bc5d
company,2023-01-16 09:40:02,Are Consumer Staples Stocks Lagging  Lamb Weston (LW) This Year?,118284538,https://media.zenfs.com/en/zacks.com/432476d296d64c50172213c0415587c9,MDLZ,Yahoo,Here is how Lamb Weston (LW) and Mondelez (MDLZ) have performed compared to their sector so far this year.,https://finnhub.io/api/news?id=5759fb14b4e135400e516c1c955c8ecd288699e657f94a4e78e67d11f0038ea9
company,2023-01-16 08:39:01,The J.M. Smucker (SJM) Up More Than 15% in 6 Months: Here's Why,118280585,https://media.zenfs.com/en/zacks.com/51605c2039ff58a386509d40df3f4403,MDLZ,Yahoo,The J.M. Smucker (SJM) is benefiting from strategic pricing actions amid the inflationary environment. The company is progressing well with core priorities.,https://finnhub.io/api/news?id=f6f1763818ff1cd545cc5c6c93de1dcefa26d73919ac80d2dd71f5b505339a9f
company,2023-01-15 09:23:00,25 Biggest Illinois Companies and Stocks,118274457,https://media.zenfs.com/en/insidermonkey.com/6e2e21ae0027e228cfdebfb05e6274c9,MDLZ,Yahoo,"In this article, we will be taking a look at the 25 biggest Illinois companies and stocks. To skip our detailed analysis, you can go directly to see the 5 Biggest Illinois Companies and Stocks. If all U.S. states were countries, Illinois would be the 21st largest economy in the world. It is the fifth […]",https://finnhub.io/api/news?id=be09efe9bbd8e1949afb77702eaca0ca5bf1d8273c5becbc4d32c8fe356a0787
company,2023-01-20 18:15:11,Mondelez (MDLZ) Gains But Lags Market: What You Should Know,118344001,https://media.zenfs.com/en/zacks.com/090f58c1efbe3555b861102525e50b39,MDLZ,Yahoo,"Mondelez (MDLZ) closed at $64.04 in the latest trading session, marking a +0.31% move from the prior day.",https://finnhub.io/api/news?id=c8c9e566b8ec2274ff331cf703914bbe4b6e75df85b4706d51681640d7c5ee45
company,2023-01-20 11:31:04,McCormick (MKC) Gears Up for Q4 Earnings: Things to Consider,118336441,https://media.zenfs.com/en/zacks.com/35c687708a92dc1852487b4945bc1b43,MDLZ,Yahoo,"McCormick (MKC) fourth-quarter fiscal 2022 performance is likely to reflect gains from strategic pricing and impressive brand portfolio. Also, prudent buyouts are upsides.",https://finnhub.io/api/news?id=0b75c438ce0b93e16ea6e7891e17965a5fbd6117b0f1f39edbcc2858d5f24d38
company,2023-01-20 09:28:02,Mondelez (MDLZ) Looks Tempting on Snacking Category Strength,118332249,https://media.zenfs.com/en/zacks.com/c421504ada8f1eaaf77da24955bedee4,MDLZ,Yahoo,"Mondelez (MDLZ) highlights that consumers continue to put snacking as a priority, even amid inflated costs and economic headwinds. The company remains well-placed for growth.",https://finnhub.io/api/news?id=b7b20292b75d6ac4ea8251641b9be31597544e36af24cc92152cc6dbf1a75918
company,2023-01-20 09:02:02,Here's How Diageo (DEO) is Placed Ahead of 1H23 Earnings,118331848,https://media.zenfs.com/en/zacks.com/75dec12007d31b46be31852a5fdce5b0,MDLZ,Yahoo,"Diageo's (DEO) first half of fiscal 2023 results are likely to reflect gains from market share improvements, continued recovery across markets and premiumization efforts, offset by inflationary costs.",https://finnhub.io/api/news?id=7b25987a162973d85b3050d0ace6dcb8dddc263f40470a7f6999605a282d771a
