category,datetime,headline,id,image,related,source,summary,url
company,2023-03-09 11:30:04,Hain Celestial (HAIN) Down 10.1% Since Last Earnings Report: Can It Rebound?,119143072,https://media.zenfs.com/en/zacks.com/17a4db66bb13bdabcbf848550a6ea15a,MDLZ,Yahoo,Hain Celestial (HAIN) reported earnings 30 days ago. What's next for the stock? We take a look at earnings estimates for some clues.,https://finnhub.io/api/news?id=5a2b83ea904d6e074fb0bb58718e3d691f1a008107deef2c073fc418d924a9f9
company,2023-03-09 09:32:02,"United Natural (UNFI) Q2 Earnings Miss Estimates, Sales Rise",119137377,https://media.zenfs.com/en/zacks.com/6f2cab89bf2cbad1966358e04258e202,MDLZ,Yahoo,"United Natural's (UNFI) second-quarter fiscal 2023 results reflect lower earnings on inflationary pressure and supply chain volatility. Nevertheless, sales grew year over year.",https://finnhub.io/api/news?id=ae52f0e8d17d72cf749d8cbd2ae8d7414a9c1589e525742b6bb17d7f1f07363b
company,2023-03-08 12:08:05,"Campbell (CPB) Beats on Q2 Earnings & Sales, Raises FY23 View",119118590,https://media.zenfs.com/en/zacks.com/b7c4fc8896650cc07a37b5bb9e8a3c86,MDLZ,Yahoo,Campbell's (CPB) Q2 results reflect higher net sales and earnings on growth across all segments. Management raises the fiscal 2023 view.,https://finnhub.io/api/news?id=02a7adf1d8e483bcc936f2271ecc242df52e7bf188203a15ec5d99d1eae038ad
company,2023-03-08 12:08:00,Mondelez International Inc. Cl A stock outperforms market on strong trading day,119116352,https://images.mktw.net/im-220105/social,MDLZ,MarketWatch,"Shares of Mondelez International Inc. Cl A inched 0.43% higher to $65.09 Wednesday, on what proved to be an all-around mixed trading session for the stock...",https://finnhub.io/api/news?id=03e1511d469c1b0de00de8e77fd9dbf7ace40ff4a95dc4c12739fe3bfa263b23
company,2023-03-15 16:35:00,Mondelez Takes Next Step in Wheat Sustainability Program,119266584,https://media.zenfs.com/en/accesswire.ca/624532ad117474380e1d8c6c55c9ba5c,MDLZ,Yahoo,"NORTHAMPTON, MA / ACCESSWIRE / March 15, 2023 / Mondelēz International Originally Published by Bake Mondelez International has launched Harmony Ambition 2030, the next stage of Harmony, its third-party verified European wheat sustainability program, ...",https://finnhub.io/api/news?id=d75a7104835bd54faaac632361d595ee43dda9288a833aef655959642893bcc1
company,2023-03-15 13:08:00,"Mondelez International Inc. Cl A stock rises Wednesday, outperforms market",119267068,https://images.mktw.net/im-220105/social,MDLZ,MarketWatch,"Shares of Mondelez International Inc. Cl A inched 0.17% higher to $66.40 Wednesday, on what proved to be an all-around poor trading session for the stock...",https://finnhub.io/api/news?id=1a44620c3be16843d38f55e0de9533c866e1c3adac107cba87acf311760d43cb
company,2023-03-15 08:45:00,Mondelez call volume above normal and directionally bullish,119263370,,MDLZ,Thefly.com,Looking for stock market analysis and research with proves results? Zacks.com offers in-depth financial research with over 30years of proven results.,https://finnhub.io/api/news?id=d201a2197b470ed27a211a7f1b6c9a25d532250cfd4e3b229bc9bd54763a8de1
company,2023-03-15 04:24:00,Food stocks are called appetizing by Mizuho amid banking sector meltdown,119252584,,MDLZ,Seeking Alpha,Looking for stock market analysis and research with proves results? Zacks.com offers in-depth financial research with over 30years of proven results.,https://finnhub.io/api/news?id=41b55ed8f349484debfd17f6c881b41f6f5e8200b0051da7b85ef098a2550155
company,2023-03-14 18:15:10,Mondelez (MDLZ) Gains But Lags Market: What You Should Know,119243385,https://media.zenfs.com/en/zacks.com/f889276f4a638f3c7a79c0e3e6b768c1,MDLZ,Yahoo,"Mondelez (MDLZ) closed the most recent trading day at $66.29, moving +1.14% from the previous trading session.",https://finnhub.io/api/news?id=02a8cee3da57a6d417549afbe9c1779f5ca908dc75099405c9bfc1163bb327e1
company,2023-03-14 13:09:00,"Mondelez International Inc. Cl A stock rises Tuesday, still underperforms market",119238044,https://images.mktw.net/im-220105/social,MDLZ,MarketWatch,"Shares of Mondelez International Inc. Cl A rallied 1.14% to $66.29 Tuesday, on what proved to be an all-around great trading session for the stock market,...",https://finnhub.io/api/news?id=852e3ecf89fe096823f69f18f67264a7dcc7aa7e2c2946b30fc5a3f0ef81470b
company,2023-03-14 11:55:00,Why Procter & Gamble and Other Consumer Staple Stocks Are Suddenly Back in Style,119264678,https://images.barrons.com/im-743314/social,MDLZ,MarketWatch,"Over the past week, shares of Procter & Gamble, Colgate-Palmolive, and Mondelez International have seen gains, despite a broader market selloff.",https://finnhub.io/api/news?id=81a7c5f0c8c6bfdbc0a370f8b9a7d78da283df50d95e5d5ff1b49d403a123f9b
company,2023-03-14 11:55:00,Why Consumer Staple Stocks Are Suddenly Back in Style,119237926,https://images.barrons.com/im-743314/social,MDLZ,MarketWatch,"Over the past week, shares of Procter & Gamble, Colgate-Palmolive, and Mondelez International have seen gains, despite a broader market selloff.",https://finnhub.io/api/news?id=70820c0662c77ab1193c906f10adb1df3d082c85cd7a08a7157a022f86327305
company,2023-03-14 01:09:11,Tracking Nelson Peltz's Trian Fund Management Portfolio - Q4 2022 Update,119220089,https://static.seekingalpha.com/cdn/s3/uploads/getty_images/56574449/image_56574449.jpg?io=getty-c-w1536,MDLZ,SeekingAlpha,Nelson Peltzâs 13F portfolio value increased from $3.80B to $4.87B this quarter. Click here to see an update Trian Fund Management's trades for Q4 2022.,https://finnhub.io/api/news?id=f2016f394fbb8a56d583a4d36650ddd84ebd7f4320e92d0c8cf220c1394dc04b
company,2023-03-14 00:10:00,Tracking Nelson Peltz`s Trian Fund Management Portfolio - Q4 2022 Update,119226660,,MDLZ,Seeking Alpha,Looking for stock market analysis and research with proves results? Zacks.com offers in-depth financial research with over 30years of proven results.,https://finnhub.io/api/news?id=78154b615012899b4413399459e05269e042008fdc160969f05ad27569cc1e46
company,2023-03-13 15:08:00,Mondelez International Stock Shows Rising Relative Strength Upgrade,119204020,https://media.zenfs.com/en/ibd.com/62147566276b3a75eab1ea938001a116,MDLZ,Yahoo,"Mondelez Intl Cl A shows improving price performance, earning an upgrade to its IBD Relative Strength Rating",https://finnhub.io/api/news?id=b3e97eeeb0eabd2433845c164c151d890eff598b3389a51483141f09ec7fee20
company,2023-03-13 13:09:00,Mondelez International Inc. Cl A stock underperforms Monday when compared to competitors despite daily gains,119221175,https://images.mktw.net/im-220105/social,MDLZ,MarketWatch,"Shares of Mondelez International Inc. Cl A inched 0.99% higher to $65.54 Monday, on what proved to be an all-around rough trading session for the stock...",https://finnhub.io/api/news?id=8b3b82a9d669c3a270d14ed75cb98b344356f5a38d3fe26f9286f43cea2e76c2
company,2023-03-13 09:00:00,Chips Ahoy!® Kicks off Epic Birthday by Hosting Fans with the Ultimate Celebration,119204021,https://media.zenfs.com/en/prnewswire.com/09f3d7f5d568f4ed3b32f26498467d8f,MDLZ,Yahoo,"The beloved Chips Ahoy! cookie is a welcome treat at any celebration, and now – to commemorate the brand's 60th birthday, Chips Ahoy! announces the Chips Ahoy! Happiest Birthday Party.",https://finnhub.io/api/news?id=886b689ba0790a30b5a101cc8835b80d8b2afd757e8fe4bb3f1a33919c70da32
company,2023-03-17 17:10:00,Stocks for Market Turmoil: Consumer Staples,119326749,https://images.barrons.com/im-745760/social,MDLZ,MarketWatch,"These steady performers were hot last year and cold in 2023, but now rapidly warming as bank fears hit the market. It helps that they have pricing power and...",https://finnhub.io/api/news?id=39c670d8f0590b94acda1826071a1e3148a5d0ca1ef0323fddd5686d39474139
company,2023-03-17 13:08:00,Mondelez International Inc. Cl A stock underperforms Friday when compared to competitors,119327683,https://images.mktw.net/im-220105/social,MDLZ,MarketWatch,"Shares of Mondelez International Inc. Cl A slipped 0.81% to $66.40 Friday, on what proved to be an all-around dismal trading session for the stock market,...",https://finnhub.io/api/news?id=b726db1dfff9b4f39628c2111d6f4a1df86e6ca921d81b9719dcd7e29d7ec0ab
company,2023-03-17 01:30:00,"3 ���Strong Buy��� Value Stocks, According to Analysts",119305910,,MDLZ,TipRanks,Looking for stock market analysis and research with proves results? Zacks.com offers in-depth financial research with over 30years of proven results.,https://finnhub.io/api/news?id=56cd52e1793a69189ded93c8c3966a508e1cd9a5e154d506d1f47ba15ee071de
company,2023-03-17 01:29:00,"Here are 3 ���Strong Buy��� Value Stocks, According to Analysts",119305911,,MDLZ,TipRanks,Looking for stock market analysis and research with proves results? Zacks.com offers in-depth financial research with over 30years of proven results.,https://finnhub.io/api/news?id=9c9edbe2fe3efada200ab3a69b15e79d2d9b9fe9ebed811c798489bfeac7ea52
company,2023-03-17 01:26:00,"3 Value Stocks That are ���Strong Buys,��� According to Analysts",119305912,,MDLZ,TipRanks,Looking for stock market analysis and research with proves results? Zacks.com offers in-depth financial research with over 30years of proven results.,https://finnhub.io/api/news?id=97b001854de948aee4539287b14fad12515847f878d69038a340393186958925
company,2023-03-16 13:08:00,"Mondelez International Inc. Cl A stock rises Thursday, still underperforms market",119290280,https://images.mktw.net/im-220105/social,MDLZ,MarketWatch,"Shares of Mondelez International Inc. Cl A inched 0.81% higher to $66.94 Thursday, on what proved to be an all-around favorable trading session for the stock...",https://finnhub.io/api/news?id=bac11eb08266c6dc4d23f35975080ff346ab6b8f59e5e38cf310d06d3460d85a
company,2023-03-23 13:00:00,What’s in an Oreo? A Food Scientist Explains.,119385017,https://s.yimg.com/ny/api/res/1.2/wuQFkzDtJjLQqJ9b6Zka4Q--/YXBwaWQ9aGlnaGxhbmRlcjt3PTEyMDA7aD02NzU-/https://media.zenfs.com/en/wall_street_journal_733/79149671aefc41c98f1c82500efabfc3,MDLZ,Yahoo,"Oreos are one of the most well-known cookies in the world, with around 40 billion produced each year. But some of the ingredients are not as well-known. The WSJ spoke with a food scientist to understand how the “creme”-filled cookie is made. Photo: Christopher Hart for The Wall Street Journal",https://finnhub.io/api/news?id=3e3d1d952ee4642b48e032ba220575182d3e3bd240ed5d56d84f490cc30114e3
company,2023-03-23 06:51:00,MDLZ May 5th Options Begin Trading,119380756,,MDLZ,Stock Options Channel,Looking for stock market analysis and research with proves results? Zacks.com offers in-depth financial research with over 30years of proven results.,https://finnhub.io/api/news?id=02cd558abc4b0fdcec419b55a85189689cf22908139befa9b003872d776c67e0
company,2023-03-23 00:11:00,"Mondelez International Inc. Cl A stock falls Thursday, underperforms market",119380757,,MDLZ,MarketWatch,Looking for stock market analysis and research with proves results? Zacks.com offers in-depth financial research with over 30years of proven results.,https://finnhub.io/api/news?id=9a296a98967c6b2e397c0f0e023d302742499a718f88ecf80ef321ca02b0a504
company,2023-03-22 18:15:10,Mondelez (MDLZ) Stock Moves -0.69%: What You Should Know,119363906,https://media.zenfs.com/en/zacks.com/7853de8d69faeccb7d1ad6ebba40b8a2,MDLZ,Yahoo,"In the latest trading session, Mondelez (MDLZ) closed at $67.36, marking a -0.69% move from the previous day.",https://finnhub.io/api/news?id=f3f157bd6d07dd5c24fe973ea5ac6bc0363a2da5a2b8c200ed70070fc17e4861
company,2023-03-22 13:08:00,Mondelez International Inc. Cl A stock underperforms Wednesday when compared to competitors,119366538,https://images.mktw.net/im-220105/social,MDLZ,MarketWatch,"Shares of Mondelez International Inc. Cl A slumped 0.69% to $67.36 Wednesday, on what proved to be an all-around grim trading session for the stock market,...",https://finnhub.io/api/news?id=7f630547775a03a23a61da9115c8f4b518ef97b996471fdf205e1f3fe88bf305
company,2023-03-21 13:08:00,"Mondelez International Inc. Cl A stock rises Tuesday, still underperforms market",119366539,https://images.mktw.net/im-220105/social,MDLZ,MarketWatch,"Shares of Mondelez International Inc. Cl A inched 0.15% higher to $67.83 Tuesday, on what proved to be an all-around favorable trading session for the stock...",https://finnhub.io/api/news?id=5644ec42ed99aee74d988d8733b76346a89d9c9486b3f1e127b8cf81759ed226
company,2023-03-21 11:40:03,MHGVY or MDLZ: Which Is the Better Value Stock Right Now?,119339939,https://media.zenfs.com/en/zacks.com/ace7df31c7fcb10255abe7c990ea373a,MDLZ,Yahoo,MHGVY vs. MDLZ: Which Stock Is the Better Value Option?,https://finnhub.io/api/news?id=bb2570820bedee3b61a964a981f3fa5ac4e27fdad8fce2aaebe70d9d1de53201
company,2023-03-20 13:08:00,Mondelez International Inc. Cl A stock outperforms competitors on strong trading day,119327681,https://images.mktw.net/im-220105/social,MDLZ,MarketWatch,"Shares of Mondelez International Inc. Cl A rose 2.00% to $67.73 Monday, on what proved to be an all-around positive trading session for the stock market,...",https://finnhub.io/api/news?id=48bf7c5af747fbd6c060da6df6def2717b1fafa703fd99593a4919c9b8a40a9d
company,2023-03-20 04:25:00,Deutsche Bank picks winners and losers in the consumer staples sector,119304738,,MDLZ,Seeking Alpha,Looking for stock market analysis and research with proves results? Zacks.com offers in-depth financial research with over 30years of proven results.,https://finnhub.io/api/news?id=dcac835eeef68b129543eecc5d463cf26348d31f155afe218b1fcfd70c78175b
company,2023-03-20 01:03:00,Mondelez price target lowered to $73 from $76 at Deutsche Bank,119313684,,MDLZ,Thefly.com,Looking for stock market analysis and research with proves results? Zacks.com offers in-depth financial research with over 30years of proven results.,https://finnhub.io/api/news?id=3399e87646255473dfb563bc5557de7acbdfd25d0554c261e31bf4f3b1fc39c4
company,2023-03-27 17:36:53,"This Is The Market's Sweet Spot, Literally: Defensive Stocks Of A Sugary Kind",119452005,,MDLZ,Yahoo,Defensive stocks in focus: chocolate and confectionary stocks are hitting new highs. Some are in bases while others are in buy zones.,https://finnhub.io/api/news?id=2ce2b848ce8da71ba99f12ccdfd6d87deecd2d6ae96e3e40af3e042d006c8732
company,2023-03-27 13:08:00,"Mondelez International Inc. Cl A stock rises Monday, outperforms market",119576726,https://images.mktw.net/im-220105/social,MDLZ,MarketWatch,"Shares of Mondelez International Inc. Cl A inched 0.17% higher to $69.16 Monday, on what proved to be an all-around positive trading session for the stock...",https://finnhub.io/api/news?id=e4e4b681f4b508ca27b497e66936f86d2ea81bd57b718b3fca4f39de22370349
company,2023-03-26 20:17:31,Mondelez: Is It Worth The Premium?,119423758,https://static.seekingalpha.com/cdn/s3/uploads/getty_images/1412055651/image_1412055651.jpg?io=getty-c-w1536,MDLZ,SeekingAlpha,We looked at the profitability and the efficiency of Mondelez and its change over time. Read why we have a neutral view on MDLZ stock.,https://finnhub.io/api/news?id=5d3af2531ecf5a8c110ce94d3c7f3dddc113f79470758447ad7b00443919193a
company,2023-03-25 10:30:21,25 Most Valuable Food Companies in The World,119385636,https://s.yimg.com/ny/api/res/1.2/mYFLsWeeVPyqqTLIQjmSpg--/YXBwaWQ9aGlnaGxhbmRlcjt3PTEyMDA7aD03MjM-/https://media.zenfs.com/en/insidermonkey.com/225848da635791be3c33fabd036eb023,MDLZ,Yahoo,"We will take a look at the 25 most valuable food companies in the world. To skip our analysis of the recent market trends, you can go directly to see the 5 Most Valuable Food Companies in the World. The food industry is a vast and intricate system that encompasses all the processes that food […]",https://finnhub.io/api/news?id=5486a6045c9b74c53bb78e7c709392f443d2b074e88fb7743ee059342d76f843
company,2023-03-25 06:44:38,"Dividend Champion, Contender, And Challenger Highlights: Week Of March 26",119385432,https://static.seekingalpha.com/cdn/s3/uploads/getty_images/1072593728/image_1072593728.jpg?io=getty-c-w1536,MDLZ,SeekingAlpha,"A weekly summary of dividend activity for Dividend Champions, Contenders, and Challengers. Read more to see the companies with upcoming ex-dividend dates.",https://finnhub.io/api/news?id=bc86deb2a9ce527dcf25efd490764077e238bc55bb4d8a79b57f634f13bb291a
company,2023-03-24 00:09:00,"Mondelez International Inc. Cl A stock rises Friday, outperforms market",119450995,,MDLZ,MarketWatch,Looking for stock market analysis and research with proves results? Zacks.com offers in-depth financial research with over 30years of proven results.,https://finnhub.io/api/news?id=56ebf8959ebc51ae22f2174be033eb310d11c7aa9836728627b31664753c22f5
company,2023-03-31 18:15:10,Mondelez (MDLZ) Gains But Lags Market: What You Should Know,119545099,https://media.zenfs.com/en/zacks.com/ac90b3d74679f6d01a122aa033d8a9a4,MDLZ,Yahoo,"Mondelez (MDLZ) closed at $69.72 in the latest trading session, marking a +0.2% move from the prior day.",https://finnhub.io/api/news?id=560e2f5ca68ecc88ca809f8473b86fe9167c285187070584be149d7f3fffcb8a
company,2023-03-31 15:26:34,Letter: Toblerone is just getting the Boddingtons treatment,119545101,https://s.yimg.com/cv/apiv2/social/images/yahoo_default_logo-1200x1200.png,MDLZ,Yahoo,"Globalisation and world dominance, particularly when it comes to brands, is out of step with current tastes — consumers want products and brands that are meaningful and have true credentials.  It reminds me of what happened to Boddingtons (the “Cream of Manchester”) when the beer brand was acquired by Interbrew (now AB InBev).  The original Strangeways Brewery was subsequently closed down and the beer was brewed elsewhere.",https://finnhub.io/api/news?id=5b4066cbbbdbb7848152c3d7ab61075ea7d3b9f24d3d67253349096af3577eea
company,2023-03-31 13:11:00,"Mondelez International Inc. Cl A stock rises Friday, still underperforms market",119576722,https://images.mktw.net/im-220105/social,MDLZ,MarketWatch,"Shares of Mondelez International Inc. Cl A inched 0.20% higher to $69.72 Friday, on what proved to be an all-around favorable trading session for the stock...",https://finnhub.io/api/news?id=a43301af3e6e1fa4beccef9132e50eb8fe61713da8897aa19d953331da85ebb4
company,2023-03-30 13:08:00,"Mondelez International Inc. Cl A stock falls Thursday, underperforms market",119576723,https://images.mktw.net/im-220105/social,MDLZ,MarketWatch,"Shares of Mondelez International Inc. Cl A slipped 0.58% to $69.58 Thursday, on what proved to be an all-around favorable trading session for the stock...",https://finnhub.io/api/news?id=61ad2b05267d36d7552c9257bbf7c36e867bb572ecb72ad53e3c1285c2b2e151
company,2023-03-30 04:44:08,"The Zacks Analyst Blog Highlights Hershey's, General Mills, Mondelez and Vital Farms",119515103,https://media.zenfs.com/en/zacks.com/faac065eb52223542a1d3c704ff2b797,MDLZ,Yahoo,"Hershey's, General Mills, Mondelez and Vital Farms are included in this Analyst Blog.",https://finnhub.io/api/news?id=9b7da90aefa6f575f4143ee918be3c0be605e5536ca8bf50315a6e5e1d50f7e7
company,2023-03-30 00:45:49,Mondelez offloads some stake in JDE Peet's at a discount - Bloomberg,119516179,https://s.yimg.com/cv/apiv2/social/images/yahoo_default_logo-1200x1200.png,MDLZ,Yahoo,By Scott Kanowsky,https://finnhub.io/api/news?id=a0ff5a0027e35bdcec6fe781a955a78c8c97512d627aa81ec44b710b52e5b30f
company,2023-03-29 13:08:00,"Mondelez International Inc. Cl A stock rises Wednesday, still underperforms market",119576724,https://images.mktw.net/im-220105/social,MDLZ,MarketWatch,"Shares of Mondelez International Inc. Cl A rose 1.12% to $70.37 Wednesday, on what proved to be an all-around favorable trading session for the stock market,...",https://finnhub.io/api/news?id=1d12d431409584ff83d1d8aeba0d4d65b0615e5866c92cdaa619772ebf4fc490
company,2023-03-29 08:07:12,4 Stocks to Buy on Rebound in March Consumer Confidence,119492293,https://media.zenfs.com/en/zacks.com/3ad5e0e8e428dd3de2c59bd91ad11b86,MDLZ,Yahoo,"Consumer confidence is rebounding, but the crisis is far from over. Investing in consumer staple stocks like The Hershey Company (HSY), General Mills (GIS), Mondelez International (MDLZ) and Vital Farms (VITL) would be a wise decision.",https://finnhub.io/api/news?id=fb1807b0e896f03784afea75d829458c9152d7a1545ccb416d26350a33b794d2
company,2023-03-28 13:08:00,Mondelez International Inc. Cl A stock outperforms market on strong trading day,119576725,https://images.mktw.net/im-220105/social,MDLZ,MarketWatch,"Shares of Mondelez International Inc. Cl A inched 0.62% higher to $69.59 Tuesday, on what proved to be an all-around dismal trading session for the stock...",https://finnhub.io/api/news?id=fd13fe6da09ba15553d5a440a21f97c8b1c276d78077cf39a10eea1248400140
company,2023-04-04 13:08:00,"Mondelez International Inc. Cl A stock rises Tuesday, outperforms market",119619356,https://images.mktw.net/im-220105/social,MDLZ,MarketWatch,"Shares of Mondelez International Inc. Cl A inched 0.43% higher to $70.52 Tuesday, on what proved to be an all-around poor trading session for the stock...",https://finnhub.io/api/news?id=92aaf785914e3f1e3454fd1f12e97397a8b4b4b6ebabe48f57dc62d2840c0b09
company,2023-04-04 09:00:01,How to Boost Your Portfolio with Top Consumer Staples Stocks Set to Beat Earnings,119607678,https://media.zenfs.com/en/zacks.com/c2fdcaac033e049c74f38d188afcc9f9,MDLZ,Yahoo,The Zacks Earnings ESP is a great way to find potential earnings surprises. Why investors should take advantage now.,https://finnhub.io/api/news?id=e86f8fb2e5cc8985e1982dafc55721fc8dbc3688b01e9bebeb41859b6cf7362f
company,2023-04-04 08:15:00,Mondelez Hits a 52-Week High and May Be Far From Finished,119607679,https://s.yimg.com/ny/api/res/1.2/hYjo2r5iLT42RfGa5dX0MQ--/YXBwaWQ9aGlnaGxhbmRlcjt3PTEyMDA7aD04MDA-/https://media.zenfs.com/en/thestreet.com/59dd40461ac243eb1d3927b10e57b125,MDLZ,Yahoo,"Mondelez International Inc. has surprised me to the upside. In my Feb. 16 review of the snack food and beverage producer I was positive on the shares but wrote that Mondelez ""is not scheduled to report earnings until late April, so an upside breakout to new highs may not happen for a while.",https://finnhub.io/api/news?id=869d2ef6e79cf6ebfe07ccd394d8b79347636754a68be41340bccfb30b06fe45
company,2023-04-03 21:47:00,Winners and losers in the food sector from the latest Nielsen numbers,119611824,,MDLZ,Seeking Alpha,Looking for stock market analysis and research with proves results? Zacks.com offers in-depth financial research with over 30years of proven results.,https://finnhub.io/api/news?id=d5c258ac52cead7629fd647b8e5fff4941049c2ba939021ab1c587868f69d8d9
company,2023-04-03 13:08:00,Mondelez International Inc. Cl A stock outperforms competitors on strong trading day,119594232,https://images.mktw.net/im-220105/social,MDLZ,MarketWatch,"Shares of Mondelez International Inc. Cl A inched 0.72% higher to $70.22 Monday, on what proved to be an all-around positive trading session for the stock...",https://finnhub.io/api/news?id=420a97660d1b9c91e3e8519d6825397dcc3a649f542cd8364ca42209712d8d75
company,2023-04-03 09:04:00,Mondelēz Canada Introduces Snackable Mini Version of the Iconic RITZ® Cracker,119599506,https://media.zenfs.com/en/cnwgroup.com/67f306b88bffd1705f747adde4db4ce5,MDLZ,Yahoo,"Today, RITZ – one of Canada's most loved cracker brands – is introducing a new, bite-sized format of its famous cracker. Offering the same smooth and crispy taste in a fun new size, MINI RITZ Crackers were created to suit even more snacking occasions.",https://finnhub.io/api/news?id=b5a073ac4474a1cfaeed6be98e0e6c2f3165d2c7973029a4448cb993a822cd26
company,2023-04-07 09:20:00,2 Warren Buffett Stocks to Buy Hand Over Fist in April,119670184,https://media.zenfs.com/en/motleyfool.com/ee348b6c467b94f28d25e3b7baef35bd,MDLZ,Yahoo,Warren Buffett is one of the greatest investors in history.  The proof is quite simple: He took an obscure textile company in Berkshire Hathaway (NYSE: BRK.A)(NYSE: BRK.B) and transformed it into the largest investment company on the planet.  This is why investors would be wise to consider the dozens of holdings in Berkshire Hathaway's portfolio for their own portfolios.,https://finnhub.io/api/news?id=983b4ad01d30618d71b12f3d95d79747826a3195532e9bd7ebd114ec7671ece0
company,2023-04-07 04:46:00,RBC Capital Sticks to Its Hold Rating for Mondelez International (MDLZ),119684732,,MDLZ,TipRanks,Looking for stock market analysis and research with proves results? Zacks.com offers in-depth financial research with over 30years of proven results.,https://finnhub.io/api/news?id=740bfbf77081ebda2a2dc0dbc11d2f3dadb9ad8474bcef7a7e234064bb3e776c
company,2023-04-07 02:14:01,Tracking Ray Dalio's Bridgewater Associates 13F Portfolio - Q4 2022 Update,119665997,https://static.seekingalpha.com/cdn/s3/uploads/getty_images/1178614043/image_1178614043.jpg?io=getty-c-w1536,MDLZ,SeekingAlpha,Bridgewater Associatesâ 13F portfolio value decreased from ~$19.75B to ~$18.32B this quarter. Click here for a complete analysis.,https://finnhub.io/api/news?id=b6da06f751f199e8537a0c3f931d75ecfad056b9a7fb383dcf9502a1fa84da8a
company,2023-04-07 01:19:00,Tracking Ray Dalio`s Bridgewater Associates 13F Portfolio - Q4 2022 Update,119669688,,MDLZ,Seeking Alpha,Looking for stock market analysis and research with proves results? Zacks.com offers in-depth financial research with over 30years of proven results.,https://finnhub.io/api/news?id=3b55ef2bfb5151b04b3646ad1ae414e69e430b58987698eb41db548e9932732d
company,2023-04-06 13:08:00,"Mondelez International Inc. Cl A stock falls Thursday, underperforms market",119677144,https://images.mktw.net/im-220105/social,MDLZ,MarketWatch,"Shares of Mondelez International Inc. Cl A slid 0.49% to $71.05 Thursday, on what proved to be an all-around positive trading session for the stock market,...",https://finnhub.io/api/news?id=8ca12365996a1659648ea88fd3e29cd54798438a5b737b6c3f116e9c20b00ccf
