category,datetime,headline,id,image,related,source,summary,url
company,2023-05-16 09:53:00,2 Unstoppable Warren Buffett Stocks That Can Turn Sitting Cash Into Growing Wealth,120388475,,MDLZ,Yahoo,"With an investment portfolio worth some $335 billion, Berkshire Hathaway is indisputably one of the largest and most admired investment holding companies on the planet.  Headed up by legendary investor Warren Buffett, the company has a track record of investing in many of the greatest businesses around.  With brands like Cadbury chocolate, Honey Maid graham crackers, and Philadelphia Cream Cheese, the company offers something for everyone's taste.",https://finnhub.io/api/news?id=f0692c7f40de844f2e7d263cd911ab1aedf90442415280158e16a7b56364b50a
company,2023-05-15 18:16:14,Millennials and Gen Z’s rebellion against their parents’ rules is spawning a $181 billion industry that makes everything into a snack,120388477,https://s.yimg.com/ny/api/res/1.2/UvifIDC7tfm.aeS5Q3ouvw--/YXBwaWQ9aGlnaGxhbmRlcjt3PTEyMDA7aD04MDA-/https://media.zenfs.com/en/fortune_175/e07ad87baef80763d7d5ee14045ebe3f,MDLZ,Yahoo,"Forget pasta, rice, and salad for meals. Chips, granola bars, and cookies are becoming breakfast, lunch and dinner for some age groups.",https://finnhub.io/api/news?id=444fd4acc69d7dd79eb2323437dfa6a06e65e02d606895f61ebe1ad75311c8aa
company,2023-05-15 01:41:00,"Peltz`s Trian Fund slashes stakes in Invesco, Disney; exits Sysco",120358350,,MDLZ,Seeking Alpha,Looking for stock market analysis and research with proves results? Zacks.com offers in-depth financial research with over 30years of proven results.,https://finnhub.io/api/news?id=60cc6d0af0503da8d0d135cf7a69477f8fac3c7262dd812ab24d67d7e78ff3b1
company,2023-05-15 00:10:00,Mondelez International Inc. Cl A stock outperforms competitors despite losses on the day,120358513,,MDLZ,MarketWatch,Looking for stock market analysis and research with proves results? Zacks.com offers in-depth financial research with over 30years of proven results.,https://finnhub.io/api/news?id=0f49cd6a396c2e470e734eb2422a51aff5297b9a9f06882f22c5807a43aedade
company,2023-05-14 23:57:00,"Trian Fund buys GE Healthcare, exits Sysco in Q1",120356245,,MDLZ,Thefly.com,Looking for stock market analysis and research with proves results? Zacks.com offers in-depth financial research with over 30years of proven results.,https://finnhub.io/api/news?id=8912565a503a01495cdbf13bfabea1fbf593195c98d1ab4d5f784e312e2171a1
company,2023-05-22 13:09:00,Mondelez International Inc. Cl A stock outperforms competitors despite losses on the day,120509331,https://images.mktw.net/im-220105/social,MDLZ,MarketWatch,"Shares of Mondelez International Inc. Cl A shed 1.54% to $75.87 Monday, on what proved to be an all-around mixed trading session for the stock market, with...",https://finnhub.io/api/news?id=a72a71def190fc02ad671b42a28fddf73601f005ff682acb74e0567e25692b62
company,2023-05-22 06:00:00,Dividend Growth Investing Like Warren Buffett,120480075,https://static.seekingalpha.com/cdn/s3/uploads/getty_images/492444286/image_492444286.jpg?io=getty-c-w1536,MDLZ,SeekingAlpha,3 of Buffett's core investing principles are just as applicable to dividend growth investing as they are to any kind of investing. Read more to see my thoughts.,https://finnhub.io/api/news?id=b696d393bfa32d66c8e174747b1ebe83f5b70bc7d87aa823c50f17284adcb3f4
company,2023-05-19 19:20:33,Lawsuit over Trident 'Original Flavor' gum is dismissed,120458229,https://static.reuters.com/resources/r/?m=02&d=20230519&t=2&i=1633229683&r=LYNXMPEJ4I0XQ,MDLZ,Reuters,"A federal judge in Illinois has dismissed a lawsuit accusing Mondelez International Inc of deceiving consumers into believing its Trident ""Original Flavor"" gum contained real mint.",https://finnhub.io/api/news?id=67c5e5ae6d18aa54d26a88d3419059290302b47b34add71e6805447e2f6e64b5
company,2023-05-19 13:08:00,"Mondelez International Inc. Cl A stock falls Friday, underperforms market",120509332,https://images.mktw.net/im-220105/social,MDLZ,MarketWatch,"Shares of Mondelez International Inc. Cl A dropped 0.27% to $77.06 Friday, on what proved to be an all-around rough trading session for the stock market,...",https://finnhub.io/api/news?id=ec96d4788a3cecf3c630c95d55cd2c102af329da4074e7a65f3f04fc6f3ef927
company,2023-05-19 12:30:00,"Sour, Sweet and So Refreshing: SOUR PATCH KIDS® Launches Lemonade-Inspired Flavors Just in Time for Summer",120458069,https://media.zenfs.com/en/prnewswire.com/c488360327886d3fd5d298a1b8835c67,MDLZ,Yahoo,"SOUR PATCH KIDS is celebrating summer with the launch of Lemonade Fest, a mouth-puckering, lemonade-inspired candy. Now available in stores nationwide, Lemonade Fest is SOUR PATCH KIDS' delicious mix of everyone's favorite sour-then-sweet candy in four unique lemonade-themed flavors: Lemonade, Strawberry Lemonade, Blue Raspberry Lemonade and Cherry Lime Lemonade. From the first sour bite to the sweet finish, SOUR PATCH KIDS Lemonade Fest is sure to make tastebuds tingle.",https://finnhub.io/api/news?id=c98e72d9123346b8d8f8ece55502b053792b40f150168ff44a69fb942ba632a1
company,2023-05-19 02:37:03,Mondelez International Inc. - (MDLZ) Declares $0.38 Dividend,120439334,,MDLZ,Fintel,,https://finnhub.io/api/news?id=1e9eaa898c6aff69bf4c4606251557c0045dab8a1852decaf73fc25e53e2c348
company,2023-05-19 02:30:00,"Dividend Roundup: Johnson & Johnson, Northrop Grumman, JPMorgan and more",120446478,,MDLZ,Seeking Alpha,Looking for stock market analysis and research with proves results? Zacks.com offers in-depth financial research with over 30years of proven results.,https://finnhub.io/api/news?id=e387f9f3a21ed4f2209ea123658b47e1f7dbf813b8dec90b5ba7c16a44dc1a82
company,2023-05-26 13:09:00,Mondelez International Inc. Cl A stock outperforms competitors despite losses on the day,120682871,https://images.mktw.net/im-220105/social,MDLZ,MarketWatch,"Shares of Mondelez International Inc. Cl A shed 0.07% to $75.13 Friday, on what proved to be an all-around great trading session for the stock market, with...",https://finnhub.io/api/news?id=6587a5d27b43e8cb5bc2f572a276b08f6d29245c5e968476ff9b872d383d9727
company,2023-05-25 00:10:00,"Mondelez International Inc. Cl A stock falls Thursday, underperforms market",120573769,,MDLZ,MarketWatch,Looking for stock market analysis and research with proves results? Zacks.com offers in-depth financial research with over 30years of proven results.,https://finnhub.io/api/news?id=94dd2702e5c36ce56f76b5adc24201e5cde3bfa3328df42b9554b1db0148746d
company,2023-05-24 00:10:00,Mondelez International Inc. Cl A stock outperforms market despite losses on the day,120548752,,MDLZ,MarketWatch,Looking for stock market analysis and research with proves results? Zacks.com offers in-depth financial research with over 30years of proven results.,https://finnhub.io/api/news?id=b4f59cc4a03ff825ebf53b6ae17818d548f759a347bb36c6b47da947956848cc
company,2023-05-23 17:50:00,Mondelēz International Advances Its “Snacking Made Right” ESG Goals,120517372,https://media.zenfs.com/en/accesswire.ca/914f63076acb2bb1dbefe329aaeb1893,MDLZ,Yahoo,"CHICAGO, IL / ACCESSWIRE / May 23, 2023 / Mondelēz International Confirms progress in mission to lead the future of more sustainable snackingReaffirms accelerated focus to provide transparent and measurable information for stakeholders on goals, ...",https://finnhub.io/api/news?id=5f23c12e7f44a4a935ebe9294ed912d57707e409a0189075853db76c5d05e54e
company,2023-05-23 13:09:00,Mondelez International Inc. Cl A stock underperforms Tuesday when compared to competitors,120509330,https://images.mktw.net/im-220105/social,MDLZ,MarketWatch,"Shares of Mondelez International Inc. Cl A slid 0.29% to $75.65 Tuesday, on what proved to be an all-around grim trading session for the stock market, with...",https://finnhub.io/api/news?id=a746120a78b83d56a81480f2c9d238d7ddeba6e9181a449fb2f6251a1b4bd34c
company,2023-05-23 06:20:51,Tootsie Roll Industries: Still Expensive Despite Great Performance,120496853,https://static.seekingalpha.com/cdn/s3/uploads/getty_images/516417414/image_516417414.jpg?io=getty-c-w1536,MDLZ,SeekingAlpha,Tootsie Roll Industries has seen significant upside in recent months due to favorable financial results. Click here for my view of TR stock's valuation issues.,https://finnhub.io/api/news?id=2cd72fa39ea7eaff7cb1266d990acb7c5128e36c6920eb158881f2394259c081
company,2023-05-23 02:43:00,Why Mondelez International is a Top 25 Dividend Giant (MDLZ),120504909,,MDLZ,ETF Channel,Looking for stock market analysis and research with proves results? Zacks.com offers in-depth financial research with over 30years of proven results.,https://finnhub.io/api/news?id=f3508b5fa01c5c6cf5ee99c56d46400e1aeae37cb30d9c55aa6b39d8f50e867d
company,2023-05-30 13:09:00,Mondelez International Inc. Cl A stock underperforms Tuesday when compared to competitors,120682868,https://images.mktw.net/im-220105/social,MDLZ,MarketWatch,"Shares of Mondelez International Inc. Cl A slid 3.67% to $72.37 Tuesday, on what proved to be an all-around mixed trading session for the stock market, with...",https://finnhub.io/api/news?id=5cb1eb94ea0e9420e8cfcee51b015143d52bab1e561e93bbea689e613c7d926d
company,2023-05-30 11:07:47,"Mondelez: When Strong Brands Are Properly Managed, Results Follow",120615545,https://static.seekingalpha.com/cdn/s3/uploads/getty_images/1996464/image_1996464.jpg?io=getty-c-w1536,MDLZ,SeekingAlpha,"After delivering strong returns for a very low risk, Mondelez is still trading at fair value. Click here to see our take on MDLZ stock.",https://finnhub.io/api/news?id=931d0428591ad7a883625b1386a4ada5688ef23f5b08baf458ce8e076e851706
company,2023-05-30 08:01:00,P&G stock leads the Dow’s losers as debt-ceiling optimism turns investors away from safety of consumer staples,120674138,https://s.wsj.net/public/resources/MWimages/MW-GP644_MicroS_ZG_20180906154215.jpg,MDLZ,MarketWatch,"Shares of Procter & Gamble Co. slumped 1.6% toward a 2 1/2-month low in midday trading, enough to pace the Dow Jones Industrial Average’s decliners, as...",https://finnhub.io/api/news?id=50f943bed9ba6c015f7d1541620dd8abcb065c0562077411792d69333ee0c24c
company,2023-05-30 01:08:00,"Nvidia, C3.ai, Ford stocks climb while Anheuser-Busch shares fall, and other stocks on the move",120674137,https://images.mktw.net/im-790609/social,MDLZ,MarketWatch,Here are some of the biggest movers on Tuesday as investors returned from a three-day break.,https://finnhub.io/api/news?id=e7f7c076b06df2a9b2ec1b35271ec9b6c22f8567605ca0884996120af6cdacdb
company,2023-05-29 00:18:28,Buy 8 May Buffett Dividend Dogs And Watch 7,120598775,https://static.seekingalpha.com/cdn/s3/uploads/getty_images/1433697677/image_1433697677.jpg?io=getty-c-w1536,MDLZ,SeekingAlpha,Any collection of stocks is more clearly understood when subjected to yield-based analysis. Read why this Buffett/Berkshire batch is perfect for the dogcatcher process.,https://finnhub.io/api/news?id=ab57833b69840002ea3e392daae8d21028f4876036a78fed9150e04d96f8dcc5
company,2023-05-27 08:00:00,"Gen Z and millennials aren’t just rebelling by swapping meals for snacks—they want something ‘experiential’ for TikTok, Oreo’s analytics chief says",120584892,https://s.yimg.com/ny/api/res/1.2/AYGehZlqGNaDN8ROuX7UFA--/YXBwaWQ9aGlnaGxhbmRlcjt3PTEyMDA7aD04MDA-/https://media.zenfs.com/en/fortune_175/be2dbc97b83b6a4280e4939c543d44ee,MDLZ,Yahoo,"These generations aren't only ""big snackers,"" says Mondelez's Nick Graham. “Their needs from snacking are much more diverse.”",https://finnhub.io/api/news?id=074e48f32643358b052bc75e5c6276308dc7ea3cf59e91bfd84af29960d1270b
company,2023-06-02 12:41:00,"Mondelez International Inc. Cl A stock rises Friday, still underperforms market",120682865,https://images.mktw.net/im-220105/social,MDLZ,MarketWatch,"Shares of Mondelez International Inc. Cl A inched 0.90% higher to $74.27 Friday, on what proved to be an all-around great trading session for the stock...",https://finnhub.io/api/news?id=14fe33b50b969d41131a835e26339cf623c1f7c6e96bfc90a3d9dd7b77bdfeb9
company,2023-06-02 08:26:50,3 Millionaire-Making Sleeper Stocks to Buy Before Investors Wake Up,120771636,https://media.zenfs.com/en/investorplace_417/250e3866b147215245e1d4618e1e4179,MDLZ,Yahoo,"Identifying undervalued sleeper stocks will always be a great way to find strong returns in the market. As with all investments, you can only get out what you put in; reaching a million will take time. That said, the three names below can help you in your journey toward millionaire status. The market is again in flux. Lots of investors have realized strong returns in tech in 2023. Those who invested heavily in Nvidia (NASDAQ:NVDA) and other AI-linked shares are surely happy after Nvidia’s strong",https://finnhub.io/api/news?id=af2215dc84f8409b8f7a356b1ebab86206b29eaa2c51eefb8f86d8313f0454a2
company,2023-06-01 13:09:00,"Mondelez International Inc. Cl A stock rises Thursday, still underperforms market",120682866,https://images.mktw.net/im-220105/social,MDLZ,MarketWatch,"Shares of Mondelez International Inc. Cl A inched 0.27% higher to $73.61 Thursday, on what proved to be an all-around positive trading session for the stock...",https://finnhub.io/api/news?id=860c832f5276e5cb0eeaf346b73d401304eb054e143d0b0cc28457ed110b9379
company,2023-06-01 09:53:53,10 Stocks Jim Cramer Thinks Can Weather a Debt Default,120644332,https://media.zenfs.com/en/insidermonkey.com/d246300e28cb36eea299b67b3e75789d,MDLZ,Yahoo,"In this article, we will be taking a look at 10 stocks Cramer thinks can weather a debt default. To explore similar stocks, you can go see 5 Stocks Cramer Thinks Can Weather a Debt Default. “When The Market Throws a Sale, I Tell You To Do Some Buying” On May 12, Jim Cramer noted […]",https://finnhub.io/api/news?id=a3d48960ab5b23c3485fe00f5416e417e14f91883906fba864f9703f13d02ebb
company,2023-06-01 06:45:00,MDLZ July 14th Options Begin Trading,120648645,,MDLZ,Stock Options Channel,Looking for stock market analysis and research with proves results? Zacks.com offers in-depth financial research with over 30years of proven results.,https://finnhub.io/api/news?id=a3a403b83460ebe310bcf7f6be57db0505fd2106ea56fae2aa05ddb7380cb328
company,2023-06-01 03:47:00,MamaMancini's appoints Lauren Sella as CMO,120646235,,MDLZ,Thefly.com,Looking for stock market analysis and research with proves results? Zacks.com offers in-depth financial research with over 30years of proven results.,https://finnhub.io/api/news?id=355dad6ed6d08370e5e499ef77bc7a5fc376329d3712d264ec71afd173241315
company,2023-05-31 18:15:04,Mondelez (MDLZ) Gains As Market Dips: What You Should Know,120645973,https://media.zenfs.com/en/zacks.com/2f0d6efdd8740952a371c97ddea6e926,MDLZ,Yahoo,"In the latest trading session, Mondelez (MDLZ) closed at $73.41, marking a +1.44% move from the previous day.",https://finnhub.io/api/news?id=0bda1ab64d9abec76957882dd558c5842bb2137d936ad76304251e8e17ef1aa6
company,2023-05-31 13:09:00,Mondelez International Inc. Cl A stock outperforms competitors on strong trading day,120682867,https://images.mktw.net/im-220105/social,MDLZ,MarketWatch,"Shares of Mondelez International Inc. Cl A advanced 1.44% to $73.41 Wednesday, on what proved to be an all-around grim trading session for the stock market,...",https://finnhub.io/api/news?id=b3794b99841f3dc0f913dc1525336cfaa5732a27fe79e691b16d68229a4139a6
company,2023-06-07 12:41:00,"Mondelez International Inc. Cl A stock falls Wednesday, underperforms market",120875058,https://images.mktw.net/im-220105/social,MDLZ,MarketWatch,"Shares of Mondelez International Inc. Cl A slid 1.49% to $72.19 Wednesday, on what proved to be an all-around mixed trading session for the stock market,...",https://finnhub.io/api/news?id=387edd94dfb54d3b21dc00765062ee3d6be615f1888e682cfd324c8d2a37db16
company,2023-06-06 18:15:04,Mondelez (MDLZ) Stock Sinks As Market Gains: What You Should Know,120742070,https://media.zenfs.com/en/zacks.com/a41b81fe729c761f3f94f42ff348f70c,MDLZ,Yahoo,"Mondelez (MDLZ) closed at $73.28 in the latest trading session, marking a -1.36% move from the prior day.",https://finnhub.io/api/news?id=1b317cf44da0bec67e8ebae44b12c20c2111f2e8a8336a420abe1fd69515e0c8
company,2023-06-06 12:41:00,"Mondelez International Inc. Cl A stock falls Tuesday, underperforms market",120759320,https://images.mktw.net/im-220105/social,MDLZ,MarketWatch,"Shares of Mondelez International Inc. Cl A slid 1.36% to $73.28 Tuesday, on what proved to be an all-around great trading session for the stock market, with...",https://finnhub.io/api/news?id=475bc22d5b8e165df0de42106e1e82ffe69246bbc990fbe03478c0506e64013b
company,2023-06-06 04:27:00,Premium Gifting Perfection: Cadbury's Limited Edition Dairy Milk Laser-Engraved Bars Sell Out within Two Weeks,120738616,,MDLZ,PR Newswire,Looking for stock market analysis and research with proves results? Zacks.com offers in-depth financial research with over 30years of proven results.,https://finnhub.io/api/news?id=7818cd20d3144efb64d6d1f9778188afae7153cfa3f9566e5a553985d1fa1f4b
company,2023-06-05 12:41:00,Mondelez International Inc. Cl A stock outperforms competitors on strong trading day,120719111,https://images.mktw.net/im-220105/social,MDLZ,MarketWatch,"Shares of Mondelez International Inc. Cl A inched 0.03% higher to $74.29 Monday, on what proved to be an all-around grim trading session for the stock...",https://finnhub.io/api/news?id=e366fbea7d838d8bf0e83cbe978954e9650c6e48aff0f99bcae12f30b60e6a3a
company,2023-06-05 02:48:00,Big Companies Keep Raising Prices: 7 ‘Strong Buy’ Dividend Stocks Offer Inflation Protection,120712327,,MDLZ,247WallSt,Looking for stock market analysis and research with proves results? Zacks.com offers in-depth financial research with over 30years of proven results.,https://finnhub.io/api/news?id=da7017588f7a86b3b773132136608240d24a952b855486184465fcc84cda873d
company,2023-06-09 12:41:00,"Mondelez International Inc. Cl A stock falls Friday, underperforms market",120875056,https://images.mktw.net/im-220105/social,MDLZ,MarketWatch,"Shares of Mondelez International Inc. Cl A slipped 0.16% to $72.97 Friday, on what proved to be an all-around great trading session for the stock market,...",https://finnhub.io/api/news?id=5eef0ad49e5f22b1cb8853b99356cf0c8ab95bc0d4887272f9934d62d7fd90ce
company,2023-06-09 06:55:05,Mondelez: One Of My Top Picks In The Consumer Staples Sector,120792850,https://media.gettyimages.com/id/1397280307/nl/foto/top-view-of-homemade-chocolate-chips-cookies-on-a-rustic-wooden-table.jpg?b=1&s=170667a&w=0&k=20&c=yEC4fhdYJOVFFFAW5HwOFDZRwZ_jUDjf8J7H8xXit1U=,MDLZ,SeekingAlpha,"While the shares are not cheap, I believe Mondelez deserves to trade at a premium and calculate a target price of $83. See why we believe MDLZ stock is a buy.",https://finnhub.io/api/news?id=e2e3139b2560f8691260121416fdaa507c0feed10c562edc6e0db71b8f34e7e2
company,2023-06-08 12:41:00,"Mondelez International Inc. Cl A stock rises Thursday, outperforms market",120875057,https://images.mktw.net/im-220105/social,MDLZ,MarketWatch,"Shares of Mondelez International Inc. Cl A rallied 1.25% to $73.09 Thursday, on what proved to be an all-around favorable trading session for the stock...",https://finnhub.io/api/news?id=8fba70a7c8df1d48e70651cb223943b0fcb2fd8eb25c08dfb49e29b0c34c8b4b
company,2023-06-08 09:40:00,Mondelez (MDLZ) Gains From Core Categories Amid Cost Woes,120774980,https://media.zenfs.com/en/zacks.com/c421504ada8f1eaaf77da24955bedee4,MDLZ,Yahoo,Mondelez (MDLZ) benefits from its core chocolate and biscuit categories amid global cost inflation.,https://finnhub.io/api/news?id=10e3421525245efd3baef12fa070009b1ac5cf5385443a3c38833382baa54515
company,2023-06-08 06:39:00,July 28th Options Now Available For Mondelez International (MDLZ),120777894,,MDLZ,Stock Options Channel,Looking for stock market analysis and research with proves results? Zacks.com offers in-depth financial research with over 30years of proven results.,https://finnhub.io/api/news?id=28f09bab833823efe28139e3ed7d384fae610c49003032d42820582f46e25294
company,2023-06-08 06:37:00,Fed Putting Brakes On Rate Hikes Could Be Godsend For These Dividend-Paying Stocks — What You Need To Know,120795010,,MDLZ,Benzinga,Looking for stock market analysis and research with proves results? Zacks.com offers in-depth financial research with over 30years of proven results.,https://finnhub.io/api/news?id=eb9e47f6ab772b5602326feeef4dcd1743a46ebfc97eb5bc56269bcbbb4eb734
company,2023-06-15 12:41:00,"Mondelez International Inc. Cl A stock rises Thursday, still underperforms market",120938723,https://images.mktw.net/im-220105/social,MDLZ,MarketWatch,"Shares of Mondelez International Inc. Cl A inched 0.45% higher to $73.46 Thursday, on what proved to be an all-around favorable trading session for the stock...",https://finnhub.io/api/news?id=bd57d85f9b16c774a3c2a131097ce2de1c8da6de1b77af16bc5e8b1038bd0fba
company,2023-06-15 12:15:08,UPDATE 1-Mondelez plans to separate Russia operations by year-end,120889751,https://s.yimg.com/cv/apiv2/social/images/yahoo_default_logo-1200x1200.png,MDLZ,Yahoo,"Oreo-maker Mondelez International said on Thursday it has scaled down operations in Russia and plans to make it a stand-alone business with a self-sufficient supply chain before the end of the year.  The Chicago-based snack maker, which has faced a widening corporate boycott in the Nordic region over its presence in Russia, said it has discontinued new capital investments, product launches and advertising media spending in the country.  ""As a result of these actions...overall volumes have declined double digits and both our import volumes and market share have significantly decreased,"" the company said in a statement.",https://finnhub.io/api/news?id=4414af810f1c2165018287866254cc0297684518450d944074645053fa750fe8
company,2023-06-15 07:53:00,Mondelez to separate Russia business by year-end,120915017,,MDLZ,Seeking Alpha,Looking for stock market analysis and research with proves results? Zacks.com offers in-depth financial research with over 30years of proven results.,https://finnhub.io/api/news?id=6b849c08afa9fb9f169fc25c9f9a23f81c25ef32323dcb07f0112f2d0d1e5d2d
company,2023-06-14 12:41:00,Mondelez International Inc. Cl A stock outperforms market on strong trading day,120875053,https://images.mktw.net/im-220105/social,MDLZ,MarketWatch,"Shares of Mondelez International Inc. Cl A inched 0.56% higher to $73.13 Wednesday, on what proved to be an all-around mixed trading session for the stock...",https://finnhub.io/api/news?id=4b453fb3cadeb14295c461b84806ec76e6b3fb3a1f816df3064a220bdc59e473
company,2023-06-14 06:13:00,Packaged food stocks will face tricky sales growth comparisons after a year of inflation,120866648,,MDLZ,Seeking Alpha,Looking for stock market analysis and research with proves results? Zacks.com offers in-depth financial research with over 30years of proven results.,https://finnhub.io/api/news?id=c0d6eb38bc30634867478413e917a6d2388d34440e368571e89dc2ef8840cc5f
company,2023-06-14 00:41:00,Analysts Offer Insights on Consumer Goods Companies: Celsius Holdings (CELH) and Mondelez International (MDLZ),120871285,,MDLZ,TipRanks,Looking for stock market analysis and research with proves results? Zacks.com offers in-depth financial research with over 30years of proven results.,https://finnhub.io/api/news?id=25a250427e1146473c49e78b599d4358d1f5ece1022ec4f7914d37ce9f8bce5d
company,2023-06-13 13:41:00,"Mondelez International Inc. Cl A stock falls Tuesday, underperforms market",120875054,https://images.mktw.net/im-220105/social,MDLZ,MarketWatch,"Shares of Mondelez International Inc. Cl A slumped 0.12% to $72.72 Tuesday, on what proved to be an all-around great trading session for the stock market,...",https://finnhub.io/api/news?id=5d67ec646254a1b76366ffacec07decde8018e1d340a2df7426e33341853fd1a
company,2023-06-13 12:59:23,UPDATE 1-Belgian supermarket Colruyt annual profit drops on cost hikes,120846869,https://s.yimg.com/cv/apiv2/social/images/yahoo_default_logo-1200x1200.png,MDLZ,Yahoo,"Belgian discount supermarket chain Colruyt on Tuesday reported lower annual earnings, citing inflation and substantial cost increases that it has been unable to fully pass on to customers.  Under its ""lower price"" model, Colruyt said it can only pass on higher costs if all its competitors had raised prices, as the grocery sector struggles with elevated inflation.  Gross profit margin decreased to 27.1% of revenue in the fiscal year ended March 31 from 27.4% a year ago, the company said in a statement.",https://finnhub.io/api/news?id=013027a3a9c6c99d6d1d48e6f5bbe73dc2d72ea6f0da0e44cf4072c08349c63e
company,2023-06-12 15:12:00,Top Scandinavian companies are boycotting the maker of Oreo and Toblerone for its business in Russia,120839956,https://media.zenfs.com/en/quartz.com/5053110d6030118b8f8a5d9769c4ceaf,MDLZ,Yahoo,Mondelez International—the global manufacturer of a range of snacks including Oreo and Toblerone—is facing a growing boycott across northern Europe for its decision to remain in Russia.,https://finnhub.io/api/news?id=c0bc9660fd4ab9407fe1642ffc89165e36e867afde071ae5287ca645344c3b1a
company,2023-06-12 12:58:33,UPDATE 1-Oreo-maker Mondelez faces Nordic backlash over Russia business,120831313,https://s.yimg.com/cv/apiv2/social/images/yahoo_default_logo-1200x1200.png,MDLZ,Yahoo,"Mondelez International , facing a widening corporate boycott in the Nordic region over its presence in Russia will meet with Norwegian government representatives this week in the hope of protecting the group's local business.  Airlines SAS and Norwegian Air, railway group SJ, hotel chain Strawberry, retailer Elkjop, shipping group Fjord Line and the Norwegian Football Association were among those announcing in recent days that they would stop selling Mondelez products.",https://finnhub.io/api/news?id=1b8e86702faba9c20cd823b44cb1f883c513451a4861c4cc7aaada13ffc94dc1
