category,datetime,headline,id,image,related,source,summary,url
company,2023-06-12 12:54:00,"Paccar Inc. stock rises Monday, outperforms market",120876552,https://images.mktw.net/im-220105/social,PCAR,MarketWatch,"Shares of Paccar Inc. rallied 1.21% to $77.76 Monday, on what proved to be an all-around positive trading session for the stock market, with the S&P 500...",https://finnhub.io/api/news?id=9d818fc97fa8d69e7347fece308830d937d4553b0a4086512b3f62e904fda6b0
company,2023-06-19 15:28:11,Paccar recalls Peterbilt trucks after 6 under hood fires,120949658,https://media.zenfs.com/en/freightwaves_373/7b48c23ba00837b0c88f87e2776bf99d,PCAR,Yahoo,"Paccar Inc. is recalling 4,914 Peterbilt Model 579 Class 8 trucks because a misplaced fastener can chafe alternator insulation to catch fire. The post Paccar recalls Peterbilt trucks after 6 under hood fires appeared first on FreightWaves.",https://finnhub.io/api/news?id=518ab0beded1a24951a9258f5afbf8be4eb80b82dfac6f6c99910cf41d89d8a0
company,2023-06-16 12:53:00,"Paccar Inc. stock falls Friday, underperforms market",120937679,https://images.mktw.net/im-220105/social,PCAR,MarketWatch,"Shares of Paccar Inc. sank 0.57% to $78.63 Friday, on what proved to be an all-around rough trading session for the stock market, with the S&P 500 Index...",https://finnhub.io/api/news?id=968456d77aa2fd6eb3c5c24f3c3c6f36d315e665405b8fa47e4c92c91a67f8ec
company,2023-06-23 12:53:00,"Paccar Inc. stock rises Friday, outperforms market",121028023,https://images.mktw.net/im-220105/social,PCAR,MarketWatch,"Shares of Paccar Inc. inched 0.42% higher to $78.44 Friday, on what proved to be an all-around rough trading session for the stock market, with the S&P 500...",https://finnhub.io/api/news?id=8d0f1af5e89f83f4688b651fe4b7adcba1e5286724cbb39515c38ac0fb68e92a
company,2023-06-23 07:33:00,Here's How Much $100 Invested In PACCAR 20 Years Ago Would Be Worth Today,121020617,,PCAR,Benzinga,Looking for stock market analysis and research with proves results? Zacks.com offers in-depth financial research with over 30years of proven results.,https://finnhub.io/api/news?id=3d77461e4fcf11f8032209b5f5104a287605c67a70e9390f3db4f9888df2cb88
company,2023-06-22 16:47:43,Billionaire Investor Who Returned 51% in 2022 is Selling These 12 Stocks in 2023,121009490,https://media.zenfs.com/en/insidermonkey.com/c87e024ee8754d1f1d4fdd0fed65cda1,PCAR,Yahoo,"In this article, we discuss 12 stocks billionaire Chris Rokos is selling in 2023. If you want to skip our detailed analysis of Rokos’ investment philosophy and portfolio construction, go directly to the Billionaire Chris Rokos is Selling These 5 Stocks in 2023. Rokos Capital Management, led by billionaire trader Chris Rokos, made headlines earlier […]",https://finnhub.io/api/news?id=189615385b1527bc44dcf9e2c617d7668a35104c78ab429526e6c851b787eee7
company,2023-06-22 12:53:00,"Paccar Inc. stock falls Thursday, underperforms market",121028024,https://images.mktw.net/im-220105/social,PCAR,MarketWatch,"Shares of Paccar Inc. slid 0.52% to $78.11 Thursday, on what proved to be an all-around mixed trading session for the stock market, with the S&P 500 Index...",https://finnhub.io/api/news?id=010525a7b3f620f4f221898802b7808a0fae6c15b460069752e0691c6d531a88
company,2023-06-21 21:09:00,NHTSA proposes automatic emergency braking standards for heavy vehicles,121001265,,PCAR,Thefly.com,Looking for stock market analysis and research with proves results? Zacks.com offers in-depth financial research with over 30years of proven results.,https://finnhub.io/api/news?id=c9db3e65a049f902337a63ca0bea95c4fcb2696ac7b13b3e882c7c465766d5a5
company,2023-06-21 12:53:00,"Paccar Inc. stock rises Wednesday, outperforms market",120992429,https://images.mktw.net/im-220105/social,PCAR,MarketWatch,"Shares of Paccar Inc. inched 0.96% higher to $78.52 Wednesday, on what proved to be an all-around dismal trading session for the stock market, with the S&P...",https://finnhub.io/api/news?id=56b7e3543d4368863ebf48ddfe98596a3e30e0e9f7184658c71f7d7dcd933dfa
company,2023-06-20 23:39:00,"PACCAR Now #189 Largest Company, Surpassing Hess",120987085,,PCAR,The Online Investor,Looking for stock market analysis and research with proves results? Zacks.com offers in-depth financial research with over 30years of proven results.,https://finnhub.io/api/news?id=88a854957f59d5ea3d626936b5fa600f0c92709ada10225c6188375add169b8b
company,2023-06-20 12:53:00,"Paccar Inc. stock falls Tuesday, underperforms market",120966311,https://images.mktw.net/im-220105/social,PCAR,MarketWatch,"Shares of Paccar Inc. slid 1.09% to $77.77 Tuesday, on what proved to be an all-around poor trading session for the stock market, with the S&P 500 Index...",https://finnhub.io/api/news?id=c1efb6626255a91b8265e340c4efc513c54984c870982608e11b0c51dca2a9dc
company,2023-06-27 18:15:20,Paccar (PCAR) Outpaces Stock Market Gains: What You Should Know,121085388,https://media.zenfs.com/en/zacks.com/737ffb82e07dc8bffb77e72d153c91f2,PCAR,Yahoo,"In the latest trading session, Paccar (PCAR) closed at $80.36, marking a +1.45% move from the previous day.",https://finnhub.io/api/news?id=e6e620d0c05d6bba69d96c5f9f7a08741d9503fd6955fc6d8ea19679d1a4576f
company,2023-06-27 12:52:00,"Paccar Inc. stock rises Tuesday, outperforms market",121081471,https://images.mktw.net/im-220105/social,PCAR,MarketWatch,"Shares of Paccar Inc. rallied 1.45% to $80.36 Tuesday, on what proved to be an all-around great trading session for the stock market, with the S&P 500 Index...",https://finnhub.io/api/news?id=9227ac911d688f54ee0c19369df65b1984a57a34dce566f51575929855fb1e3f
company,2023-06-26 12:52:00,"Paccar Inc. stock rises Monday, outperforms market",121059790,https://images.mktw.net/im-220105/social,PCAR,MarketWatch,"Shares of Paccar Inc. inched 0.98% higher to $79.21 Monday, on what proved to be an all-around rough trading session for the stock market, with the S&P 500...",https://finnhub.io/api/news?id=8b9d9908beb08915169ae834ba54d55ac554ad15fb606a81ebb5771d8fb9e345
company,2023-06-24 08:00:43,S&P 500 Giants Lead Stocks Near Buy Points; Can They Hold Up Amid The Market Pullback?,121032852,https://media.zenfs.com/en/ibd.com/aa7d2174929e3dd5d9c282a49e174428,PCAR,Yahoo,S&P 500 components Paccar and Parker Hannifin lead a group of five stocks trading right around entry points.,https://finnhub.io/api/news?id=f680ac0697eeaa707cbc2568b7f06f5c05335b33dba834383455199438c6390e
company,2023-06-30 13:42:05,Paccar : ESG Report,121153076,,PCAR,Finnhub,"ESG Presentation
      
    
    
      
        
          Forward Looking / Cautionary Statements
        
        
          This presentation may contain statements that are...",https://finnhub.io/api/news?id=91eddccef764f93bb637f961d367ff7931aa8db9d884ff0690dfc79c6c961f9b
company,2023-06-30 12:52:00,"Paccar Inc. stock rises Friday, outperforms market",121168922,https://images.mktw.net/im-220105/social,PCAR,MarketWatch,"Shares of Paccar Inc. rallied 1.26% to $83.65 Friday, on what proved to be an all-around great trading session for the stock market, with the S&P 500 Index...",https://finnhub.io/api/news?id=ea4652a85368fc6bf35575d9cfb56758a26e16418686787b098af385f6d328ff
company,2023-06-30 09:00:06,Why Investors Need to Take Advantage of These 2 Auto-Tires-Trucks Stocks Now,121141404,https://media.zenfs.com/en/zacks.com/3496571a811465d910e99bd171c71a94,PCAR,Yahoo,Finding stocks expected to beat quarterly earnings estimates becomes an easier task with our Zacks Earnings ESP.,https://finnhub.io/api/news?id=e51b32a7c67b43d613536c042382c308e70dcd37974b3855079bff50c3f95b7c
company,2023-06-29 21:47:00,How Is The Market Feeling About PACCAR?,121155235,,PCAR,Benzinga,Looking for stock market analysis and research with proves results? Zacks.com offers in-depth financial research with over 30years of proven results.,https://finnhub.io/api/news?id=33a75473243abd4fd4e4738ffbefc0c5877b81ee5e4657458c81b291d2b70dd9
company,2023-06-29 12:52:00,"Paccar Inc. stock rises Thursday, outperforms market",121125559,https://images.mktw.net/im-220105/social,PCAR,MarketWatch,"Shares of Paccar Inc. advanced 2.39% to $82.61 Thursday, on what proved to be an all-around positive trading session for the stock market, with the S&P 500...",https://finnhub.io/api/news?id=06917d085f8eac59292980eec5c3d1072f31b25964f35f959f48ee4fda236a1e
company,2023-06-29 04:55:00,Early notable gainers among liquid option names on June 29th,121113820,,PCAR,Thefly.com,Looking for stock market analysis and research with proves results? Zacks.com offers in-depth financial research with over 30years of proven results.,https://finnhub.io/api/news?id=27fbff3224384ba2aef7d60e55b7701f1e7ac20a3a805600876d11fdc7299daa
company,2023-06-28 12:52:00,"Paccar Inc. stock rises Wednesday, outperforms market",121125561,https://images.mktw.net/im-220105/social,PCAR,MarketWatch,"Shares of Paccar Inc. inched 0.40% higher to $80.68 Wednesday, on what proved to be an all-around poor trading session for the stock market, with the S&P 500...",https://finnhub.io/api/news?id=02dc3d92d0434a2e84bb7fab2cb5a2c710d61799c840f526475e59d095ceb11d
company,2023-06-28 09:40:04,Are You a Value Investor? This 1 Stock Could Be the Perfect Pick,121099737,https://media.zenfs.com/en/zacks.com/2a50596f066181e48e4ae0ad6be00462,PCAR,Yahoo,"Whether you're a value, growth, or momentum investor, finding strong stocks becomes easier with the Zacks Style Scores, a top feature of the Zacks Premium research service.",https://finnhub.io/api/news?id=c19f60f5867e8ec5e7161ecd26f4a3bb9793f04453d275f3c1f6cc9702ac2c96
company,2023-07-05 12:52:00,"Paccar Inc. stock falls Wednesday, underperforms market",121277373,https://images.mktw.net/im-220105/social,PCAR,MarketWatch,"Shares of Paccar Inc. slid 1.63% to $82.28 Wednesday, on what proved to be an all-around rough trading session for the stock market, with the S&P 500 Index...",https://finnhub.io/api/news?id=c03a62a174fe72b40af8f7a99b38017722256f018f4a6d7d4107bb8233b9936d
company,2023-07-03 12:45:06,"Is Paccar (PCAR) a Solid Growth Stock? 3 Reasons to Think ""Yes""",121194454,https://media.zenfs.com/en/zacks.com/1154d43aaeb65735a640003549116295,PCAR,Yahoo,Paccar (PCAR) could produce exceptional returns because of its solid growth attributes.,https://finnhub.io/api/news?id=efd3fd9288fff5bd6b3b45cb97efcef34199112fd623c22b29ca53fdde7ac90c
company,2023-07-03 09:40:12,Are Investors Undervaluing PACCAR (PCAR) Right Now?,121186281,https://media.zenfs.com/en/zacks.com/f541c90e0d995722d10914cb76a7c653,PCAR,Yahoo,"Here at Zacks, our focus is on the proven Zacks Rank system, which emphasizes earnings estimates and estimate revisions to find great stocks. Nevertheless, we are always paying attention to the latest value, growth, and momentum trends to underscore strong picks.",https://finnhub.io/api/news?id=8251ab63714f164f687498e8c747938a3427ae5e1dbd960ffc0dcab5aa15ef00
company,2023-07-07 12:52:00,"Paccar Inc. stock rises Friday, outperforms market",121277370,https://images.mktw.net/im-220105/social,PCAR,MarketWatch,"Shares of Paccar Inc. inched 0.60% higher to $82.31 Friday, on what proved to be an all-around rough trading session for the stock market, with the S&P 500...",https://finnhub.io/api/news?id=ab6ee5454f3bc632b733ae116401aa61926b10febefd8d841ba657a74e94b01d
company,2023-07-07 12:00:07,Paccar (PCAR) is a Great Momentum Stock: Should You Buy?,121261937,https://media.zenfs.com/en/zacks.com/023168c7ea091c342492be3899b280af,PCAR,Yahoo,Does Paccar (PCAR) have what it takes to be a top stock pick for momentum investors? Let's find out.,https://finnhub.io/api/news?id=8423af261289bf09958ebbdb6eb419caaa71797e55debda5141d097c18ed5957
company,2023-07-06 17:05:00,Truck makers pledge to comply with new California rules phasing out gas-powered vehicles,121276540,https://images.mktw.net/im-813055/social,PCAR,MarketWatch,"California is trying to rid itself of fossil fuels, passing new rules in recent years to phase out gas-powered cars, trucks, trains and lawn equipment in the...",https://finnhub.io/api/news?id=adaf948346e6d207c1d4401dcde79c87229b6468eaa185b955e43d20f35ab1e1
company,2023-07-06 12:52:00,Paccar Inc. stock outperforms market despite losses on the day,121277372,https://images.mktw.net/im-220105/social,PCAR,MarketWatch,"Shares of Paccar Inc. dropped 0.56% to $81.82 Thursday, on what proved to be an all-around dismal trading session for the stock market, with the S&P 500...",https://finnhub.io/api/news?id=57fa1f0d100cf15c76311d7bb0d2b687d0e3e49ed4b22d43fe9aef2f498fc612
company,2023-07-06 02:40:00,Class 8 truck orders rise in June but stay at seasonally soft level,121233023,,PCAR,Seeking Alpha,Looking for stock market analysis and research with proves results? Zacks.com offers in-depth financial research with over 30years of proven results.,https://finnhub.io/api/news?id=80e45bb4a2eecd740a14c2addbcc0c593ee43f009816a353647ad40799fec1aa
company,2023-07-13 12:52:00,"Paccar Inc. stock falls Thursday, underperforms market",121432126,https://images.mktw.net/im-220105/social,PCAR,MarketWatch,"Shares of Paccar Inc. slid 0.53% to $85.77 Thursday, on what proved to be an all-around favorable trading session for the stock market, with the S&P 500...",https://finnhub.io/api/news?id=9dee0c364a304905d8ca8d3f181dff355fa6291bc969dc428cdb120818d23320
company,2023-07-13 09:32:00,2 Auto Stocks With Recent Dividend Hikes Worth Buying,121363016,https://media.zenfs.com/en/zacks.com/03db7d1a0d9d1c41c545bc18e945266e,PCAR,Yahoo,"PACCAR (PCAR) and Cummins (CMI) raise their quarterly payouts by 8% and 7%, respectively. Backed by solid prospects and investor-friendly movies, both stocks are worth placing your bets on.",https://finnhub.io/api/news?id=ad70a7347504a04770097cf74c254262f593f98625c50470e136b1799208d0cf
company,2023-07-12 18:15:18,Paccar (PCAR) Gains But Lags Market: What You Should Know,121350369,https://media.zenfs.com/en/zacks.com/d7dcbe11345e3f8e5e71e6827fe3c4c9,PCAR,Yahoo,"Paccar (PCAR) closed at $86.23 in the latest trading session, marking a +0.12% move from the prior day.",https://finnhub.io/api/news?id=83381d732a87209b53e4b0597720e27eee67972378f35491169f73cf2ed17f5c
company,2023-07-12 12:52:00,"Paccar Inc. stock rises Wednesday, still underperforms market",121347388,https://images.mktw.net/im-220105/social,PCAR,MarketWatch,"Shares of Paccar Inc. inched 0.12% higher to $86.23 Wednesday, on what proved to be an all-around great trading session for the stock market, with the S&P...",https://finnhub.io/api/news?id=2dcdb4c798ad658b2c7ce86200abf70b90367c53271b6b09df4c347882155426
company,2023-07-12 12:10:11,Will Paccar (PCAR) Beat Estimates Again in Its Next Earnings Report?,121340917,https://media.zenfs.com/en/zacks.com/e8e4b0344809eaac6d73c9fd25fd180a,PCAR,Yahoo,Paccar (PCAR) has an impressive earnings surprise history and currently possesses the right combination of the two key ingredients for a likely beat in its next quarterly report.,https://finnhub.io/api/news?id=8af2fd4ddce1aafb31400019aa84ea17828d358bf5d271328a870cfc62a28204
company,2023-07-12 06:36:05,Paccar : Aviso aos Acionistas,121333767,,PCAR,Finnhub,"INFORMAÇÃO PÚBLICA - PUBLIC INFORMATION
        
        
          Todas as datas estão definidas como DD/MM/AAAAKindly be aware that date format is DD/MM/YYYY
       ...",https://finnhub.io/api/news?id=11f7a778d6d6e0fe80dfebd97e9ae501014d050593e0ac822f353bdf7940c97e
company,2023-07-11 12:52:00,"Paccar Inc. stock rises Tuesday, outperforms market",121347389,https://images.mktw.net/im-220105/social,PCAR,MarketWatch,"Shares of Paccar Inc. rose 1.80% to $86.13 Tuesday, on what proved to be an all-around positive trading session for the stock market, with the S&P 500 Index...",https://finnhub.io/api/news?id=50e55075e8cef349d707dc4850179b234aa5c43730dd6f5428a46517448c39bc
company,2023-07-11 10:28:00,PACCAR Increases Regular Quarterly Dividend,121309441,https://s.yimg.com/cv/apiv2/social/images/yahoo_default_logo-1200x1200.png,PCAR,Yahoo,"BELLEVUE, Wash., July 11, 2023--PACCAR Inc’s Board of Directors today approved an increase of 8% in the regular quarterly cash dividend from twenty-five cents ($.25) per share to twenty-seven cents ($.27) per share. The dividend will be payable on September 7, 2023, to stockholders of record at the close of business on August 17, 2023.",https://finnhub.io/api/news?id=70fd68c87f4f8f7e80190f39c5dbb74be55d756495b4243a194d5e7e37c0031d
company,2023-07-11 09:50:07,Here's Why Paccar (PCAR) is a Strong Momentum Stock,121310369,https://media.zenfs.com/en/zacks.com/39dfb058875b6e691de9136bc97a47b4,PCAR,Yahoo,The Zacks Style Scores offers investors a way to easily find top-rated stocks based on their investing style. Here's why you should take advantage.,https://finnhub.io/api/news?id=f00902c260b12e85d78d08ce9d253fd32b18619b3d247487176520fc14760a95
company,2023-07-11 07:32:00,"Paccar raises dividend, to boost yield above 1.2%",121347391,https://s.wsj.net/public/resources/MWimages/MW-GP644_MicroS_ZG_20180906154215.jpg,PCAR,MarketWatch,"Shares of Paccar Inc. surged 1.7% into record territory in morning trading Tuesday, after the truck maker raised its quarterly dividend by 8%. The company...",https://finnhub.io/api/news?id=dd1df3bef4a1f3c123bc23970d1a0eed9204f416fd04957133c8549850f2b076
company,2023-07-11 05:43:00,PACCAR raises dividend by 8% to $0.27,121318891,,PCAR,Seeking Alpha,Looking for stock market analysis and research with proves results? Zacks.com offers in-depth financial research with over 30years of proven results.,https://finnhub.io/api/news?id=de59413a4f61f968f627c76437f2756341eb5fc49072dae7b4e2c4d6067df06d
company,2023-07-11 05:30:00,Paccar boosts quarterly dividend to 27c from 25c per share,121318892,,PCAR,Thefly.com,Looking for stock market analysis and research with proves results? Zacks.com offers in-depth financial research with over 30years of proven results.,https://finnhub.io/api/news?id=74e4ca20367dcfcdb228d46891a844ae32224d3d6413e491773740e6d9fbb5d0
company,2023-07-10 12:52:00,"Paccar Inc. stock rises Monday, outperforms market",121347392,https://images.mktw.net/im-220105/social,PCAR,MarketWatch,"Shares of Paccar Inc. rose 2.79% to $84.61 Monday, on what proved to be an all-around great trading session for the stock market, with the S&P 500 Index...",https://finnhub.io/api/news?id=04572dceaa5b330ac22fb20b87e97d91155c9e9c8f46b2c4c254e285bcc83d35
company,2023-07-17 15:00:00,Paccar Keeps on Truckin' Toward My Price Target,121431632,,PCAR,Yahoo,"As the truck manufacturer gets an upgrade, here's what the latest charts and indicators tell us.",https://finnhub.io/api/news?id=0cff9d14b150c6d60667e908d77e8b3d127dfdaa675d8f9e2e0b43f9d69eb890
company,2023-07-17 13:16:17,Jefferies Upgrades Paccar (PCAR),121428488,,PCAR,Fintel,,https://finnhub.io/api/news?id=f6fdfee2bcf0977dfec0f90d5eb7dd0ab5d53e574cfcda2deb2f1af0acbdaa0e
company,2023-07-17 10:02:42,"PepsiCo downgraded, Chewy upgraded: Wall Street's top analyst calls",121424590,https://media.zenfs.com/en/the_fly_169/135b0749a3ad5e86fe326a9da1d664b6,PCAR,Yahoo,"PepsiCo downgraded, Chewy upgraded: Wall Street's top analyst calls",https://finnhub.io/api/news?id=285ca966956198cf8112ba0f15a78b2a273b6ad851173c19e18efcffd8569f6f
company,2023-07-17 03:05:00,GLOBAL BROKER RATINGS: Pepsi cut; Deutsche Bank lifts Johnson Matthey,121426227,,PCAR,Alliance News,Looking for stock market analysis and research with proves results? Zacks.com offers in-depth financial research with over 30years of proven results.,https://finnhub.io/api/news?id=6b2c4e2f10d542c2d23667455d8833de615913264c009795831a497f22f332b7
company,2023-07-17 02:54:00,Baidu To Rally Around 32%? Here Are 10 Other Analyst Forecasts For Monday,121426212,,PCAR,Benzinga,Looking for stock market analysis and research with proves results? Zacks.com offers in-depth financial research with over 30years of proven results.,https://finnhub.io/api/news?id=7a1e9a0200e4a563d0396debce2ca2f680448239a1f2e22f01b294bc5d901558
company,2023-07-17 00:21:00,Paccar upgraded to Buy from Hold at Jefferies,121430519,,PCAR,Thefly.com,Looking for stock market analysis and research with proves results? Zacks.com offers in-depth financial research with over 30years of proven results.,https://finnhub.io/api/news?id=defcf80c2552fee8e0e61bea52c1aad9d94dd4508415ae65fe172cf0f1149ad2
company,2023-07-16 23:54:00,"Paccar Inc. stock rises Monday, outperforms market",121455210,,PCAR,MarketWatch,Looking for stock market analysis and research with proves results? Zacks.com offers in-depth financial research with over 30years of proven results.,https://finnhub.io/api/news?id=7d5a5f9d4827a9c6998b013afe1416319ac9b3bb34f73f52f7ff1c8f52d231c2
company,2023-07-16 23:36:00,Positive Report for Paccar (PCAR) from Jefferies,121430520,,PCAR,TipRanks,Looking for stock market analysis and research with proves results? Zacks.com offers in-depth financial research with over 30years of proven results.,https://finnhub.io/api/news?id=9ecb2151d3ff1be5cf0d6547c350d747f347dc6037de2a9540c2330a8436f787
company,2023-07-14 12:52:00,"Paccar Inc. stock falls Friday, underperforms market",121432125,https://images.mktw.net/im-220105/social,PCAR,MarketWatch,"Shares of Paccar Inc. dropped 0.13% to $85.66 Friday, on what proved to be an all-around mixed trading session for the stock market, with the Dow Jones...",https://finnhub.io/api/news?id=14fa6fb2b0727d826a233a0c83e9c5bbd58ed822d5b8db6fce2df5496cbea41d
company,2023-07-14 11:40:11,PCAR vs. FOXF: Which Stock Is the Better Value Option?,121389853,https://media.zenfs.com/en/zacks.com/a41b81fe729c761f3f94f42ff348f70c,PCAR,Yahoo,PCAR vs. FOXF: Which Stock Is the Better Value Option?,https://finnhub.io/api/news?id=c77b6d1ee87a8700f5cfac2f3b52d1183ec1715b6f087799ae4497bd6daaee75
company,2023-07-14 06:54:52,Multiple Tailwinds Pushed PACCAR (PCAR) in Q2,121384379,https://s.yimg.com/ny/api/res/1.2/qMlROJP5YGPGFubdfTOSBg--/YXBwaWQ9aGlnaGxhbmRlcjt3PTEyMDA7aD04MDI-/https://media.zenfs.com/en/insidermonkey.com/f6a42fa12b58bd56643aa084bcf9355d,PCAR,Yahoo,"Madison Investments, an investment advisor, released its “Madison Investors Fund” second quarter 2023 investor letter. A copy of the same can be downloaded here. In the second quarter, the fund advanced 8.5% compared to an 8.7% return for S&P 500 Index benchmark. In addition, you can check the top 5 holdings of the fund to know […]",https://finnhub.io/api/news?id=2e33b1be6b132efb2e631240060c42c1b3553b2a78b7412b92643b7c519f1b2a
company,2023-07-14 05:51:01,Paccar: Overvalued Momentum Stock Worth Holding Onto,121382922,https://media.gettyimages.com/id/1474006029/photo/used-peterbilt-kenworth-international-and-freightliner-trucks-for-sale-pre-owned-semi-tractor.jpg?b=1&s=170667a&w=0&k=20&c=4gLxsCdv0iNR_wyY3bNKRaEDU857ROKcQy89iYC2xpE=,PCAR,SeekingAlpha,"Paccar, up 66% over the past year, is among a group of hot truck manufacturing stocks whose prices have boomed along with sales and profits. Read more here.",https://finnhub.io/api/news?id=d6bcb7db0b9ad8474fc65fa240f962886bd8074dc23ab26b123fb184208578fa
company,2023-07-13 21:33:00,$100 Invested In This Stock 5 Years Ago Would Be Worth $200 Today,121409162,,PCAR,Benzinga,Looking for stock market analysis and research with proves results? Zacks.com offers in-depth financial research with over 30years of proven results.,https://finnhub.io/api/news?id=6d587967e88268f5de99709a05bdfcb603576948ef36d44648e4a050775dd70c
company,2023-07-21 18:00:19,Paccar (PCAR) Stock Sinks As Market Gains: What You Should Know,121544312,https://media.zenfs.com/en/zacks.com/26a86d59f0e8f1e82a35a92ae5684cd9,PCAR,Yahoo,"In the latest trading session, Paccar (PCAR) closed at $87.91, marking a -1.04% move from the previous day.",https://finnhub.io/api/news?id=c9048b03e7515d3b9a087e7feb385b96d5e209571e6b2f5739264edfe4b5a444
company,2023-07-21 09:40:12,Should Value Investors Buy PACCAR (PCAR) Stock?,121532344,https://media.zenfs.com/en/zacks.com/078b2d95159d12a337f09f2519ff10ba,PCAR,Yahoo,"Here at Zacks, our focus is on the proven Zacks Rank system, which emphasizes earnings estimates and estimate revisions to find great stocks. Nevertheless, we are always paying attention to the latest value, growth, and momentum trends to underscore strong picks.",https://finnhub.io/api/news?id=bc84268d6e846881b32a77dfa4b3de119c987ccf0748e28a5dc8a7238261f9c5
company,2023-07-21 05:00:00,"The Zacks Analyst Blog Highlights Cadence Design Systems, PulteGroup, Ford Motor, PACCAR and Tyler",121521919,https://media.zenfs.com/en/zacks.com/6f9fd5d81a15fcc24562a2f18e90107c,PCAR,Yahoo,"Cadence Design Systems, PulteGroup, Ford Motor, PACCAR and Tyler are included in this Analyst Blog.",https://finnhub.io/api/news?id=3e1cd3d1770cba3610bde2650cd08a82f2904ac55011415eb9e42cfa15c71679
company,2023-07-21 00:23:00,Invesco QQQ Trust ETF: What Lies Ahead?,121532039,,PCAR,TipRanks,Looking for stock market analysis and research with proves results? Zacks.com offers in-depth financial research with over 30years of proven results.,https://finnhub.io/api/news?id=ca43b2617fa7d7117c7912298dfca20c1a243fe034116947c935041554baf579
company,2023-07-20 23:52:00,"Paccar Inc. stock falls Friday, underperforms market",121553192,,PCAR,MarketWatch,Looking for stock market analysis and research with proves results? Zacks.com offers in-depth financial research with over 30years of proven results.,https://finnhub.io/api/news?id=807edf6bb68b800069c111215408190e03324d5cb9884a8e79a7011f81416bb5
company,2023-07-20 15:07:36,Raymond James Maintains Paccar (PCAR) Strong Buy Recommendation,121506911,,PCAR,Fintel,,https://finnhub.io/api/news?id=ec0de3829434051c1ba4181a777088a75f435f06bb71a8d478f1cb20d64f92a5
