category,datetime,headline,id,image,related,source,summary,url
company,2023-03-13 18:15:10,Paccar (PCAR) Dips More Than Broader Markets: What You Should Know,119210761,https://media.zenfs.com/en/zacks.com/d7dcbe11345e3f8e5e71e6827fe3c4c9,PCAR,Yahoo,"Paccar (PCAR) closed at $71.42 in the latest trading session, marking a -1.24% move from the prior day.",https://finnhub.io/api/news?id=84000849fd7fa38ff5022ed04cf8f5da86ce178b5d3d044a6c4f0c5fc71637fa
company,2023-03-13 13:16:00,"Paccar Inc. stock falls Monday, underperforms market",119219833,https://images.mktw.net/im-220105/social,PCAR,MarketWatch,"Shares of Paccar Inc. slipped 1.24% to $71.42 Monday, on what proved to be an all-around dismal trading session for the stock market, with the S&P 500 Index...",https://finnhub.io/api/news?id=7ac6cd41ff8ed1ed14f346dd1fe065da5aeb633f816ab30f32474a1ef2ca3c8e
company,2023-03-13 12:00:00,PACCAR Recognizes 10 PPM Quality Award Winners,119200986,https://s.yimg.com/cv/apiv2/social/images/yahoo_default_logo-1200x1200.png,PCAR,Yahoo,"BELLEVUE, Wash., March 13, 2023--PACCAR annually recognizes suppliers who exceed PACCAR’s 10 ppm quality standard, or the equivalent of 10 defective parts for every million components shipped to PACCAR. To qualify, suppliers must also meet demanding criteria for customer support and continuous improvement. For 2022, PACCAR recognizes 453 suppliers in 34 countries on five continents for achieving this high level of quality performance.",https://finnhub.io/api/news?id=910198330550a0062933e485969ef141af0f89d538a7bcbb8e42113a6e5def90
company,2023-03-13 09:05:01,"Zacks Value Trader Highlights: Penske Automotive Group, United Rentals and PACCAR",119197348,https://media.zenfs.com/en/zacks.com/151b82f71a601e92bed5c7a6a599c37c,PCAR,Yahoo,"Penske Automotive Group, United Rentals and PACCAR are part of the Zacks Value Trader blog.",https://finnhub.io/api/news?id=80c26d8397937945b3cb4acb88ce33d23e31ee598f621b887f2f2c6bdb84ffe5
company,2023-03-13 07:56:32,Reviewing Nikola's Partnership With Iveco,119198775,https://static.seekingalpha.com/cdn/s3/uploads/getty_images/1426340269/image_1426340269.jpg?io=getty-c-w1536,PCAR,SeekingAlpha,"Nikola and Iveco signed a partnership to build in Ulm, Germany, the Nikola Tre. Click here to read more about the partnership.",https://finnhub.io/api/news?id=149edb138487bd419da557e7082068d63c4cb5c2670997afac7fdb52c67abbb1
company,2023-03-13 07:09:00,"Nikola manufacturing upside balanced by execution, competition - Morgan Stanley",119203337,,PCAR,Seeking Alpha,Looking for stock market analysis and research with proves results? Zacks.com offers in-depth financial research with over 30years of proven results.,https://finnhub.io/api/news?id=4c38743726fc6c9cff3a9082566f77be74991e60b8fd897aee34834e4552ab89
company,2023-03-13 06:57:00,Reviewing Nikola`s Partnership With Iveco,119203338,,PCAR,Seeking Alpha,Looking for stock market analysis and research with proves results? Zacks.com offers in-depth financial research with over 30years of proven results.,https://finnhub.io/api/news?id=09e6d134798fe634b0fe25c0d4e65eb1f57241df35e682ea97c243fbb4864f8a
company,2023-03-17 13:15:00,"Paccar Inc. stock falls Friday, underperforms market",119349454,https://images.mktw.net/im-220105/social,PCAR,MarketWatch,"Shares of Paccar Inc. slid 3.05% to $68.69 Friday, on what proved to be an all-around poor trading session for the stock market, with the S&P 500 Index...",https://finnhub.io/api/news?id=b31950dfe440493a25cef1a4f3827a2bf386decd77bbebe6ee894b6fc7d43e93
company,2023-03-17 08:12:12,"Zacks Industry Outlook Highlights General Motors, PACCAR and Harley-Davidson",119295060,https://media.zenfs.com/en/zacks.com/87614551452ad74d54a2e01f1d5873fc,PCAR,Yahoo,"General Motors, PACCAR and Harley-Davidson are part of the Zacks Industry Outlook article.",https://finnhub.io/api/news?id=39bc534f2d2fcd9533223e1e9bc4e676a2a6f36d58af2a42df56ad38e694a7d2
company,2023-03-16 13:16:00,"Paccar Inc. stock rises Thursday, still underperforms market",119289068,https://images.mktw.net/im-220105/social,PCAR,MarketWatch,"Shares of Paccar Inc. inched 0.23% higher to $70.85 Thursday, on what proved to be an all-around positive trading session for the stock market, with the S&P...",https://finnhub.io/api/news?id=5ca3361c7a0146175bbc57785f67f14cc48b5a35175925b8fb8fb16a641a87c2
company,2023-03-16 09:21:01,3 Domestic Auto Stocks Well-Poised to Fend Off Industry Woes,119275051,https://media.zenfs.com/en/zacks.com/d9909195d38b3d0a5e8f4add2c63c714,PCAR,Yahoo,"While the rising economic uncertainty has dampened the Domestic Auto Industry's prospects, industry players like GM, PCAR and HOG are better equipped to tide over the headwinds.",https://finnhub.io/api/news?id=b7a51b5e17d526d237d7eb9a22fc79e8f56310e24aa14eb57730d692809c77b2
company,2023-03-23 13:17:00,"Paccar Inc. stock falls Thursday, underperforms market",119449921,https://images.mktw.net/im-220105/social,PCAR,MarketWatch,"Shares of Paccar Inc. sank 0.75% to $69.81 Thursday, on what proved to be an all-around favorable trading session for the stock market, with the S&P 500...",https://finnhub.io/api/news?id=e3639300e751e8feb6a99441b20800f97e429a259b6ffdf78479e7124f8ad50d
company,2023-03-23 09:39:23,Oshkosh: Parts In Search Of A Cohesive Whole,119374615,https://media.gettyimages.com/id/1461274652/photo/detail-of-a-red-pierce-fire-truck-at-the-old-pontiac-fire-department-in-pontiac-illinois-usa.jpg?b=1&s=170667a&w=0&k=20&c=4QmbTe-_VTqWu5rQ2L0YDVj3XtHX9nnhzny90v4NLt0=,PCAR,SeekingAlpha,Oshkosh has several distinct lines of heavy machinery business but no overarching theme to connect them that we can identify. Find out my analysis of OSK stock.,https://finnhub.io/api/news?id=7673c352fb38047ee57aa8e1ae9159fa325712e04c7c006dc7f456bec3840a65
company,2023-03-22 18:00:10,Paccar (PCAR) Stock Moves -1.54%: What You Should Know,119364652,https://media.zenfs.com/en/zacks.com/3d7c5b2146ac04ffd51752e17ff2a619,PCAR,Yahoo,"In the latest trading session, Paccar (PCAR) closed at $70.34, marking a -1.54% move from the previous day.",https://finnhub.io/api/news?id=a55a4162c94586272524978521c6e5dbc1c86c788a8704ca462da467114ad42a
company,2023-03-22 13:16:00,"Paccar Inc. stock falls Wednesday, still outperforms market",119366540,https://images.mktw.net/im-220105/social,PCAR,MarketWatch,"Shares of Paccar Inc. slid 1.54% to $70.34 Wednesday, on what proved to be an all-around grim trading session for the stock market, with the S&P 500 Index...",https://finnhub.io/api/news?id=18d250ff7cc2c5c3ba3cfb0c2cf13d76c0b923fb48ce735a214ea5a511a6658b
company,2023-03-21 18:15:10,Paccar (PCAR) Outpaces Stock Market Gains: What You Should Know,119342924,https://media.zenfs.com/en/zacks.com/b9775f315e7b6c4ada6e36d0048a929a,PCAR,Yahoo,"Paccar (PCAR) closed at $71.44 in the latest trading session, marking a +1.55% move from the prior day.",https://finnhub.io/api/news?id=9cff5c8b2b26cb2603365a0ea23484f89bea863dacd5b248f65f70a06740ec8a
company,2023-03-21 13:16:00,"Paccar Inc. stock rises Tuesday, outperforms market",119349452,https://images.mktw.net/im-220105/social,PCAR,MarketWatch,"Shares of Paccar Inc. rallied 1.55% to $71.44 Tuesday, on what proved to be an all-around positive trading session for the stock market, with the S&P 500...",https://finnhub.io/api/news?id=8bc8c94e2ea31389914462835855cc2acb364399f292476abb42120001cab8ca
company,2023-03-20 13:16:00,"Paccar Inc. stock rises Monday, outperforms market",119349453,https://images.mktw.net/im-220105/social,PCAR,MarketWatch,"Shares of Paccar Inc. rose 2.42% to $70.35 Monday, on what proved to be an all-around positive trading session for the stock market, with the S&P 500 Index...",https://finnhub.io/api/news?id=8a8b3034adaee0d5b860ce7bc4da6dab68468f0e7461cb618aa494195f495b51
company,2023-03-20 09:00:01,These 2 Auto-Tires-Trucks Stocks Could Beat Earnings: Why They Should Be on Your Radar,119304283,https://media.zenfs.com/en/zacks.com/b9775f315e7b6c4ada6e36d0048a929a,PCAR,Yahoo,Why investors should use the Zacks Earnings ESP tool to help find stocks that are poised to top quarterly earnings estimates.,https://finnhub.io/api/news?id=b84012d7dac167bd5f2bc7e643ac48129d4bff59396f8161ef1da24b9a6a42f3
company,2023-03-27 13:16:00,"Paccar Inc. stock rises Monday, outperforms market",119449918,https://images.mktw.net/im-220105/social,PCAR,MarketWatch,"Shares of Paccar Inc. rallied 1.49% to $70.94 Monday, on what proved to be an all-around positive trading session for the stock market, with the S&P 500...",https://finnhub.io/api/news?id=de15c0f6c8de826a4c7a51ef60deba419ea4ced06b6615c719c39a9746f99793
company,2023-03-27 11:40:03,PCAR or FOXF: Which Is the Better Value Stock Right Now?,119444789,https://media.zenfs.com/en/zacks.com/432476d296d64c50172213c0415587c9,PCAR,Yahoo,PCAR vs. FOXF: Which Stock Is the Better Value Option?,https://finnhub.io/api/news?id=f0affa4793bef0ec9cae5e2193d0450ecffcd58390e0a0b27089a81b13f2f601
company,2023-03-27 09:40:01,Are Investors Undervaluing PACCAR (PCAR) Right Now?,119453284,https://media.zenfs.com/en/zacks.com/3cb5117fc22f5e37890d1860dcd61f9f,PCAR,Yahoo,"Here at Zacks, our focus is on the proven Zacks Rank system, which emphasizes earnings estimates and estimate revisions to find great stocks. Nevertheless, we are always paying attention to the latest value, growth, and momentum trends to underscore strong picks.",https://finnhub.io/api/news?id=119ac8de04897cd5463d7130aa0eb9c0aaefdfb78aa8cb4a121546ecf3a14b4a
company,2023-03-24 13:16:00,"Paccar Inc. stock rises Friday, still underperforms market",119449920,https://images.mktw.net/im-220105/social,PCAR,MarketWatch,"Shares of Paccar Inc. inched 0.13% higher to $69.90 Friday, on what proved to be an all-around positive trading session for the stock market, with the S&P...",https://finnhub.io/api/news?id=a2fa7da37e9d572a79379126de6836e1233d85f90ebe9dc84d5a88596059c536
company,2023-03-31 13:19:00,"Paccar Inc. stock rises Friday, still underperforms market",119579900,https://images.mktw.net/im-220105/social,PCAR,MarketWatch,"Shares of Paccar Inc. rallied 1.37% to $73.20 Friday, on what proved to be an all-around great trading session for the stock market, with the S&P 500 Index...",https://finnhub.io/api/news?id=15c30aa8db446433ca1e24c1ee5dfa446f92e087e7fb69e6032ba21036af9757
company,2023-03-31 13:06:05,PACCAR (PCAR) Makes Equity Investment in Platform Science,119544484,https://media.zenfs.com/en/zacks.com/578c75a0bdc2572dd0bbdad8c4aeb25c,PCAR,Yahoo,PACCAR's (PCAR) minority equity investment in integrating Platform Science's Virtual Vehicle technology with the PACCAR Connect telematics system will simplify the vehicle I.T. environment.,https://finnhub.io/api/news?id=7495ce1e5ab649eac120eca84283edd809bb8e5973cceff7ea48c551ece8d54e
company,2023-03-30 21:45:00,‘Value’ Stocks Are Showing Signs of Life. Take a Look at This Truck Maker.,119557940,https://images.barrons.com/im-754289/social,PCAR,MarketWatch,"The Russell 1000 Value Index, which tracks about 1,000 stocks, large and small, has gained just under 4% since hitting its low for the year in mid March.",https://finnhub.io/api/news?id=75fd17bc218be04eb44f65074feb8b52752332016ffe982870cb9ce20887c2b8
company,2023-03-30 13:16:00,"Paccar Inc. stock falls Thursday, underperforms market",119579902,https://images.mktw.net/im-220105/social,PCAR,MarketWatch,"Shares of Paccar Inc. dropped 0.19% to $72.21 Thursday, on what proved to be an all-around positive trading session for the stock market, with the S&P 500...",https://finnhub.io/api/news?id=9da2232f74beb516c84e7118768e0c6498e42042716fd0f7b5285b712700704c
company,2023-03-30 12:00:00,PACCAR and Platform Science Announce Strategic Equity Investment,119527051,https://s.yimg.com/cv/apiv2/social/images/yahoo_default_logo-1200x1200.png,PCAR,Yahoo,"BELLEVUE, Wash., March 30, 2023--PACCAR announced today that it has made a minority equity investment in its connected truck partner, Platform Science. This strategic investment complements the partnership recently launched by PACCAR and Platform Science to integrate Platform Science’s Virtual Vehicle technology with the PACCAR Connect telematics system.",https://finnhub.io/api/news?id=953cc2031966091caefca2e6db503cb9c1ff9eacb0a337d835faf1e47a7bea5c
company,2023-03-30 07:01:00,"Paccar, Platform Science announce strategic equity investment",119517350,,PCAR,Thefly.com,Looking for stock market analysis and research with proves results? Zacks.com offers in-depth financial research with over 30years of proven results.,https://finnhub.io/api/news?id=866ac284ea2ca051d93acccb4b66259ff042b585e94f14c8694a399c1b6ddfd3
company,2023-03-29 21:58:00,PACCAR makes a small investment in Platform Science,119539529,,PCAR,Seeking Alpha,Looking for stock market analysis and research with proves results? Zacks.com offers in-depth financial research with over 30years of proven results.,https://finnhub.io/api/news?id=72d38b6c4a5e36e30c16f7cc5bec5eff7c43ea120dc4d7b60f8d7afae3585cab
company,2023-03-29 18:15:10,Paccar (PCAR) Gains But Lags Market: What You Should Know,119514236,https://media.zenfs.com/en/zacks.com/17a4db66bb13bdabcbf848550a6ea15a,PCAR,Yahoo,"Paccar (PCAR) closed the most recent trading day at $72.35, moving +0.71% from the previous trading session.",https://finnhub.io/api/news?id=26e3ee3d005b89a6e7e3b9eac5ed8b380404087a5272b631e72a9951cc7ef851
company,2023-03-29 13:16:00,"Paccar Inc. stock rises Wednesday, still underperforms market",119511512,https://images.mktw.net/im-220105/social,PCAR,MarketWatch,"Shares of Paccar Inc. inched 0.71% higher to $72.35 Wednesday, on what proved to be an all-around favorable trading session for the stock market, with the...",https://finnhub.io/api/news?id=b5640ab646a1881702fce419176e3507cfc789da4e42c182e59c3405dbf61069
company,2023-03-29 12:00:00,PACCAR Recognizes Top Performing Suppliers in North America,119502504,https://s.yimg.com/cv/apiv2/social/images/yahoo_default_logo-1200x1200.png,PCAR,Yahoo,"BELLEVUE, Wash., March 29, 2023--PACCAR utilizes its comprehensive Supplier Performance Management program (SPM) to evaluate supplier achievements in the areas of product development, operations and aftermarket support, and alignment with PACCAR’s key business objectives.",https://finnhub.io/api/news?id=ca01009312ce12abb39cd0b0ad4432eb88d7708b0b86fb0dd910fc3654fb4809
company,2023-03-28 13:16:00,"Paccar Inc. stock rises Tuesday, outperforms market",119511513,https://images.mktw.net/im-220105/social,PCAR,MarketWatch,"Shares of Paccar Inc. rallied 1.27% to $71.84 Tuesday, on what proved to be an all-around dismal trading session for the stock market, with the S&P 500 Index...",https://finnhub.io/api/news?id=b136414e982b4c33c9f9fd8d2d9dda9ba3800ef6b1880a07cab07c73a3d8aa7b
company,2023-03-28 04:17:28,Daimler Truck: Ignore No More The Industry Leader (Rating Upgrade),119468057,https://static.seekingalpha.com/cdn/s3/uploads/getty_images/1019869956/image_1019869956.jpg?io=getty-c-w1536,PCAR,SeekingAlpha,Daimler Truck is the largest truck and bus manufacturer in the world in terms of revenue. Click here to read my analysis of DTGHF stock.,https://finnhub.io/api/news?id=4f1b2ac4a220f3f6c964d6db745d0369c62cae4c55692e905009153dcd1e4727
company,2023-04-04 13:16:00,"Paccar Inc. stock falls Tuesday, underperforms market",119645904,https://images.mktw.net/im-220105/social,PCAR,MarketWatch,"Shares of Paccar Inc. slid 3.07% to $70.80 Tuesday, on what proved to be an all-around poor trading session for the stock market, with the S&P 500 Index...",https://finnhub.io/api/news?id=8f5c786b61a08c2edfed2b85da7f053d507c33e3101c9b1f85ce37191184e5f3
company,2023-04-03 13:15:00,"Paccar Inc. stock falls Monday, underperforms market",119645907,https://images.mktw.net/im-220105/social,PCAR,MarketWatch,"Shares of Paccar Inc. slipped 0.22% to $73.04 Monday, on what proved to be an all-around great trading session for the stock market, with the S&P 500 Index...",https://finnhub.io/api/news?id=17cb9fa003a7122d76f393faaa3251b548b3b2206fc5aa50bd2d90746cd5457c
company,2023-04-03 12:45:04,Looking for a Growth Stock? 3 Reasons Why Paccar (PCAR) is a Solid Choice,119598874,https://media.zenfs.com/en/zacks.com/d2f7ed3d1940141716bfd200f5c94c6b,PCAR,Yahoo,"Paccar (PCAR) is well positioned to outperform the market, as it exhibits above-average growth in financials.",https://finnhub.io/api/news?id=8645c1fe57de6df9fa2eee5c025a1ab58cd1e09636a5968597465bfcb70b51f4
company,2023-04-03 09:24:01,"Auto Roundup: WGO to Acquire Lithionics, F Signs Nickel Deal & More",119590477,https://media.zenfs.com/en/zacks.com/a85d3c312978a2854a4f2dc00d1253cd,PCAR,Yahoo,"Amid an accelerated e-mobility revolution, Winnebago (WGO) is set to buy Lithionics to power its electric RV offerings. Ford (F) invests in a nickel project in Indonesia to ensure steady supply of the metal.",https://finnhub.io/api/news?id=0e825238f663caee2e9571b2ea0707ce56eaf5c833656d18fc189d013b724611
company,2023-04-06 18:15:10,Paccar (PCAR) Gains But Lags Market: What You Should Know,119665791,https://media.zenfs.com/en/zacks.com/71afbbc0512eb3c471136d93f39079c9,PCAR,Yahoo,"Paccar (PCAR) closed at $68.49 in the latest trading session, marking a +0.01% move from the prior day.",https://finnhub.io/api/news?id=15ad69c446a87d0dad9a22d59dd9e6c9259814422092c9f717e08845d33c8b0d
company,2023-04-06 13:16:00,"Paccar Inc. stock rises Thursday, still underperforms market",119689463,https://images.mktw.net/im-220105/social,PCAR,MarketWatch,"Shares of Paccar Inc. inched 0.01% higher to $68.49 Thursday, on what proved to be an all-around positive trading session for the stock market, with the S&P...",https://finnhub.io/api/news?id=b390485ee61e7ed2a429d915f49b116b92fb66abeefc0f1de29b9e3b25278262
company,2023-04-05 13:16:00,"Paccar Inc. stock falls Wednesday, underperforms market",119645901,https://images.mktw.net/im-220105/social,PCAR,MarketWatch,"Shares of Paccar Inc. slipped 3.28% to $68.48 Wednesday, on what proved to be an all-around mixed trading session for the stock market, with the Dow Jones...",https://finnhub.io/api/news?id=f9451fa75cba70ceceefc1bf1ce7ee07fea8d97371f0728f501b92091bf6b5f8
company,2023-04-04 22:54:00,"Preliminary North American Class 8  truck orders fell 18% in March, FTR reports",119641695,,PCAR,Thefly.com,Looking for stock market analysis and research with proves results? Zacks.com offers in-depth financial research with over 30years of proven results.,https://finnhub.io/api/news?id=ed171bd5d009771653280b59d570f3203e847c3bd4173782c8497f50db2ba7e4
company,2023-04-04 22:19:00,"Class 8 truck orders for March skid 19% M/M, related stocks decline",119641787,,PCAR,Seeking Alpha,Looking for stock market analysis and research with proves results? Zacks.com offers in-depth financial research with over 30years of proven results.,https://finnhub.io/api/news?id=cc9c11bcb5f011a84e983c87b5731bf9f4803797856c3c953042faea71d31019
company,2023-04-12 17:11:36,Deutsche Bank Maintains PACCAR (PCAR) Hold Recommendation,119732682,,PCAR,Fintel,,https://finnhub.io/api/news?id=460daef0fc60826ec9ea6f923340dd545e64aff6ad75c2a9787d8f844c1601b0
company,2023-04-12 13:15:00,"Paccar Inc. stock rises Wednesday, outperforms market",119753471,https://images.mktw.net/im-220105/social,PCAR,MarketWatch,"Shares of Paccar Inc. rallied 1.51% to $72.11 Wednesday, on what proved to be an all-around poor trading session for the stock market, with the S&P 500 Index...",https://finnhub.io/api/news?id=672c7bb90e186327f93259ffac6a8aae2df34322076317593d1a8e1cd4105318
company,2023-04-12 11:40:03,PCAR vs. FOXF: Which Stock Is the Better Value Option?,119737563,https://media.zenfs.com/en/zacks.com/105b2acef7bf0873f24b78932b1fdc3c,PCAR,Yahoo,PCAR vs. FOXF: Which Stock Is the Better Value Option?,https://finnhub.io/api/news?id=05e4271bcb3faa125cc06df468b033ae7ce39821d8cb13f735c8b47079fe4265
company,2023-04-12 09:40:01,Should Value Investors Buy PACCAR (PCAR) Stock?,119737565,https://media.zenfs.com/en/zacks.com/2a50596f066181e48e4ae0ad6be00462,PCAR,Yahoo,"Here at Zacks, our focus is on the proven Zacks Rank system, which emphasizes earnings estimates and estimate revisions to find great stocks. Nevertheless, we are always paying attention to the latest value, growth, and momentum trends to underscore strong picks.",https://finnhub.io/api/news?id=34b4acc84ab0213ef7b5148163b06ee12b948086d54e7f5f63934ebfd84bfc5a
company,2023-04-12 04:04:00,Heavy-duty truck market view downgraded to Mixed from Positive at OTR Global,119727917,,PCAR,Thefly.com,Looking for stock market analysis and research with proves results? Zacks.com offers in-depth financial research with over 30years of proven results.,https://finnhub.io/api/news?id=243dd86a5cd3226492cd36003a0059c14cab9e07bc344523f93a73cd2c600cec
company,2023-04-12 00:38:00,Paccar price target raised to $72 from $70 at Deutsche Bank,119727918,,PCAR,Thefly.com,Looking for stock market analysis and research with proves results? Zacks.com offers in-depth financial research with over 30years of proven results.,https://finnhub.io/api/news?id=b0aab86e600652ef113143f5da8f8f3098818bab8898dc8d247de3e79285e01c
company,2023-04-11 13:15:00,"Paccar Inc. stock rises Tuesday, outperforms market",119753472,https://images.mktw.net/im-220105/social,PCAR,MarketWatch,"Shares of Paccar Inc. advanced 1.94% to $71.04 Tuesday, on what proved to be an all-around mixed trading session for the stock market, with the S&P 500 Index...",https://finnhub.io/api/news?id=5c48c42c1ce76d40f456db8d2e8c4ebb490b743d4c1a0b8c7ff903f03be2c611
company,2023-04-10 13:16:00,"Paccar Inc. stock rises Monday, outperforms market",119708403,https://images.mktw.net/im-220105/social,PCAR,MarketWatch,"Shares of Paccar Inc. rallied 1.74% to $69.68 Monday, on what proved to be an all-around favorable trading session for the stock market, with the S&P 500...",https://finnhub.io/api/news?id=956c5c8d2323d7ca7f782970b0ce8a8dc4de8e907566e631d1725c5f304e241b
company,2023-04-10 00:03:00,MULN Stock: What Should Mullen Do With a $110 Million Windfall?,119707180,,PCAR,InvestorPlace,Looking for stock market analysis and research with proves results? Zacks.com offers in-depth financial research with over 30years of proven results.,https://finnhub.io/api/news?id=40a4c8351c769dbf141fd655957df108fa085060004d92c4d765bd51a288615c
company,2023-04-14 13:16:00,"Paccar Inc. stock rises Friday, outperforms market",119871739,https://images.mktw.net/im-220105/social,PCAR,MarketWatch,"Shares of Paccar Inc. advanced 1.58% to $72.72 Friday, on what proved to be an all-around poor trading session for the stock market, with the S&P 500 Index...",https://finnhub.io/api/news?id=d91f3535a3d1ab40035ace8279c39422d1a135fb439e179fe9854f5245f73c46
company,2023-04-13 13:15:00,"Paccar Inc. stock falls Thursday, underperforms market",119753469,https://images.mktw.net/im-220105/social,PCAR,MarketWatch,"Shares of Paccar Inc. slipped 0.72% to $71.59 Thursday, on what proved to be an all-around positive trading session for the stock market, with the S&P 500...",https://finnhub.io/api/news?id=57929ffc9deb41d8fd1e6cada8f736103bd5e6461a7157e9498291efe69e1e5f
company,2023-04-13 03:30:00,"S&P 500 Futures Climb in Premarket Trading; Sarepta Therapeutics, Catalent Lag",119752945,https://s.wsj.net/public/resources/MWimages/MW-HA919_barron_NS_20181226134502.png,PCAR,MarketWatch,"With U.S. stock markets set to open in two hours, (IONS) was up 3.8% in pre-market trading, and (UAL) was up 3.2%. (MGA), (PCAR), and (BRKR) were all posting...",https://finnhub.io/api/news?id=52f0cd4778d6635ff1bb789dd2e82ecd44473a977802cf9d82f30a0e4b56a5d1
company,2023-04-20 13:16:00,"Paccar Inc. stock falls Thursday, still outperforms market",119871732,https://images.mktw.net/im-220105/social,PCAR,MarketWatch,"Shares of Paccar Inc. slipped 0.45% to $72.58 Thursday, on what proved to be an all-around grim trading session for the stock market, with the S&P 500 Index...",https://finnhub.io/api/news?id=f29d1c032aa1d076b0ee810086e2ac32f6c7787c941f06b9bfe57abb51e8390c
company,2023-04-20 10:02:02,Analysts Estimate Harley-Davidson (HOG) to Report a Decline in Earnings: What to Look Out for,119858503,https://media.zenfs.com/en/zacks.com/1a018a29aef5adbf5b4319f32058e209,PCAR,Yahoo,Harley-Davidson (HOG) doesn't possess the right combination of the two key ingredients for a likely earnings beat in its upcoming report. Get prepared with the key expectations.,https://finnhub.io/api/news?id=be17ce9cefc03fc1b7803bd68ab6b8c223c147986e15fccbb4e3c02bc0ff8d11
company,2023-04-19 13:16:00,"Paccar Inc. stock falls Wednesday, underperforms market",119871734,https://images.mktw.net/im-220105/social,PCAR,MarketWatch,"Shares of Paccar Inc. slipped 0.23% to $72.91 Wednesday, on what proved to be an all-around grim trading session for the stock market, with the S&P 500 Index...",https://finnhub.io/api/news?id=8212e4f1180ab2ab32d3b6b9d52e3f2365be20da67bb43d84104f01c8a099311
company,2023-04-19 12:45:04,Here is Why Growth Investors Should Buy Paccar (PCAR) Now,119860730,https://media.zenfs.com/en/zacks.com/2f0d6efdd8740952a371c97ddea6e926,PCAR,Yahoo,"Paccar (PCAR) possesses solid growth attributes, which could help it handily outperform the market.",https://finnhub.io/api/news?id=b793d30115f2c1d5feef53c55daf01c7add6c69c4752ba56f1f83cc1f2ff4fdd
company,2023-04-19 07:03:13,Paccar: Slightly Expensive If Margins Don't Improve Significantly,119823719,,PCAR,SeekingAlpha,,https://finnhub.io/api/news?id=416ca33a0081f9afce6cc4f47a4e5fe5730100e3fa356dbd41cbbd4297c31cd7
company,2023-04-19 06:06:00,Paccar: Slightly Expensive If Margins Don`t Improve Significantly,119872193,,PCAR,Seeking Alpha,Looking for stock market analysis and research with proves results? Zacks.com offers in-depth financial research with over 30years of proven results.,https://finnhub.io/api/news?id=6589977662f52447df085fe7b87cef0029febed63564c28614f82ee426dbb507
