category,datetime,headline,id,image,related,source,summary,url
company,2023-04-04 13:21:00,Ross Stores Inc. stock outperforms market despite losses on the day,119619377,https://images.mktw.net/im-220105/social,ROST,MarketWatch,"Shares of Ross Stores Inc. slumped 0.09% to $108.53 Tuesday, on what proved to be an all-around dismal trading session for the stock market, with the S&P 500...",https://finnhub.io/api/news?id=bcd67b2308fa467aa27cadd4124849c6fbc2f9ed23067f74122f06fcd1c3e98c
company,2023-04-03 13:21:00,Ross Stores Inc. stock outperforms competitors on strong trading day,119619378,https://images.mktw.net/im-220105/social,ROST,MarketWatch,"Shares of Ross Stores Inc. rose 2.36% to $108.63 Monday, on what proved to be an all-around great trading session for the stock market, with the S&P 500...",https://finnhub.io/api/news?id=50589975e732703278cff085e9bd1032cd5ad6b9dac65a121a9b253fafaa638f
company,2023-04-03 06:00:37,Solid Results Pushed Ross Stores (ROST) Stock in Q4,119586065,https://media.zenfs.com/en/insidermonkey.com/4c6d146bb32aa6629a8b2861ea94d26e,ROST,Yahoo,"TimesSquare Capital Management, an equity investment management company, released its “U.S. Mid Cap Growth Strategy” fourth-quarter investor letter. A copy of the same can be downloaded here. In the fourth quarter, the strategy returned 4.18% (net), compared to 6.90% for the Russell Midcap Growth Index. For the calendar year, the strategy returned -22.13% (net) compared to […]",https://finnhub.io/api/news?id=bf4065d8dc801159466fe7e4d98d821e995f6139bbf5c85b9d9453184856befd
company,2023-04-03 02:25:00,Ross Stores price target raised to $124 from $123 at JPMorgan,119597217,,ROST,Thefly.com,Looking for stock market analysis and research with proves results? Zacks.com offers in-depth financial research with over 30years of proven results.,https://finnhub.io/api/news?id=9390bc7385543163cba7060fe6e8950342ea7778c3361c3fc8f418a396db2288
company,2023-04-01 05:00:00,The Retirees Guide To An Upcoming Recession,119553069,https://static.seekingalpha.com/cdn/s3/uploads/getty_images/1257405518/image_1257405518.jpg?io=getty-c-w1536,ROST,SeekingAlpha,Tech sector layoffs are accelerating as an era of free money causes companies to re-think the speed of innovation and product development. Read more here.,https://finnhub.io/api/news?id=28222b5e9c67980187c5bbc8a30bcc88b8fbdf245d9f7349adf17e6a9af74b05
company,2023-04-06 13:21:00,"Ross Stores Inc. stock falls Thursday, underperforms market",119687135,https://images.mktw.net/im-220105/social,ROST,MarketWatch,"Shares of Ross Stores Inc. dropped 0.23% to $106.22 Thursday, on what proved to be an all-around favorable trading session for the stock market, with the S&P...",https://finnhub.io/api/news?id=42efbabced10abd39cf03eedb534c0ae651fd9f6f5171a720af4e3b1b8ae5342
company,2023-04-05 13:21:00,"Ross Stores Inc. stock falls Wednesday, underperforms market",119640964,https://images.mktw.net/im-220105/social,ROST,MarketWatch,"Shares of Ross Stores Inc. slid 1.91% to $106.46 Wednesday, on what proved to be an all-around mixed trading session for the stock market, with the Dow Jones...",https://finnhub.io/api/news?id=1be82bf89ad8f1abc2438c74cea8074acb000750a9aecda535aa5bad9cc3c191
company,2023-04-12 13:21:00,Ross Stores Inc. stock underperforms Wednesday when compared to competitors,119766206,https://images.mktw.net/im-220105/social,ROST,MarketWatch,"Shares of Ross Stores Inc. shed 2.13% to $102.89 Wednesday, on what proved to be an all-around poor trading session for the stock market, with the S&P 500...",https://finnhub.io/api/news?id=c4c8fcb80a295b56cc98e64fba1e2d174b946197dd370e95003cfd33bfa72536
company,2023-04-11 13:21:00,Ross Stores Inc. stock outperforms competitors despite losses on the day,119766207,https://images.mktw.net/im-220105/social,ROST,MarketWatch,"Shares of Ross Stores Inc. slipped 1.42% to $105.13 Tuesday, on what proved to be an all-around mixed trading session for the stock market, with the S&P 500...",https://finnhub.io/api/news?id=c45785e84c4da31b817a1a7b8d18bcee438c7e0be6780af7d12472fddae571f7
company,2023-04-10 13:21:00,"Ross Stores Inc. stock rises Monday, outperforms market",119713010,https://images.mktw.net/im-220105/social,ROST,MarketWatch,"Shares of Ross Stores Inc. inched 0.40% higher to $106.64 Monday, on what proved to be an all-around positive trading session for the stock market, with the...",https://finnhub.io/api/news?id=74be5094dee4fc1c34f2f91f96121d05715e2935ca6fbfce3da5d59faac0437a
company,2023-04-10 10:32:36,Here's What's Concerning About Ross Stores' (NASDAQ:ROST) Returns On Capital,119711287,https://media.zenfs.com/en/simply_wall_st__316/5e99d13d88d9e9a58e4b4d374d5369fd,ROST,Yahoo,"If you're looking for a multi-bagger, there's a few things to keep an eye out for. Ideally, a business will show two...",https://finnhub.io/api/news?id=458ba7d8602cdfdec91365a56b390fb04325c5bc772ce365246c9b628ffe29a0
company,2023-04-14 13:21:00,Ross Stores Inc. stock outperforms competitors on strong trading day,119766204,https://images.mktw.net/im-220105/social,ROST,MarketWatch,"Shares of Ross Stores Inc. inched 0.39% higher to $104.60 Friday, on what proved to be an all-around rough trading session for the stock market, with the S&P...",https://finnhub.io/api/news?id=596c924213dbf875de0042a97690465a206f19c2e197b9d5cfb5b007a7402aa3
company,2023-04-14 04:32:00,"Electronics, department stores lead declines in weak retail sales report",119759677,,ROST,Seeking Alpha,Looking for stock market analysis and research with proves results? Zacks.com offers in-depth financial research with over 30years of proven results.,https://finnhub.io/api/news?id=a1a39dc82a42c523c7fc631b9e16442caa5e41a27985ce097f2f502ed2f76a97
company,2023-04-13 13:21:00,"Ross Stores Inc. stock rises Thursday, still underperforms market",119766205,https://images.mktw.net/im-220105/social,ROST,MarketWatch,"Shares of Ross Stores Inc. advanced 1.26% to $104.19 Thursday, on what proved to be an all-around favorable trading session for the stock market, with the...",https://finnhub.io/api/news?id=4d3d1a42a7c77ec24b77f2b57fee058d2ffe9155d34dbbde8e6ddb6fa0172b86
company,2023-04-20 13:21:00,"Ross Stores Inc. stock rises Thursday, outperforms market",119925169,https://images.mktw.net/im-220105/social,ROST,MarketWatch,"Shares of Ross Stores Inc. advanced 1.70% to $106.03 Thursday, on what proved to be an all-around grim trading session for the stock market, with the S&P 500...",https://finnhub.io/api/news?id=783a146c9a7b67a2a1774e7c0f4c15b875d361c166f3fe121a5b135e454d114a
company,2023-04-19 13:22:00,Ross Stores Inc. stock underperforms Wednesday when compared to competitors despite daily gains,119843574,https://images.mktw.net/im-220105/social,ROST,MarketWatch,"Shares of Ross Stores Inc. inched 0.55% higher to $104.26 Wednesday, on what proved to be an all-around poor trading session for the stock market, with the...",https://finnhub.io/api/news?id=e1047869ee373dcdd4fd2191010e94100abb6857b7ed55b25973144488301fb2
company,2023-04-18 22:00:00,TJX Stock Is Just Right for Bargain Hunters,119843378,https://images.barrons.com/im-764845/social,ROST,MarketWatch,"The largest of the off-price retailers, TJX—whose stores include T.J. Maxx, HomeGoods, and Marshalls—is well positioned to buck a slowdown in consumer spending.",https://finnhub.io/api/news?id=160f36ffb2fca2d11b1b625646c659292be0e2de9d7566abe2521e2369d8f0fc
company,2023-04-18 13:21:00,Ross Stores Inc. stock underperforms Tuesday when compared to competitors,119843575,https://images.mktw.net/im-220105/social,ROST,MarketWatch,"Shares of Ross Stores Inc. slid 0.47% to $103.69 Tuesday, on what proved to be an all-around mixed trading session for the stock market, with the S&P 500...",https://finnhub.io/api/news?id=2a0bfc2ea2d500073930533a2babc7aa94ec68225569bd7837694efe58067458
company,2023-04-18 07:28:57,Multiple Headwinds Impacted Ross Stores (ROST) in Q1,119816178,https://s.yimg.com/ny/api/res/1.2/G_b_syEKdUF3PYsCNqLalw--/YXBwaWQ9aGlnaGxhbmRlcjt3PTEyMDA7aD04MDA-/https://media.zenfs.com/en/insidermonkey.com/4613847fcc09040c26fe4384168260f1,ROST,Yahoo,"Madison Investments, an investment advisor, released its “Madison Mid Cap Fund” first quarter 2023 investor letter. A copy of the same can be downloaded here. In the first quarter, the fund was up 5.3% compared to a 4.1% return for the Russell Midcap Index benchmark. In addition, you can check the top 5 holdings of the […]",https://finnhub.io/api/news?id=dc90b6ab1564a8529a64a76720f2b43366cd5d6e7a0643727c8ecb0c95466362
company,2023-04-17 13:21:00,"Ross Stores Inc. stock falls Monday, underperforms market",119806757,https://images.mktw.net/im-220105/social,ROST,MarketWatch,"Shares of Ross Stores Inc. slumped 0.40% to $104.18 Monday, on what proved to be an all-around great trading session for the stock market, with the S&P 500...",https://finnhub.io/api/news?id=e26735d87a98652a0793eca3fa3c78461fdca1710d59074ab645baf5387c7f01
company,2023-04-24 13:22:00,"Ross Stores Inc. stock rises Monday, still underperforms market",119925167,https://images.mktw.net/im-220105/social,ROST,MarketWatch,"Shares of Ross Stores Inc. inched 0.08% higher to $106.41 Monday, on what proved to be an all-around favorable trading session for the stock market, with the...",https://finnhub.io/api/news?id=4c7910c497ea1188f21927bc5b72dd277b9cc7b16faf7e0e51c94c2afbcbae42
company,2023-04-24 04:26:00,BBBY Stock Alert: Bed Bath & Beyond Plunges 40% on Bankruptcy Filing,119914905,,ROST,InvestorPlace,Looking for stock market analysis and research with proves results? Zacks.com offers in-depth financial research with over 30years of proven results.,https://finnhub.io/api/news?id=3b4d24e4bed97b94d14c2b54047e138c601624c1a2d1163066d19c873266d3ff
company,2023-04-21 13:21:00,"Ross Stores Inc. stock rises Friday, outperforms market",119925168,https://images.mktw.net/im-220105/social,ROST,MarketWatch,"Shares of Ross Stores Inc. inched 0.27% higher to $106.32 Friday, on what proved to be an all-around positive trading session for the stock market, with the...",https://finnhub.io/api/news?id=9a38ab01378edcc37ffed064f3992276d7e6963cd4fe733da08baf67c6b53bbd
company,2023-04-28 13:21:00,"Ross Stores Inc. stock rises Friday, outperforms market",120030299,https://images.mktw.net/im-220105/social,ROST,MarketWatch,"Shares of Ross Stores Inc. rallied 1.12% to $106.73 Friday, on what proved to be an all-around positive trading session for the stock market, with the S&P...",https://finnhub.io/api/news?id=a26ce1f42f17292044a4fde3aa0439ac44c605cb308bb39abc7343ef02c4e00e
company,2023-04-28 03:00:01,Bed Bath & Beyond store closures will kick off a land grab for fast-growing retailers,120004833,https://image.cnbcfm.com/api/v1/image/107231440-1682521977572-gettyimages-1484927640-bedbathbeyondfiledforbankruptcyprotection007.jpeg?v=1682679601&w=1920&h=1080,ROST,CNBC,"Bed Bath & Beyond, which filed for bankruptcy, is expected to soon close hundreds of store locations.",https://finnhub.io/api/news?id=61d51b9a9ac1c7c0bc6656dd2f5a25a8407219916df7681da06e57a082e9dbef
company,2023-04-27 13:23:00,"Ross Stores Inc. stock rises Thursday, still underperforms market",120030301,https://images.mktw.net/im-220105/social,ROST,MarketWatch,"Shares of Ross Stores Inc. inched 0.81% higher to $105.55 Thursday, on what proved to be an all-around positive trading session for the stock market, with...",https://finnhub.io/api/news?id=d5c1dff2fc4504459281bf7c449c867aa9132c93b9245cd008aa74ff753e3e00
company,2023-04-27 07:17:24,"An Intrinsic Calculation For Ross Stores, Inc. (NASDAQ:ROST) Suggests It's 33% Undervalued",119984659,https://media.zenfs.com/en/simply_wall_st__316/5e99d13d88d9e9a58e4b4d374d5369fd,ROST,Yahoo,"Key Insights Using the 2 Stage Free Cash Flow to Equity, Ross Stores fair value estimate is US$156 Ross Stores is...",https://finnhub.io/api/news?id=72dc514df5648c61a105a223edcc004519b04aaabb35986ddc9c5336ba5f0875
company,2023-04-26 13:21:00,Ross Stores Inc. stock outperforms market on strong trading day,120030303,https://images.mktw.net/im-220105/social,ROST,MarketWatch,"Shares of Ross Stores Inc. inched 0.63% higher to $104.70 Wednesday, on what proved to be an all-around poor trading session for the stock market, with the...",https://finnhub.io/api/news?id=7684e5ea253542c81002a0e9dfcdce021ce79a0e1b9a60a38098e13e5fd0b310
company,2023-04-25 13:21:00,Ross Stores Inc. stock outperforms competitors despite losses on the day,119925166,https://images.mktw.net/im-220105/social,ROST,MarketWatch,"Shares of Ross Stores Inc. shed 2.23% to $104.04 Tuesday, on what proved to be an all-around rough trading session for the stock market, with the S&P 500...",https://finnhub.io/api/news?id=f611deb5907a8c6504682c87c49fd8a2e44dac708db047556e00b5a49604098b
company,2023-05-02 13:21:00,Ross Stores Inc. stock outperforms market despite losses on the day,120112866,https://images.mktw.net/im-220105/social,ROST,MarketWatch,"Shares of Ross Stores Inc. slipped 0.93% to $104.77 Tuesday, on what proved to be an all-around grim trading session for the stock market, with the S&P 500...",https://finnhub.io/api/news?id=df2b290066ae80cddda9b505f516521476352d105f22d28363d49c4936bcd3c3
company,2023-05-02 12:10:04,Why Ross Stores (ROST) is Poised to Beat Earnings Estimates Again,120129567,https://media.zenfs.com/en/zacks.com/4f1a8d86cead9f96536efb147945dcc9,ROST,Yahoo,Ross Stores (ROST) has an impressive earnings surprise history and currently possesses the right combination of the two key ingredients for a likely beat in its next quarterly report.,https://finnhub.io/api/news?id=6b5f762a3752f18bae06da3ebb449154261d686f4fcad498f61b07a47c1108e6
company,2023-05-02 09:40:01,Why Ross Stores (ROST) is a Top Value Stock for the Long-Term,120103522,https://media.zenfs.com/en/zacks.com/1a018a29aef5adbf5b4319f32058e209,ROST,Yahoo,"Wondering how to pick strong, market-beating stocks for your investment portfolio? Look no further than the Zacks Style Scores.",https://finnhub.io/api/news?id=5ac37f55d4374a3bfb91027eb02e3380b65fb118d636a6b1a169f3eeea44ac83
company,2023-05-02 06:08:00,Barclays picks recession scenario winners and losers from the retail sector,120100830,,ROST,Seeking Alpha,Looking for stock market analysis and research with proves results? Zacks.com offers in-depth financial research with over 30years of proven results.,https://finnhub.io/api/news?id=b6cdf6bf1c57b7b1f1685b2d9b1402cb608e38e7bc355f1df3661d995471f80f
company,2023-05-02 04:40:00,Ross Stores price target lowered to $122 from $139 at Barclays,120100831,,ROST,Thefly.com,Looking for stock market analysis and research with proves results? Zacks.com offers in-depth financial research with over 30years of proven results.,https://finnhub.io/api/news?id=9a9ffd680e370cf252b7dd6e2712347abe7fc0faaadf5028bc4cce2105c3b774
company,2023-05-02 02:39:00,"Bed Bath closures an opportunity for Burlington, Ross and TJX, says BofA",120100832,,ROST,Thefly.com,Looking for stock market analysis and research with proves results? Zacks.com offers in-depth financial research with over 30years of proven results.,https://finnhub.io/api/news?id=8aa1955b11ccf9c25328fc4cff9dec29b60d1cd4810615d77e07edabc5e778e9
company,2023-05-01 13:21:00,"Ross Stores Inc. stock falls Monday, underperforms market",120112867,https://images.mktw.net/im-220105/social,ROST,MarketWatch,"Shares of Ross Stores Inc. slid 0.92% to $105.75 Monday, on what proved to be an all-around grim trading session for the stock market, with the S&P 500 Index...",https://finnhub.io/api/news?id=8e4ad24bce753089a35b3d10f5e7d16745bd4e87e230b543d4e24982940278ec
company,2023-05-05 13:22:00,"Ross Stores Inc. stock rises Friday, still underperforms market",120253650,https://images.mktw.net/im-220105/social,ROST,MarketWatch,"Shares of Ross Stores Inc. rallied 1.57% to $104.44 Friday, on what proved to be an all-around positive trading session for the stock market, with the S&P...",https://finnhub.io/api/news?id=d6f202b87b65b057f643204332fdcee4a6dbff81df2aaa717b2ac2e365825c34
company,2023-05-05 11:40:03,ROST vs. COST: Which Stock Is the Better Value Option?,120183188,https://media.zenfs.com/en/zacks.com/7853de8d69faeccb7d1ad6ebba40b8a2,ROST,Yahoo,ROST vs. COST: Which Stock Is the Better Value Option?,https://finnhub.io/api/news?id=390948121810b816ed0aa1af97fed87501f9ace5a65e5780ebd87e60aa177c66
company,2023-05-04 16:01:00,"Ross Stores, Inc. Announces First Quarter 2023 Earnings Release and Conference Call",120177375,https://media.zenfs.com/en/business-wire.com/02dd2ee9fe9b2494f9dc86700abebc35,ROST,Yahoo,"DUBLIN, Calif., May 04, 2023--Ross Stores, Inc. (NASDAQ: ROST) plans to release its first quarter 2023 earnings results on Thursday, May 18, 2023 at approximately 4:00 p.m. Eastern time.",https://finnhub.io/api/news?id=a18f27d2e6add9a7c8e5509cc0012f2d33b336686fe345b8bd0a117d3958c0a7
company,2023-05-04 13:22:00,Ross Stores Inc. stock underperforms Thursday when compared to competitors,120172477,https://images.mktw.net/im-220105/social,ROST,MarketWatch,"Shares of Ross Stores Inc. shed 1.12% to $102.83 Thursday, on what proved to be an all-around poor trading session for the stock market, with the S&P 500...",https://finnhub.io/api/news?id=bd13e6c1550722e9c40285523adf85ddfad1471681c5754d98b78433b1e1eb61
company,2023-05-03 13:22:00,"Ross Stores Inc. stock falls Wednesday, underperforms market",120133679,https://images.mktw.net/im-220105/social,ROST,MarketWatch,"Shares of Ross Stores Inc. slumped 0.74% to $103.99 Wednesday, on what proved to be an all-around grim trading session for the stock market, with the S&P 500...",https://finnhub.io/api/news?id=e00d6c0dfa8dad0c3bb71d334eceae0403e649c1c3399718f42d6d63f6ea97bc
company,2023-05-03 08:13:12,Here's How Dillard's (DDS) is Positioned Ahead of Q1 Earnings,120125365,https://media.zenfs.com/en/zacks.com/6993d288404c5e8906cb8cf90889c4ae,ROST,Yahoo,"Dillard's (DDS) Q1 results are expected to reflect gains from strong consumer demand, leading to continued sales momentum. Inventory management initiatives also bode well.",https://finnhub.io/api/news?id=a42edafaa4b8bb76356a0cf2d40df514d55dfd7a6aa37b81d50ac75d3047bf4f
company,2023-05-10 13:22:00,Ross Stores Inc. stock underperforms Wednesday when compared to competitors,120329662,https://images.mktw.net/im-220105/social,ROST,MarketWatch,"Shares of Ross Stores Inc. shed 2.05% to $101.95 Wednesday, on what proved to be an all-around mixed trading session for the stock market, with the S&P 500...",https://finnhub.io/api/news?id=c22c25f1b3f0562e66de6c687df6f563a0546ad0627d107a94cdab225109d4e9
company,2023-05-10 07:06:00,Notable Two Hundred Day Moving Average Cross - ROST,120285562,,ROST,Dividend Channel,Looking for stock market analysis and research with proves results? Zacks.com offers in-depth financial research with over 30years of proven results.,https://finnhub.io/api/news?id=df527c712866464b16f2e9d3382edc664cb079166b2e2e13f3d2fb07b0ffaf93
company,2023-05-10 01:55:00,Citigroup Remains a Buy on Ross Stores (ROST),120285564,,ROST,TipRanks,Looking for stock market analysis and research with proves results? Zacks.com offers in-depth financial research with over 30years of proven results.,https://finnhub.io/api/news?id=1fc309bdfff16ff8afec86c6acf290ee0609d210d1d4b06136761f30e92d7d42
company,2023-05-09 13:22:00,Ross Stores Inc. stock underperforms Tuesday when compared to competitors,120253648,https://images.mktw.net/im-220105/social,ROST,MarketWatch,"Shares of Ross Stores Inc. slid 0.72% to $104.08 Tuesday, on what proved to be an all-around poor trading session for the stock market, with the S&P 500...",https://finnhub.io/api/news?id=3aafdc8df8c2aecbcb9322adf568937bc500066d46bcac6444d32433c5feea1a
company,2023-05-08 20:29:39,7 Inflation-Proof Stocks to Buy for More Bank Bailouts,120325918,https://media.zenfs.com/en/investorplace_417/5314b134984a5aa9416d8a20ab5b5cb4,ROST,Yahoo,"While Wall Street apparently seems content with the federal government’s efforts to contain recent banking failures, investors may want to start targeting inflation-resistant stocks to buy just in case. To be sure, the nuances behind bank bailouts are complex. Still, at the root, these lifelines tend to be inflationary. Basically, that money has to come from somewhere. Further, if the Federal Reserve somehow manages to consistently curb accelerating consumer prices, it may then face another prob",https://finnhub.io/api/news?id=a9348078efd222cf0d9667a1d82d3bbe118cbe7ed07d389cb755e60a9ca4f5af
company,2023-05-08 13:23:00,Ross Stores Inc. stock outperforms competitors on strong trading day,120253649,https://images.mktw.net/im-220105/social,ROST,MarketWatch,"Shares of Ross Stores Inc. inched 0.37% higher to $104.83 Monday, on what proved to be an all-around mixed trading session for the stock market, with the S&P...",https://finnhub.io/api/news?id=c7ac350703a4d02be7b5ecd9dc5fa2817f8989fe361fc9aaac9fd62bdc39b360
company,2023-05-14 11:00:00,"Walmart, Alibaba, Target, and More Stocks to Watch This Week",120361956,https://images.barrons.com/im-764111/social,ROST,MarketWatch,"First-quarter earnings from Home Depot, Cisco Systems, Take-Two, Target, Walmart, Alibaba, Applied Materials, Ross Stores, and Deere. Plus, retail sales and...",https://finnhub.io/api/news?id=fac20014d52395ac6fd93bf8faf9cc4c50ec14b4810ae2c7b027f1dfdce9dd2c
company,2023-05-12 13:22:00,"Ross Stores Inc. stock rises Friday, outperforms market",120329660,https://images.mktw.net/im-220105/social,ROST,MarketWatch,"Shares of Ross Stores Inc. rose 1.93% to $104.51 Friday, on what proved to be an all-around rough trading session for the stock market, with the S&P 500...",https://finnhub.io/api/news?id=118ccb13db49e788c3be4eb4bafaf39d68d10ed3f2f70e4f5e1d694da084699c
company,2023-05-12 09:47:23,Telsey Advisory Group Reiterates Ross Stores (ROST) Market Perform Recommendation,120316846,,ROST,Fintel,,https://finnhub.io/api/news?id=a22f6b22af8c327ca8bf672202c1a6ff3746adf53fab7000a177b37e22869002
company,2023-05-12 06:02:29,Nordstrom wants off-price chain Rack to lead it out of sales slump,120317384,https://image.cnbcfm.com/api/v1/image/107155062-1669052594417-gettyimages-1242726075-NORDSTROM_EARNS.jpeg?v=1683900149&w=1920&h=1080,ROST,CNBC,The department store operator is opening 20 Nordstrom Rack stores and zeroing in on best-selling brands.,https://finnhub.io/api/news?id=8154bb47ed7982c1b4142eb94a7ec71a430c7750adff05dd6b479617de485bed
company,2023-05-12 03:26:00,Telsey Advisory Sticks to Their Hold Rating for Ross Stores (ROST),120319384,,ROST,TipRanks,Looking for stock market analysis and research with proves results? Zacks.com offers in-depth financial research with over 30years of proven results.,https://finnhub.io/api/news?id=780f985ac41cc6729abb6302da4d363b573eb7427c9c8a0ba68327c81a9b7010
company,2023-05-11 22:06:00,"Catalyst watch: AI talk, ON Semiconductor event, hedge fund reports and Walmart earnings",120319958,,ROST,Seeking Alpha,Looking for stock market analysis and research with proves results? Zacks.com offers in-depth financial research with over 30years of proven results.,https://finnhub.io/api/news?id=0c53ce0ff51437c523ba0d5a4b9f51f8f78ccac2be7571264a528d100377417b
company,2023-05-11 21:14:00,"Earnings Week Ahead: Walmart, Home Depot, Alibaba, Cisco, and more",120319241,,ROST,Seeking Alpha,Looking for stock market analysis and research with proves results? Zacks.com offers in-depth financial research with over 30years of proven results.,https://finnhub.io/api/news?id=e216115dcddd712d003b028c7f3b6f766a37366fdbf592227a389073bca56656
company,2023-05-11 13:22:00,Ross Stores Inc. stock outperforms market on strong trading day,120329661,https://images.mktw.net/im-220105/social,ROST,MarketWatch,"Shares of Ross Stores Inc. inched 0.57% higher to $102.53 Thursday, on what proved to be an all-around grim trading session for the stock market, with the...",https://finnhub.io/api/news?id=51bd529302d14dfe8a1129880bae9195757b0f866aadab359c43990bb17038e2
company,2023-05-11 06:42:00,Global company events calendar - next 7 days,120297117,,ROST,Alliance News,Looking for stock market analysis and research with proves results? Zacks.com offers in-depth financial research with over 30years of proven results.,https://finnhub.io/api/news?id=82572f860553ec070ff25a363ec843b708221e0c645c9922aea12eee7d703176
company,2023-05-18 17:59:09,"Are Markets All-In on a ""Soft Landing""?",120434019,https://media.zenfs.com/en/zacks.com/6b3157985225cfff3a06dcf5af6a4b1b,ROST,Yahoo,Markets swung back late in the day from early afternoon doldrums to close near session highs across the board.,https://finnhub.io/api/news?id=bf5c732af1c3747681dec85a53760ee48c1c591b86b4d9f5d7669cbc2f39e9c0
company,2023-05-18 17:36:33,"Ross Stores lifts annual profit forecast on strong demand, easing freight costs",120433560,https://static.reuters.com/resources/r/?m=02&d=20230518&t=2&i=1633098075&r=LYNXMPEJ4H0VZ,ROST,Reuters,"Ross Stores on Thursday raised its annual profit forecast after upbeat quarterly results, buoyed by budget-conscious customers increasingly shopping at the off-price retailer and easing freight costs.",https://finnhub.io/api/news?id=bf23d716784844a6e1edf38eb743b101ff8a9bce8e0ce7f212f859a01e52d64e
company,2023-05-18 17:28:39,"Stocks moving in after-hours: Ross Stores, Applied Materials",120433549,https://s.yimg.com/ny/api/res/1.2/wo1PU6gRe9RwaF6RQyGdiA--/YXBwaWQ9aGlnaGxhbmRlcjt3PTEyMDA7aD04MzM-/https://s.yimg.com/os/creatr-uploaded-images/2023-05/c0385580-f5b0-11ed-bfeb-c4dd4fae1b63,ROST,Yahoo,"These are the stocks moving in after-hours trade on May 18, 2023.",https://finnhub.io/api/news?id=5954e1479bcde10bfba50041ca3354414a971cad380c59ee49e485109b3d4d6f
