category,datetime,headline,id,image,related,source,summary,url
company,2022-09-23 13:20:00,"Ross Stores Inc. stock falls Friday, underperforms market",116242602,https://images.mktw.net/im-220105/social,ROST,MarketWatch,"Shares of Ross Stores Inc. slid 2.48% to $84.44 Friday, on what proved to be an all-around grim trading session for the stock market, with the S&P 500 Index...",https://finnhub.io/api/news?id=03beb36444c2711ba827554c1b7c6adfc9d1ddc187d9a97b174e8557820de117
company,2022-09-23 11:52:30,7 Retail Stocks to Dump Before the Coming Holiday Sales Slump,116260779,https://s.yimg.com/uu/api/res/1.2/2wRXjSJYuXzcOg5Aeqa1UQ--~B/aD00MDA7dz03Mjg7YXBwaWQ9eXRhY2h5b24-/https://media.zenfs.com/en/investorplace_417/b983dda721190fa8bbd5121c3222eb87,ROST,Yahoo,"Usually, the winter season brings levity to people as the holidays approach, but the chilly economic nature this year brings up the uncomfortable topic of retail stocks to sell. Fundamentally, Federal Reserve Chair Jerome Powell indicated that his top priority is controlling inflation. What’s more, Powell made good on his statements, with the central bank raising the benchmark interest rate. Moving forward, it’s not so much about the rate hike itself (up 0.75%) that matters. Instead, it’s all ab",https://finnhub.io/api/news?id=08073d7e01c2a6ed6ec551a50229da881ce41a85806b2f9006e4edae0db3d4dd
company,2022-09-23 05:27:24,Ross Stores: Benefits From Weak Consumer Sentiment And Supply Glut,116212503,https://static.seekingalpha.com/cdn/s3/uploads/getty_images/1262039233/image_1262039233.jpg?io=getty-c-w750,ROST,SeekingAlpha,ROST to benefit from consumers trade-down to cheaper goods. ROST has significant scale advantage over smaller players. Read more why I rate the stock a buy.,https://finnhub.io/api/news?id=6ccbffd1cdae92a097de7bdc3e54a4183cd02331b5e68d6c0558eafdc7e62495
company,2022-09-23 04:30:00,"dd's DISCOUNTS to Open a New Store in Bolingbrook, Illinois",116224898,,ROST,PR Newswire,Looking for stock market analysis and research with proves results? Zacks.com offers in-depth financial research with over 30years of proven results.,https://finnhub.io/api/news?id=84bb2f1d82d1606569337c344a210785d0c8d5b939f69716b560db6d83fcb3d0
company,2022-09-23 04:30:00,"Ross Dress for Less to Open a New Store in Cincinnati, Ohio",116224897,,ROST,PR Newswire,Looking for stock market analysis and research with proves results? Zacks.com offers in-depth financial research with over 30years of proven results.,https://finnhub.io/api/news?id=2b20b1e17c85d4eade9ad0571314e07b9eda1e58794aba251446be6b8692cc4e
company,2022-09-28 04:30:00,"Ross Dress for Less to Open a New Store in Pueblo, Colorado",116314884,,ROST,PR Newswire,Looking for stock market analysis and research with proves results? Zacks.com offers in-depth financial research with over 30years of proven results.,https://finnhub.io/api/news?id=aa08484fd7b030c815b7ed3b60b8f5af9827cc1a3cf231c362192104050b282b
company,2022-09-27 04:30:00,"Ross Dress for Less to Open a New Store in Somerset, Kentucky",116314885,,ROST,PR Newswire,Looking for stock market analysis and research with proves results? Zacks.com offers in-depth financial research with over 30years of proven results.,https://finnhub.io/api/news?id=46c8c620572e570db09d09a23eb041af86996392670c35bc5886db45a1c3d778
company,2022-09-26 18:15:10,Ross Stores (ROST) Dips More Than Broader Markets: What You Should Know,116270290,https://s.yimg.com/uu/api/res/1.2/5w_iAw5naBqMPrzpIECi9Q--~B/aD02NzU7dz05MDA7YXBwaWQ9eXRhY2h5b24-/https://media.zenfs.com/en/zacks.com/670d1917693293f70179651625deb88f,ROST,Yahoo,"Ross Stores (ROST) closed the most recent trading day at $82.93, moving -1.79% from the previous trading session.",https://finnhub.io/api/news?id=8733dc24339e3083bf976046db34b37b322c74e6a40bc505ac2116685dfd06bd
company,2022-09-26 04:30:00,"Ross Dress for Less to Open a New Store in Maysville, Kentucky",116262260,,ROST,PR Newswire,Looking for stock market analysis and research with proves results? Zacks.com offers in-depth financial research with over 30years of proven results.,https://finnhub.io/api/news?id=b0056ac993653df61c0d5aa368e8e0639f3748f4c5ca3cb0e4cc2b9a2290306c
company,2022-09-25 08:20:00,This Dividend-Paying Growth Stock Hit a Rough Patch. Is It Still a Buy?,116242891,,ROST,Yahoo,"Let's go over Ross Stores' fundamentals and valuation to see if it is currently on the sale rack for dividend growth investors.  Operating 1,669 Ross Dress for Less stores in 40 U.S. states, Washington D.C., and Guam as of the second quarter, Ross Stores is the largest off-price apparel and home fashion chain in the U.S. The company also operated 311 dd's DISCOUNTS in 21 U.S. states with in-season and name brand apparel.  Ross Stores produced $4.6 billion in sales during the second quarter, which was down 4.6% year over year.",https://finnhub.io/api/news?id=bf26d361b8760c034c345b20928c767912129aa2674c2e8ebe4f86ce07d63171
company,2022-09-30 04:30:00,"Ross Dress for Less to Open a New Store in Brookfield, Wisconsin",116361585,,ROST,PR Newswire,Looking for stock market analysis and research with proves results? Zacks.com offers in-depth financial research with over 30years of proven results.,https://finnhub.io/api/news?id=2732e5d8a7ffff853fcc7ea5ccb38fa820e1849406d1295b95115b806a9448f4
company,2022-09-29 04:30:00,"Ross Dress for Less to Relocate and Open a New Store in Spartanburg, South Carolina",116340002,,ROST,PR Newswire,Looking for stock market analysis and research with proves results? Zacks.com offers in-depth financial research with over 30years of proven results.,https://finnhub.io/api/news?id=ac9a463bc6f95ce3125db5d30c367757fba7e5acaa16ade531f47f282a486879
company,2022-09-29 00:04:00,7 Real Estate Stocks to Sell Before They Die,116342012,https://investorplace.com/wp-content/uploads/2022/06/real-estate-single-family-home-1600.png,ROST,InvestorPlace,"The pandemic hit many real estate stocks hard, and now rising interest rates are looking like another crippling blow to the industry.",https://finnhub.io/api/news?id=37548094cc240068e32efa4f664265887ecdc27b0e3a46b07032693accbc668a
company,2022-10-06 16:15:00,Edward G. Cannizzaro Joins Ross Stores Board of Directors,116516563,https://s.yimg.com/uu/api/res/1.2/94GM3KPaC5jBZnFjNRiQbA--~B/aD0xNDg7dz00ODA7YXBwaWQ9eXRhY2h5b24-/https://media.zenfs.com/en/business-wire.com/77d288aacf7c60d15681f1e08c085f4d,ROST,Yahoo,"DUBLIN, Calif., October 06, 2022--Ross Stores, Inc. (NASDAQ: ROST) announced today that Edward G. Cannizzaro has been elected to its Board of Directors, effective October 14, 2022.",https://finnhub.io/api/news?id=db4eb47a9ccb17d8db495c2cdcc065f86fbe3c65070e2ac6e6fdd21df65dbd9d
company,2022-10-06 13:20:00,"Ross Stores Inc. stock falls Thursday, underperforms market",116558119,https://images.mktw.net/im-220105/social,ROST,MarketWatch,"Shares of Ross Stores Inc. slid 1.76% to $88.24 Thursday, on what proved to be an all-around poor trading session for the stock market, with the S&P 500...",https://finnhub.io/api/news?id=697233bc7be5ea81851e8c83be10927134d72c80977e7672d2041fde9700308f
company,2022-10-06 04:30:00,"Ross Dress for Less to Open a New Store in Sheboygan, Wisconsin",116504627,,ROST,PR Newswire,Looking for stock market analysis and research with proves results? Zacks.com offers in-depth financial research with over 30years of proven results.,https://finnhub.io/api/news?id=6bef93755f5c3333d43e243eea653564126e1dda01f9997c9bdd962691c97b6d
company,2022-10-05 13:20:00,"Ross Stores Inc. stock rises Wednesday, outperforms market",116558120,https://images.mktw.net/im-220105/social,ROST,MarketWatch,"Shares of Ross Stores Inc. inched 0.49% higher to $89.82 Wednesday, on what proved to be an all-around grim trading session for the stock market, with the...",https://finnhub.io/api/news?id=e670fcb46e7314be480c557761375c923f490b77dec8ca11267f400b645c771b
company,2022-10-05 04:30:00,"Ross Dress for Less to Open a New Store in Plantation, Florida",116477503,,ROST,PR Newswire,Looking for stock market analysis and research with proves results? Zacks.com offers in-depth financial research with over 30years of proven results.,https://finnhub.io/api/news?id=f9adac3df4a8451c7bd7bc0ea276b2e105cbbbf55a048a87a48933514aacbb31
company,2022-10-04 13:47:51,Ross Stores Stock's Bearish Signal Has Never Been Wrong,116441524,https://s.yimg.com/uu/api/res/1.2/2TCLTZdjislG5YIErM56zA--~B/aD00MTQ7dz01OTU7YXBwaWQ9eXRhY2h5b24-/https://media.zenfs.com/en/schaeffers_investment_research_24/d6feb45757ecf59a6f73e9e1611ce2ee,ROST,Yahoo,The shares just pulled back to the historically bearish 180-day moving average,https://finnhub.io/api/news?id=f378dfd755ddf498c0a2f65df78f076860cd99a2176604eb13a47954f8900af6
company,2022-10-04 13:20:00,"Ross Stores Inc. stock rises Tuesday, outperforms market",116558121,https://images.mktw.net/im-220105/social,ROST,MarketWatch,"Shares of Ross Stores Inc. rallied 3.98% to $89.38 Tuesday, on what proved to be an all-around favorable trading session for the stock market, with the S&P...",https://finnhub.io/api/news?id=b48e6545b0528a533a11bcb3136b77001a43c871d7d0716333fae4215b128b7b
company,2022-10-04 04:30:00,"Ross Dress for Less to Open a New Store in McComb, Mississippi",116477504,,ROST,PR Newswire,Looking for stock market analysis and research with proves results? Zacks.com offers in-depth financial research with over 30years of proven results.,https://finnhub.io/api/news?id=413d0261da43678454b4e5bf6894ca186f2e0c8edea15d6b9319cb78105d6cf2
company,2022-10-03 13:20:00,"Ross Stores Inc. stock rises Monday, still underperforms market",116558122,https://images.mktw.net/im-220105/social,ROST,MarketWatch,"Shares of Ross Stores Inc. rose 2.01% to $85.96 Monday, on what proved to be an all-around positive trading session for the stock market, with the S&P 500...",https://finnhub.io/api/news?id=10e9b4302f7bf80d639d5c4b7e24dc04993628c8dbb0fc022ef40d19e84c03c3
company,2022-10-03 04:30:00,"Ross Dress for Less to Open a New Store in Barboursville, West Virginia",116400634,,ROST,PR Newswire,Looking for stock market analysis and research with proves results? Zacks.com offers in-depth financial research with over 30years of proven results.,https://finnhub.io/api/news?id=30285ae7b2114d91cd813ea630eb9bafedb716ae6c9b1d4df4be03f1cda4aba8
company,2022-10-10 12:01:00,"ROSS STORES DONATES $400,000 TO AMERICAN RED CROSS DISASTER RELIEF IN RESPONSE TO HURRICANE IAN",116586283,,ROST,PR Newswire,Looking for stock market analysis and research with proves results? Zacks.com offers in-depth financial research with over 30years of proven results.,https://finnhub.io/api/news?id=9a65b054032d31a0deb25b54919c070dfbd6fce6df557490016198a5365a1a47
company,2022-10-07 18:15:10,Ross Stores (ROST) Stock Moves -1.56%: What You Should Know,116540972,https://s.yimg.com/uu/api/res/1.2/UYup8AGIrn99rMsHiTllqA--~B/aD04NzY7dz05MDA7YXBwaWQ9eXRhY2h5b24-/https://media.zenfs.com/en/zacks.com/d0d4ab152198da2f423d92da8a7d22ee,ROST,Yahoo,"In the latest trading session, Ross Stores (ROST) closed at $86.86, marking a -1.56% move from the previous day.",https://finnhub.io/api/news?id=e13edcd0d4852a952540c16a64c9d868e85e2fc1e711a3036d1da680d5d5dafe
company,2022-10-07 13:20:00,Ross Stores Inc. stock underperforms Friday when compared to competitors,116558118,https://images.mktw.net/im-220105/social,ROST,MarketWatch,"Shares of Ross Stores Inc. slipped 1.56% to $86.86 Friday, on what proved to be an all-around rough trading session for the stock market, with the S&P 500...",https://finnhub.io/api/news?id=2c442ebf0948ecdb0bfa43694bf2013ba8547a979cb4e99e49cd8e522edad691
company,2022-10-14 15:57:00,"Shortages Have Turned to Gluts. TJX, Burlington, and Other Stocks That Could Benefit.",116709001,https://images.barrons.com/im-644439/social,ROST,MarketWatch,"When a company has too much to sell, it has little choice but to start discounting. But some, like off-price retailers TJX, Ross Stores, and Burlington...",https://finnhub.io/api/news?id=64c1fc1403dd996332816501edbe5bc54c61f8bbac7c4b37ce72c9b46d71f132
company,2022-10-14 13:21:00,"Ross Stores Inc. stock falls Friday, underperforms market",116726126,https://images.mktw.net/im-220105/social,ROST,MarketWatch,"Shares of Ross Stores Inc. slipped 4.68% to $81.45 Friday, on what proved to be an all-around dismal trading session for the stock market, with the S&P 500...",https://finnhub.io/api/news?id=98f97a9e0060445482ef197d5268ff98faf52f9e663fd3a0940cb1940c83ade5
company,2022-10-13 13:21:00,"Ross Stores Inc. stock rises Thursday, still underperforms market",116726127,https://images.mktw.net/im-220105/social,ROST,MarketWatch,"Shares of Ross Stores Inc. rallied 1.11% to $85.45 Thursday, on what proved to be an all-around favorable trading session for the stock market, with the S&P...",https://finnhub.io/api/news?id=5b907930b4be7b2f1dae73570e4c6369c00fc7d4372e700e9eebf02ae112a46d
company,2022-10-13 03:00:00,Macellum Issues Letter to Fellow Shareholders Regarding its Desire to Collaborate with the Kohl’s Board of Directors on an Immediate and Targeted Refresh,116623085,,ROST,Business Wire,Looking for stock market analysis and research with proves results? Zacks.com offers in-depth financial research with over 30years of proven results.,https://finnhub.io/api/news?id=f05596615c950e6e0988100e01b795a3048352811cd7cd7826b0b7cee75a3df7
company,2022-10-12 13:21:00,Ross Stores Inc. stock underperforms Wednesday when compared to competitors,116726128,https://images.mktw.net/im-220105/social,ROST,MarketWatch,"Shares of Ross Stores Inc. shed 1.89% to $84.51 Wednesday, on what proved to be an all-around rough trading session for the stock market, with the S&P 500...",https://finnhub.io/api/news?id=aa62e59c40147cd3ae8aa72a9861a1db57202f7d3af3dd9b9678f404d9ae3cf3
company,2022-10-18 13:21:00,"Ross Stores Inc. stock rises Tuesday, still underperforms market",116726123,https://images.mktw.net/im-220105/social,ROST,MarketWatch,"Shares of Ross Stores Inc. inched 0.53% higher to $84.66 Tuesday, on what proved to be an all-around positive trading session for the stock market, with the...",https://finnhub.io/api/news?id=4718bb888f13268a5f0ab905c84be5cb55b2049dd9bac92157328531139d7f1e
company,2022-10-17 13:21:00,"Ross Stores Inc. stock rises Monday, outperforms market",116726124,https://images.mktw.net/im-220105/social,ROST,MarketWatch,"Shares of Ross Stores Inc. rose 3.39% to $84.21 Monday, on what proved to be an all-around positive trading session for the stock market, with the S&P 500...",https://finnhub.io/api/news?id=532bea3c0e087066969c4d97b434fb9a34b20087d4fcd6bdbf4f35ec21564ccd
company,2022-10-16 03:06:00,Fly Intel: Top five weekend stock stories,116719030,https://thefly.com/images/meta/hotstocks.jpg,ROST,Thefly.com,"Catch up on the weekend&#... SPLK, MBGYY, TSLA, ORCL, AMZN, MSFT, GOOG, GOOGL, CMCSA, CMCSK, TJX, ROST, BURL, DECK, BHP, RIO, GLNCY, NGLOY, FCX, AA, GOLD, NEM, CCJ",https://finnhub.io/api/news?id=9a10938fc956410926676336dfc780e770fd810b2374b0255d54c33bc2d09f1c
company,2022-10-15 04:24:00,"Shortages have turned to gluts, off-price retailers could benefit, Barron's says",116665547,https://thefly.com/images/meta/periodicals.jpg,ROST,Thefly.com,"Shortages have turned int... TGT, NKE, TJX, ROST, BURL",https://finnhub.io/api/news?id=5f7f67b30aebd4b232062a8b71af70a1fdedd4d0838df00ff937cef9df1be061
company,2022-10-21 13:21:00,Ross Stores Inc. stock outperforms market on strong trading day,116785402,https://images.mktw.net/im-220105/social,ROST,MarketWatch,"Shares of Ross Stores Inc. rose 3.13% to $85.07 Friday, on what proved to be an all-around favorable trading session for the stock market, with the S&P 500...",https://finnhub.io/api/news?id=e754077c1940a9ff7a6f821ca0d12ff7b1ed0e7c171fe8249cc46999a9a3e904
company,2022-10-20 13:21:00,"Ross Stores Inc. stock falls Thursday, underperforms market",116777490,https://images.mktw.net/im-220105/social,ROST,MarketWatch,"Shares of Ross Stores Inc. slipped 1.40% to $82.49 Thursday, on what proved to be an all-around grim trading session for the stock market, with the S&P 500...",https://finnhub.io/api/news?id=233e1da7f40c4d06f37becdf3300117cf41bad9b36d56173233eb44bcc9238d3
company,2022-10-20 07:13:00,"JLB & ASSOCIATES INC Buys 4, S - GuruFocus.com",116747335,https://static.gurufocus.com/images/logo_global.png,ROST,GuruFocus,GuruFocus Article or News written by insider and the topic is about: ,https://finnhub.io/api/news?id=7c60d4214f6ba59d4dff85e2147c16fb589a76e16ecb8aa5a03998a02448cf91
company,2022-10-19 13:21:00,"Ross Stores Inc. stock falls Wednesday, underperforms market",116726121,https://images.mktw.net/im-220105/social,ROST,MarketWatch,"Shares of Ross Stores Inc. slipped 1.18% to $83.66 Wednesday, on what proved to be an all-around dismal trading session for the stock market, with the S&P...",https://finnhub.io/api/news?id=2935abee8df5f4eeac9826ef4df5c4f2405aee5a540f052dc88066a96fe0f444
company,2022-10-19 06:51:00,Stocks of TJX and Ross Stores Look Pricey. Try These 4 Instead.,116777491,https://images.barrons.com/im-646308/social,ROST,MarketWatch,"Stocks of TJX, Ross Stores, and Burlington Stores trade at lofty levels. Some retailers that sell to consumers online are looking like better bets.",https://finnhub.io/api/news?id=f7e81edb815232ea715369009e8030fa3e9970fc3291f0c24be0f25da7ab8a5b
company,2022-10-26 13:21:00,Ross Stores Inc. stock outperforms market on strong trading day,116882936,https://images.mktw.net/im-220105/social,ROST,MarketWatch,"Shares of Ross Stores Inc. inched 0.34% higher to $93.39 Wednesday, on what proved to be an all-around mixed trading session for the stock market, with the...",https://finnhub.io/api/news?id=cc1646b4f495d1b85f4dceb11218687fd44081592067b418117c941382737c5f
company,2022-10-25 13:21:00,Ross Stores Inc. stock outperforms competitors on strong trading day,116882937,https://images.mktw.net/im-220105/social,ROST,MarketWatch,"Shares of Ross Stores Inc. rallied 6.87% to $93.07 Tuesday, on what proved to be an all-around favorable trading session for the stock market, with the S&P...",https://finnhub.io/api/news?id=eb09aca2b805a8b722072fbcfba589cae734332556bed600dac0e75472a9f024
company,2022-10-25 10:31:00,"Ross Stores Stock Is One of the Best Ways to Play Off-Price, Says a New Bull",116820264,https://s.yimg.com/ny/api/res/1.2/k6BLEVbk1aCJZ8Re.QADXg--/YXBwaWQ9aGlnaGxhbmRlcjt3PTEyMDA7aD02MDA-/https://media.zenfs.com/en/Barrons.com/1a4181b7a0ab30a7fcf8fb1606f33b72,ROST,Yahoo,Wells Fargo analyst Ike Boruchow upgraded discount retailer Ross to Overweight from Equal-Weight. He says it and Burlington Stores top TJX.,https://finnhub.io/api/news?id=a8bbac20c754490655282e781186f0d9bc30c7fb864a6f5b9a7dc7665844cc33
company,2022-10-25 08:55:14,"Stocks making the biggest moves midday: Xerox, Logitech, Upstart, Hibbett, Planet Fitness & more",116822565,https://image.cnbcfm.com/api/v1/image/102384461-137777210.jpg?v=1666716914&w=1920&h=1080,ROST,CNBC,These are the stocks posting the largest moves in midday trading. ,https://finnhub.io/api/news?id=98e62560af9eaa952a71a30f74d0679e2ae582fa926b05e68fb098f6e50744ba
company,2022-10-25 04:57:00,"Street Wrap: Today's Top 15 Upgrades, Downgrades, Initiations",116819935,https://image.thefly.com/catalog/201811/img_112.jpg,ROST,Thefly.com,"Ross Stores upgrade, Arista Networks downgrade and Deckers Brands initiation among today's top calls on Wall Street ROST, PLNT, HIBB, NKE, WEBR, ISBA, ANET, ARBK, HRT, FA, HCAT, MNRL, STR, DECK, UPST, ARVN, STEM, AMPS",https://finnhub.io/api/news?id=fdbc487095be218fca2583a0951b1e2219264cd738a5549324149e4f00c8dd5c
company,2022-10-25 03:56:06,"UPS, General Motors, Coca-Cola Rise Premarket; 3M, HSBC Fall",116818994,https://s.yimg.com/cv/apiv2/social/images/yahoo_default_logo-1200x1200.png,ROST,Yahoo,By Peter Nurse,https://finnhub.io/api/news?id=70614af557771c9727fd206150df9995bd0916361040b65f8ef387a1d4834101
company,2022-10-25 00:24:00,Ross Stores upgraded to Overweight from Equal Weight at Wells Fargo,116821861,https://thefly.com/images/meta/streetresearch_upgrade.jpg,ROST,Thefly.com,"Wells Fargo analyst Ike B... ROST, BURL",https://finnhub.io/api/news?id=2319f323eaafd265b2a8fdac5a35e2359afa3ac451b40eea824548a7e337fe46
company,2022-10-24 23:30:00,What You Missed On Wall Street On Tuesday,116825295,https://image.thefly.com/catalog/201810/img_66.png,ROST,Thefly.com,"Five top five lists with the news and calls moving stocks, powered by The Fly. KO, GE, GM, WBD, ADDYY, GPS, ROST, ANET, PLNT, HRT, UPST, TM, DWAC, INTC, TWTR, UL, WEBR, MEDP, CGC, CCK, BRO, PYPL, AMZN, MMM, BIIB, XRX, UPS, AAN",https://finnhub.io/api/news?id=058e32c9fc2a09e225535d8f31da5519d316c3dd71a2790d76479a7c90a0c65f
company,2022-10-24 21:24:00,"Notable Tuesday Option Activity: ROST, CVS, HAL",116826314,,ROST,Stock Options Channel,"Staff article entitled Notable Tuesday Option Activity: ROST, CVS, HAL, about stock options, from Stock Options Channel.",https://finnhub.io/api/news?id=a878fe2b409d9a13e86d371988e1663efa18efef74b7a10859e8838417f1f02c
company,2022-10-28 13:21:00,"Ross Stores Inc. stock rises Friday, still underperforms market",116882934,https://images.mktw.net/im-220105/social,ROST,MarketWatch,"Shares of Ross Stores Inc. inched 0.79% higher to $95.35 Friday, on what proved to be an all-around positive trading session for the stock market, with the...",https://finnhub.io/api/news?id=4eb5a18c63ae25f238119dee26574556fc3f2c052c358ec115c4e498fb148ad6
company,2022-10-28 11:27:00,Why Ross Stores Stock Was Up 10% This Week,116869147,https://s.yimg.com/ny/api/res/1.2/9gkpv1_bJN9iB3DM5xeTKw--/YXBwaWQ9aGlnaGxhbmRlcjt3PTEyMDA7aD04OTY-/https://media.zenfs.com/en/motleyfool.com/f27918dcfb25fca5aab682de617e9961,ROST,Yahoo,"Ross Stores (NASDAQ: ROST) shareholders beat the market this week as the stock gained 10% by 10 a.m. ET on Friday.  Ross Stores caught a head-turning upgrade earlier in the week when a Wells Fargo analyst called the stock a buy and raised the short-term price target to $110 per share from $90 per share.  Ross Stores might have an unusually strong selection of merchandise if the holiday season requires extra promotions from major apparel and home goods, brands, too.",https://finnhub.io/api/news?id=77ee04521b149a50dfe2416c2e6c579e1a3acfe61a44d8fd2fdc311e47528a5c
company,2022-10-28 06:26:46,TJX: Upside Is Limited,116855171,https://static.seekingalpha.com/cdn/s3/uploads/getty_images/1415456251/image_1415456251.jpg?io=getty-c-w750,ROST,SeekingAlpha,TJX Companies continues to perform well in a difficult environment and is well positioned for long-term growth. Click here to read my analysis of TJX stock.,https://finnhub.io/api/news?id=b02e527c3bb5ee76327d188aa102013784a1c2d2bcce5f46719566e4aaa8fe79
company,2022-10-27 13:21:00,Ross Stores Inc. stock outperforms market on strong trading day,116882935,https://images.mktw.net/im-220105/social,ROST,MarketWatch,"Shares of Ross Stores Inc. rose 1.30% to $94.60 Thursday, on what proved to be an all-around mixed trading session for the stock market, with the Dow Jones...",https://finnhub.io/api/news?id=b8e115a05986a87166f42d2d669a11f0e01482b47fcd0a71055053929c40f5c3
company,2022-11-03 16:01:00,"Ross Stores, Inc. Announces Third Quarter 2022 Earnings Release and Conference Call",116944869,https://media.zenfs.com/en/business-wire.com/aa9672c7a2b8cd782d37d03f05e120e1,ROST,Yahoo,"DUBLIN, Calif., November 03, 2022--Ross Stores, Inc. (NASDAQ: ROST) plans to release its third quarter 2022 earnings results on Thursday, November 17, 2022 at approximately 4:00 p.m. Eastern time.",https://finnhub.io/api/news?id=347f5555c0e63a296de284b059ce4ee6832bd481c51de6721386c2fb449c3983
company,2022-11-03 13:21:00,Ross Stores Inc. stock outperforms market despite losses on the day,116946742,https://images.mktw.net/im-220105/social,ROST,MarketWatch,"Shares of Ross Stores Inc. slid 0.32% to $92.30 Thursday, on what proved to be an all-around grim trading session for the stock market, with the S&P 500...",https://finnhub.io/api/news?id=e9141c022377994a06a4e6065483c121e7bd4552bffc7b81a3767e0f34de1ecc
company,2022-11-02 16:48:22,Shopping Center REITs: Supply/Demand Too Good To Ignore,116920763,https://static.seekingalpha.com/cdn/s3/uploads/getty_images/485974602/image_485974602.jpg?io=getty-c-w750,ROST,SeekingAlpha,"For much of the last decade, pundits have been calling for the death of brick-and-mortar retail. See why we are positive on shopping center REITs and our picks.",https://finnhub.io/api/news?id=1c2f062afa6d2c427ec690bf5cf716bcb0970f25b1e36147dbccd18145c62ffb
company,2022-11-01 15:33:58,Retail analyst details 'the biggest risk' for sellers this holiday season,116906459,https://s.yimg.com/ny/api/res/1.2/a7N8Yn7ohHAL793Z.T3F_A--/YXBwaWQ9aGlnaGxhbmRlcjt3PTEyMDA7aD04MDA-/https://s.yimg.com/os/creatr-uploaded-images/2022-11/1a5cc4d0-5a0f-11ed-899d-fa9ac11486f6,ROST,Yahoo,Not every retailer will be a winner this holiday season.,https://finnhub.io/api/news?id=dc6355896db2046dddda637d835865bf030f34e486b3d0d62f33db71aef9bd93
company,2022-11-01 13:21:00,"Ross Stores Inc. stock falls Tuesday, underperforms market",116898446,https://images.mktw.net/im-220105/social,ROST,MarketWatch,"Shares of Ross Stores Inc. slid 1.06% to $94.68 Tuesday, on what proved to be an all-around rough trading session for the stock market, with the S&P 500...",https://finnhub.io/api/news?id=cb1c1576ddaadd71f6d40341d9047e50164d1463f79150198fcd2ff01d063522
company,2022-10-31 17:50:50,Is it Still Safe to Invest in Ross Stores (ROST)?,116906460,https://media.zenfs.com/en/insidermonkey.com/65518468ef319d035ed7bebb351c5868,ROST,Yahoo,"Madison Funds, managed by Madison Asset Management, LLC, released its “Madison Mid Cap Fund” third quarter 2022 investor letter – a copy of which can be downloaded here. The Madison Mid Cap Fund (Class Y) was down -3.39% in the third quarter, compared to the -3.44% decline in the benchmark Russell Midcap Index. The Fund (-21.13%) […]",https://finnhub.io/api/news?id=7ff0b63691a9f871abcb567403cafd14ee4f55e217ac74bf8d6d81355bff7b3b
