category,datetime,headline,id,image,related,source,summary,url
company,2023-01-13 07:10:27,Should You Hold Ross Stores (ROST) Stock?,118239237,https://media.zenfs.com/en/insidermonkey.com/d7352d71981e98e619582c47208a8ea8,ROST,Yahoo,"Madison Funds, managed by Madison Investment Management, released its “Madison Mid Cap Fund” fourth-quarter 2022 investor letter. A copy of the same can be downloaded here. In the fourth quarter, the fund increased by 9.6% compared to a 9.2% increase in the Russell Midcap Index. In addition, you can check the top 5 holdings of the fund […]",https://finnhub.io/api/news?id=8c67ad2c3880564da1d7560c6c7341bbcb2986fe9d56af6c91ac6204e3b1407b
company,2023-01-13 00:18:00,Ross Stores price target raised to $139 from $127 at Barclays,118409532,,ROST,Thefly.com,Looking for stock market analysis and research with proves results? Zacks.com offers in-depth financial research with over 30years of proven results.,https://finnhub.io/api/news?id=f803f64a5bd4822caec666f88e2e9b05407009651ed07a21ea32ed93031ff87b
company,2023-01-12 23:23:00,"Ross Stores Inc. stock rises Friday, outperforms market",118409533,,ROST,MarketWatch,Looking for stock market analysis and research with proves results? Zacks.com offers in-depth financial research with over 30years of proven results.,https://finnhub.io/api/news?id=defe96ba6276fb2d136ba10f77a36da708ac342cc78f340fb810d41919d23641
company,2023-01-12 12:22:00,Ross Stores Inc. stock underperforms Thursday when compared to competitors,118218469,https://images.mktw.net/im-220105/social,ROST,MarketWatch,"Shares of Ross Stores Inc. shed 0.66% to $118.75 Thursday, on what proved to be an all-around great trading session for the stock market, with the S&P 500...",https://finnhub.io/api/news?id=4ca3c4c321dfecc0457ffde0078702660f889abf79d09f701d4da61d8a82fea9
company,2023-01-11 12:22:00,Ross Stores Inc. stock underperforms Wednesday when compared to competitors,118218472,https://images.mktw.net/im-220105/social,ROST,MarketWatch,"Shares of Ross Stores Inc. dropped 0.21% to $119.54 Wednesday, on what proved to be an all-around positive trading session for the stock market, with the S&P...",https://finnhub.io/api/news?id=b7bedd8edd9626e9e44859e001fd4c89a06a58ad8f08fd822f5addfa4171b0a4
company,2023-01-11 12:00:05,Are You Looking for a Top Momentum Pick? Why Ross Stores (ROST) is a Great Choice,118195755,https://media.zenfs.com/en/zacks.com/7853de8d69faeccb7d1ad6ebba40b8a2,ROST,Yahoo,Does Ross Stores (ROST) have what it takes to be a top stock pick for momentum investors? Let's find out.,https://finnhub.io/api/news?id=22fce027a9455c7b4254ab95723d7a2d63175f24028365ba27757e68a2aa1820
company,2023-01-11 10:56:03,The TJX Companies (TJX) Gains on Online Business & Marketing,118195756,https://media.zenfs.com/en/zacks.com/34b4115704687326183f10e40baf018b,ROST,Yahoo,"The TJX Companies' (TJX) off-price model, strategic store locations and impressive online business is working well.",https://finnhub.io/api/news?id=26a6810de50f5ffdffdd5ff9bdf1e312f8c168a1b90fb05abbc3247846ba01ac
company,2023-01-11 10:42:03,"Bed Bath & Beyond (BBBY) Q3 Loss Wider Than Expected, Sales Lag",118195757,https://media.zenfs.com/en/zacks.com/3712b8efaf62bf4a91d001304d6de6db,ROST,Yahoo,"Bed Bath & Beyond's (BBBY) Q3 results have been hurt by a drab demand, supply-chain issues and cash shortage.",https://finnhub.io/api/news?id=53801bce39cf6fcbf1ea8a88c2d20120f15d1233c2f4a244419c53da06f25a0e
company,2023-01-11 08:39:01,4 Stocks to Buy as E-Commerce Sales Continue to Grow,118195758,https://media.zenfs.com/en/zacks.com/fa3b216c116a24f7614ebcf2be53b701,ROST,Yahoo,"E-commerce is helping boost retail sales, which is likely to benefit stocks like Capri Holdings Limited (CPRI), Casey's General Stores, Inc. (CASY), Ross Stores, Inc. (ROST) and Arhaus, Inc. (ARHS).",https://finnhub.io/api/news?id=abe62c2f4077c5ba4787ea7024119067652e4e5f7ed6445f9e5bb58790722e2b
company,2023-01-11 07:19:17,Should You Hold Ross Stores (ROST)?,118195759,https://media.zenfs.com/en/insidermonkey.com/d7352d71981e98e619582c47208a8ea8,ROST,Yahoo,"Right Tail Capital, an investment management company, released its fourth-quarter 2022 investor letter. A copy of the same can be downloaded here. For the calendar year 2022, the fund declined -0.7% compared to a -3.5% return for the S&P 500 Index. 90% of the fund’s portfolio is invested in undervalued, high-quality companies with attractive return potential, […]",https://finnhub.io/api/news?id=50fbaecf0143b81035dec9ab16a3602a9444bb143a4b54410e17b397b0e6fdb8
company,2023-01-17 23:23:00,Ross Stores Inc. stock underperforms Wednesday when compared to competitors,118409529,,ROST,MarketWatch,Looking for stock market analysis and research with proves results? Zacks.com offers in-depth financial research with over 30years of proven results.,https://finnhub.io/api/news?id=ca731d1a49a53e113568b41d2a574b40955dc541c0a52e314d0cb229506f32cb
company,2023-01-16 23:23:00,"Ross Stores Inc. stock falls Tuesday, underperforms market",118409530,,ROST,MarketWatch,Looking for stock market analysis and research with proves results? Zacks.com offers in-depth financial research with over 30years of proven results.,https://finnhub.io/api/news?id=cb7143d1236c90aa33c3e1e89b8c4e310f48ad9c9345f6e7ab6c81316a4fe7c9
company,2023-01-16 09:40:02,Is Casey's General Stores (CASY) Stock Outpacing Its Retail-Wholesale Peers This Year?,118282172,https://media.zenfs.com/en/zacks.com/bdc2850a48a0f40806db817a9e24f36f,ROST,Yahoo,Here is how Casey's General Stores (CASY) and Ross Stores (ROST) have performed compared to their sector so far this year.,https://finnhub.io/api/news?id=a925ee978f4d75d448ef31d5ca0ed12c10a0e45221c1af2c58ece7b82611ada3
company,2023-01-16 09:18:33,"Do Its Financials Have Any Role To Play In Driving Ross Stores, Inc.'s (NASDAQ:ROST) Stock Up Recently?",118282173,,ROST,Yahoo,Most readers would already be aware that Ross Stores' (NASDAQ:ROST) stock increased significantly by 42% over the past...,https://finnhub.io/api/news?id=41bbb8ee61718ef7b1e913b20142a34da0fa2bc7eefdc25c759776ac3bb0c7af
company,2023-01-16 09:02:02,Here's Why it is Apt to Buy Ross Stores (ROST) at This Moment,118282174,https://media.zenfs.com/en/zacks.com/9c9168bcd74fab6e906e343dad460865,ROST,Yahoo,"Ross Stores (ROST) looks well-poised on fundamental strength, off-price model, improved traffic trends in the retail industry and cost leverage, resulting in upbeat guidance.",https://finnhub.io/api/news?id=c9ac1941ba023cd52adb20f684de61419f3d84eafcd083409e8bba49fc6f6ecd
company,2023-01-15 18:09:55,Ross Stores: Recovery Is Priced In,118277728,https://static.seekingalpha.com/cdn/s3/uploads/getty_images/1396955839/image_1396955839.jpg?io=getty-c-w750,ROST,SeekingAlpha,"2022 was a tough year for Ross Stores with same store sales, operating profit, and EPS all declining vs. 2021. See why I'm staying on the sidelines for now.",https://finnhub.io/api/news?id=86472f10f08ac39ba57648b4d7a82d7a1f94e62d28fc0747a98b0a95a26d0a89
company,2023-01-15 10:00:11,25 Biggest California Companies and Stocks,118274312,https://media.zenfs.com/en/insidermonkey.com/eeed882247613dabcd00c9d73a545b37,ROST,Yahoo,"In this article, we will be taking a look at the 25 biggest California companies and stocks. To skip our detailed analysis, you can go directly to see the 5 Biggest California Companies and Stocks. California is not just the most populous state in the U.S. with over 39 million residents, but it is also […]",https://finnhub.io/api/news?id=c2bb039aa6279ae62acc2df46f7f97558306beadb1e201f9846e6d29915ad509
company,2023-01-19 20:05:35,Office pain spreads to the Tri-Valley in the East Bay,118326262,,ROST,Yahoo,"Companies are cutting office space everywhere, but are the Tri-Valley’s once-prized office parks particularly vulnerable?",https://finnhub.io/api/news?id=58a7a33eb22789a63736ab90d5b2db9745d3468ad0371b546d72b72cef12fb47
company,2023-01-18 23:23:00,"Ross Stores Inc. stock falls Thursday, underperforms market",118409528,,ROST,MarketWatch,Looking for stock market analysis and research with proves results? Zacks.com offers in-depth financial research with over 30years of proven results.,https://finnhub.io/api/news?id=c15d758dd995ee34c2ce8b4d6abf19c4113908785d2ab63844176060f0581170
company,2023-01-26 03:30:00,"dd's DISCOUNTS to Open a New Store in Canoga Park, California",118409521,,ROST,PR Newswire,Looking for stock market analysis and research with proves results? Zacks.com offers in-depth financial research with over 30years of proven results.,https://finnhub.io/api/news?id=043dd0c8d09d85eccda3cf2f30c9fffae9658c58d0a72edc876fb1815cc4ec01
company,2023-01-25 23:23:00,"Ross Stores Inc. stock rises Thursday, still underperforms market",118409522,,ROST,MarketWatch,Looking for stock market analysis and research with proves results? Zacks.com offers in-depth financial research with over 30years of proven results.,https://finnhub.io/api/news?id=f57dd5799175b730707c2f635ad2c9c20da10034e17f07299b606437304aa458
company,2023-01-25 07:47:00,Watch these retailers as the most likely to nab sales from closing Bed Bath & Beyond stores,118409523,,ROST,Seeking Alpha,Looking for stock market analysis and research with proves results? Zacks.com offers in-depth financial research with over 30years of proven results.,https://finnhub.io/api/news?id=dea9f84a8c62d86d030177c6dc8069c823a70f283d1279058f0ec242ea27cfd4
company,2023-01-25 03:30:00,"dd's DISCOUNTS to Open a New Store in San Jose, California",118409524,,ROST,PR Newswire,Looking for stock market analysis and research with proves results? Zacks.com offers in-depth financial research with over 30years of proven results.,https://finnhub.io/api/news?id=9c7e723e392adec76d72d74ba6963decf55cdcbd3f07c3164aaebabe3aab592a
company,2023-01-24 23:23:00,"Ross Stores Inc. stock rises Wednesday, outperforms market",118409525,,ROST,MarketWatch,Looking for stock market analysis and research with proves results? Zacks.com offers in-depth financial research with over 30years of proven results.,https://finnhub.io/api/news?id=c7503a4d9569478e806eccb88a8a80d72af8c5ff944bd1ffce711df36da00819
company,2023-01-23 23:23:00,Ross Stores Inc. stock outperforms competitors on strong trading day,118409526,,ROST,MarketWatch,Looking for stock market analysis and research with proves results? Zacks.com offers in-depth financial research with over 30years of proven results.,https://finnhub.io/api/news?id=612d3bb0baf1336f89bcd42137f587acd83c45d5504ca41d7032bfc1eea78635
company,2023-01-22 23:23:00,"Ross Stores Inc. stock rises Monday, still underperforms market",118409527,,ROST,MarketWatch,Looking for stock market analysis and research with proves results? Zacks.com offers in-depth financial research with over 30years of proven results.,https://finnhub.io/api/news?id=9773a435a5e6d775784cad4ae57fe510ccf275e5bcd59f404390f3d498e6c31a
company,2023-01-30 12:22:00,"Ross Stores Inc. stock falls Monday, still outperforms market",118482779,https://images.mktw.net/im-220105/social,ROST,MarketWatch,"Shares of Ross Stores Inc. shed 0.41% to $119.00 Monday, on what proved to be an all-around grim trading session for the stock market, with the S&P 500 Index...",https://finnhub.io/api/news?id=4671f1d084a600e73a1b614efeaa5283987aefd2a20bd4f03a2a04b7afd86dc3
company,2023-01-30 03:30:00,dd's DISCOUNTS to Open its First Wisconsin Store in Milwaukee,118409516,,ROST,PR Newswire,Looking for stock market analysis and research with proves results? Zacks.com offers in-depth financial research with over 30years of proven results.,https://finnhub.io/api/news?id=4875905c9261e8b7c09d069af31e5ef5c870a39990700b46002db916a33cb770
company,2023-01-30 03:00:00,Dividend Cut Risk For Tanger But SWAN With Simon,118398444,https://static.seekingalpha.com/cdn/s3/uploads/getty_images/1367402313/image_1367402313.jpg?io=getty-c-w1536,ROST,SeekingAlpha,"In this article, we share a high yield at risk of cutting its dividend as well as one that is very likely to sustain theirs. See if SKT or SPG, which is best.",https://finnhub.io/api/news?id=429e14ccc6b72be0a836ee2ab947ef146ec838c0117a0c2c96cf34e8f5317f5d
company,2023-01-29 05:01:00,2 Stocks Near All-Time Highs Worth Buying Now,118390046,https://s.yimg.com/ny/api/res/1.2/XnApM6O96.s8Zo8ptyIPlA--/YXBwaWQ9aGlnaGxhbmRlcjt3PTEyMDA7aD04MDA-/https://media.zenfs.com/en/motleyfool.com/4228b92d9c62283434e5c4b2746f991d,ROST,Yahoo,"Ross Stores (NASDAQ: ROST) stock is 9% off its all-time high, while TXJ Companies (NYSE: TJX) has set new highs regularly in recent trading days. Are they set up for a recession crash? While there's always the risk of volatility, Motley Fool contributors Jason Hall and Tyler Crowe explain why they're set up for strong continued success and should keep rewarding investors for years to come, even from these near-record stock prices.",https://finnhub.io/api/news?id=fa332eefab4a3a8c36f9cd3f0e2851149b36680fba5b957262e99482a6f0db2d
company,2023-01-27 03:30:00,"dd's DISCOUNTS to Open a New Store in Joliet, Illinois",118409519,,ROST,PR Newswire,Looking for stock market analysis and research with proves results? Zacks.com offers in-depth financial research with over 30years of proven results.,https://finnhub.io/api/news?id=a9ec6155c486b3f1bcfdd9b2173ae5fc182d71dd17c838379f38896cad81cdf5
company,2023-01-26 23:23:00,Ross Stores Inc. stock underperforms Friday when compared to competitors,118409520,,ROST,MarketWatch,Looking for stock market analysis and research with proves results? Zacks.com offers in-depth financial research with over 30years of proven results.,https://finnhub.io/api/news?id=dade9974b90979d32b49747497532e836c5d6bd86c84218e34d9c68d4eae058c
company,2023-02-03 12:22:00,Ross Stores Inc. stock outperforms market despite losses on the day,118482773,https://images.mktw.net/im-220105/social,ROST,MarketWatch,"Shares of Ross Stores Inc. dropped 0.66% to $115.32 Friday, on what proved to be an all-around rough trading session for the stock market, with the S&P 500...",https://finnhub.io/api/news?id=ad70bf417203759517557de9e430aca1b9bf032ecbe40d63534408135eb6cf7f
company,2023-02-03 03:34:00,Right Tail Capital - Ross Stores:�� Creating Tremendous Value Per Dollar Of Investment,118748213,,ROST,Seeking Alpha,Looking for stock market analysis and research with proves results? Zacks.com offers in-depth financial research with over 30years of proven results.,https://finnhub.io/api/news?id=cd573998beb832cb5d564f853b0074bf0a4156a12d4ed8a61484ebf2aabc9d11
company,2023-02-03 03:30:00,"dd's DISCOUNTS to Open a New Store in Merrillville, Indiana",118748215,,ROST,PR Newswire,Looking for stock market analysis and research with proves results? Zacks.com offers in-depth financial research with over 30years of proven results.,https://finnhub.io/api/news?id=841a8113e38afdf7f3a8ed4acaae6f4d8dd6deefdb50d8983f972c8d619ec58d
company,2023-02-03 02:47:00,Right Tail Capital Q4 2022 Investor Letter,118455232,,ROST,Seeking Alpha,Looking for stock market analysis and research with proves results? Zacks.com offers in-depth financial research with over 30years of proven results.,https://finnhub.io/api/news?id=106a972a957049ff2ac4fbcecb05d5cf4c2794b3bbaddbe562173d155e8fca49
company,2023-02-02 12:21:00,"Ross Stores Inc. stock falls Thursday, underperforms market",118482774,https://images.mktw.net/im-220105/social,ROST,MarketWatch,"Shares of Ross Stores Inc. shed 2.05% to $116.09 Thursday, on what proved to be an all-around mixed trading session for the stock market, with the S&P 500...",https://finnhub.io/api/news?id=317c03f6579a1013ed35e76ac61395db2d5e824715f8b0b777ff7d20b7dbeacf
company,2023-02-02 03:30:00,"dd's DISCOUNTS to Open a New Store in Fort Myers, Florida",118748221,,ROST,PR Newswire,Looking for stock market analysis and research with proves results? Zacks.com offers in-depth financial research with over 30years of proven results.,https://finnhub.io/api/news?id=d8a7ab619bf2972fd8f199ca12dd99ee47847fb2467828cac94f30e10f6f558f
company,2023-02-01 12:22:00,"Ross Stores Inc. stock rises Wednesday, still underperforms market",118482775,https://images.mktw.net/im-220105/social,ROST,MarketWatch,"Shares of Ross Stores Inc. inched 0.28% higher to $118.52 Wednesday, on what proved to be an all-around positive trading session for the stock market, with...",https://finnhub.io/api/news?id=23aeff30c3c78e1d1fa520f82ae0a9b3fd11838a97e75ad5fdc0db5788b0b840
company,2023-02-01 03:30:00,"dd's DISCOUNTS to Open a New Store in Houston, Texas",118409513,,ROST,PR Newswire,Looking for stock market analysis and research with proves results? Zacks.com offers in-depth financial research with over 30years of proven results.,https://finnhub.io/api/news?id=50bad1a4cf6643d879dcd1d2e75f6a9d7b286b636173e35d70a8dcd8021d3044
company,2023-01-31 12:21:00,"Ross Stores Inc. stock falls Tuesday, underperforms market",118482777,https://images.mktw.net/im-220105/social,ROST,MarketWatch,"Shares of Ross Stores Inc. slipped 0.68% to $118.19 Tuesday, on what proved to be an all-around positive trading session for the stock market, with the S&P...",https://finnhub.io/api/news?id=6f05f85702f8a8948b84c702d0ba9aedb54a18b8b9a5d248a90a3a31b66f6acc
company,2023-01-31 03:30:00,"dd's DISCOUNTS to Open a New Store in Laurel, Maryland",118409514,,ROST,PR Newswire,Looking for stock market analysis and research with proves results? Zacks.com offers in-depth financial research with over 30years of proven results.,https://finnhub.io/api/news?id=6c8110783c761ae61cf4da79a73c56b8b5f2dc26895abc209511537695e2bf92
company,2023-02-07 12:21:00,Ross Stores Inc. stock underperforms Tuesday when compared to competitors,118505466,https://images.mktw.net/im-220105/social,ROST,MarketWatch,"Shares of Ross Stores Inc. slipped 1.05% to $114.49 Tuesday, on what proved to be an all-around positive trading session for the stock market, with the S&P...",https://finnhub.io/api/news?id=c47f96cdf65a4434c8fea75ae5047f7db16f3e32ba5d61d1dd6d375e666e132b
company,2023-02-07 10:48:00,Bed Bath & Beyond's debt woes puts nearly $6 billion in property bonds in focus,118502392,https://images.mktw.net/im-719445/social,ROST,MarketWatch,"Bed Bath & Beyond's debt woes are putting a spotlight on nearly $6 billion worth of commercial mortgage bonds with exposure to its stores, according to a...",https://finnhub.io/api/news?id=38f2b2464f8276f0fd04fd6908c22894c9c7e4056ef51010e1d3f725861b1a73
company,2023-02-06 21:49:00,Bed Bath & Beyond`s debt woes puts nearly $6 billion in property bonds in focus,118748207,,ROST,MarketWatch,Looking for stock market analysis and research with proves results? Zacks.com offers in-depth financial research with over 30years of proven results.,https://finnhub.io/api/news?id=15efb8b92c2ec9587fe400349c90ef6d55a7f549b73e2c308581a491d2e5cb66
company,2023-02-06 20:39:00,Retail sector dips as earnings jitters for holiday quarter come into play,118589122,,ROST,Seeking Alpha,Looking for stock market analysis and research with proves results? Zacks.com offers in-depth financial research with over 30years of proven results.,https://finnhub.io/api/news?id=46c80cb74fa459c625888b7f12ea76941fd15c5303d6ffa7d33304d430234698
company,2023-02-06 12:22:00,Ross Stores Inc. stock outperforms market on strong trading day,118505473,https://images.mktw.net/im-220105/social,ROST,MarketWatch,"Shares of Ross Stores Inc. inched 0.34% higher to $115.71 Monday, on what proved to be an all-around grim trading session for the stock market, with the S&P...",https://finnhub.io/api/news?id=ae47595e44c43210916d4fee921f5138b7bd980e9f581d3bc96818761e1417fd
company,2023-02-09 23:23:00,"Ross Stores Inc. stock rises Friday, still underperforms market",118748200,,ROST,MarketWatch,Looking for stock market analysis and research with proves results? Zacks.com offers in-depth financial research with over 30years of proven results.,https://finnhub.io/api/news?id=e34731364ccb1220e53fd6c6bf12bafabe2d3c5bd3e4a3d08f58f23b0d977dd6
company,2023-02-08 23:22:00,Ross Stores Inc. stock outperforms competitors on strong trading day,118748202,,ROST,MarketWatch,Looking for stock market analysis and research with proves results? Zacks.com offers in-depth financial research with over 30years of proven results.,https://finnhub.io/api/news?id=93176012ca53326678ea94b2412fdca7742d40dc9b0b68e32cbc04cc51b659db
company,2023-02-07 23:23:00,"Ross Stores Inc. stock remains steady Wednesday, still outperforms market",118748204,,ROST,MarketWatch,Looking for stock market analysis and research with proves results? Zacks.com offers in-depth financial research with over 30years of proven results.,https://finnhub.io/api/news?id=105c67eb59ce9cf461ff4877371bfd168df98a9aef4ae1e2ae0fefadeb1f9170
company,2023-02-15 12:22:00,Ross Stores Inc. stock underperforms Wednesday when compared to competitors,118637075,https://images.mktw.net/im-220105/social,ROST,MarketWatch,"Shares of Ross Stores Inc. sank 0.14% to $116.64 Wednesday, on what proved to be an all-around great trading session for the stock market, with the S&P 500...",https://finnhub.io/api/news?id=ecee8dae5d9437734699792a6ce68a530704ff7e756c9ab8346c7b72e48270e1
company,2023-02-14 16:01:00,"Ross Stores, Inc. Announces Fourth Quarter and Fiscal 2022 Earnings Release and Conference Call",118587844,https://media.zenfs.com/en/business-wire.com/7d151fe8a8b5e0268bf98a86f6cdbc1d,ROST,Yahoo,"DUBLIN, Calif., February 14, 2023--Ross Stores, Inc. (NASDAQ: ROST) plans to release its fourth quarter and fiscal 2022 earnings results on Tuesday, February 28, 2023 at approximately 4:00 p.m. Eastern time.",https://finnhub.io/api/news?id=783944eccd1b32a0871331e0dcd7fad3e6eb04076fd33d4be9ae1bac3e06b71e
company,2023-02-14 12:22:00,"Ross Stores Inc. stock rises Tuesday, outperforms market",118637076,https://images.mktw.net/im-220105/social,ROST,MarketWatch,"Shares of Ross Stores Inc. inched 0.02% higher to $116.80 Tuesday, on what proved to be an all-around poor trading session for the stock market, with the S&P...",https://finnhub.io/api/news?id=dea23da11a2cf7b80f6480a23da33a5efba6f8460ae55b3c2dcc209e7af0b999
company,2023-02-14 12:10:05,Why Ross Stores (ROST) Could Beat Earnings Estimates Again,118587846,https://media.zenfs.com/en/zacks.com/f889276f4a638f3c7a79c0e3e6b768c1,ROST,Yahoo,Ross Stores (ROST) has an impressive earnings surprise history and currently possesses the right combination of the two key ingredients for a likely beat in its next quarterly report.,https://finnhub.io/api/news?id=716cfdb41c25f1b81e9c3853f56f996e4c1a319ee18feb8a3473f8c1444656df
company,2023-02-14 05:01:00,"Top 5 4th Quarter Trades of Court Place Advisors, LLC",118664640,,ROST,GuruFocus,Looking for stock market analysis and research with proves results? Zacks.com offers in-depth financial research with over 30years of proven results.,https://finnhub.io/api/news?id=8aee11d7ee70ffd78ff94c43af69419198d9aff83de810385bbf63379ba85fbc
company,2023-02-13 12:22:00,Ross Stores Inc. stock underperforms Monday when compared to competitors despite daily gains,118637077,https://images.mktw.net/im-220105/social,ROST,MarketWatch,"Shares of Ross Stores Inc. rose 1.39% to $116.78 Monday, on what proved to be an all-around great trading session for the stock market, with the S&P 500...",https://finnhub.io/api/news?id=27c5c3947e6f58176a64dc5e6b638d38ed36807171aec6fa89a0c33feee65801
company,2023-02-11 23:03:00,Are retailers finally wrangling inventory issues?,118589887,,ROST,Seeking Alpha,Looking for stock market analysis and research with proves results? Zacks.com offers in-depth financial research with over 30years of proven results.,https://finnhub.io/api/news?id=ba1df005e5a3dd05225f8040ca4c0a99b1cb9b9f0a374512153bc59b0d423be5
company,2023-02-17 21:19:27,"Steven Cohen’s Point72 Hedge Fund Backs Salesforce, Broadcom And Meta While Cutting Palo Alto And Workday Stakes",118627532,,ROST,Fintel,,https://finnhub.io/api/news?id=ec9a519c4b12ab6370c147f2cb4a0d0353bb66d23e44fd431e932b3f799dc23b
company,2023-02-17 12:21:00,Ross Stores Inc. stock outperforms competitors on strong trading day,118637073,https://images.mktw.net/im-220105/social,ROST,MarketWatch,"Shares of Ross Stores Inc. inched 0.32% higher to $115.69 Friday, on what proved to be an all-around mixed trading session for the stock market, with the Dow...",https://finnhub.io/api/news?id=5e1a0671b29e922837e4cb9a6ceaf4401e534aad9fc6bdd59df2b72e596cd5b1
company,2023-02-17 03:30:00,"Ross Dress for Less to Re-Open its Tornado-Damaged Store in Round Rock, Texas",118748173,,ROST,PR Newswire,Looking for stock market analysis and research with proves results? Zacks.com offers in-depth financial research with over 30years of proven results.,https://finnhub.io/api/news?id=fcbc22225e21948b2529e0134c04b85cce0e5e7bc8ffc6d61a7d196bd55c5267
company,2023-02-17 03:01:00,"Cornerstone Investment Partners, LLC Buys 1, Sells 4 in 4th Quarter",118692886,,ROST,GuruFocus,Looking for stock market analysis and research with proves results? Zacks.com offers in-depth financial research with over 30years of proven results.,https://finnhub.io/api/news?id=832f032650420f59021b6fc39cc3244171b10935a4775f5bef74edab6a140ea8
company,2023-02-17 03:01:00,"SCOPUS ASSET MANAGEMENT, L.P. Buys 2, Sells 3 in 4th Quarter",118672236,,ROST,GuruFocus,Looking for stock market analysis and research with proves results? Zacks.com offers in-depth financial research with over 30years of proven results.,https://finnhub.io/api/news?id=9f734538d7022c2633a61e3aca328f74a3852452bb31b883cd8e0e76d8ea6dd6
company,2023-02-17 01:31:00,Analysts Offer Insights on Consumer Goods Companies: Ross Stores (ROST) and Five Below (FIVE),118748179,,ROST,TipRanks,Looking for stock market analysis and research with proves results? Zacks.com offers in-depth financial research with over 30years of proven results.,https://finnhub.io/api/news?id=30e53569a6171875c9c69288bf45ee8bd9bcb1241f4473d2c811c4fc43a22023
