category,datetime,headline,id,image,related,source,summary,url
company,2023-06-19 23:55:00,Ross Stores CEO Barbara Rentler to continue in top boss role through Jan. 2026,120980650,,ROST,Seeking Alpha,Looking for stock market analysis and research with proves results? Zacks.com offers in-depth financial research with over 30years of proven results.,https://finnhub.io/api/news?id=908dff05d47556efe4927e9e2e4374a7e1dc91a5b4b3011628938ba01a18864e
company,2023-06-19 23:17:00,"Ross Stores board extends Barbara Rentler as CEO through March 31, 2027",120980651,,ROST,Thefly.com,Looking for stock market analysis and research with proves results? Zacks.com offers in-depth financial research with over 30years of proven results.,https://finnhub.io/api/news?id=498ddae97fde40e0a828456b3e195e7f5143b50eed6d612a94065b444c32c71f
company,2023-06-27 12:55:00,Ross Stores Inc. stock underperforms Tuesday when compared to competitors despite daily gains,121123297,https://images.mktw.net/im-220105/social,ROST,MarketWatch,"Shares of Ross Stores Inc. advanced 1.22% to $108.92 Tuesday, on what proved to be an all-around positive trading session for the stock market, with the S&P...",https://finnhub.io/api/news?id=7d3eb0db7612dcd2701a28d73a0e1fc3d7e8519f0207194b51fa66572ce05efe
company,2023-06-27 04:23:00,"Tuesday’s Top Analyst Upgrades and Downgrades: Advance Auto Parts, Alphabet, Micron Technology, Ross Stores, Tesla and More",121068034,,ROST,247WallSt,Looking for stock market analysis and research with proves results? Zacks.com offers in-depth financial research with over 30years of proven results.,https://finnhub.io/api/news?id=54d271b306cb38beefc95f493ebddabf205c78eab8d579b7736547f1e74b1ded
company,2023-06-26 16:20:05,Gordon Haskett Downgrades Ross Stores (ROST),121056265,,ROST,Fintel,,https://finnhub.io/api/news?id=92c5f55d249792a7137f994199a6caf33c7250297ab9c0efa30cc98f176ebea9
company,2023-06-26 12:56:28,12 Most Undervalued Retail Stocks to Buy According to Hedge Funds,121050586,https://media.zenfs.com/en/insidermonkey.com/bce9326267f164143012ede5d1142f73,ROST,Yahoo,On January 23rd we prepared the article below that discussed the 12 most undervalued retail stocks to buy according to hedge funds. We didn’t publish this article but decided to follow the performance of these stocks. Our research and experience indicate that hedge funds’ top stock picks generate a significant amount of alpha. This article […],https://finnhub.io/api/news?id=2526ed74917881865dc1b0c119f6e90cea752663c651375bdafb8cd7f84bffb2
company,2023-06-26 12:55:00,"Ross Stores Inc. stock falls Monday, underperforms market",121076780,https://images.mktw.net/im-220105/social,ROST,MarketWatch,"Shares of Ross Stores Inc. slipped 0.97% to $107.61 Monday, on what proved to be an all-around poor trading session for the stock market, with the S&P 500...",https://finnhub.io/api/news?id=b3cb96d82ede9e0a81ca5a26fc5f3a720ea685b10fa9118203a2a25d0ce31f0c
company,2023-06-26 09:50:49,"Alphabet downgraded, Moderna upgraded: Wall Street's top analyst calls",121047717,https://media.zenfs.com/en/the_fly_169/135b0749a3ad5e86fe326a9da1d664b6,ROST,Yahoo,"Alphabet downgraded, Moderna upgraded: Wall Street's top analyst calls",https://finnhub.io/api/news?id=795e1226e5ee986cccb5eda51ebac6aad3dc7a500d9621d23f23b0c3e28d2439
company,2023-06-26 08:03:00,What 11 Analyst Ratings Have To Say About Ross Stores,121053445,,ROST,Benzinga,Looking for stock market analysis and research with proves results? Zacks.com offers in-depth financial research with over 30years of proven results.,https://finnhub.io/api/news?id=96ad3f8b99ff6ad3731ccc956d57bf4330224b310268d9d4cec92681c881c340
company,2023-06-26 06:03:00,"Benzinga's Top Ratings Upgrades, Downgrades For June 26, 2023",121049315,,ROST,Benzinga,Looking for stock market analysis and research with proves results? Zacks.com offers in-depth financial research with over 30years of proven results.,https://finnhub.io/api/news?id=34401fbb6cac9e0423a95c06db66cada486525ae56b7f33a10fae5b4be3232ad
company,2023-06-26 01:17:00,Ross Stores downgraded to Accumulate from Buy at Gordon Haskett,121053448,,ROST,Thefly.com,Looking for stock market analysis and research with proves results? Zacks.com offers in-depth financial research with over 30years of proven results.,https://finnhub.io/api/news?id=8ea4710140684ecc47b272c1c1f4537ca08dc21a65e4d1d087cf5211f70a074b
company,2023-06-30 12:56:00,"Ross Stores Inc. stock rises Friday, outperforms market",121167201,https://images.mktw.net/im-220105/social,ROST,MarketWatch,"Shares of Ross Stores Inc. rallied 2.99% to $112.13 Friday, on what proved to be an all-around positive trading session for the stock market, with the S&P...",https://finnhub.io/api/news?id=6d281575d3c4a94b86c0be0371c639277ba8eccc75500ef53dee2bc7e1c0595c
company,2023-06-30 04:30:00,"Ross Dress for Less to Open a New Store in Grandville, Michigan",121155831,,ROST,PR Newswire,Looking for stock market analysis and research with proves results? Zacks.com offers in-depth financial research with over 30years of proven results.,https://finnhub.io/api/news?id=67b5a10bea5d650fb1bd27f4e1a900459ecee9a4cb3271f9312571c2a21b9a65
company,2023-06-30 04:15:00,"Friday’s Top Analyst Upgrades and Downgrades: Citizens Financial, Freeport-McMoRan, General Mills, Micron Technology, Netflix, Pfizer, Roku, Ross Stores and More",121142391,,ROST,247WallSt,Looking for stock market analysis and research with proves results? Zacks.com offers in-depth financial research with over 30years of proven results.,https://finnhub.io/api/news?id=c1f04a3463b96ed3c7dbb1ce987469007738d1979852e36bdf4ddda8b41bc6a1
company,2023-06-29 23:03:00,Looking Into Ross Stores's Recent Short Interest,121155834,,ROST,Benzinga,Looking for stock market analysis and research with proves results? Zacks.com offers in-depth financial research with over 30years of proven results.,https://finnhub.io/api/news?id=75c49e79642a4f8e8e1cc5a3995a84ae4f3d0c59f10b316bcbb58280c426621d
company,2023-06-29 12:56:00,Ross Stores Inc. stock outperforms market on strong trading day,121123293,https://images.mktw.net/im-220105/social,ROST,MarketWatch,"Shares of Ross Stores Inc. inched 0.49% higher to $108.87 Thursday, on what proved to be an all-around positive trading session for the stock market, with...",https://finnhub.io/api/news?id=81938ed3516d326ad18e74dcb3a6d053c89ac2626083dc024f0f6c2a66e0e1ef
company,2023-06-29 09:53:46,"Disney downgraded, Micron upgraded: Wall Street's top analyst calls",121112248,https://media.zenfs.com/en/the_fly_169/135b0749a3ad5e86fe326a9da1d664b6,ROST,Yahoo,"Disney downgraded, Micron upgraded: Wall Street's top analyst calls",https://finnhub.io/api/news?id=121939d832f4080266cc4c74851c245ba8ef76dac74515ad3393bfd927a419d7
company,2023-06-29 06:04:00,"Benzinga's Top Ratings Upgrades, Downgrades For June 29, 2023",121111953,,ROST,Benzinga,Looking for stock market analysis and research with proves results? Zacks.com offers in-depth financial research with over 30years of proven results.,https://finnhub.io/api/news?id=31f0b46952aac5ff3549f4b6466deeecfc79fe5ee4310ced57e92aa68e28f159
company,2023-06-29 04:30:00,"Ross Dress for Less to Open a New Store in Rockingham, North Carolina",121122783,,ROST,PR Newswire,Looking for stock market analysis and research with proves results? Zacks.com offers in-depth financial research with over 30years of proven results.,https://finnhub.io/api/news?id=9cc9e5df51c09bedb37b2ed90929055bcfb610a2037ab2eb49f0399eba983678
company,2023-06-29 00:28:00,Ross Stores initiated with a Neutral at Piper Sandler,121122784,,ROST,Thefly.com,Looking for stock market analysis and research with proves results? Zacks.com offers in-depth financial research with over 30years of proven results.,https://finnhub.io/api/news?id=91a5b896ece996ddc035d987ec873a5f07f1405ca18d822a62a0729af59612fe
company,2023-06-28 12:55:00,"Ross Stores Inc. stock falls Wednesday, underperforms market",121123295,https://images.mktw.net/im-220105/social,ROST,MarketWatch,"Shares of Ross Stores Inc. dropped 0.53% to $108.34 Wednesday, on what proved to be an all-around grim trading session for the stock market, with the S&P 500...",https://finnhub.io/api/news?id=6c71f77be6a2cfc0abe11daa658bf472d91d2ad8e12696313235ff0b1073ac83
company,2023-06-28 04:30:00,"Ross Dress for Less to Open a New Store in Lebanon, Tennessee",121089837,,ROST,PR Newswire,Looking for stock market analysis and research with proves results? Zacks.com offers in-depth financial research with over 30years of proven results.,https://finnhub.io/api/news?id=9f861a8303a61d05e005529ace70a9eeead4443561a7b2250749aae6788eb917
company,2023-07-05 12:56:00,Ross Stores Inc. stock underperforms Wednesday when compared to competitors,121242289,https://images.mktw.net/im-220105/social,ROST,MarketWatch,"Shares of Ross Stores Inc. sank 0.46% to $110.62 Wednesday, on what proved to be an all-around rough trading session for the stock market, with the S&P 500...",https://finnhub.io/api/news?id=86dfe0f5fcdcab06095949eb1a9021714a61115563fa4b4cee7af0083199f2ee
company,2023-07-07 12:55:00,"Ross Stores Inc. stock falls Friday, underperforms market",121275967,https://images.mktw.net/im-220105/social,ROST,MarketWatch,"Shares of Ross Stores Inc. shed 1.71% to $107.46 Friday, on what proved to be an all-around dismal trading session for the stock market, with the S&P 500...",https://finnhub.io/api/news?id=749d109999169a7473ff520f5c04cffb068fb8f6f9915aea1349a7b04425c6f7
company,2023-07-07 04:30:00,"Ross Dress for Less to Open a New Store in Las Vegas, Nevada",121258421,,ROST,PR Newswire,Looking for stock market analysis and research with proves results? Zacks.com offers in-depth financial research with over 30years of proven results.,https://finnhub.io/api/news?id=5efeab58faf6777abed5096c7e789df8a23ee5de2575d719c6f91d86a8940bd7
company,2023-07-06 12:56:00,"Ross Stores Inc. stock falls Thursday, underperforms market",121275969,https://images.mktw.net/im-220105/social,ROST,MarketWatch,"Shares of Ross Stores Inc. slipped 1.17% to $109.33 Thursday, on what proved to be an all-around dismal trading session for the stock market, with the S&P...",https://finnhub.io/api/news?id=cc9b2ce9a30bc44c15afde32a20ad26b80aa2f441646742699ecdfc90b347084
company,2023-07-06 04:30:00,"Ross Dress for Less to Open a New Store in Lansing, Michigan",121240665,,ROST,PR Newswire,Looking for stock market analysis and research with proves results? Zacks.com offers in-depth financial research with over 30years of proven results.,https://finnhub.io/api/news?id=2a431e81677bd71e3073c235316e483eb2c1fd1d6bc6496eb9a6249e4b8ac297
company,2023-07-06 02:26:19,Ross Stores: Business Fundamentals Should Continue To Stay Strong,121228609,https://static.seekingalpha.com/cdn/s3/uploads/getty_images/1419214599/image_1419214599.jpg?io=getty-c-w1536,ROST,SeekingAlpha,Ross Stores could exceed current estimates and restore margins to pre-recession levels. Click here to see why ROST stock is a Buy.,https://finnhub.io/api/news?id=9eb28fcba16b8b8c0f15b9819e877b77c0f369dfd22d1d359ae0dc5911e8603b
company,2023-07-13 12:56:00,"Ross Stores Inc. stock falls Thursday, underperforms market",121394479,https://images.mktw.net/im-220105/social,ROST,MarketWatch,"Shares of Ross Stores Inc. slid 0.04% to $111.48 Thursday, on what proved to be an all-around positive trading session for the stock market, with the S&P 500...",https://finnhub.io/api/news?id=39773877aa8d94a7064b68e6fc100ee483e75d47be97d15c40fff98de9a8d39f
company,2023-07-13 09:43:00,Here's Why Ross Stores (ROST) is Marching Ahead of the Industry,121368041,https://media.zenfs.com/en/zacks.com/fc28f07a3b1bd5fe8fadad59ddc469dc,ROST,Yahoo,"Ross Stores (ROST) seems well poised for further growth on the back of strong value offerings, store expansion efforts and improved merchandise, despite cost headwinds.",https://finnhub.io/api/news?id=69aa59822e74c5e4cc3e41f23e7a6e06435a16be3015a8fdea7ff0574766cf19
company,2023-07-13 04:30:00,"Ross Dress for Less to Open a New Store in Wyoming, Michigan",121364255,,ROST,PR Newswire,Looking for stock market analysis and research with proves results? Zacks.com offers in-depth financial research with over 30years of proven results.,https://finnhub.io/api/news?id=7c21a59f8480bb856578a3196c3b1c857923b564fb85c428caa6b0422e118621
company,2023-07-12 12:56:00,"Ross Stores Inc. stock rises Wednesday, still underperforms market",121394480,https://images.mktw.net/im-220105/social,ROST,MarketWatch,"Shares of Ross Stores Inc. inched 0.47% higher to $111.52 Wednesday, on what proved to be an all-around great trading session for the stock market, with the...",https://finnhub.io/api/news?id=9f14d204dab96036dbb7a36e0d2fc61b7c01d40e934ef236a00928c66d4ebfc0
company,2023-07-11 12:57:00,"Ross Stores Inc. stock rises Tuesday, outperforms market",121344898,https://images.mktw.net/im-220105/social,ROST,MarketWatch,"Shares of Ross Stores Inc. advanced 1.30% to $111.00 Tuesday, on what proved to be an all-around positive trading session for the stock market, with the S&P...",https://finnhub.io/api/news?id=bd446c84fd237aa886c797850f4b3aa04ec81db326a534b557b20584ead2b6f9
company,2023-07-11 00:06:00,$100 Invested In Ross Stores 15 Years Ago Would Be Worth This Much Today,121339965,,ROST,Benzinga,Looking for stock market analysis and research with proves results? Zacks.com offers in-depth financial research with over 30years of proven results.,https://finnhub.io/api/news?id=ec2b4f2674e478cb0d86786c27695e8bfe9577ecfe91f1668d3b0c140a2d6f2f
company,2023-07-10 22:30:24,Price T Rowe Associates Now Owns 7.80% of Ross Stores (ROST),121302903,,ROST,Fintel,,https://finnhub.io/api/news?id=638f984ed3947f67ba4d66c5a23d2bdbcd834377fd3694513b89b965eb0ef987
company,2023-07-10 12:56:00,"Ross Stores Inc. stock rises Monday, outperforms market",121344899,https://images.mktw.net/im-220105/social,ROST,MarketWatch,"Shares of Ross Stores Inc. rose 1.97% to $109.58 Monday, on what proved to be an all-around great trading session for the stock market, with the S&P 500...",https://finnhub.io/api/news?id=2eec2ebd7e026a7ee506f3b7801a218fb89fdb6bcb6411eb0172f56774840f48
company,2023-07-10 04:30:00,"Ross Dress for Less to Open a New Store in Perry, Georgia",121292943,,ROST,PR Newswire,Looking for stock market analysis and research with proves results? Zacks.com offers in-depth financial research with over 30years of proven results.,https://finnhub.io/api/news?id=61e10c2cb9460df93ddbf4c14eddfc9178164b3a05324d938c970922bce171bc
company,2023-07-17 16:01:00,ROSS STORES OPENS 27 NEW LOCATIONS,121440414,https://media.zenfs.com/en/prnewswire.com/1dc6c882895bf8fdbda919bef67c3002,ROST,Yahoo,"Ross Stores recently opened 18 Ross Dress for Less® (""Ross"") and nine dd's DISCOUNTS® stores across 14 different states in June and July. These new locations are part of the Company's plans to add approximately 100 new stores – 75 Ross and 25 dd's DISCOUNTS – during fiscal 2023.",https://finnhub.io/api/news?id=4182b8ea0acf1e9f1bd6bcc5ff32e8a9aca89448032332bf4f486c3f121eecd0
company,2023-07-17 12:57:00,Ross Stores Inc. stock underperforms Monday when compared to competitors,121436846,https://images.mktw.net/im-220105/social,ROST,MarketWatch,"Shares of Ross Stores Inc. slipped 1.19% to $110.25 Monday, on what proved to be an all-around favorable trading session for the stock market, with the S&P...",https://finnhub.io/api/news?id=cd83f3bb47e9b1a02db8f545c8b4653e004b8db3995926fea3cb5000d2ef069f
company,2023-07-16 23:37:00,(ROST) - Analyzing Ross Stores's Short Interest,121461216,,ROST,Benzinga,Looking for stock market analysis and research with proves results? Zacks.com offers in-depth financial research with over 30years of proven results.,https://finnhub.io/api/news?id=cf9b91234b8d94ddafc76b08719943ef87f101a381fd9dddd848d5e1e6764edf
company,2023-07-15 08:35:49,"Institutional investors are Ross Stores, Inc.'s (NASDAQ:ROST) biggest bettors and were rewarded after last week's US$1.4b market cap gain",121405506,https://media.zenfs.com/en/simply_wall_st__316/5e99d13d88d9e9a58e4b4d374d5369fd,ROST,Yahoo,Key Insights Institutions' substantial holdings in Ross Stores implies that they have significant influence over the...,https://finnhub.io/api/news?id=adc47443d529dd53120077950987bfd5008ecdbc38442f33af09d0116ffbbebe
company,2023-07-14 12:56:00,"Ross Stores Inc. stock rises Friday, outperforms market",121436848,https://images.mktw.net/im-220105/social,ROST,MarketWatch,"Shares of Ross Stores Inc. inched 0.09% higher to $111.58 Friday, on what proved to be an all-around mixed trading session for the stock market, with the Dow...",https://finnhub.io/api/news?id=a481ff9a361a15a6120686266d9733a57c74bf62a069e2ab6930a4dbb8835d63
company,2023-07-14 04:30:00,"Ross Dress for Less to Open a New Store in Huntington Park, California",121396608,,ROST,PR Newswire,Looking for stock market analysis and research with proves results? Zacks.com offers in-depth financial research with over 30years of proven results.,https://finnhub.io/api/news?id=3d657a3b8fd7ae0bbd28321acd04aac83d2fb25705d772896a3dc698a745d50d
company,2023-07-21 09:40:04,Here's Why Ross Stores (ROST) is a Strong Value Stock,121532093,https://media.zenfs.com/en/zacks.com/f889276f4a638f3c7a79c0e3e6b768c1,ROST,Yahoo,"Whether you're a value, growth, or momentum investor, finding strong stocks becomes easier with the Zacks Style Scores, a top feature of the Zacks Premium research service.",https://finnhub.io/api/news?id=cd846b4f5f626f8de816db4bdf8193a00ed87e650fd184a4881e2b651b0258a9
company,2023-07-20 23:57:00,Ross Stores Inc. stock underperforms Friday when compared to competitors,121550729,,ROST,MarketWatch,Looking for stock market analysis and research with proves results? Zacks.com offers in-depth financial research with over 30years of proven results.,https://finnhub.io/api/news?id=1ac4ea350025c02d8b8c43f0cc7f2e01ab3fcb4760f45b9ac661aef837502dba
company,2023-07-20 12:56:00,Ross Stores Inc. stock outperforms market despite losses on the day,121515098,https://images.mktw.net/im-220105/social,ROST,MarketWatch,"Shares of Ross Stores Inc. slumped 0.37% to $112.20 Thursday, on what proved to be an all-around mixed trading session for the stock market, with the Dow...",https://finnhub.io/api/news?id=5d16c46374fe6c552f19b10229071c470c2d72358effb376677ce2bc133e63f6
company,2023-07-20 11:12:00,4 Retail Discount Stocks Thriving Amid Industry Challenges,121499953,,ROST,Yahoo,"Better pricing, effective inventory management and operational initiatives are likely to drive Retail - Discount Stores companies. Costco (COST), The TJX Companies (TJX), Target (TGT) and Ross Stores (ROST) look well-placed.",https://finnhub.io/api/news?id=335872cdfb8abbe89d34bcaaab08fed66a86e84961b61c1359a1a6cb0f75a105
company,2023-07-20 08:26:23,10 Best Retail Dividend Stocks to Buy,121495454,https://media.zenfs.com/en/insidermonkey.com/65518468ef319d035ed7bebb351c5868,ROST,Yahoo,"In this article, we discuss 10 best retail dividend stocks to buy. You can skip our detailed analysis of the retail sector and the performance of dividend stocks, and go directly to read 5 Best Retail Dividend Stocks to Buy. The retail sector has experienced a major shift since the onset of the pandemic in […]",https://finnhub.io/api/news?id=9a56974ff1178bfa183192c356deb4130b87676dadb04b4640dc4df7ace2646d
company,2023-07-19 14:52:00,"Off-Price Retailers TJX, Ross, and Burlington Have a Different Path to Profits",121480570,,ROST,Yahoo,"TJ Maxx owner TJX, Ross Stores, and Burlington Stores have low gross margins, and spend almost nothing on marketing. That could be a recipe for success.",https://finnhub.io/api/news?id=7f8cf6a0f4b89df5e117dc775b6898aa7dff2065a9be9f50305aae2f07a3f77b
company,2023-07-19 12:56:00,Ross Stores Inc. stock outperforms market on strong trading day,121515099,https://images.mktw.net/im-220105/social,ROST,MarketWatch,"Shares of Ross Stores Inc. inched 0.63% higher to $112.62 Wednesday, on what proved to be an all-around favorable trading session for the stock market, with...",https://finnhub.io/api/news?id=d56bde27df80d5b9d7f847be28c1fc797a401762e6bbb8686ea4b760a1ebf9c5
company,2023-07-18 11:40:00,"Ross Stores (ROST) Expands Footprint, Unveils 27 New Locations",121452619,https://media.zenfs.com/en/zacks.com/9c9168bcd74fab6e906e343dad460865,ROST,Yahoo,"Ross Stores (ROST) strengthens brand visibility, captures new customers and unlocks potential sales growth by expanding its store network.",https://finnhub.io/api/news?id=0bedc039d1acfdf293ca58f662329c23a95b8033bd6b94940197d659f569789c
company,2023-07-18 06:47:20,Ross Stores - PLANNING APPROXIMATELY 100 NEW STORES IN 2023,121447246,,ROST,Finnhub,"UBLIN, Calif-- Ross Stores recently opened 18 Ross Dress for Less  and nine dd's DISCOUNTS stores across 14 different states in June and July. These new locations are part of the Company's plans to...",https://finnhub.io/api/news?id=595c0aeb7f365d557a929194b3a0c4351a5e38ef2f00b047c1a6260e75ceaa74
company,2023-07-25 12:57:00,Ross Stores Inc. stock underperforms Tuesday when compared to competitors,121699431,https://images.mktw.net/im-220105/social,ROST,MarketWatch,"Shares of Ross Stores Inc. dropped 0.17% to $112.51 Tuesday, on what proved to be an all-around favorable trading session for the stock market, with the S&P...",https://finnhub.io/api/news?id=6539a5ba0b4f812055e9d2d4924f0b1b91e3ca259b238b3c0a635d17662aa165
company,2023-07-24 12:56:00,Ross Stores Inc. stock outperforms competitors on strong trading day,121699433,https://images.mktw.net/im-220105/social,ROST,MarketWatch,"Shares of Ross Stores Inc. inched 0.60% higher to $112.70 Monday, on what proved to be an all-around favorable trading session for the stock market, with the...",https://finnhub.io/api/news?id=93b252bdca70b35a8c23d7019a54264e2dfd4524755a2b7d28c36251e1ba6c99
company,2023-07-24 11:40:11,ROST or COST: Which Is the Better Value Stock Right Now?,121568957,https://s.yimg.com/ny/api/res/1.2/gZA5XMnsr1RRZw6lGNAcdA--/YXBwaWQ9aGlnaGxhbmRlcjt3PTEyMDA7aD05NDA-/https://media.zenfs.com/en/zacks.com/c65fb4556b91b6c9dc83e4eff25fede0,ROST,Yahoo,ROST vs. COST: Which Stock Is the Better Value Option?,https://finnhub.io/api/news?id=ae64c30b3a84d4627ea202c3606e20b010b6752e1bd48a9c39492b5fd45908a3
company,2023-07-24 01:36:00,Savers Value Village initiated with a Buy at Jefferies,121567859,,ROST,Thefly.com,Looking for stock market analysis and research with proves results? Zacks.com offers in-depth financial research with over 30years of proven results.,https://finnhub.io/api/news?id=19682c74331c66b83c10817f7406dfdd55e1b467a8a71b4af1deafbae572c39d
company,2023-07-23 22:33:00,$100 Invested In Ross Stores 20 Years Ago Would Be Worth This Much Today,121572495,,ROST,Benzinga,Looking for stock market analysis and research with proves results? Zacks.com offers in-depth financial research with over 30years of proven results.,https://finnhub.io/api/news?id=bc1dfb467f05ab5b6bafe87186490d89a58eb0f9fb0ff920ae0322e44945613c
company,2023-07-28 12:56:00,"Ross Stores Inc. stock rises Friday, outperforms market",121699427,https://images.mktw.net/im-220105/social,ROST,MarketWatch,"Shares of Ross Stores Inc. inched 1.00% higher to $114.61 Friday, on what proved to be an all-around favorable trading session for the stock market, with the...",https://finnhub.io/api/news?id=82eef4e29b05782d75be016e0be980b6d48584b634a635d443da3fe0446d6f12
company,2023-07-27 12:57:00,"Ross Stores Inc. stock remains steady Thursday, still outperforms market",121699428,https://images.mktw.net/im-220105/social,ROST,MarketWatch,"Shares of Ross Stores Inc. were unchanged Thursday, on what proved to be an all-around grim trading session for the stock market, with the S&P 500 Index...",https://finnhub.io/api/news?id=881accbec6cb0c32a33293011d268e3613671a2f4b052c7a6f82a17fda830e42
company,2023-07-26 12:57:00,"Ross Stores Inc. stock rises Wednesday, outperforms market",121699430,https://images.mktw.net/im-220105/social,ROST,MarketWatch,"Shares of Ross Stores Inc. inched 0.86% higher to $113.48 Wednesday, on what proved to be an all-around mixed trading session for the stock market, with the...",https://finnhub.io/api/news?id=5b735695a63fae04e49c664e105199ec2e91e777b939a356a52e558423c6f466
company,2023-08-02 09:02:00,"Sprouts Farmers (SFM) Beats on Q2 Earnings, Raises FY23 View",121767973,https://media.zenfs.com/en/zacks.com/32d286cfea22fe7d32d0197897498c73,ROST,Yahoo,"Sprouts Farmers' (SFM) second-quarter comparable store sales increase 3.2% year over year. For the third quarter, the company expects low-single-digit growth in comparable store sales.",https://finnhub.io/api/news?id=f170819e213a9fb158b42e269122fc6d33c054b4b4b81afa7e6abe9298db257d
company,2023-08-02 00:00:00,"Ross Stores Inc. stock falls Wednesday, underperforms market",121780087,,ROST,MarketWatch,Looking for stock market analysis and research with proves results? Zacks.com offers in-depth financial research with over 30years of proven results.,https://finnhub.io/api/news?id=6097c8a242d4bced57c7957121955b5a32cc5adaba96e607bf8e869e17d90394
company,2023-08-01 10:27:00,Casey's (CASY) Expands Horizons Through Operational Efforts,121738183,https://media.zenfs.com/en/zacks.com/13d791d5d2af1db30797bf3b6750ca20,ROST,Yahoo,"Casey's (CASY) price and product optimization strategies, increased penetration of private brands and digital engagements are commendable.",https://finnhub.io/api/news?id=8c5259b98d1ac1dce596c20057a3a2b32a0c57b651a4ad83e35f6a7c97bcf2fb
company,2023-08-01 08:38:38,Investing in Ross Stores (NASDAQ:ROST) a year ago would have delivered you a 41% gain,121735278,https://media.zenfs.com/en/simply_wall_st__316/5e99d13d88d9e9a58e4b4d374d5369fd,ROST,Yahoo,"If you want to compound wealth in the stock market, you can do so by buying an index fund. But if you pick the right...",https://finnhub.io/api/news?id=e9ced713153d9c2d2d0a5aede15fc30045e87d6fcd45485ce483f655d91397b4
