category,datetime,headline,id,image,related,source,summary,url
company,2022-12-20 05:14:00,"China predicts COVID ‘normalcy’ within months, but experts forecast more than 1 million deaths",117585285,https://images.mktw.net/im-689113/social,WBA,DowJones,"In the U.S., COVID hospitalizations are rising, and pediatric cold medicines are still in short supply.",https://finnhub.io/api/news?id=d6ba0789524ac3428f69e41be743c7c4d6d11aa5b30488bbba70053ceea67599
company,2022-12-20 04:00:00,"By Crushing The Market In Year 8, The Dividend Growth 50 Plays Catch-Up",117584567,https://static.seekingalpha.com/cdn/s3/uploads/getty_images/1365758819/image_1365758819.jpg?io=getty-c-w750,WBA,SeekingAlpha,"Filled with high-quality, dividend-growing stocks, the DG50 easily beat the S&P 500 Index over the last year. Read more here.",https://finnhub.io/api/news?id=8addbc8c3972abaffca6d70a7206c87728eb47808fa4917d5a1b38766b7144dc
company,2022-12-20 03:51:00,Tracking Bruce Berkowitz`s Fairholme Portfolio - Q3 2022 Update,117627926,,WBA,Seeking Alpha,Looking for stock market analysis and research with proves results? Zacks.com offers in-depth financial research with over 30years of proven results.,https://finnhub.io/api/news?id=84f138dd9f27b4abd8ea1826e4d6cbf8c1538dc6c846e83926f9ed647aeec481
company,2022-12-20 00:07:00,Walgreens Boots Alliance in $1B delayed draw term loan credit agreement,117674958,,WBA,Seeking Alpha,Looking for stock market analysis and research with proves results? Zacks.com offers in-depth financial research with over 30years of proven results.,https://finnhub.io/api/news?id=193985c9db569557a6e61edb7925e748a7b4e148a8153ea028dfdaf1dabee4af
company,2022-12-19 23:55:00,"Walgreens, CVS limiting purchase of children`s pain medications, Reuters reports",117627496,,WBA,Thefly.com,Looking for stock market analysis and research with proves results? Zacks.com offers in-depth financial research with over 30years of proven results.,https://finnhub.io/api/news?id=3545fe6adb62f05296292a21a457abfe0ef4566852115dfc4ec9bc9f8f2a9b1b
company,2022-12-19 21:54:08,Treasury yields rise as Japan unexpectedly loosens its bond yield cap,117582776,https://image.cnbcfm.com/api/v1/image/107091887-1658374095380-gettyimages-1240240227-JAPAN_BOJ.jpeg?v=1671522848&w=1920&h=1080,WBA,CNBC,"U.S. Treasury yields rose after Japan unexpectedly raised its cap on 10-year government bond yields, sparking a sell-off in global long-duration bond markets.",https://finnhub.io/api/news?id=32b7a5df6d9f8ae2cec898d5168f9cca880bb35a8293cd3c05f3ccb08a159765
company,2022-12-19 20:17:00,Walmart says $3.1B payout to settle opioid lawsuits cleared by all 50 states,117637821,,WBA,Seeking Alpha,Looking for stock market analysis and research with proves results? Zacks.com offers in-depth financial research with over 30years of proven results.,https://finnhub.io/api/news?id=df0b0be84a3a94367f7f3a877a8b2865a70f22e77142cd5861a9f5ee3b21b6da
company,2022-12-19 20:16:51,"Walgreens, CVS and others limiting purchases of children's pain relief medicine as respiratory illnesses rise",117580725,https://s.yimg.com/ny/api/res/1.2/1l3pBzEapmHp8KeP.uF8zg--/YXBwaWQ9aGlnaGxhbmRlcjt3PTEyMDA7aD02NzU-/https://media.zenfs.com/en/fox_business_text_367/c24ddb946cd2e3c1f0e13c97cfb50fbb,WBA,Yahoo,CVS and Walgreens recently put limits on purchases of children's pain relief medication amid a rise in respiratory illnesses such as the flu and RSV.,https://finnhub.io/api/news?id=5f661dad8505753691b476248304514a09f1ae2b0e420644130ab4f5a12af1b6
company,2022-12-19 20:10:00,"Have a sick kid? Here’s what to know as CVS, Walgreens limit purchases of medicines",117579928,https://s.yimg.com/ny/api/res/1.2/fru4NiLvpVHZN4.i0w3YZA--/YXBwaWQ9aGlnaGxhbmRlcjt3PTEyMDA7aD02MDA-/https://media.zenfs.com/en/marketwatch.com/ef5e4644b5fdb5a76ffa4d608d37d60d,WBA,Yahoo,Caring for sick children has become extra stressful recently for many U.S. parents due to shortages of Children’s Tylenol and other medicines.,https://finnhub.io/api/news?id=2a091b09faa13ce9c1183d290618bad565b82d019e667d16e27131332d75bff1
company,2022-12-19 18:23:30,"CVS, Walgreens limit purchase of children's pain medicines",117579336,https://static.reuters.com/resources/r/?m=02&d=20221219&t=2&i=1617634640&r=LYNXMPEIBI0QV,WBA,Reuters,Pharmacy chains CVS Health Corp and Walgreens Boots Alliance Inc limited purchase of children's pain drugs as they face supply constraints and high demand with the United States experiencing one of the worst flu season in a decade.,https://finnhub.io/api/news?id=77e2584f1060b451e8f10fec5117e931583d6e0e0f8837947724668f43754527
company,2022-12-19 17:50:10,Walgreens Boots Alliance (WBA) Gains As Market Dips: What You Should Know,117578925,https://media.zenfs.com/en/zacks.com/1154d43aaeb65735a640003549116295,WBA,Yahoo,"Walgreens Boots Alliance (WBA) closed at $39.32 in the latest trading session, marking a +0.69% move from the prior day.",https://finnhub.io/api/news?id=929deab29477ea5b522e068040992cf9d0ff838120977df2f5bdd17cfe0f148d
company,2022-12-19 16:59:48,"UPDATE 1-CVS, Walgreens limit purchase of children's pain medicines",117577723,https://s.yimg.com/ny/api/res/1.2/YiAdREEBPMSOyTmgBD9jpQ--/YXBwaWQ9aGlnaGxhbmRlcjt3PTEyMDA7aD04MDA-/https://s.yimg.com/os/creatr-uploaded-images/2022-05/66e358d0-cbb4-11ec-bfff-1b4100ad066e,WBA,Yahoo,"Pharmacy chains CVS Health Corp and Walgreens Boots Alliance Inc limited purchase of children's pain drugs as they face supply constraints and high demand with the United States experiencing one of the worst flu season in a decade.  CVS said there is currently a two-product limit on all children's pain-relief products at all its pharmacy locations and online, while Walgreens said it had put a limit of six over-the-counter pediatric fever reducers per online transaction.",https://finnhub.io/api/news?id=13816039b985094a468f65042ae0e9df5f5fa445fd4aef1b559560d0ee1b3706
company,2022-12-19 16:08:05,Unilever Or Procter & Gamble: Which Consumer Goods Giant Is Right For Your Portfolio?,117579568,https://media.gettyimages.com/id/1363642870/photo/young-woman-in-household-chemistry-department-of-supermarket-chooses-washing-powder.jpg?b=1&s=170667a&w=0&k=20&c=USjLGB8kEgQXhXr9gXjRcAwqwEfWC4vykcQVUXyESZU=,WBA,SeekingAlpha,Unilever and P&G are facing similar challenges like competition from fierce startups and supermarket private labels. See why we would favor UL over PG.,https://finnhub.io/api/news?id=898236090e4edb99f036158a8f50b5bc4b6402e217b733dd42df3d2d1d4c34c1
company,2022-12-19 15:10:00,"Have a sick kid? Here's what to know as CVS, Walgreens limit purchases of medicines",117604125,https://images.mktw.net/im-688923/social,WBA,MarketWatch,Caring for sick children has become extra stressful recently for many U.S. parents due to shortages of Children’s Tylenol and other medicines.,https://finnhub.io/api/news?id=93581b881b9a13cd2884065a04c12648b64ffafaf019301406479848ac038394
company,2022-12-19 10:29:40,"Institutional investors may adopt severe steps after Walgreens Boots Alliance, Inc.'s (NASDAQ:WBA) latest 4.9% drop adds to a year losses",117580732,https://media.zenfs.com/en/simply_wall_st__316/45ec4a41578580e5934171fc2b23d843,WBA,Yahoo,"A look at the shareholders of Walgreens Boots Alliance, Inc. ( NASDAQ:WBA ) can tell us which group is most powerful...",https://finnhub.io/api/news?id=1a977ae9124b32081a70ef4562dc922f8fd38ba046e1a881e746c8bec7fcb488
company,2022-12-19 08:57:04,What Stores Are Open on Christmas Eve and Christmas Day?,117573988,https://s.yimg.com/ny/api/res/1.2/moH2ING.qtn3taH.bpo3kA--/YXBwaWQ9aGlnaGxhbmRlcjt3PTEyMDA7aD04MDE-/https://media.zenfs.com/en/gobankingrates_644/f159fb0bc26572b1f7db4deae101e5ad,WBA,Yahoo,Many retail and grocery stores remain open for the holidays. Here's a list of stores that will be open on Christmas Eve and Christmas and a look at their hours.,https://finnhub.io/api/news?id=daa0c39a95a8fbc4ee5de30a454ec66471be01d48ad83bebdc4a9159ef0ccd5c
company,2022-12-19 02:11:00,"Have a sick kid? Here`s what to know as CVS, Walgreens limit purchases of medicines",117697749,,WBA,MarketWatch,Looking for stock market analysis and research with proves results? Zacks.com offers in-depth financial research with over 30years of proven results.,https://finnhub.io/api/news?id=23fce813b6f82e645a45160844cd6f297a816da37fb5fd599dc5f562d00ac20a
company,2022-12-19 01:21:51,We Like Walgreens Boots Alliance's Dividends,117571742,https://static.seekingalpha.com/cdn/s3/uploads/getty_images/1346412977/image_1346412977.jpg?io=getty-c-w750,WBA,SeekingAlpha,Walgreens Boots Alliance has a strong track record of returning value to shareholders in the form of dividends. Click here to read more on WBA's dividend safety.,https://finnhub.io/api/news?id=b7d47ca84cd782b0b43a5045069daac8df9484fc16d3d93d809aff7115756f1d
company,2022-12-19 00:23:00,We Like Walgreens Boots Alliance`s Dividends,117976555,,WBA,Seeking Alpha,Looking for stock market analysis and research with proves results? Zacks.com offers in-depth financial research with over 30years of proven results.,https://finnhub.io/api/news?id=d24071ff3b518e41b628983d9fe74fdcec12a303805f94cdfe70ea6ec72ccdf9
company,2022-12-18 13:02:22,S&P 500 falls as stocks struggle into year-end,117576507,https://image.cnbcfm.com/api/v1/image/107166039-16710309032022-12-14t151255z_99791062_rc2q5y9dm17w_rtrmadp_0_usa-stocks.jpeg?v=1671458410&w=1920&h=1080,WBA,CNBC,Stocks were choppy in early Monday trading after the major averages posted their second straight week of losses.,https://finnhub.io/api/news?id=822335458daba53a220a4467a49891ac2f62f75fe1d14723bb3c1cd66c910516
company,2022-12-18 02:30:00,Walgreens Is Cheap At 8.7x P/E And 5% Yield,117566053,https://static.seekingalpha.com/cdn/s3/uploads/getty_images/1248262649/image_1248262649.jpg?io=getty-c-w750,WBA,SeekingAlpha,Walgreens Boots Alliance has been transforming itself to become a more holistic healthcare company. Click here to read my analysis of WBA stock.,https://finnhub.io/api/news?id=7ab0fa8b187f4101370008f79d8a8b3b81d637e54dde256dd974b8005b428a6b
company,2022-12-18 01:33:41,Walgreens Boots Alliance: A Value Buy Despite Obvious Headwinds,117565779,https://static.seekingalpha.com/cdn/s3/uploads/getty_images/1346412977/image_1346412977.jpg?io=getty-c-w750,WBA,SeekingAlpha,Walgreens Boots Alliance core business strategy needs some changes. Read more to see why I think the risk/reward are favorable in WBA stock.,https://finnhub.io/api/news?id=35b9b72f27d56727704629cb3730568ffd8188d16a187f0a40276e39f8512246
company,2022-12-24 05:08:00,3 Worst Performing Dow Jones Stocks In 2022,117727033,,WBA,TalkMarkets,Looking for stock market analysis and research with proves results? Zacks.com offers in-depth financial research with over 30years of proven results.,https://finnhub.io/api/news?id=5eb622c7c6a2803b26bd251ea84703aeb3f398e06a3f3e788cded49216b8c424
company,2022-12-23 15:16:00,Walgreens Applauds Lawmakers for passing the INFORM Consumers Act in 2023 Omnibus Spending Package,117648385,https://media.zenfs.com/en/business-wire.com/159ee6e40ad6070494e09533cde53160,WBA,Yahoo,"DEERFIELD, Ill., December 23, 2022--Today, Walgreens issued the following statement on the passage of the Integrity, Notification, and Fairness in Online Retail Marketplaces (INFORM) Consumers Act in the U.S. Congressional 2023 omnibus spending package.",https://finnhub.io/api/news?id=04a47e9e037da79d5396db92e71e3a72a68975cbf8c8492ea5a0ffbc6e2d8acf
company,2022-12-23 12:31:00,"Walgreens Boots Alliance Inc. stock rises Friday, still underperforms market",117699087,https://images.mktw.net/im-220105/social,WBA,MarketWatch,"Shares of Walgreens Boots Alliance Inc. inched 0.49% higher to $38.63 Friday, on what proved to be an all-around great trading session for the stock market,...",https://finnhub.io/api/news?id=b3f6473242b7b0595e1dce1b3be3754c7131b52078940c23c598588e1949b315
company,2022-12-23 10:26:17,Walgreens Boots Alliance CEO Roz Brewer to teach MasterClass on business innovation,117648386,,WBA,Yahoo,She is is one of only two Black women to lead Fortune 500 companies and a former C-suite executive at Starbucks and Sam's Club.,https://finnhub.io/api/news?id=a7313e32218a665000b594ad45892f532e51a1c838acfdd2d3ad1c9848387d06
company,2022-12-22 17:45:10,Walgreens Boots Alliance (WBA) Stock Moves -0.41%: What You Should Know,117625377,https://media.zenfs.com/en/zacks.com/432476d296d64c50172213c0415587c9,WBA,Yahoo,"In the latest trading session, Walgreens Boots Alliance (WBA) closed at $38.44, marking a -0.41% move from the previous day.",https://finnhub.io/api/news?id=ea23ac6f119c392cf6a903881b6e27857418dabfaa2bbd3fea159a2da963fcc3
company,2022-12-22 14:42:44,10 Best Widow and Orphan Stocks To Buy,117618689,https://media.zenfs.com/en/insidermonkey.com/8b188cbde663decbf2cf6049a11f9e0c,WBA,Yahoo,"In this article, we discuss 10 best window and orphan stocks to buy. If you want to see more stocks in this selection, check out 5 Best Widow and Orphan Stocks To Buy. A widow and orphan stock refers to an equity investment that pays a steady dividend and is generally considered to be low-risk, […]",https://finnhub.io/api/news?id=6d7c34c0bb156d86d5669081e3de46cf3b062005a2529586c4d0b071c4285095
company,2022-12-22 12:31:00,"Walgreens Boots Alliance Inc. stock falls Thursday, still outperforms market",117699088,https://images.mktw.net/im-220105/social,WBA,MarketWatch,"Shares of Walgreens Boots Alliance Inc. slid 0.41% to $38.44 Thursday, on what proved to be an all-around grim trading session for the stock market, with the...",https://finnhub.io/api/news?id=773b2d4c56b0bf4356d58fa7435c1617b1f27ead2c4773ae2e591f9a09a3f872
company,2022-12-22 09:08:02,Walgreens Boots (WBA) Gains From Digital Sales Amid Cost Woes,117616888,https://media.zenfs.com/en/zacks.com/d03a17bd79ce8d7f20dad2f635fce375,WBA,Yahoo,"Within the U.S. Healthcare segment, Walgreens Boots (WBA) is optimistic about the acquisition of CareCentrix.",https://finnhub.io/api/news?id=ffe99d6dbd3dd5891c1f5dd3a6cc4797d5d7841929c3f4fa457c3ee92dbc4514
company,2022-12-22 05:15:00,1 Beaten-Down Dow Stock to Buy Before It Pops,117614666,,WBA,Yahoo,Large-cap dividend stock Walgreens is clearly being shunned by Wall Street. That's a potential opportunity.,https://finnhub.io/api/news?id=3db1ed3122b8f5983e14345f05ae438435808f1c8cf8f7c832ec5db62821291e
company,2022-12-22 04:00:00,"Dividend Harvesting Portfolio Week 94 Update: $9,400 Allocated, $713.28 Projected Annual Dividends",117615404,https://static.seekingalpha.com/cdn/s3/uploads/getty_images/1072593728/image_1072593728.jpg?io=getty-c-w750,WBA,SeekingAlpha,"The Dividend Harvesting Portfolio is now generating $713.28 in annual dividends, yielding 7.88%. See what positions I added to the portfolio.",https://finnhub.io/api/news?id=5b4a0460dfe80ede9a6f4e3a9f32e747de6313b5814877ded4f8325f354bd889
company,2022-12-22 01:44:54,Wall Street Breakfast: SBF Associates Flip,117614341,https://static.seekingalpha.com/cdn/s3/uploads/getty_images/1241501470/image_1241501470.jpg?io=getty-c-w750,WBA,SeekingAlpha,"Listen on the go! A daily podcast of Wall Street Breakfast will be available by 8:00 a.m. on Seeking Alpha, iTunes, Stitcher and Spotify.",https://finnhub.io/api/news?id=e431d5d78de1928ed589536a55bfb821014a0feb44d2b166881cf45d88d856d7
company,2022-12-21 22:02:32,Treasury yields fall as investors return to bond market,117613149,https://image.cnbcfm.com/api/v1/image/103179656-GettyImages-110126160.jpg?v=1671696152&w=1920&h=1080,WBA,CNBC,U.S. Treasury yields fell on Thursday as the sell-off seen earlier in the week abated.,https://finnhub.io/api/news?id=72ab9d37ed1f30104dc41a3e575cab5d10b809506fb1422147e5d0c28538c3ed
company,2022-12-29 18:16:42,Sellers Hit WBA Stock Ahead Of Earnings; Lamb Weston Holds Near Highs Amid Bullish Growth,117890580,,WBA,Yahoo,WBA stock has come under heavy selling pressure ahead of earnings as the company transforms into a full-service health care provider.,https://finnhub.io/api/news?id=003493d34d85d268e67912a545cb85e898d08a38321424c1444b77033bb75d75
company,2022-12-29 12:31:00,"Walgreens Boots Alliance Inc. stock falls Thursday, underperforms market",118129730,https://images.mktw.net/im-220105/social,WBA,MarketWatch,"Shares of Walgreens Boots Alliance Inc. slid 0.29% to $37.47 Thursday, on what proved to be an all-around favorable trading session for the stock market,...",https://finnhub.io/api/news?id=489eff6ea79d25d1236cc96b82640a92ad3662f74010d854a9353c2afe4233d1
company,2022-12-29 10:00:03,Analysts Estimate Walgreens Boots Alliance (WBA) to Report a Decline in Earnings: What to Look Out for,117865492,https://media.zenfs.com/en/zacks.com/0c6f98f4bf655bec3b199bc1a71b8b85,WBA,Yahoo,Walgreens (WBA) doesn't possess the right combination of the two key ingredients for a likely earnings beat in its upcoming report. Get prepared with the key expectations.,https://finnhub.io/api/news?id=25a8f6ea2a84c020daaa49d5cd7cf15fd88139d909101d5cee684f13371bb410
company,2022-12-29 05:39:00,February 2023 Options Now Available For Walgreens Boots Alliance (WBA),117976492,,WBA,Stock Options Channel,Looking for stock market analysis and research with proves results? Zacks.com offers in-depth financial research with over 30years of proven results.,https://finnhub.io/api/news?id=9e60b5dcac714818ef73f3621469aecfa1b98a4ae6054c2b5477860094c247cd
company,2022-12-29 05:15:00,AmerisourceBergen sued by DoJ over suspicious opioid orders,117943555,,WBA,Seeking Alpha,Looking for stock market analysis and research with proves results? Zacks.com offers in-depth financial research with over 30years of proven results.,https://finnhub.io/api/news?id=54cee1a289d0629bd9068ccce8fe8c1a3150171196921178a2753749a979f8a5
company,2022-12-28 22:44:00,Novartis to pay $245M to settle antitrust lawsuit on hypertension drug Exforge,117860551,,WBA,Seeking Alpha,Looking for stock market analysis and research with proves results? Zacks.com offers in-depth financial research with over 30years of proven results.,https://finnhub.io/api/news?id=92093260f6c43801d3f869d5ce101506e506a53e3456c2fd65526b621a320892
company,2022-12-28 17:50:10,Walgreens Boots Alliance (WBA) Dips More Than Broader Markets: What You Should Know,117865494,https://media.zenfs.com/en/zacks.com/1a018a29aef5adbf5b4319f32058e209,WBA,Yahoo,"In the latest trading session, Walgreens Boots Alliance (WBA) closed at $37.58, marking a -1.91% move from the previous day.",https://finnhub.io/api/news?id=9aa76b5d20e5e542bdf70230b6eca0e21bf4a13f30491055ea542db90535b1b8
company,2022-12-28 12:31:00,Walgreens Boots Alliance Inc. stock underperforms Wednesday when compared to competitors,117847293,https://images.mktw.net/im-220105/social,WBA,MarketWatch,"Shares of Walgreens Boots Alliance Inc. shed 1.91% to $37.58 Wednesday, on what proved to be an all-around dismal trading session for the stock market, with...",https://finnhub.io/api/news?id=27cc8b640a08330e8e05a8486ee86c23b0d497e37d0270b85b15d563e20ecdb0
company,2022-12-28 10:40:00,Should You Invest in Walgreens for Its 5% Dividend Yield?,117816074,,WBA,Yahoo,"A high-yielding dividend stock can be attractive in today's bear market.  With the stock market in the doldrums, a hefty but safe dividend yield can offset some of the potential loss in wealth appreciation -- plus, it can mean you're generating some recurring dividend income.  At around 5%, Walgreens Boots Alliance (NASDAQ: WBA) pays a significantly high yield when you consider the S&P 500 average is less than 1.8%.",https://finnhub.io/api/news?id=9a742974f6489e4598a662c3690a987b36512ee35be5f960792ea4c910267f23
company,2022-12-28 05:29:00,"Dow drops 150 points on losses for Apple, Dow stocks",117830040,,WBA,MarketWatch,Looking for stock market analysis and research with proves results? Zacks.com offers in-depth financial research with over 30years of proven results.,https://finnhub.io/api/news?id=08eaf38f6e7e45c555659e256103426ccddb6231d0adb0a296274440755e9d40
company,2022-12-28 00:35:00,Top 3 Large-Cap Stocks Reporting Earnings In The First Week Of 2023,117843503,,WBA,TalkMarkets,Looking for stock market analysis and research with proves results? Zacks.com offers in-depth financial research with over 30years of proven results.,https://finnhub.io/api/news?id=1813f2f536097c387323b3b0c41b098ed89ece553b65db2c62af461236e510bb
company,2022-12-27 21:40:49,Dow 30 Stocks List: Ranked By 2022 Hedge Fund Bullishness Index,117810466,https://media.zenfs.com/en/insidermonkey.com/dc80761093b430fc5d9d5d2414e9dbe5,WBA,Yahoo,"In this article, we discuss the Dow 30 stocks and their rank according to the 2022 hedge fund bullishness index. The Dow Jones Industrial Average, sometimes known as Dow Jones or just the Dow, is an indicator of 30 renowned American firms that are traded on NYSE and NASDAQ. One of the first and most […]",https://finnhub.io/api/news?id=66963ee4f68e272074908d33777db8ae13bf79527285cb642a2c070d94ad7268
company,2022-12-27 17:44:13,Tracking John Rogers' Ariel Investments Portfolio - Q3 2022 Update,117810776,https://static.seekingalpha.com/cdn/s3/uploads/getty_images/477618545/image_477618545.jpg?io=getty-c-w750,WBA,SeekingAlpha,Ariel Investmentsâ 13F portfolio value decreased from $10.02B to $9.11B this quarter. Read more to for an update on the portfolio's trades for Q3 2022.,https://finnhub.io/api/news?id=1bd27341a9b611d27672bed7953f2d24d6e17117774c8bbb8bc29ce120cc15cb
company,2022-12-27 17:10:41,10 Biggest Healthcare Companies,117809329,https://s.yimg.com/ny/api/res/1.2/16IS7lS5OHuKgSFB9VyvKA--/YXBwaWQ9aGlnaGxhbmRlcjt3PTEyMDA7aD04MDE-/https://media.zenfs.com/en/investopedia.com/d77dd91774327d5dee4cecb8f0aae425,WBA,Yahoo,"The healthcare sector includes companies that produce medical goods, such as drugs and medical devices, and companies that provide medical services, such as health insurance or hospital administration.",https://finnhub.io/api/news?id=544e3fb3febd0ec98a83469f91d85bfa11ec9174c1b09125786ded448ad69acf
company,2022-12-27 12:31:00,"Walgreens Boots Alliance Inc. stock falls Tuesday, underperforms market",117847294,https://images.mktw.net/im-220105/social,WBA,MarketWatch,"Shares of Walgreens Boots Alliance Inc. slid 0.83% to $38.31 Tuesday, on what proved to be an all-around mixed trading session for the stock market, with the...",https://finnhub.io/api/news?id=8d3f117d91339fbb49c3b15cb938a6b70fd4f09f532671bb7e00c136c7000e2d
company,2022-12-27 10:37:56,"Walgreens looking to ‘disrupt how we deliver clinical trials,’ exec says",117816080,https://s.yimg.com/ny/api/res/1.2/kXWWZX7N_TbBA6CxCbxTtw--/YXBwaWQ9aGlnaGxhbmRlcjt3PTEyMDA7aD02NzQ-/https://s.yimg.com/os/creatr-uploaded-images/2022-12/06d86090-85fc-11ed-afff-235e312a910f,WBA,Yahoo,"Walgreens Chief Clinical Trials Officer Ramita Tandon joins Yahoo Finance Live’s Anjalee Khemlani to discuss delivering health care into local communities with a clinical trial business, health equity, and the outlook for the drug store chain.",https://finnhub.io/api/news?id=98cdb5a2558e463a30249c3549433f5b1893a6c6672c1990166994cce4afdfe5
company,2022-12-27 09:45:00,"Invest $5,000 In These 2 Top Dividend Stocks Before the End of the Bear Market",117816082,,WBA,Yahoo,"Bear markets are excellent opportunities to invest in dividend stocks, and it's obvious why.  As panicked investors sell off their shares of money-printing businesses in favor of sitting on the sidelines, fat yields await those with the confidence to be buying -- and that could be you.  In particular, there are two strong passive income stocks you should consider buying before prices start to rise again.",https://finnhub.io/api/news?id=c682ec36a94c872b21abc4aea76e6ab53012224fc7a899710e8090db7b2e97f6
company,2022-12-27 04:46:00,Tracking John Rogers` Ariel Investments Portfolio - Q3 2022 Update,117815429,,WBA,Seeking Alpha,Looking for stock market analysis and research with proves results? Zacks.com offers in-depth financial research with over 30years of proven results.,https://finnhub.io/api/news?id=bc9b005d2978580b3b7d44999c6fe4505f2787a91a6fb8ce4b97e0b6a27790b9
company,2022-12-27 01:47:00,2023 Will Be Dire for Crypto. It Might Be Better for Bitcoin.,117837179,https://images.barrons.com/im-692690/social,WBA,MarketWatch,"Robot worker installations surge in face of post-pandemic labor shortage, thousands more flights canceled in wake of winter storm, China will open its...",https://finnhub.io/api/news?id=629b07703cb2eaff0ccf2f9600bfc5dfa5a659d777d7e024be42a431539bbf1d
company,2022-12-25 22:43:00,12 Recession-Proof Stocks,117815412,,WBA,TalkMarkets,Looking for stock market analysis and research with proves results? Zacks.com offers in-depth financial research with over 30years of proven results.,https://finnhub.io/api/news?id=5382a35ed40aa73187eb8b13b857b2e408643cf05805fab5d7c38d0c4a32df32
company,2023-01-02 17:05:21,Penny Stocks & The Stock Market This Week Jan. 3 to Jan. 6 2023,118092110,https://pennystocks.com/wp-content/uploads/2022/11/stock-market-outlook-week-november-21-november-25-thanksgiving-week-2022.jpg,WBA,PennyStocks,What to watch in the stock market this week January 3rd - January 6th.,https://finnhub.io/api/news?id=3d150a23d899813e239870e253e69f245cdada78f0b72aea683265bd703fab2c
company,2023-01-02 15:48:27,15 Most Influential Companies to Invest In,118092661,https://media.zenfs.com/en/insidermonkey.com/6f96b7afdf0afe74fbca09aea327b14c,WBA,Yahoo,"In this article, we will be taking a look at the 15 most influential companies to invest in. For more such companies, go to 5 Most Influential Companies to Invest In. An average human these days seems to be continually under the influence of major companies. You wake up in the morning thanks to the alarm […]",https://finnhub.io/api/news?id=612ac7b7591107ce28daaf40679d785e584819034d74f7e918b97dda5fc471db
