category,datetime,headline,id,image,related,source,summary,url
company,2023-03-16 15:22:26,"Lightning Round: I'm not recommending any companies that are losing money, says Cramer",119284816,https://image.cnbcfm.com/api/v1/image/107210373-1679008651MM-Block-E-031623.jpg?v=1679008946&w=1920&h=1080,WBA,CNBC,"Mad Money host Jim Cramer weighs in on all manner of stocks, including SoFi, Geron, Phillips 66, FREYR Battery, Redfin, Steel Dynamics and Walgreens Boots Alliance.",https://finnhub.io/api/news?id=2758ac73c629fb3ba3b54a99f7f5b0383ee6ff9725f8582386a61780f3406dce
company,2023-03-16 13:31:00,"Walgreens Boots Alliance Inc. stock falls Thursday, underperforms market",119290248,https://images.mktw.net/im-220105/social,WBA,MarketWatch,"Shares of Walgreens Boots Alliance Inc. shed 0.39% to $33.41 Thursday, on what proved to be an all-around favorable trading session for the stock market,...",https://finnhub.io/api/news?id=fe0c0ec59e54f2334fda181fd9c7e9e5126f25bbf2624e125e39737b6d0a0feb
company,2023-03-16 11:15:04,"Why retailers like Home Depot, CVS and Walgreens are spending billions on anti-theft technology",119284786,https://image.cnbcfm.com/api/v1/image/107174475-1672931535490-gettyimages-1370922695-4045_48_2022_1077.jpeg?v=1678994104&w=1920&h=1080,WBA,CNBC,"According to the NRF, retail shrink, which refers to inventory loss due to theft, unknown loss and administrative error, reached $94.5 billion in 2021, a 4% increase from the year prior. While retailers and trade associations depict a ""shoplifting epidemic,"" criminologists and civil rights advocates worry the story is more nuanced. They point out, among other things, that retail shrink is difficult to track, and of the data available, the methodology is inconsistent.",https://finnhub.io/api/news?id=8324228263647a82afb56d5e31931fc4dc4f59fedb188308e66e22972046ebc9
company,2023-03-16 10:45:02,Here's Why You Should Retain Walgreens Boots (WBA) For Now,119276127,https://media.zenfs.com/en/zacks.com/8bcea0791fac129e7de5b2ff7486a1e3,WBA,Yahoo,"Investors are optimistic about Walgreens Boots (WBA), backed by continued partnership growth and a strong focus on strategic execution.",https://finnhub.io/api/news?id=c9082594e1d02aad3a9de1778f178d9b0fb0c9283d238ca237388485621b297a
company,2023-03-16 08:45:00,2 Healthcare Dividend Stocks That Hit the Sweet Spot,119279224,https://s.yimg.com/ny/api/res/1.2/6lOhwb_XPi7G0GravnrGAw--/YXBwaWQ9aGlnaGxhbmRlcjt3PTEyMDA7aD04MDE-/https://media.zenfs.com/en/motleyfool.com/1cc15aadcb96b07bd4403bdf0c7476a4,WBA,Yahoo,"Walgreens Boots Alliance (NASDAQ: WBA) and CareTrust REIT (NYSE: CTRE) combine everything you want in a dividend stock: yields above 5% but with a safe payout ratio and a history of dividend and revenue growth.  Both healthcare companies, however, have faced recent difficulties.  Walgreens Boots Alliance employs more than 315,000 people across 13,000 locations in nine countries.",https://finnhub.io/api/news?id=4018b36af210b6d0f7c944dfe2b08bfeebdee81f6415825f3611e3573a48f0f0
company,2023-03-16 06:27:00,"Visa, Chevron share losses contribute to Dow`s 50-point drop",119272413,,WBA,MarketWatch,Looking for stock market analysis and research with proves results? Zacks.com offers in-depth financial research with over 30years of proven results.,https://finnhub.io/api/news?id=df988f80f247f29b643c6b4ba2c0d2b8d4250a83ef996a3979a6ec21a77a380e
company,2023-03-16 05:21:00,"3 Exceptionally Safe Stocks That Can Turn $400,000 Into $1 Million by 2030",119271841,https://s.yimg.com/ny/api/res/1.2/Njo9g5ImyJ34d9rUOJxGaw--/YXBwaWQ9aGlnaGxhbmRlcjt3PTEyMDA7aD04NDM-/https://media.zenfs.com/en/motleyfool.com/b4e031922a694b57795354687063b217,WBA,Yahoo,"These highly profitable, time-tested stocks are perfect for conservative investors looking to grow their wealth.",https://finnhub.io/api/news?id=62218688d245124f2c6cb6920f8d30b48d5b9736bc8011127ffa9e3f3ad66370
company,2023-03-23 10:23:02,Is a Surprise Coming for Walgreens Boots Alliance (WBA) This Earnings Season?,119384808,https://media.zenfs.com/en/zacks.com/c7644815c1050c4faa12c4217ed2d126,WBA,Yahoo,Walgreens Boots Alliance (WBA) is seeing favorable earnings estimate revision activity and has a positive Zacks Earnings ESP heading into earnings season.,https://finnhub.io/api/news?id=0ca8b29752b539255290e446731e75ed88eade8175bed5fe28920fbef341b255
company,2023-03-23 07:46:00,Global company events calendar - next 7 days,119374564,,WBA,Alliance News,Looking for stock market analysis and research with proves results? Zacks.com offers in-depth financial research with over 30years of proven results.,https://finnhub.io/api/news?id=2c04d785ff6b36ed89b5a3dbe28beb55d3bd027ff1d2ede0166f5da5f8ddb0a0
company,2023-03-23 06:47:00,Interesting WBA Put And Call Options For May 5th,119376274,,WBA,Stock Options Channel,Looking for stock market analysis and research with proves results? Zacks.com offers in-depth financial research with over 30years of proven results.,https://finnhub.io/api/news?id=f7a12d9babd9a39da666f639c5c5e693de4476ee77c0257c288b132e6e3d5513
company,2023-03-23 00:33:00,Walgreens Boots Alliance Inc. stock underperforms Thursday when compared to competitors,119459641,,WBA,MarketWatch,Looking for stock market analysis and research with proves results? Zacks.com offers in-depth financial research with over 30years of proven results.,https://finnhub.io/api/news?id=4d884350a8781e61e9de207bfea7af9e25cf58d8edba3afe4e1376a0e91a6d46
company,2023-03-22 18:17:04,Why Walgreens Boots Alliance Stock Weakened on Wednesday,119363645,https://s.yimg.com/ny/api/res/1.2/aNya6hXu9GQ_aDAloSR0Iw--/YXBwaWQ9aGlnaGxhbmRlcjt3PTEyMDA7aD04MDE-/https://media.zenfs.com/en/motleyfool.com/2d0838f6e51f21a92830f5778c429b99,WBA,Yahoo,Pundits following the stock are adjusting their takes in the run-up to the second-quarter earnings release.,https://finnhub.io/api/news?id=a77c8946cb90bc957c5ca0d5d924a36816a2d11277d7904a9981e62e7f3c56f4
company,2023-03-22 13:31:00,"Walgreens Boots Alliance Inc. stock falls Wednesday, underperforms market",119365516,https://images.mktw.net/im-220105/social,WBA,MarketWatch,"Shares of Walgreens Boots Alliance Inc. slipped 3.10% to $32.50 Wednesday, on what proved to be an all-around grim trading session for the stock market, with...",https://finnhub.io/api/news?id=0019b4fec64c73844b50b59284bd1c6d1f0768f41c92687ec17534804ec08583
company,2023-03-22 04:56:00,Walgreens Boots Alliance price target lowered to $35 from $36 at Evercore ISI,119360033,,WBA,Thefly.com,Looking for stock market analysis and research with proves results? Zacks.com offers in-depth financial research with over 30years of proven results.,https://finnhub.io/api/news?id=e6893259142f38c960f0db8d3d1a0e4d2db60347e03df4063cf05e73cbd04d81
company,2023-03-21 18:34:21,Tracking Bruce Berkowitz's Fairholme Portfolio - Q4 2022 Update,119342385,https://static.seekingalpha.com/cdn/s3/uploads/getty_images/1013942720/image_1013942720.jpg?io=getty-c-w1536,WBA,SeekingAlpha,Bruce Berkowitzâs 13F stock portfolio value increased this quarter from $1.03B to $1.20B. Click here to read more about Fairholme's holdings for Q4 2022.,https://finnhub.io/api/news?id=a3778c3c9d58443570671e00f824e78288a8dd93289759c530a58f6a98ebb003
company,2023-03-21 17:45:09,Walgreens Boots Alliance (WBA) Gains But Lags Market: What You Should Know,119341075,https://media.zenfs.com/en/zacks.com/090f58c1efbe3555b861102525e50b39,WBA,Yahoo,"Walgreens Boots Alliance (WBA) closed the most recent trading day at $33.54, moving +1.05% from the previous trading session.",https://finnhub.io/api/news?id=4bc24dfb52aef1425e99bb0484bcc4c92fec1e14ab12128429c88a9c060fb070
company,2023-03-21 13:31:00,"Walgreens Boots Alliance Inc. stock rises Tuesday, still underperforms market",119345946,https://images.mktw.net/im-220105/social,WBA,MarketWatch,"Shares of Walgreens Boots Alliance Inc. advanced 1.05% to $33.54 Tuesday, on what proved to be an all-around positive trading session for the stock market,...",https://finnhub.io/api/news?id=9cbe144a3341d2fcb155b1de17eecb49c9985d3a3cf5a9e818a0631f6a857cc9
company,2023-03-21 10:00:02,Walgreens Boots Alliance (WBA) Expected to Beat Earnings Estimates: What to Know Ahead of Q2 Release,119341076,https://media.zenfs.com/en/zacks.com/39dfb058875b6e691de9136bc97a47b4,WBA,Yahoo,Walgreens (WBA) possesses the right combination of the two key ingredients for a likely earnings beat in its upcoming report. Get prepared with the key expectations.,https://finnhub.io/api/news?id=f3eaaa286a5a232555562658c478315fd4f02c674bb70bc6e3d496e64b70b071
company,2023-03-21 05:38:00,Tracking Bruce Berkowitz`s Fairholme Portfolio - Q4 2022 Update,119342792,,WBA,Seeking Alpha,Looking for stock market analysis and research with proves results? Zacks.com offers in-depth financial research with over 30years of proven results.,https://finnhub.io/api/news?id=d8a96a32a35f1c04c692371fc8eed095f5b45932ac28e0ee1849b7c85444cfb1
company,2023-03-21 01:05:00,British Land hails acquisitions of two parks and one retail warehouse,119331140,,WBA,Alliance News,Looking for stock market analysis and research with proves results? Zacks.com offers in-depth financial research with over 30years of proven results.,https://finnhub.io/api/news?id=a5f000284ac496ad3fd9defba857a845bc82b17eea5e69b6edee74ece8cd2d5a
company,2023-03-20 13:30:00,"Walgreens Boots Alliance Inc. stock rises Monday, still underperforms market",119326739,https://images.mktw.net/im-220105/social,WBA,MarketWatch,"Shares of Walgreens Boots Alliance Inc. inched 0.85% higher to $33.19 Monday, on what proved to be an all-around great trading session for the stock market,...",https://finnhub.io/api/news?id=2ac006602fedc25508735e42252f8a087f00820097e8ab212a1b60b6b6432b61
company,2023-03-20 09:33:27,Best Dividend Stock to Buy: Walgreens vs. CVS,119304809,https://s.yimg.com/ny/api/res/1.2/CQBOM6BuQXM6VfVL6Tc5kw--/YXBwaWQ9aGlnaGxhbmRlcjt3PTEyMDA7aD02NzU-/https://media.zenfs.com/en/motleyfool.com/2a294ccbeaaa7087da0a6f520fd0ce08,WBA,Yahoo,"Walgreens (NASDAQ: WBA) and CVS (NYSE: CVS) may not be growing revenue explosively, but they are stable companies that offer dividends. This video will evaluate the two dividend stocks across several financial metrics to determine which is the best stock for passive income investors.",https://finnhub.io/api/news?id=17bcfe52eba2f281e163ad5de0dde40206ead2251bd2b0867325011b0c33a1a0
company,2023-03-20 09:27:01,Walgreens (WBA) to Report Q2 Earnings: What's in the Cards?,119307176,https://media.zenfs.com/en/zacks.com/8bcea0791fac129e7de5b2ff7486a1e3,WBA,Yahoo,Walgreens' (WBA) strategic executions on the United States and the international front is likely to have contributed to the Q2 2023 top line.,https://finnhub.io/api/news?id=f14e36bdf85631e3ccf42bb2cd39b346eb4b6d4443c950b4ed641caff80728b0
company,2023-03-20 09:00:01,"Is Trending Stock Walgreens Boots Alliance, Inc. (WBA) a Buy Now?",119307178,https://media.zenfs.com/en/zacks.com/2a50596f066181e48e4ae0ad6be00462,WBA,Yahoo,"Recently, Zacks.com users have been paying close attention to Walgreens (WBA). This makes it worthwhile to examine what the stock has in store.",https://finnhub.io/api/news?id=8e6c2bd3e3997ec70f31e437cdfde88608d8af0c539962eb07677849d91cfd23
company,2023-03-27 14:04:21,Stock futures tick higher on Monday evening: Live updates,119453286,https://image.cnbcfm.com/api/v1/image/107138894-Traders-TF-Photo-202201021-ACJ-086-PRESS-4.jpg?v=1679954661&w=1920&h=1080,WBA,CNBC,The overnight moves followed a mixed session as investors fought to extend last week's gains.,https://finnhub.io/api/news?id=8f05ff49b32de08989db39dd99782fc01114efbbf5505530c00f2b1f7826ec03
company,2023-03-27 13:30:00,Walgreens Boots Alliance Inc. stock outperforms competitors on strong trading day,119581251,https://images.mktw.net/im-220105/social,WBA,MarketWatch,"Shares of Walgreens Boots Alliance Inc. inched 0.73% higher to $32.94 Monday, on what proved to be an all-around favorable trading session for the stock...",https://finnhub.io/api/news?id=eec78e337ea25f33d2c79c444b56e8c3b51fb77c33040b360f0aee5965f1e63b
company,2023-03-27 12:21:00,NEW YORK MARKET CLOSE: Tech stocks slip back but banks push Dow higher,119444429,,WBA,Alliance News,Looking for stock market analysis and research with proves results? Zacks.com offers in-depth financial research with over 30years of proven results.,https://finnhub.io/api/news?id=1d95f7dfc81bef63ac592c43b319a5a70faefcdf72641253e4cb72ba0fca8065
company,2023-03-27 11:56:18,"Micron, Lululemon, Walgreens Boots Alliance: 3 things to watch",119452703,https://s.yimg.com/cv/apiv2/social/images/yahoo_default_logo-1200x1200.png,WBA,Yahoo,By Liz Moyer,https://finnhub.io/api/news?id=148d0625ec8ecfff68b19847b9479c230f2bd18c2131e720485a32077100fb31
company,2023-03-27 10:40:02,Walgreens Boots (WBA) Benefits From Innovation Amid Margin Woe,119437101,https://media.zenfs.com/en/zacks.com/8bcea0791fac129e7de5b2ff7486a1e3,WBA,Yahoo,Walgreens Boots' (WBA) comparable pharmacy sales decline reflects lower demand for COVID-19 services.,https://finnhub.io/api/news?id=4a70b150361b8ba8e6916da5999e6b1c92525bf2057339ccd40eeeb355c8ec85
company,2023-03-27 08:16:00,Sen. Duckworth calls on FTC to investigate AmerisourceBergen over abortion pill,119451513,,WBA,Seeking Alpha,Looking for stock market analysis and research with proves results? Zacks.com offers in-depth financial research with over 30years of proven results.,https://finnhub.io/api/news?id=4153576109a1db0536d464bb5bfa98c18345dcb600cab85430e3d72893c2882a
company,2023-03-27 08:15:00,3 Stocks to Avoid This Week,119441750,https://media.zenfs.com/en/motleyfool.com/5cba5f301871080bc088878a0bcf7697,WBA,Yahoo,"Wall Street kept clawing its way back in the 12th trading week of 2023. I thought my ""three stocks to avoid"" -- Ollie's Bargain Outlet Holdings (NASDAQ: OLLI), Coinbase (NASDAQ: COIN), and Movado (NYSE: MOV) -- were going to lose to the market in the past week.",https://finnhub.io/api/news?id=509d37f2b866b7f5ed02fb0bf802de3534d764796b9ea3b30ff5aeb1aaddd2e8
company,2023-03-27 08:13:00,Notable companies reporting before tomorrow`s open,119459623,,WBA,Thefly.com,Looking for stock market analysis and research with proves results? Zacks.com offers in-depth financial research with over 30years of proven results.,https://finnhub.io/api/news?id=94f9b20042324a22c748e84fc6cfd19763682f1d51fb3e55689b6bf6ec097425
company,2023-03-27 05:21:00,3 Nasdaq 100 Stocks That Have Never Been This Cheap,119430698,https://s.yimg.com/ny/api/res/1.2/D_xWHA32q5ol8PK9bwJmUQ--/YXBwaWQ9aGlnaGxhbmRlcjt3PTEyMDA7aD04MDA-/https://media.zenfs.com/en/motleyfool.com/800ea9d601e2bb912a9cc00a658cb616,WBA,Yahoo,"These brand-name companies, some of which have been public for more than a quarter of a century, are historically inexpensive.",https://finnhub.io/api/news?id=f8c333480dfffa0c67a1f97f35ec2df5685123f418a94977d380786c5e181dca
company,2023-03-27 04:40:00,Unusually active option classes on open March 27th,119437256,,WBA,Thefly.com,Looking for stock market analysis and research with proves results? Zacks.com offers in-depth financial research with over 30years of proven results.,https://finnhub.io/api/news?id=4489eaf459ba87918a4f5b3a3cf4370350325ae387bbf68235a50a9c63ba49ce
company,2023-03-27 01:16:00,Morgan Stanley Remains a Sell on Walgreens Boots Alliance (WBA),119459626,,WBA,TipRanks,Looking for stock market analysis and research with proves results? Zacks.com offers in-depth financial research with over 30years of proven results.,https://finnhub.io/api/news?id=861e1b3ff64dbe3056fc2f61ba17bb6d8b72f2694e6654a4fc6488f10e2954a4
company,2023-03-26 22:14:00,"Walgreens Boots Q2 earnings on deck, what to expect",119459628,,WBA,Seeking Alpha,Looking for stock market analysis and research with proves results? Zacks.com offers in-depth financial research with over 30years of proven results.,https://finnhub.io/api/news?id=24b9d6a3b2645f907f5e0ac85abcbcee2351bbb9b65aad4df3cae4192a8f55f7
company,2023-03-26 15:00:00,"Lululemon, Intel, Carnival, Micron, Walgreens, and More Stocks to Watch This Week",119425684,https://s.yimg.com/ny/api/res/1.2/g.CP5OaWr9lqOtI1i7RHQw--/YXBwaWQ9aGlnaGxhbmRlcjt3PTEyMDA7aD02MDA-/https://media.zenfs.com/en/Barrons.com/526d9145af1d6054de3518b671c4dac8,WBA,Yahoo,"BioNTech, Carnival, Lululemon, McCormick, Micron, and Walgreens Boots Alliance report this week. Plus, banking regulator testimony, housing data, and consumer confidence.",https://finnhub.io/api/news?id=28da387218157a84c9bb2dbede2c3595668be9ca20e428bdf7073f334d273f08
company,2023-03-26 00:03:00,Walgreens Boots Alliance price target lowered to $43 from $45 at Barclays,119459629,,WBA,Thefly.com,Looking for stock market analysis and research with proves results? Zacks.com offers in-depth financial research with over 30years of proven results.,https://finnhub.io/api/news?id=ba40f8e07f8d58814df5e9db0ecfda65a11b1d09d77fbd55c359a22115236f1e
company,2023-03-24 17:10:48,Stock Trading Action Plan: Can The Market Bootstrap Itself To A Strong March Finish?,119386061,https://media.zenfs.com/en/ibd.com/74fb84aa0bad221fdf67b25a31fa964b,WBA,Yahoo,"The Nasdaq defended gains, plus its budding rally attempt, as stock trading heads into what could be a strong final week of March.",https://finnhub.io/api/news?id=99c67d02c6c4d0a767540d36136f18405367f91146677aeff0566c03ea4bf6f1
company,2023-03-24 08:50:00,"Earnings week ahead: Micron, Lululemon, Carnival, RH and more",119436166,,WBA,Seeking Alpha,Looking for stock market analysis and research with proves results? Zacks.com offers in-depth financial research with over 30years of proven results.,https://finnhub.io/api/news?id=0559a2de8ac1490637d696a3a846460158df442af3ae5bf96e9e542f38add9ea
company,2023-03-24 08:02:00,Global company events calendar - next 7 days,119436622,,WBA,Alliance News,Looking for stock market analysis and research with proves results? Zacks.com offers in-depth financial research with over 30years of proven results.,https://finnhub.io/api/news?id=94e5a6e4f097ae31acc03f0a5592dc6a8dd3ee43eff11dc5bda78ec32903cc3b
company,2023-03-24 03:08:00,"Chevron, Goldman and JPMorgan Chase lead all 30 Dow stocks lower",119443492,https://s.wsj.net/public/resources/MWimages/MW-GP644_MicroS_ZG_20180906154215.jpg,WBA,MarketWatch,"The Dow Jones Industrial Average’s early weakness, amid investor jitters over the health of the banking sector, is unanimous, as all 30 components traded...",https://finnhub.io/api/news?id=0fa669e59f681d5bc65cf17836db3240e60c33ead77ea9e9f740f74bbf49d18a
company,2023-03-23 22:08:00,Walgreens Boots Alliance (WBA) Shares Cross 6% Yield Mark,119459638,,WBA,Dividend Channel,Looking for stock market analysis and research with proves results? Zacks.com offers in-depth financial research with over 30years of proven results.,https://finnhub.io/api/news?id=bfaea11e4d76dc80944a6a7efaa5244958fd37e8c9a5a6da1855b86061dbf2f2
company,2023-03-23 22:02:00,"Catalyst watch: Eyes on Deutsche Bank, Intel, Virgin Orbit and the Fed`s favorite inflation gauge",119435371,,WBA,Seeking Alpha,Looking for stock market analysis and research with proves results? Zacks.com offers in-depth financial research with over 30years of proven results.,https://finnhub.io/api/news?id=6a36a33652b7befbced1c7471628d550c061d8dd6e3e5c90561f6a24823ff9d8
company,2023-03-31 13:36:00,Walgreens Boots Alliance Inc. stock underperforms Friday when compared to competitors,119581241,https://images.mktw.net/im-220105/social,WBA,MarketWatch,"Shares of Walgreens Boots Alliance Inc. slipped 0.14% to $34.58 Friday, on what proved to be an all-around great trading session for the stock market, with...",https://finnhub.io/api/news?id=8523fbe91b1f33f24e2d73b3b4bbe26e637ae9cf2ac6065cfd1cefa857b101e2
company,2023-03-30 13:30:00,Walgreens Boots Alliance Inc. stock outperforms market on strong trading day,119581242,https://images.mktw.net/im-220105/social,WBA,MarketWatch,"Shares of Walgreens Boots Alliance Inc. rallied 1.41% to $34.63 Thursday, on what proved to be an all-around favorable trading session for the stock market,...",https://finnhub.io/api/news?id=75fb21ff8a978efe93c5eb5675f20fe0b678afa2aafb020352b034b46c0c3620
company,2023-03-30 13:00:00,Walgreens Boots Alliance Needs to Show a More Bullish Picture,119525693,https://media.zenfs.com/en/thestreet.com/831a2bf8dcc05bc479a022d6b28f564b,WBA,Yahoo,"Walgreens Boots Alliance posted a Q2 EPS and revenue beat on Tuesday morning but it is not yet moving the needle. Let's review the charts and indicators of this giant pharmacy chain. In this daily bar chart of WBA, below, I can see that WBA made a low in October and so far a higher low in March.",https://finnhub.io/api/news?id=0a2dfb4b5cbb38a90145febda67c03a7fb2a59a4bd1c87d8837b8d0097aee9df
company,2023-03-30 11:54:11,My Best Dividend Aristocrats For April 2023,119519916,https://static.seekingalpha.com/cdn/s3/uploads/getty_images/1397011551/image_1397011551.jpg?io=getty-c-w1536,WBA,SeekingAlpha,"NOBL gave up a big chunk of its January gains in February, finishing the month down 2.36%. March sees the ETF tumble some more as its down 1.88% through 3/29. Read more here.",https://finnhub.io/api/news?id=1b44d13a22b81159ccf207c8ab7c5fb71f4cda189c7dd3c314a16f0f12ba0afd
company,2023-03-30 07:13:00,"Intel, Walgreens Boots share gains contribute to Dow's 62-point climb",119555967,https://mw3.wsj.net/mw5/content/logos/mw_logo_social.png,WBA,MarketWatch,The Dow Jones Industrial Average is trading up Thursday morning with shares of Intel and Walgreens Boots seeing positive growth for the blue-chip average....,https://finnhub.io/api/news?id=b41ef0032b33429a8a530084f6ea0015dd5c7487f8ba9f8bf6c6c802a8b43141
company,2023-03-30 06:45:34,7 Must-Buy Income Stocks After the Fed Raised Interest Rates Again,119572644,https://media.zenfs.com/en/investorplace_417/d864b4130c9cae906e408d72f46cd4a2,WBA,Yahoo,"When the Federal Reserve raised interest rates again by 25 basis points, investors seeking stable holdings needed to consider income stocks to buy. The Fed’s benchmark rate is rising to a range of between 4.75% and 5.0%. This is the highest federal funds rate since 2017. Ideally, the best income stocks to buy pay a dividend that yields at least 4.75%, which is the risk-free rate of return from holding cash and bonds. Investors could have booked a yield as high as 5.309% on March 8, by holding th",https://finnhub.io/api/news?id=4da77a95eba78e05c8ba37597a5075c4373204dbe40b98fdbe6588f7740a236c
company,2023-03-30 06:37:00,"Intel, Walgreens Boots share gains contribute to Dow`s 62-point climb",119518019,,WBA,MarketWatch,Looking for stock market analysis and research with proves results? Zacks.com offers in-depth financial research with over 30years of proven results.,https://finnhub.io/api/news?id=17833d062f0c9ba306dc0814eeea690e6cd030a75de188248a473f12861e9fec
company,2023-03-30 06:08:18,"Walgreens Boots Alliance, Inc. (NASDAQ:WBA) Q2 2023 Earnings Call Transcript",119525694,https://media.zenfs.com/en/insidermonkey.com/ded1a174a7f76f255a671067d7216ccd,WBA,Yahoo,"Walgreens Boots Alliance, Inc. (NASDAQ:WBA) Q2 2023 Earnings Call Transcript March 28, 2023 Operator: Good morning. My name is Rob, and I will be your conference operator today. At this time, I would like to welcome everyone to the Walgreens Boots Alliance Second Quarter 2023 Earnings Conference Call. Tiffany Kanaga, Vice President of Global Investor […]",https://finnhub.io/api/news?id=8580d9bccd8f68a35a1eb68334f9cea3f2fd166b7b34bd579ce48aca5ac6ad36
company,2023-03-30 05:14:00,3 Dow Stocks That Billionaires Are Buying Hand Over Fist,119525695,https://s.yimg.com/ny/api/res/1.2/6kDStvkQDmziopFuq8lo.w--/YXBwaWQ9aGlnaGxhbmRlcjt3PTEyMDA7aD04MDA-/https://media.zenfs.com/en/motleyfool.com/faef035161e306d09f3ec54dfd5be491,WBA,Yahoo,A handful of the world's most successful investors keep making bets on these Dow Jones Industrial Average components.,https://finnhub.io/api/news?id=abd56a241f00861778d598807da2bc389175692affb204e7b6e8fc8f70fcf2d3
company,2023-03-30 01:25:00,Walgreens Boots Alliance (WBA) Receives a Sell from Bank of America Securities,119525257,,WBA,TipRanks,Looking for stock market analysis and research with proves results? Zacks.com offers in-depth financial research with over 30years of proven results.,https://finnhub.io/api/news?id=457d9a778585985cddf5d93b38dd0b82ac61c1a1546e244609e7d1e73a4dcb75
company,2023-03-30 01:25:00,Walgreens Boots Alliance (WBA) Receives a Hold from Raymond James,119525256,,WBA,TipRanks,Looking for stock market analysis and research with proves results? Zacks.com offers in-depth financial research with over 30years of proven results.,https://finnhub.io/api/news?id=fefa29b79ecac306c86c9584f8705e78d80326f3ef45677979eb21f7a5c561c1
company,2023-03-30 00:56:00,11 Stocks: 9 Dividend Payers 2 For Growth,119523209,,WBA,TalkMarkets,Looking for stock market analysis and research with proves results? Zacks.com offers in-depth financial research with over 30years of proven results.,https://finnhub.io/api/news?id=0087e9af459f36b63d30b58cf998467fbf5f2850dc1254fe5465933d19a4bf49
company,2023-03-30 00:06:00,Walgreens Boots Alliance price target lowered to $46 from $47 at Deutsche Bank,119525261,,WBA,Thefly.com,Looking for stock market analysis and research with proves results? Zacks.com offers in-depth financial research with over 30years of proven results.,https://finnhub.io/api/news?id=cc5aeb61e25c3900fb4d5dbb6fea7727915d0053dd098bfab1cb8482609b1468
company,2023-03-29 21:59:00,"Dow climbs 63 points on gains in shares of Intel, Walt Disney",119522245,,WBA,MarketWatch,Looking for stock market analysis and research with proves results? Zacks.com offers in-depth financial research with over 30years of proven results.,https://finnhub.io/api/news?id=cc083640fe90ba2288d94f3073829ff746ca9fecbf56c92064bb16d0b7bd4417
