category,datetime,headline,id,image,related,source,summary,url
company,2023-06-22 04:47:00,Cramer On Carnival Stock: 'Pay Close Attention',121020144,,WBA,Benzinga,Looking for stock market analysis and research with proves results? Zacks.com offers in-depth financial research with over 30years of proven results.,https://finnhub.io/api/news?id=96528dd9e34615f6dcbc6366fa7e551a7ca6456ab60e3ad653e18c5b1f64c36f
company,2023-06-22 02:22:00,Walgreens Boots Alliance price target lowered to $52 from $54 at TD Cowen,121002347,,WBA,Thefly.com,Looking for stock market analysis and research with proves results? Zacks.com offers in-depth financial research with over 30years of proven results.,https://finnhub.io/api/news?id=6cc15b0422dac47b2128ec8bfa3cfdde378d0dfbf528e6b842176f741435c699
company,2023-06-21 14:41:00,Want Passive Income? Try Investing in Stocks,120984116,,WBA,Yahoo,Why launch a YouTube channel when you can buy companies that have paid dividends for decades?,https://finnhub.io/api/news?id=47fb9819f794408be8169ea657dd35505b631ece5fe533aec63db4376fc4977f
company,2023-06-21 13:01:00,Walgreens Boots Alliance Inc. stock underperforms Wednesday when compared to competitors,120992653,https://images.mktw.net/im-220105/social,WBA,MarketWatch,"Shares of Walgreens Boots Alliance Inc. shed 2.56% to $31.56 Wednesday, on what proved to be an all-around dismal trading session for the stock market, with...",https://finnhub.io/api/news?id=c155b318395f3a4024997a5509a1ca0b94a8f473a5d4363e3bb88fb90a589f94
company,2023-06-21 04:40:00,Unusually active option classes on open June 21st,120976769,,WBA,Thefly.com,Looking for stock market analysis and research with proves results? Zacks.com offers in-depth financial research with over 30years of proven results.,https://finnhub.io/api/news?id=6f7743b4a05d6d94f0fdbfdf9237689d04465822d2a1a2caa30f3ba5f5b2935b
company,2023-06-21 04:06:00,The Power of Diversity: 3 Fortune 500 Stocks Led by Black CEOs Worth Buying,120976984,,WBA,InvestorPlace,Looking for stock market analysis and research with proves results? Zacks.com offers in-depth financial research with over 30years of proven results.,https://finnhub.io/api/news?id=e842f032423e1e283ad2c342a50fa88f01702a9256b7ad23f37b4925b47607da
company,2023-06-20 17:50:20,Walgreens Boots Alliance (WBA) Dips More Than Broader Markets: What You Should Know,120967626,https://media.zenfs.com/en/zacks.com/e8e4b0344809eaac6d73c9fd25fd180a,WBA,Yahoo,"Walgreens Boots Alliance (WBA) closed the most recent trading day at $32.39, moving -0.86% from the previous trading session.",https://finnhub.io/api/news?id=918a523a4ab304eb0f5b39d28cb554c305a359c6cef5f6b1faa7ea0108b1154a
company,2023-06-20 15:20:43,Walgreens Stock's Recent Bounce May Be Short-Lived,120961365,https://media.zenfs.com/en/schaeffers_investment_research_24/ca52effb62e9eaff3d73d539a3a31665,WBA,Yahoo,The security is running into a historically bearish trendline,https://finnhub.io/api/news?id=143b83582fa39ccfb4339c0fdb92373e3ebc6197d4393fd61edba9ac13a3534f
company,2023-06-20 13:01:00,"Walgreens Boots Alliance Inc. stock falls Tuesday, underperforms market",120967366,https://images.mktw.net/im-220105/social,WBA,MarketWatch,"Shares of Walgreens Boots Alliance Inc. sank 0.86% to $32.39 Tuesday, on what proved to be an all-around dismal trading session for the stock market, with...",https://finnhub.io/api/news?id=4094c778c64ff204a8a2d15ae19ec7c4e9bc6afe12289f9b972c6bcd1064c7a9
company,2023-06-20 11:19:00,Why You Should Retain Walgreens Boots (WBA) Stock for Now,120961366,https://media.zenfs.com/en/zacks.com/d03a17bd79ce8d7f20dad2f635fce375,WBA,Yahoo,Investors are optimistic about Walgreens Boots (WBA) on a strong focus on strategic priorities.,https://finnhub.io/api/news?id=54d054f09654312d6565cc87bc5b74acad75817ff88f09160681527bab642738
company,2023-06-20 10:00:06,Walgreens Boots Alliance (WBA) Earnings Expected to Grow: What to Know Ahead of Next Week's Release,120961368,https://media.zenfs.com/en/zacks.com/0c6f98f4bf655bec3b199bc1a71b8b85,WBA,Yahoo,Walgreens (WBA) doesn't possess the right combination of the two key ingredients for a likely earnings beat in its upcoming report. Get prepared with the key expectations.,https://finnhub.io/api/news?id=1ed0c44dbece59c81084338632cb23d234729bd5e1c4d015406d258eada77c65
company,2023-06-20 04:40:00,Unusually active option classes on open June 20th,120956694,,WBA,Thefly.com,Looking for stock market analysis and research with proves results? Zacks.com offers in-depth financial research with over 30years of proven results.,https://finnhub.io/api/news?id=52f0dd097732243964ae887794fe77ffc3e0459ca26b5b60c579f938b1a0533f
company,2023-06-27 17:50:00,Walgreens Lowers Financial Outlook Amid Weaker Consumer Spending,121080164,https://s.yimg.com/ny/api/res/1.2/kJ_HO8ObK4xaS0XKW3B9LQ--/YXBwaWQ9aGlnaGxhbmRlcjt3PTEyMDA7aD02MDA-/https://media.zenfs.com/en/wsj.com/dddebbc647040ac146cae249ba6b8423,WBA,Yahoo,The drugstore chain says it will step up cost-cutting measures and boost the long-term profitability of its healthcare business.,https://finnhub.io/api/news?id=9f40943ea48ab341da48bb23c71885049fa59dc58b5d5e172661b5b48c664e01
company,2023-06-27 17:46:45,Boots and Walgreens to close 450 branches across UK and US,121083724,https://s.yimg.com/cv/apiv2/social/images/yahoo_default_logo-1200x1200.png,WBA,Yahoo,"Boots will close 300 stores in the UK and a further 150 Walgreens branches in the US over the next year as parent company Walgreens Boots Alliance seeks to “optimise” locations.  James Kehoe, executive vice-president and global finance chief, confirmed the closures during an earnings call with analysts on Tuesday.  “Similar to other retailers, we’ve been impacted by the rapid softening of the macro environment and a more cautious and value-driven consumer,” Walgreens chief executive Rosalind Brewer said on its conference call.",https://finnhub.io/api/news?id=62f5b992e4ce18240417771d420433bfcb272274f2d078c9268edc7c79564ffa
company,2023-06-27 17:29:39,"Walgreens cuts guidance, Lordstown Motors' bankruptcy, Unity Software shares soared: Top stories",121080165,https://s.yimg.com/ny/api/res/1.2/God6QTg0vI8v2aLwzm8g9g--/YXBwaWQ9aGlnaGxhbmRlcjt3PTEyMDA7aD02NzU-/https://s.yimg.com/os/creatr-uploaded-images/2023-06/6d94e780-1531-11ee-afcb-016906d38315,WBA,Yahoo,"Lordstown Motors filed for bankruptcy protection, Walgreens Boots Alliance shares sunk after the company warned of 'weak consumer spending', and Unity Software shares soar after the company announced it's creating a marketplace for artificial intelligence software. Yahoo Finance Live rounds up the day at closing time.",https://finnhub.io/api/news?id=03903efb27400f7ae18de8fb02583fcec8738033bb72834ef38da8b255db5107
company,2023-06-27 16:56:47,US STOCKS-Wall Street closes higher as upbeat economic data allays slowdown fears,121077745,https://s.yimg.com/cv/apiv2/social/images/yahoo_default_logo-1200x1200.png,WBA,Yahoo,"U.S. stock indexes rebounded on Tuesday from a recent losing streak as upbeat economic data soothed investor worries about an imminent recession triggered by the Federal Reserve's aggressive interest rate hikes.  Separate reports showed new orders for key U.S.-manufactured capital goods unexpectedly rose in May, and sales of new single-family homes surged in the same month, while U.S. consumer confidence increased to a near 1-1/2 year high in June.",https://finnhub.io/api/news?id=1e800040047747eafec317b43e05cbcbefcac1b5aaef6f61c8d23fb5fa2bac16
company,2023-06-27 16:41:58,Dow Jones Today: Index Ends 6-Day Losing Streak,121077748,,WBA,Yahoo,"Tech and retail stocks helped lift the Dow Jones, while Walgreens plummeted after lowering its earnings outlook",https://finnhub.io/api/news?id=7a0f4d07c57ed3e881e38ac493dc63bb290bede68d5064a17e53691cd16e4f62
company,2023-06-27 16:34:17,Markets Rise on Positive News about Consumer Confidence and Travel Demand,121077712,https://s.yimg.com/ny/api/res/1.2/8L5ThFvpw0tmhJzMrCjjmQ--/YXBwaWQ9aGlnaGxhbmRlcjt3PTEyMDA7aD03MjA-/https://media.zenfs.com/en/investopedia.com/1222772fdfd07b7f1ae77da88d82a336,WBA,Yahoo,"Markets rise on Tuesday, June 27, 2023 on positive news about consumer confidence and rising travel demand.",https://finnhub.io/api/news?id=87cefe8d9a162703d0a88624afa7bf7e9f6c1d14d48dd124071a307651f8bb07
company,2023-06-27 16:22:06,"Nasdaq Sharpens Its Lead Amid Broad Advance, But Inflation News Looms; These Stocks Break Out",121080169,https://media.zenfs.com/en/ibd.com/03badf75f96d909dcc30092ba3766de4,WBA,Yahoo,"The Nasdaq, leader among equity indexes during the first half of the year, reasserted its dominance on Tuesday.  Its nearly 1.7% gain paced a broad rally in the stock market today.  As noted in IBD's current outlook, the stock market has been in a confirmed uptrend since a March 29 follow-through day.",https://finnhub.io/api/news?id=902562c13dc511c14a8b6a4a8500450403ec0748abfd60545772382be085fecc
company,2023-06-27 16:21:06,"Walgreens slashes guidance, Delta stock, Meta price target: Trending stocks",121077111,https://s.yimg.com/ny/api/res/1.2/vz.5JYGOLEIaOjEHbCkObg--/YXBwaWQ9aGlnaGxhbmRlcjt3PTEyMDA7aD02NzQ-/https://s.yimg.com/os/creatr-uploaded-images/2023-06/f2ad7aa0-1526-11ee-abe3-c8411f58ac46,WBA,Yahoo,Walgreens Boots Alliance shares fall after the pharmaceutical chain slashes its full-year guidance. Delta Air Lines take off on raised second-quarter guidance. Citi analysts raise Meta's price target to $360. Yahoo Finance Live examines several of today's top stocks after the closing bell.,https://finnhub.io/api/news?id=636b8f74f28e10a7089f5c7d6cc0e61bc3d9c43211173f427780baf21049ac52
company,2023-06-27 16:15:09,Stock Market Today: Dow Snaps Losing Streak on Strong Economic Data,121077751,https://s.yimg.com/ny/api/res/1.2/IQT.G3IZ.oe2UlUx.R5x7w--/YXBwaWQ9aGlnaGxhbmRlcjt3PTEyMDA7aD02NzU-/https://media.zenfs.com/en/kiplinger.com/15510851405e90edaceed179117c7fc8,WBA,Yahoo,"The blue chip index notched its first win in seven sessions even as Walgreens Boots Alliance spiraled. A slow start for stocks Tuesday turned into a sprint for the fine finish, with all three indexes posting solid gains amid an onslaught of better-than-expected economic reports. Still, not all of the day's price action was positive, with one electric vehicle (EV) stock plunging on bankruptcy news.Ahead of the opening bell, the Census Bureau said orders for durable goods were up 1.7% from April t",https://finnhub.io/api/news?id=e253cf35ad8d1a13a7abce8ee18e0eb6a7f2991b69f14b83227a101881199b2f
company,2023-06-27 16:11:00,"Walgreens stock sinks as company warns consumers pull back on spending, COVID vaccines",121077606,https://s.yimg.com/ny/api/res/1.2/hlMMxOqi3bAAGMji2aUkHg--/YXBwaWQ9aGlnaGxhbmRlcjt3PTEyMDA7aD03OTE-/https://s.yimg.com/os/creatr-uploaded-images/2022-07/43e96650-0749-11ed-a5fb-88d15a4dd4da,WBA,Yahoo,"At Walgreens, COVID-19 vaccine administrations declined 83% in the most recent quarter, forcing the retailer to cut its profit outlook for 2023.",https://finnhub.io/api/news?id=104a1b82f67c0253463846d1ce91fdc8dce64912fcf898c28f5a390dfe798a24
company,2023-06-27 15:47:03,Walgreens Falls Most Since 2020 as Forecast Cut on Fading Demand,121080173,https://s.yimg.com/ny/api/res/1.2/iblhDr0cROMk6guZzA48Yg--/YXBwaWQ9aGlnaGxhbmRlcjt3PTEyMDA7aD04MDE-/https://media.zenfs.com/en/bloomberg_markets_842/65174ae3029afa632aba01ba6b229ce6,WBA,Yahoo,"(Bloomberg) -- Walgreens Boots Alliance Inc. shares fell the most in three years after the drugstore chain slashed its fiscal-year profit forecast, hurt by fading pandemic demand and a slow transition deeper into health care. Most Read from BloombergStudent Loan-Relief Backers Warn Biden ‘Failure Isn’t an Option’Wagner Chief Lands in Belarus as Putin Says ‘Civil War’ AvertedPickleball Injuries May Cost Americans Nearly $400 Million This Year, According to UBSUBS Preparing to Cut Over Half of Cre",https://finnhub.io/api/news?id=f13209dbd2c022b5d43df387a6e6627a3c244b3186ddc5ae6b4a2aee247435ed
company,2023-06-27 15:07:10,US STOCKS-Wall Street rebounds as upbeat economic data allays slowdown fears,121077755,https://s.yimg.com/cv/apiv2/social/images/yahoo_default_logo-1200x1200.png,WBA,Yahoo,"U.S. stock indexes rebounded on Tuesday from a recent losing streak as upbeat economic data soothed investor worries about an imminent recession triggered by the Federal Reserve's aggressive interest rate hikes.  Separate reports showed new orders for key U.S.-manufactured capital goods unexpectedly rose in May, and sales of new single-family homes surged in the same month, while U.S. consumer confidence increased to a near 1-1/2 year high in June.",https://finnhub.io/api/news?id=946a489aa8b150a0e28f57bb17e194cd4d8a32bd2b36c4c6ee82ec3b6fa1c922
company,2023-06-27 14:46:45,Walgreens Bites The Covid Dust,121074970,https://media.zenfs.com/en/Benzinga/116a5c5ed115b7868f807fbcfce577b5,WBA,Yahoo,"For the first time since July 2020, Walgreens Boots Alliance Inc (NASDAQ: WBA) missed earnings expectations. Besides its disappointing fiscal third-quarter results, the retail pharmacy chain also slashed its full year earnings guidance in the face of lower consumer spending and a drop in demand for Covid vaccines and testing. Shares of Walgreens fell roughly 7% in premarket trading following the release. Fiscal Third Quarter Highlights Despite the earnings miss, Walgreens topped revenue expectat",https://finnhub.io/api/news?id=2a91d9f9539d6505b6df3eefb7f31ac6b8ed81baf20f83e16b2de5f3f53f3351
company,2023-06-27 14:04:00,"Rebel's Edge - June 27: $U, $ENVX, $WBA, and Dion Sanders",121080176,,WBA,Yahoo,"Jon and Pete Najarian join forces to discuss and debate their favorite topics, including the hottest stock-specific news and sports!",https://finnhub.io/api/news?id=6e4dcbea8c876730ac4856dcf1bca9f2350e6166fcc33700bf245c8a560a7c96
company,2023-06-27 13:52:00,Walgreens Stock Plummets. Earnings Raised Profit Concerns.,121080177,,WBA,Yahoo,The drugstore chain lowered its forecast for adjusted earnings per share for the full year and raised its target for cost savings.,https://finnhub.io/api/news?id=a7cdbbc961c9ce91bbae9dcdcdf0a76e1f9e05d3541e36782d2e6aaab2a2c48e
company,2023-06-27 11:42:06,"Stocks to Watch Tuesday: Lordstown, Tesla, Walgreens, Robinhood, Carnival",121069479,,WBA,Yahoo,"↘️ [**Lordstown Motors (RIDE)**](https://www.wsj.com/market-data/quotes/RIDE): The electric-truck startup, once cheered by investors during the SPAC boom, [filed for bankruptcy](https://www.wsj.com/articles/ev-startup-lordstown-files-for-bankruptcy-5c7a0f46?mod=hp_lead_pos2).",https://finnhub.io/api/news?id=42a2235976c781e1abcd524cb8293d4d33621a9054054cfe03324de7193c766f
company,2023-06-27 13:02:00,Walgreens Boots Alliance Inc. stock underperforms Tuesday when compared to competitors,121081412,https://images.mktw.net/im-220105/social,WBA,MarketWatch,"Shares of Walgreens Boots Alliance Inc. slipped 9.34% to $28.64 Tuesday, on what proved to be an all-around great trading session for the stock market, with...",https://finnhub.io/api/news?id=c187223112dc029086cd2f6091fd83727bc2efae25fa664c48cf6f69ca217ca9
company,2023-06-27 13:00:18,Walgreens Boots Alliance (WBA) Q3 2023 Earnings Call Transcript,121080179,https://media.zenfs.com/en/motleyfool.com/ce68ea0b0cd2631701fe87e542e7a165,WBA,Yahoo,"At this time, I would like to welcome everyone to the Walgreens Boots Alliance third quarter 2023 earnings conference call.  Thank you for joining us for the Walgreens Boots Alliance earnings call for the third quarter of fiscal year 2023.  Joining me on today's call are Roz Brewer, our chief executive officer; James Kehoe, our chief financial officer; and John Driscoll, president of US healthcare.",https://finnhub.io/api/news?id=c2e734a59e6db944f60cb3ea4c23dc850ce362e7ec62c266b63c3b402448f32f
company,2023-06-27 12:59:58,Walgreens Shares Plunge After Reducing Its Outlook as Spending Slows,121074123,https://s.yimg.com/ny/api/res/1.2/psPwDvxLvF7Qbqe2_9y6nA--/YXBwaWQ9aGlnaGxhbmRlcjt3PTEyMDA7aD04MDA-/https://media.zenfs.com/en/investopedia.com/4f306bc1b8122add557575135a7ca497,WBA,Yahoo,"Walgreens shares plummeted on Tuesday after the drugstore chain slashed its full-year earnings guidance, citing reduced consumer spending and slowing demand for COVID-19 products and services.",https://finnhub.io/api/news?id=da069916f1c657238e62d5ad5639fd5516122656c2d23d1feeee5d4784122d59
company,2023-06-27 12:21:00,NEW YORK MARKET CLOSE: Dow breaks losing streak after data surprise,121078325,,WBA,Alliance News,Looking for stock market analysis and research with proves results? Zacks.com offers in-depth financial research with over 30years of proven results.,https://finnhub.io/api/news?id=9c3a2506bc22da2cc61074e1bd95f1e26b75b802f725b2e11b519b41a7e8649c
company,2023-06-27 11:34:58,Boots to shut 300 stores across Britain,121080181,https://s.yimg.com/ny/api/res/1.2/BRmuONuX70F_6OAKYRGNhQ--/YXBwaWQ9aGlnaGxhbmRlcjt3PTEyMDA7aD03NTA-/https://media.zenfs.com/en/the_telegraph_818/8993549eff816c41e2434204010df277,WBA,Yahoo,Boots will shut 300 stores across Britain over the next year as speculation mounts over a potential break-up by its US owner.,https://finnhub.io/api/news?id=5cfb30936117a84c39b6f562709cb2da7d43e0351489507bba4782e4eeaeb21c
company,2023-06-27 11:06:43,"Walgreens cuts guidance, Meta price target boost, Eli Lilly's obesity drug: trending tickers",121073726,https://s.yimg.com/ny/api/res/1.2/dZTjnTW0BBWq5pWeeGBj2Q--/YXBwaWQ9aGlnaGxhbmRlcjt3PTEyMDA7aD02NzU-/https://s.yimg.com/os/creatr-uploaded-images/2023-06/177c4bc0-14fc-11ee-a7fd-a811f9a28c80,WBA,Yahoo,"There are a number of stocks on the move in early trading. Walgreens Boots Alliance shares tumbled after the company slashed its full-year earnings guidance. Citi boosted its price target on Meta to $360 a share, the highest on Wall Street. Eli Lilly shares rose after tests showed its experimental obesity drug helped patients lose an average of 24 percent of their body weight.",https://finnhub.io/api/news?id=bcc0653f3de9bb165bf83295bc0ca80e88290ac08b86b404e90db8ac508996e3
company,2023-06-27 11:05:57,Walgreens Stock Drops After Cutting 2023 Outlook,121080183,https://media.zenfs.com/en/wsj.com/7b2c285183be07ca3c4e8242b25a59a8,WBA,Yahoo,"Shares of Walgreens Boots Alliance dropped in early trading Tuesday after the drugstore chain [cut its financial outlook](https://www.wsj.com/articles/walgreens-wba-q3-earnings-report-2023-5d1d81ca) for the year, saying it would increase cost-cutting measures.",https://finnhub.io/api/news?id=1007f2fbc71fda2974478fab3a27e49cf20dc549e317669bcbd8d3dc71b60719
company,2023-06-27 10:51:08,"Three-Stock Lunch: DAL, WBA & LOW",121077403,https://image.cnbcfm.com/api/v1/image/107263538-16878912671687891264-30068634386-1080pnbcnews.jpg?v=1687891868&w=1920&h=1080,WBA,CNBC,"Michael Farr, Hightower Advisors, joins ‘Power Lunch’ to discuss three stocks: Delta, Walgreens and Lowe's.",https://finnhub.io/api/news?id=22d3b842ee66b22006a6206e4975c67579845ea4590f8501580a8e8d2f31261a
company,2023-06-27 10:02:00,Rite Aid Shares Fall After Walgreens Warns of Demand Slump,121081418,https://mw3.wsj.net/mw5/content/logos/mw_logo_social.png,WBA,MarketWatch,By Ben Glickman Shares of Rite Aid tumbled Tuesday after Walgreens Boots Alliance warned of weak consumer demand in the next year. The stock sank 13% to...,https://finnhub.io/api/news?id=2b9fe23769dd8acdea569fe07a67b2c344a62eb045b1ff573bf4c733bebcf5d8
company,2023-06-27 09:08:07,"Walgreens Boots Alliance, Inc. (WBA) Q3 2023 Earnings Call Transcript",121070448,https://static.seekingalpha.com/assets/og_image_1200-29b2bfe1a595477db6826bd2126c63ac2091efb7ec76347a8e7f81ba17e3de6c.png,WBA,SeekingAlpha,"Walgreens Boots Alliance, Inc. (NASDAQ:NASDAQ:WBA) Q3 2023 Earnings Conference Call June 27, 2023 8:30 AM ETCompany ParticipantsTiffany Kanaga - Vice President, Global Investor RelationsRoz...",https://finnhub.io/api/news?id=b42767dd24a957f55b87115ae5a622d337a402f74fddbd572181726ad359f585
company,2023-06-27 09:02:23,Rite Aid Q1 Earnings Preview: Bears Remain In Control,121069978,https://static.seekingalpha.com/cdn/s3/uploads/getty_images/1391465575/image_1391465575.jpg?io=getty-c-w1536,WBA,SeekingAlpha,Bears remain resolute in their strong bet against Rite Aid. Read why a weak outlook from Walgreens (WBA) hurt RA stock ahead of its Q1 earnings.,https://finnhub.io/api/news?id=837160aa924e37cbe94e97e1bba277b85ecd5153cd922fdb33fe7114aa7c9042
company,2023-06-27 08:59:00,UPDATE: Walgreens says to close 300 Boots stores in UK,121078474,,WBA,Alliance News,Looking for stock market analysis and research with proves results? Zacks.com offers in-depth financial research with over 30years of proven results.,https://finnhub.io/api/news?id=3c6e7707f3ebad457ee7bd3ce44e6e17d7ca435f5bcc90d614224baf3aed22a3
company,2023-06-27 08:49:00,"Stocks Rebound, Tech Rallies As Dip Buyers Return: What's Driving Markets Tuesday?",121071825,,WBA,Benzinga,Looking for stock market analysis and research with proves results? Zacks.com offers in-depth financial research with over 30years of proven results.,https://finnhub.io/api/news?id=e2e626d9fbf45de5f65ef4db3f04344f2e5a75c8d6ff8a6d755565173fd7e6f6
company,2023-06-27 08:30:00,Fly Intel: Pre-market Movers,121074187,,WBA,Thefly.com,Looking for stock market analysis and research with proves results? Zacks.com offers in-depth financial research with over 30years of proven results.,https://finnhub.io/api/news?id=e36da40a11820b18d499d12f02cab1bdeb688adf65457d8b7a44f27e27ab839a
company,2023-06-27 08:28:00,What You Missed On Wall Street This Morning,121071880,,WBA,Thefly.com,Looking for stock market analysis and research with proves results? Zacks.com offers in-depth financial research with over 30years of proven results.,https://finnhub.io/api/news?id=59b7db35a86318ce785973d84affaa2984b3e743d7839572e39a944a81d4a1f2
company,2023-06-27 08:24:00,"American Equity, Delta Air Lines rise; Walgreens, Lordstown Motors fall, Tuesday, 6/27/2023",121076643,,WBA,"Associated Press, The",Looking for stock market analysis and research with proves results? Zacks.com offers in-depth financial research with over 30years of proven results.,https://finnhub.io/api/news?id=c9d1061b3ecbfb668a575d50c4a46327392797340f3022595c421597baddc2d1
company,2023-06-27 08:18:00,Walgreens Boots Alliance cuts guidance on weak economic outlook,121078480,,WBA,Alliance News,Looking for stock market analysis and research with proves results? Zacks.com offers in-depth financial research with over 30years of proven results.,https://finnhub.io/api/news?id=5292a7db1fe3c5a1923b1e3f84aeb3305718f2b9243a51ab9c65cc5c38f59eb6
company,2023-06-27 08:09:00,Dow Surges Over 100 Points; Walgreens Lowers Earnings Forecast,121072865,,WBA,Benzinga,Looking for stock market analysis and research with proves results? Zacks.com offers in-depth financial research with over 30years of proven results.,https://finnhub.io/api/news?id=cf3ba6483ff1e4074212fe0b3b8e976308ea994943ab23571849691b1a7a1f4e
company,2023-06-27 07:49:00,"Most Active Equity Options For Midday - Tuesday, June 27",121070812,,WBA,TalkMarkets,Looking for stock market analysis and research with proves results? Zacks.com offers in-depth financial research with over 30years of proven results.,https://finnhub.io/api/news?id=48a16b5d072f410a156efbe9c53ce5f33cf70efdfc48b9db3b860c12d9f80376
company,2023-06-27 07:25:00,"Video: Nasdaq 100 Movers: WBA, PDD",121078487,,WBA,Market News Video,Looking for stock market analysis and research with proves results? Zacks.com offers in-depth financial research with over 30years of proven results.,https://finnhub.io/api/news?id=c15efc51e0527b33a4cbcafce80f9d5e102e716c6c4906348827890ffaf7e5bb
company,2023-06-27 07:25:00,Dow Up Triple Digits As Consumer Confidence Increases,121078160,,WBA,TalkMarkets,Looking for stock market analysis and research with proves results? Zacks.com offers in-depth financial research with over 30years of proven results.,https://finnhub.io/api/news?id=3d8fa533fd635c7fb87ee21b225863268cd6011f6c19e0fbad3216fb6297917c
company,2023-06-27 07:22:00,Walgreens shares drop sharply as cautious consumers dent full-year outlook,121078489,,WBA,MarketWatch,Looking for stock market analysis and research with proves results? Zacks.com offers in-depth financial research with over 30years of proven results.,https://finnhub.io/api/news?id=ceaa85ea29ded6b113b992a0b17fb4bb37822772e09a0e56f07f6918fd023745
company,2023-06-27 07:22:00,"Video: S&P 500 Movers: WBA, GNRC",121078488,,WBA,Market News Video,Looking for stock market analysis and research with proves results? Zacks.com offers in-depth financial research with over 30years of proven results.,https://finnhub.io/api/news?id=2f0d7f26905bb7723450a41ca45eae6a1ff2eb5e5bb4fd2a178c3e15aafc8a4d
company,2023-06-27 07:21:00,"Video: Dow Movers: WBA, MSFT",121078490,,WBA,Market News Video,Looking for stock market analysis and research with proves results? Zacks.com offers in-depth financial research with over 30years of proven results.,https://finnhub.io/api/news?id=1871b120cf7e73f7aee284a37e05b60da60b2304dcf68910f8af0a20b9e84983
company,2023-06-27 06:42:00,Delta and Walgreen's Conflicting Outlooks Signal End of 'Recession',121067535,https://www.nasdaq.com/sites/acquia.prod/files/2022/11/15/inflation-jose-luis-gonzalez-reuters.jpeg?1086814232,WBA,Nasdaq,"Traditionally, preparing your portfolio for a recession means buying things like consumer staples and cutting back on industries that cater to higher-end tastes. We're seeing the opposite right now.",https://finnhub.io/api/news?id=33226deb9d1ee11cdc584a44b50690e5f65efa7c561a85c61cbf92f02d961c31
company,2023-06-27 06:36:00,"Tech on Top: After One Day Of Rotation Into Other Sectors, Market's Breadth Narrows Again",121078494,,WBA,Benzinga,Looking for stock market analysis and research with proves results? Zacks.com offers in-depth financial research with over 30years of proven results.,https://finnhub.io/api/news?id=2d81bf5c7ba2225c762b4b4c0bc62a43a17b7f66aba44bc5144450b96047afc1
